No.     Time           Source                Destination           Protocol Length Info
      1 0.000000       host                  1.5.0                 USB      64     GET DESCRIPTOR Request DEVICE

Frame 1: 64 bytes on wire (512 bits), 64 bytes captured (512 bits) on interface usbmon1, id 0
USB URB
    [Source: host]
    [Destination: 1.5.0]
    URB id: 0xffff993fc43735c0
    URB type: URB_SUBMIT ('S')
    URB transfer type: URB_CONTROL (0x02)
    Endpoint: 0x80, Direction: IN
    Device: 5
    URB bus id: 1
    Device setup request: relevant ('\0')
    Data: not present ('<')
    URB sec: 1702353690
    URB usec: 442935
    URB status: Operation now in progress (-EINPROGRESS) (-115)
    URB length [bytes]: 18
    Data length [bytes]: 0
    [Response in: 2]
    Interval: 0
    Start frame: 0
    Copy of Transfer Flags: 0x00000200, Dir IN
    Number of ISO descriptors: 0
Setup Data
    bmRequestType: 0x80
    bRequest: GET DESCRIPTOR (6)
    Descriptor Index: 0x00
    bDescriptorType: DEVICE (0x01)
    Language Id: no language specified (0x0000)
    wLength: 18

No.     Time           Source                Destination           Protocol Length Info
      2 0.001881       1.5.0                 host                  USB      82     GET DESCRIPTOR Response DEVICE

Frame 2: 82 bytes on wire (656 bits), 82 bytes captured (656 bits) on interface usbmon1, id 0
USB URB
    [Source: 1.5.0]
    [Destination: host]
    URB id: 0xffff993fc43735c0
    URB type: URB_COMPLETE ('C')
    URB transfer type: URB_CONTROL (0x02)
    Endpoint: 0x80, Direction: IN
    Device: 5
    URB bus id: 1
    Device setup request: not relevant ('-')
    Data: present ('\0')
    URB sec: 1702353690
    URB usec: 444816
    URB status: Success (0)
    URB length [bytes]: 18
    Data length [bytes]: 18
    [Request in: 1]
    [Time from request: 0.001881000 seconds]
    Unused Setup Header
    Interval: 0
    Start frame: 0
    Copy of Transfer Flags: 0x00000200, Dir IN
    Number of ISO descriptors: 0
DEVICE DESCRIPTOR

No.     Time           Source                Destination           Protocol Length Info
      3 0.001895       host                  1.5.0                 USB      64     GET DESCRIPTOR Request CONFIGURATION

Frame 3: 64 bytes on wire (512 bits), 64 bytes captured (512 bits) on interface usbmon1, id 0
USB URB
    [Source: host]
    [Destination: 1.5.0]
    URB id: 0xffff993fc43735c0
    URB type: URB_SUBMIT ('S')
    URB transfer type: URB_CONTROL (0x02)
    Endpoint: 0x80, Direction: IN
    Device: 5
    URB bus id: 1
    Device setup request: relevant ('\0')
    Data: not present ('<')
    URB sec: 1702353690
    URB usec: 444830
    URB status: Operation now in progress (-EINPROGRESS) (-115)
    URB length [bytes]: 9
    Data length [bytes]: 0
    [Response in: 4]
    Interval: 0
    Start frame: 0
    Copy of Transfer Flags: 0x00000200, Dir IN
    Number of ISO descriptors: 0
Setup Data
    bmRequestType: 0x80
    bRequest: GET DESCRIPTOR (6)
    Descriptor Index: 0x00
    bDescriptorType: CONFIGURATION (0x02)
    Language Id: no language specified (0x0000)
    wLength: 9

No.     Time           Source                Destination           Protocol Length Info
      4 0.004890       1.5.0                 host                  USB      73     GET DESCRIPTOR Response CONFIGURATION

Frame 4: 73 bytes on wire (584 bits), 73 bytes captured (584 bits) on interface usbmon1, id 0
USB URB
    [Source: 1.5.0]
    [Destination: host]
    URB id: 0xffff993fc43735c0
    URB type: URB_COMPLETE ('C')
    URB transfer type: URB_CONTROL (0x02)
    Endpoint: 0x80, Direction: IN
    Device: 5
    URB bus id: 1
    Device setup request: not relevant ('-')
    Data: present ('\0')
    URB sec: 1702353690
    URB usec: 447825
    URB status: Success (0)
    URB length [bytes]: 9
    Data length [bytes]: 9
    [Request in: 3]
    [Time from request: 0.002995000 seconds]
    Unused Setup Header
    Interval: 0
    Start frame: 0
    Copy of Transfer Flags: 0x00000200, Dir IN
    Number of ISO descriptors: 0
CONFIGURATION DESCRIPTOR

No.     Time           Source                Destination           Protocol Length Info
      5 0.004920       host                  1.5.0                 USB      64     GET DESCRIPTOR Request CONFIGURATION

Frame 5: 64 bytes on wire (512 bits), 64 bytes captured (512 bits) on interface usbmon1, id 0
USB URB
    [Source: host]
    [Destination: 1.5.0]
    URB id: 0xffff993fc43735c0
    URB type: URB_SUBMIT ('S')
    URB transfer type: URB_CONTROL (0x02)
    Endpoint: 0x80, Direction: IN
    Device: 5
    URB bus id: 1
    Device setup request: relevant ('\0')
    Data: not present ('<')
    URB sec: 1702353690
    URB usec: 447855
    URB status: Operation now in progress (-EINPROGRESS) (-115)
    URB length [bytes]: 218
    Data length [bytes]: 0
    [Response in: 6]
    Interval: 0
    Start frame: 0
    Copy of Transfer Flags: 0x00000200, Dir IN
    Number of ISO descriptors: 0
Setup Data
    bmRequestType: 0x80
    bRequest: GET DESCRIPTOR (6)
    Descriptor Index: 0x00
    bDescriptorType: CONFIGURATION (0x02)
    Language Id: no language specified (0x0000)
    wLength: 218

No.     Time           Source                Destination           Protocol Length Info
      6 0.007891       1.5.0                 host                  USB      282    GET DESCRIPTOR Response CONFIGURATION

Frame 6: 282 bytes on wire (2256 bits), 282 bytes captured (2256 bits) on interface usbmon1, id 0
USB URB
    [Source: 1.5.0]
    [Destination: host]
    URB id: 0xffff993fc43735c0
    URB type: URB_COMPLETE ('C')
    URB transfer type: URB_CONTROL (0x02)
    Endpoint: 0x80, Direction: IN
    Device: 5
    URB bus id: 1
    Device setup request: not relevant ('-')
    Data: present ('\0')
    URB sec: 1702353690
    URB usec: 450826
    URB status: Success (0)
    URB length [bytes]: 218
    Data length [bytes]: 218
    [Request in: 5]
    [Time from request: 0.002971000 seconds]
    Unused Setup Header
    Interval: 0
    Start frame: 0
    Copy of Transfer Flags: 0x00000200, Dir IN
    Number of ISO descriptors: 0
CONFIGURATION DESCRIPTOR
INTERFACE DESCRIPTOR (0.0): class Vendor Specific
INTERFACE DESCRIPTOR (0.1): class Vendor Specific
ENDPOINT DESCRIPTOR
ENDPOINT DESCRIPTOR
ENDPOINT DESCRIPTOR
ENDPOINT DESCRIPTOR
ENDPOINT DESCRIPTOR
ENDPOINT DESCRIPTOR
ENDPOINT DESCRIPTOR
ENDPOINT DESCRIPTOR
ENDPOINT DESCRIPTOR
ENDPOINT DESCRIPTOR
ENDPOINT DESCRIPTOR
ENDPOINT DESCRIPTOR
ENDPOINT DESCRIPTOR
INTERFACE DESCRIPTOR (0.2): class Vendor Specific
ENDPOINT DESCRIPTOR
ENDPOINT DESCRIPTOR
ENDPOINT DESCRIPTOR
ENDPOINT DESCRIPTOR
ENDPOINT DESCRIPTOR
ENDPOINT DESCRIPTOR
ENDPOINT DESCRIPTOR
ENDPOINT DESCRIPTOR
ENDPOINT DESCRIPTOR
ENDPOINT DESCRIPTOR
ENDPOINT DESCRIPTOR
ENDPOINT DESCRIPTOR
ENDPOINT DESCRIPTOR

No.     Time           Source                Destination           Protocol Length Info
      7 0.007969       host                  1.1.0                 USB      64     GET DESCRIPTOR Request DEVICE

Frame 7: 64 bytes on wire (512 bits), 64 bytes captured (512 bits) on interface usbmon1, id 0
USB URB
    [Source: host]
    [Destination: 1.1.0]
    URB id: 0xffff993fc43735c0
    URB type: URB_SUBMIT ('S')
    URB transfer type: URB_CONTROL (0x02)
    Endpoint: 0x80, Direction: IN
    Device: 1
    URB bus id: 1
    Device setup request: relevant ('\0')
    Data: not present ('<')
    URB sec: 1702353690
    URB usec: 450904
    URB status: Operation now in progress (-EINPROGRESS) (-115)
    URB length [bytes]: 18
    Data length [bytes]: 0
    [Response in: 8]
    Interval: 0
    Start frame: 0
    Copy of Transfer Flags: 0x00000200, Dir IN
    Number of ISO descriptors: 0
Setup Data
    bmRequestType: 0x80
    bRequest: GET DESCRIPTOR (6)
    Descriptor Index: 0x00
    bDescriptorType: DEVICE (0x01)
    Language Id: no language specified (0x0000)
    wLength: 18

No.     Time           Source                Destination           Protocol Length Info
      8 0.007985       1.1.0                 host                  USB      82     GET DESCRIPTOR Response DEVICE

Frame 8: 82 bytes on wire (656 bits), 82 bytes captured (656 bits) on interface usbmon1, id 0
USB URB
    [Source: 1.1.0]
    [Destination: host]
    URB id: 0xffff993fc43735c0
    URB type: URB_COMPLETE ('C')
    URB transfer type: URB_CONTROL (0x02)
    Endpoint: 0x80, Direction: IN
    Device: 1
    URB bus id: 1
    Device setup request: not relevant ('-')
    Data: present ('\0')
    URB sec: 1702353690
    URB usec: 450920
    URB status: Success (0)
    URB length [bytes]: 18
    Data length [bytes]: 18
    [Request in: 7]
    [Time from request: 0.000016000 seconds]
    Unused Setup Header
    Interval: 0
    Start frame: 0
    Copy of Transfer Flags: 0x00000200, Dir IN
    Number of ISO descriptors: 0
DEVICE DESCRIPTOR

No.     Time           Source                Destination           Protocol Length Info
      9 0.007997       host                  1.1.0                 USB      64     GET DESCRIPTOR Request CONFIGURATION

Frame 9: 64 bytes on wire (512 bits), 64 bytes captured (512 bits) on interface usbmon1, id 0
USB URB
    [Source: host]
    [Destination: 1.1.0]
    URB id: 0xffff993fc43735c0
    URB type: URB_SUBMIT ('S')
    URB transfer type: URB_CONTROL (0x02)
    Endpoint: 0x80, Direction: IN
    Device: 1
    URB bus id: 1
    Device setup request: relevant ('\0')
    Data: not present ('<')
    URB sec: 1702353690
    URB usec: 450932
    URB status: Operation now in progress (-EINPROGRESS) (-115)
    URB length [bytes]: 9
    Data length [bytes]: 0
    [Response in: 10]
    Interval: 0
    Start frame: 0
    Copy of Transfer Flags: 0x00000200, Dir IN
    Number of ISO descriptors: 0
Setup Data
    bmRequestType: 0x80
    bRequest: GET DESCRIPTOR (6)
    Descriptor Index: 0x00
    bDescriptorType: CONFIGURATION (0x02)
    Language Id: no language specified (0x0000)
    wLength: 9

No.     Time           Source                Destination           Protocol Length Info
     10 0.008008       1.1.0                 host                  USB      73     GET DESCRIPTOR Response CONFIGURATION

Frame 10: 73 bytes on wire (584 bits), 73 bytes captured (584 bits) on interface usbmon1, id 0
USB URB
    [Source: 1.1.0]
    [Destination: host]
    URB id: 0xffff993fc43735c0
    URB type: URB_COMPLETE ('C')
    URB transfer type: URB_CONTROL (0x02)
    Endpoint: 0x80, Direction: IN
    Device: 1
    URB bus id: 1
    Device setup request: not relevant ('-')
    Data: present ('\0')
    URB sec: 1702353690
    URB usec: 450943
    URB status: Success (0)
    URB length [bytes]: 9
    Data length [bytes]: 9
    [Request in: 9]
    [Time from request: 0.000011000 seconds]
    Unused Setup Header
    Interval: 0
    Start frame: 0
    Copy of Transfer Flags: 0x00000200, Dir IN
    Number of ISO descriptors: 0
CONFIGURATION DESCRIPTOR

No.     Time           Source                Destination           Protocol Length Info
     11 0.008019       host                  1.1.0                 USB      64     GET DESCRIPTOR Request CONFIGURATION

Frame 11: 64 bytes on wire (512 bits), 64 bytes captured (512 bits) on interface usbmon1, id 0
USB URB
    [Source: host]
    [Destination: 1.1.0]
    URB id: 0xffff993fc43735c0
    URB type: URB_SUBMIT ('S')
    URB transfer type: URB_CONTROL (0x02)
    Endpoint: 0x80, Direction: IN
    Device: 1
    URB bus id: 1
    Device setup request: relevant ('\0')
    Data: not present ('<')
    URB sec: 1702353690
    URB usec: 450954
    URB status: Operation now in progress (-EINPROGRESS) (-115)
    URB length [bytes]: 25
    Data length [bytes]: 0
    [Response in: 12]
    Interval: 0
    Start frame: 0
    Copy of Transfer Flags: 0x00000200, Dir IN
    Number of ISO descriptors: 0
Setup Data
    bmRequestType: 0x80
    bRequest: GET DESCRIPTOR (6)
    Descriptor Index: 0x00
    bDescriptorType: CONFIGURATION (0x02)
    Language Id: no language specified (0x0000)
    wLength: 25

No.     Time           Source                Destination           Protocol Length Info
     12 0.008027       1.1.0                 host                  USB      89     GET DESCRIPTOR Response CONFIGURATION

Frame 12: 89 bytes on wire (712 bits), 89 bytes captured (712 bits) on interface usbmon1, id 0
USB URB
    [Source: 1.1.0]
    [Destination: host]
    URB id: 0xffff993fc43735c0
    URB type: URB_COMPLETE ('C')
    URB transfer type: URB_CONTROL (0x02)
    Endpoint: 0x80, Direction: IN
    Device: 1
    URB bus id: 1
    Device setup request: not relevant ('-')
    Data: present ('\0')
    URB sec: 1702353690
    URB usec: 450962
    URB status: Success (0)
    URB length [bytes]: 25
    Data length [bytes]: 25
    [Request in: 11]
    [Time from request: 0.000008000 seconds]
    Unused Setup Header
    Interval: 0
    Start frame: 0
    Copy of Transfer Flags: 0x00000200, Dir IN
    Number of ISO descriptors: 0
CONFIGURATION DESCRIPTOR
INTERFACE DESCRIPTOR (0.0): class Hub
ENDPOINT DESCRIPTOR

No.     Time           Source                Destination           Protocol Length Info
     13 28.134932      host                  1.5.0                 USB      64     GET DESCRIPTOR Request DEVICE

Frame 13: 64 bytes on wire (512 bits), 64 bytes captured (512 bits) on interface usbmon1, id 0
USB URB
    [Source: host]
    [Destination: 1.5.0]
    URB id: 0xffff993e4b828f00
    URB type: URB_SUBMIT ('S')
    URB transfer type: URB_CONTROL (0x02)
    Endpoint: 0x80, Direction: IN
    Device: 5
    URB bus id: 1
    Device setup request: relevant ('\0')
    Data: not present ('<')
    URB sec: 1702353718
    URB usec: 577867
    URB status: Operation now in progress (-EINPROGRESS) (-115)
    URB length [bytes]: 18
    Data length [bytes]: 0
    [Response in: 14]
    Interval: 0
    Start frame: 0
    Copy of Transfer Flags: 0x00000200, Dir IN
    Number of ISO descriptors: 0
Setup Data
    bmRequestType: 0x80
    bRequest: GET DESCRIPTOR (6)
    Descriptor Index: 0x00
    bDescriptorType: DEVICE (0x01)
    Language Id: no language specified (0x0000)
    wLength: 18

No.     Time           Source                Destination           Protocol Length Info
     14 28.136789      1.5.0                 host                  USB      82     GET DESCRIPTOR Response DEVICE

Frame 14: 82 bytes on wire (656 bits), 82 bytes captured (656 bits) on interface usbmon1, id 0
USB URB
    [Source: 1.5.0]
    [Destination: host]
    URB id: 0xffff993e4b828f00
    URB type: URB_COMPLETE ('C')
    URB transfer type: URB_CONTROL (0x02)
    Endpoint: 0x80, Direction: IN
    Device: 5
    URB bus id: 1
    Device setup request: not relevant ('-')
    Data: present ('\0')
    URB sec: 1702353718
    URB usec: 579724
    URB status: Success (0)
    URB length [bytes]: 18
    Data length [bytes]: 18
    [Request in: 13]
    [Time from request: 0.001857000 seconds]
    Unused Setup Header
    Interval: 0
    Start frame: 0
    Copy of Transfer Flags: 0x00000200, Dir IN
    Number of ISO descriptors: 0
DEVICE DESCRIPTOR

No.     Time           Source                Destination           Protocol Length Info
     15 28.136813      host                  1.5.0                 USB      64     GET DESCRIPTOR Request CONFIGURATION

Frame 15: 64 bytes on wire (512 bits), 64 bytes captured (512 bits) on interface usbmon1, id 0
USB URB
    [Source: host]
    [Destination: 1.5.0]
    URB id: 0xffff993e4b828f00
    URB type: URB_SUBMIT ('S')
    URB transfer type: URB_CONTROL (0x02)
    Endpoint: 0x80, Direction: IN
    Device: 5
    URB bus id: 1
    Device setup request: relevant ('\0')
    Data: not present ('<')
    URB sec: 1702353718
    URB usec: 579748
    URB status: Operation now in progress (-EINPROGRESS) (-115)
    URB length [bytes]: 9
    Data length [bytes]: 0
    [Response in: 16]
    Interval: 0
    Start frame: 0
    Copy of Transfer Flags: 0x00000200, Dir IN
    Number of ISO descriptors: 0
Setup Data
    bmRequestType: 0x80
    bRequest: GET DESCRIPTOR (6)
    Descriptor Index: 0x00
    bDescriptorType: CONFIGURATION (0x02)
    Language Id: no language specified (0x0000)
    wLength: 9

No.     Time           Source                Destination           Protocol Length Info
     16 28.139793      1.5.0                 host                  USB      73     GET DESCRIPTOR Response CONFIGURATION

Frame 16: 73 bytes on wire (584 bits), 73 bytes captured (584 bits) on interface usbmon1, id 0
USB URB
    [Source: 1.5.0]
    [Destination: host]
    URB id: 0xffff993e4b828f00
    URB type: URB_COMPLETE ('C')
    URB transfer type: URB_CONTROL (0x02)
    Endpoint: 0x80, Direction: IN
    Device: 5
    URB bus id: 1
    Device setup request: not relevant ('-')
    Data: present ('\0')
    URB sec: 1702353718
    URB usec: 582728
    URB status: Success (0)
    URB length [bytes]: 9
    Data length [bytes]: 9
    [Request in: 15]
    [Time from request: 0.002980000 seconds]
    Unused Setup Header
    Interval: 0
    Start frame: 0
    Copy of Transfer Flags: 0x00000200, Dir IN
    Number of ISO descriptors: 0
CONFIGURATION DESCRIPTOR

No.     Time           Source                Destination           Protocol Length Info
     17 28.239861      host                  1.5.0                 USB      64     GET DESCRIPTOR Request CONFIGURATION

Frame 17: 64 bytes on wire (512 bits), 64 bytes captured (512 bits) on interface usbmon1, id 0
USB URB
    [Source: host]
    [Destination: 1.5.0]
    URB id: 0xffff993e4b828f00
    URB type: URB_SUBMIT ('S')
    URB transfer type: URB_CONTROL (0x02)
    Endpoint: 0x80, Direction: IN
    Device: 5
    URB bus id: 1
    Device setup request: relevant ('\0')
    Data: not present ('<')
    URB sec: 1702353718
    URB usec: 682796
    URB status: Operation now in progress (-EINPROGRESS) (-115)
    URB length [bytes]: 218
    Data length [bytes]: 0
    [Response in: 18]
    Interval: 0
    Start frame: 0
    Copy of Transfer Flags: 0x00000200, Dir IN
    Number of ISO descriptors: 0
Setup Data
    bmRequestType: 0x80
    bRequest: GET DESCRIPTOR (6)
    Descriptor Index: 0x00
    bDescriptorType: CONFIGURATION (0x02)
    Language Id: no language specified (0x0000)
    wLength: 218

No.     Time           Source                Destination           Protocol Length Info
     18 28.241797      1.5.0                 host                  USB      282    GET DESCRIPTOR Response CONFIGURATION

Frame 18: 282 bytes on wire (2256 bits), 282 bytes captured (2256 bits) on interface usbmon1, id 0
USB URB
    [Source: 1.5.0]
    [Destination: host]
    URB id: 0xffff993e4b828f00
    URB type: URB_COMPLETE ('C')
    URB transfer type: URB_CONTROL (0x02)
    Endpoint: 0x80, Direction: IN
    Device: 5
    URB bus id: 1
    Device setup request: not relevant ('-')
    Data: present ('\0')
    URB sec: 1702353718
    URB usec: 684732
    URB status: Success (0)
    URB length [bytes]: 218
    Data length [bytes]: 218
    [Request in: 17]
    [Time from request: 0.001936000 seconds]
    Unused Setup Header
    Interval: 0
    Start frame: 0
    Copy of Transfer Flags: 0x00000200, Dir IN
    Number of ISO descriptors: 0
CONFIGURATION DESCRIPTOR
INTERFACE DESCRIPTOR (0.0): class Vendor Specific
INTERFACE DESCRIPTOR (0.1): class Vendor Specific
ENDPOINT DESCRIPTOR
ENDPOINT DESCRIPTOR
ENDPOINT DESCRIPTOR
ENDPOINT DESCRIPTOR
ENDPOINT DESCRIPTOR
ENDPOINT DESCRIPTOR
ENDPOINT DESCRIPTOR
ENDPOINT DESCRIPTOR
ENDPOINT DESCRIPTOR
ENDPOINT DESCRIPTOR
ENDPOINT DESCRIPTOR
ENDPOINT DESCRIPTOR
ENDPOINT DESCRIPTOR
INTERFACE DESCRIPTOR (0.2): class Vendor Specific
ENDPOINT DESCRIPTOR
ENDPOINT DESCRIPTOR
ENDPOINT DESCRIPTOR
ENDPOINT DESCRIPTOR
ENDPOINT DESCRIPTOR
ENDPOINT DESCRIPTOR
ENDPOINT DESCRIPTOR
ENDPOINT DESCRIPTOR
ENDPOINT DESCRIPTOR
ENDPOINT DESCRIPTOR
ENDPOINT DESCRIPTOR
ENDPOINT DESCRIPTOR
ENDPOINT DESCRIPTOR

No.     Time           Source                Destination           Protocol Length Info
     19 28.266080      host                  1.1.0                 USBHUB   64     SET_FEATURE Request    [Port 1: PORT_RESET]

Frame 19: 64 bytes on wire (512 bits), 64 bytes captured (512 bits) on interface usbmon1, id 0
USB URB
    [Source: host]
    [Destination: 1.1.0]
    URB id: 0xffff993e4b828f00
    URB type: URB_SUBMIT ('S')
    URB transfer type: URB_CONTROL (0x02)
    Endpoint: 0x00, Direction: OUT
    Device: 1
    URB bus id: 1
    Device setup request: relevant ('\0')
    Data: present ('\0')
    URB sec: 1702353718
    URB usec: 709015
    URB status: Operation now in progress (-EINPROGRESS) (-115)
    URB length [bytes]: 0
    Data length [bytes]: 0
    [Response in: 20]
    Interval: 0
    Start frame: 0
    Copy of Transfer Flags: 0x00000000
    Number of ISO descriptors: 0
    [bInterfaceClass: Unknown (0xffff)]
Setup Data
    bmRequestType: 0x23
    bRequest: SET_FEATURE (0x03)
    wValue: 0x0004
    wIndex: 1
    wLength: 0

No.     Time           Source                Destination           Protocol Length Info
     20 28.266095      1.1.0                 host                  USBHUB   64     SET_FEATURE Response   [Port 1: PORT_RESET]

Frame 20: 64 bytes on wire (512 bits), 64 bytes captured (512 bits) on interface usbmon1, id 0
USB URB
    [Source: 1.1.0]
    [Destination: host]
    URB id: 0xffff993e4b828f00
    URB type: URB_COMPLETE ('C')
    URB transfer type: URB_CONTROL (0x02)
    Endpoint: 0x00, Direction: OUT
    Device: 1
    URB bus id: 1
    Device setup request: not relevant ('-')
    Data: not present ('>')
    URB sec: 1702353718
    URB usec: 709030
    URB status: Success (0)
    URB length [bytes]: 0
    Data length [bytes]: 0
    [Request in: 19]
    [Time from request: 0.000015000 seconds]
    Unused Setup Header
    Interval: 0
    Start frame: 0
    Copy of Transfer Flags: 0x00000000
    Number of ISO descriptors: 0
    [bInterfaceClass: Unknown (0xffff)]

No.     Time           Source                Destination           Protocol Length Info
     21 28.334960      host                  1.1.0                 USBHUB   64     GET_STATUS Request     [Port 1]

Frame 21: 64 bytes on wire (512 bits), 64 bytes captured (512 bits) on interface usbmon1, id 0
USB URB
    [Source: host]
    [Destination: 1.1.0]
    URB id: 0xffff993e4b828f00
    URB type: URB_SUBMIT ('S')
    URB transfer type: URB_CONTROL (0x02)
    Endpoint: 0x80, Direction: IN
    Device: 1
    URB bus id: 1
    Device setup request: relevant ('\0')
    Data: not present ('<')
    URB sec: 1702353718
    URB usec: 777895
    URB status: Operation now in progress (-EINPROGRESS) (-115)
    URB length [bytes]: 4
    Data length [bytes]: 0
    [Response in: 22]
    Interval: 0
    Start frame: 0
    Copy of Transfer Flags: 0x00000200, Dir IN
    Number of ISO descriptors: 0
    [bInterfaceClass: Unknown (0xffff)]
Setup Data
    bmRequestType: 0xa3
    bRequest: GET_STATUS (0x00)
    wValue: 0x0000
    wIndex: 1
    wLength: 4

No.     Time           Source                Destination           Protocol Length Info
     22 28.334973      1.1.0                 host                  USBHUB   68     GET_STATUS Response    [Port 1]

Frame 22: 68 bytes on wire (544 bits), 68 bytes captured (544 bits) on interface usbmon1, id 0
USB URB
    [Source: 1.1.0]
    [Destination: host]
    URB id: 0xffff993e4b828f00
    URB type: URB_COMPLETE ('C')
    URB transfer type: URB_CONTROL (0x02)
    Endpoint: 0x80, Direction: IN
    Device: 1
    URB bus id: 1
    Device setup request: not relevant ('-')
    Data: present ('\0')
    URB sec: 1702353718
    URB usec: 777908
    URB status: Success (0)
    URB length [bytes]: 4
    Data length [bytes]: 4
    [Request in: 21]
    [Time from request: 0.000013000 seconds]
    Unused Setup Header
    Interval: 0
    Start frame: 0
    Copy of Transfer Flags: 0x00000200, Dir IN
    Number of ISO descriptors: 0
    [bInterfaceClass: Unknown (0xffff)]
Port Status: 0x0103, PORT_CONNECTION, PORT_ENABLE, PORT_POWER
Port Change: 0x0010, C_PORT_RESET

No.     Time           Source                Destination           Protocol Length Info
     23 28.334981      host                  1.1.0                 USBHUB   64     CLEAR_FEATURE Request  [Port 1: C_PORT_RESET]

Frame 23: 64 bytes on wire (512 bits), 64 bytes captured (512 bits) on interface usbmon1, id 0
USB URB
    [Source: host]
    [Destination: 1.1.0]
    URB id: 0xffff993e4b828f00
    URB type: URB_SUBMIT ('S')
    URB transfer type: URB_CONTROL (0x02)
    Endpoint: 0x00, Direction: OUT
    Device: 1
    URB bus id: 1
    Device setup request: relevant ('\0')
    Data: present ('\0')
    URB sec: 1702353718
    URB usec: 777916
    URB status: Operation now in progress (-EINPROGRESS) (-115)
    URB length [bytes]: 0
    Data length [bytes]: 0
    [Response in: 24]
    Interval: 0
    Start frame: 0
    Copy of Transfer Flags: 0x00000000
    Number of ISO descriptors: 0
    [bInterfaceClass: Unknown (0xffff)]
Setup Data
    bmRequestType: 0x23
    bRequest: CLEAR_FEATURE (0x01)
    wValue: 0x0014
    wIndex: 1
    wLength: 0

No.     Time           Source                Destination           Protocol Length Info
     24 28.334987      1.1.0                 host                  USBHUB   64     CLEAR_FEATURE Response [Port 1: C_PORT_RESET]

Frame 24: 64 bytes on wire (512 bits), 64 bytes captured (512 bits) on interface usbmon1, id 0
USB URB
    [Source: 1.1.0]
    [Destination: host]
    URB id: 0xffff993e4b828f00
    URB type: URB_COMPLETE ('C')
    URB transfer type: URB_CONTROL (0x02)
    Endpoint: 0x00, Direction: OUT
    Device: 1
    URB bus id: 1
    Device setup request: not relevant ('-')
    Data: not present ('>')
    URB sec: 1702353718
    URB usec: 777922
    URB status: Success (0)
    URB length [bytes]: 0
    Data length [bytes]: 0
    [Request in: 23]
    [Time from request: 0.000006000 seconds]
    Unused Setup Header
    Interval: 0
    Start frame: 0
    Copy of Transfer Flags: 0x00000000
    Number of ISO descriptors: 0
    [bInterfaceClass: Unknown (0xffff)]

No.     Time           Source                Destination           Protocol Length Info
     25 28.395031      host                  1.0.0                 USB      64     GET DESCRIPTOR Request DEVICE

Frame 25: 64 bytes on wire (512 bits), 64 bytes captured (512 bits) on interface usbmon1, id 0
USB URB
    [Source: host]
    [Destination: 1.0.0]
    URB id: 0xffff993e4b828f00
    URB type: URB_SUBMIT ('S')
    URB transfer type: URB_CONTROL (0x02)
    Endpoint: 0x80, Direction: IN
    Device: 0
    URB bus id: 1
    Device setup request: relevant ('\0')
    Data: not present ('<')
    URB sec: 1702353718
    URB usec: 837966
    URB status: Operation now in progress (-EINPROGRESS) (-115)
    URB length [bytes]: 64
    Data length [bytes]: 0
    [Response in: 26]
    Interval: 0
    Start frame: 0
    Copy of Transfer Flags: 0x00000200, Dir IN
    Number of ISO descriptors: 0
Setup Data
    bmRequestType: 0x80
    bRequest: GET DESCRIPTOR (6)
    Descriptor Index: 0x00
    bDescriptorType: DEVICE (0x01)
    Language Id: no language specified (0x0000)
    wLength: 64

No.     Time           Source                Destination           Protocol Length Info
     26 28.396808      1.0.0                 host                  USB      82     GET DESCRIPTOR Response DEVICE

Frame 26: 82 bytes on wire (656 bits), 82 bytes captured (656 bits) on interface usbmon1, id 0
USB URB
    [Source: 1.0.0]
    [Destination: host]
    URB id: 0xffff993e4b828f00
    URB type: URB_COMPLETE ('C')
    URB transfer type: URB_CONTROL (0x02)
    Endpoint: 0x80, Direction: IN
    Device: 0
    URB bus id: 1
    Device setup request: not relevant ('-')
    Data: present ('\0')
    URB sec: 1702353718
    URB usec: 839743
    URB status: Success (0)
    URB length [bytes]: 18
    Data length [bytes]: 18
    [Request in: 25]
    [Time from request: 0.001777000 seconds]
    Unused Setup Header
    Interval: 0
    Start frame: 0
    Copy of Transfer Flags: 0x00000200, Dir IN
    Number of ISO descriptors: 0
DEVICE DESCRIPTOR

No.     Time           Source                Destination           Protocol Length Info
     27 28.396824      host                  1.1.0                 USBHUB   64     SET_FEATURE Request    [Port 1: PORT_RESET]

Frame 27: 64 bytes on wire (512 bits), 64 bytes captured (512 bits) on interface usbmon1, id 0
USB URB
    [Source: host]
    [Destination: 1.1.0]
    URB id: 0xffff993e4b828f00
    URB type: URB_SUBMIT ('S')
    URB transfer type: URB_CONTROL (0x02)
    Endpoint: 0x00, Direction: OUT
    Device: 1
    URB bus id: 1
    Device setup request: relevant ('\0')
    Data: present ('\0')
    URB sec: 1702353718
    URB usec: 839759
    URB status: Operation now in progress (-EINPROGRESS) (-115)
    URB length [bytes]: 0
    Data length [bytes]: 0
    [Response in: 28]
    Interval: 0
    Start frame: 0
    Copy of Transfer Flags: 0x00000000
    Number of ISO descriptors: 0
    [bInterfaceClass: Unknown (0xffff)]
Setup Data
    bmRequestType: 0x23
    bRequest: SET_FEATURE (0x03)
    wValue: 0x0004
    wIndex: 1
    wLength: 0

No.     Time           Source                Destination           Protocol Length Info
     28 28.396837      1.1.0                 host                  USBHUB   64     SET_FEATURE Response   [Port 1: PORT_RESET]

Frame 28: 64 bytes on wire (512 bits), 64 bytes captured (512 bits) on interface usbmon1, id 0
USB URB
    [Source: 1.1.0]
    [Destination: host]
    URB id: 0xffff993e4b828f00
    URB type: URB_COMPLETE ('C')
    URB transfer type: URB_CONTROL (0x02)
    Endpoint: 0x00, Direction: OUT
    Device: 1
    URB bus id: 1
    Device setup request: not relevant ('-')
    Data: not present ('>')
    URB sec: 1702353718
    URB usec: 839772
    URB status: Success (0)
    URB length [bytes]: 0
    Data length [bytes]: 0
    [Request in: 27]
    [Time from request: 0.000013000 seconds]
    Unused Setup Header
    Interval: 0
    Start frame: 0
    Copy of Transfer Flags: 0x00000000
    Number of ISO descriptors: 0
    [bInterfaceClass: Unknown (0xffff)]

No.     Time           Source                Destination           Protocol Length Info
     29 28.462968      host                  1.1.0                 USBHUB   64     GET_STATUS Request     [Port 1]

Frame 29: 64 bytes on wire (512 bits), 64 bytes captured (512 bits) on interface usbmon1, id 0
USB URB
    [Source: host]
    [Destination: 1.1.0]
    URB id: 0xffff993e4b828f00
    URB type: URB_SUBMIT ('S')
    URB transfer type: URB_CONTROL (0x02)
    Endpoint: 0x80, Direction: IN
    Device: 1
    URB bus id: 1
    Device setup request: relevant ('\0')
    Data: not present ('<')
    URB sec: 1702353718
    URB usec: 905903
    URB status: Operation now in progress (-EINPROGRESS) (-115)
    URB length [bytes]: 4
    Data length [bytes]: 0
    [Response in: 30]
    Interval: 0
    Start frame: 0
    Copy of Transfer Flags: 0x00000200, Dir IN
    Number of ISO descriptors: 0
    [bInterfaceClass: Unknown (0xffff)]
Setup Data
    bmRequestType: 0xa3
    bRequest: GET_STATUS (0x00)
    wValue: 0x0000
    wIndex: 1
    wLength: 4

No.     Time           Source                Destination           Protocol Length Info
     30 28.462980      1.1.0                 host                  USBHUB   68     GET_STATUS Response    [Port 1]

Frame 30: 68 bytes on wire (544 bits), 68 bytes captured (544 bits) on interface usbmon1, id 0
USB URB
    [Source: 1.1.0]
    [Destination: host]
    URB id: 0xffff993e4b828f00
    URB type: URB_COMPLETE ('C')
    URB transfer type: URB_CONTROL (0x02)
    Endpoint: 0x80, Direction: IN
    Device: 1
    URB bus id: 1
    Device setup request: not relevant ('-')
    Data: present ('\0')
    URB sec: 1702353718
    URB usec: 905915
    URB status: Success (0)
    URB length [bytes]: 4
    Data length [bytes]: 4
    [Request in: 29]
    [Time from request: 0.000012000 seconds]
    Unused Setup Header
    Interval: 0
    Start frame: 0
    Copy of Transfer Flags: 0x00000200, Dir IN
    Number of ISO descriptors: 0
    [bInterfaceClass: Unknown (0xffff)]
Port Status: 0x0103, PORT_CONNECTION, PORT_ENABLE, PORT_POWER
Port Change: 0x0010, C_PORT_RESET

No.     Time           Source                Destination           Protocol Length Info
     31 28.462987      host                  1.1.0                 USBHUB   64     CLEAR_FEATURE Request  [Port 1: C_PORT_RESET]

Frame 31: 64 bytes on wire (512 bits), 64 bytes captured (512 bits) on interface usbmon1, id 0
USB URB
    [Source: host]
    [Destination: 1.1.0]
    URB id: 0xffff993e4b828f00
    URB type: URB_SUBMIT ('S')
    URB transfer type: URB_CONTROL (0x02)
    Endpoint: 0x00, Direction: OUT
    Device: 1
    URB bus id: 1
    Device setup request: relevant ('\0')
    Data: present ('\0')
    URB sec: 1702353718
    URB usec: 905922
    URB status: Operation now in progress (-EINPROGRESS) (-115)
    URB length [bytes]: 0
    Data length [bytes]: 0
    [Response in: 32]
    Interval: 0
    Start frame: 0
    Copy of Transfer Flags: 0x00000000
    Number of ISO descriptors: 0
    [bInterfaceClass: Unknown (0xffff)]
Setup Data
    bmRequestType: 0x23
    bRequest: CLEAR_FEATURE (0x01)
    wValue: 0x0014
    wIndex: 1
    wLength: 0

No.     Time           Source                Destination           Protocol Length Info
     32 28.462993      1.1.0                 host                  USBHUB   64     CLEAR_FEATURE Response [Port 1: C_PORT_RESET]

Frame 32: 64 bytes on wire (512 bits), 64 bytes captured (512 bits) on interface usbmon1, id 0
USB URB
    [Source: 1.1.0]
    [Destination: host]
    URB id: 0xffff993e4b828f00
    URB type: URB_COMPLETE ('C')
    URB transfer type: URB_CONTROL (0x02)
    Endpoint: 0x00, Direction: OUT
    Device: 1
    URB bus id: 1
    Device setup request: not relevant ('-')
    Data: not present ('>')
    URB sec: 1702353718
    URB usec: 905928
    URB status: Success (0)
    URB length [bytes]: 0
    Data length [bytes]: 0
    [Request in: 31]
    [Time from request: 0.000006000 seconds]
    Unused Setup Header
    Interval: 0
    Start frame: 0
    Copy of Transfer Flags: 0x00000000
    Number of ISO descriptors: 0
    [bInterfaceClass: Unknown (0xffff)]

No.     Time           Source                Destination           Protocol Length Info
     33 28.542967      host                  1.5.0                 USB      64     GET DESCRIPTOR Request DEVICE

Frame 33: 64 bytes on wire (512 bits), 64 bytes captured (512 bits) on interface usbmon1, id 0
USB URB
    [Source: host]
    [Destination: 1.5.0]
    URB id: 0xffff993e4b828f00
    URB type: URB_SUBMIT ('S')
    URB transfer type: URB_CONTROL (0x02)
    Endpoint: 0x80, Direction: IN
    Device: 5
    URB bus id: 1
    Device setup request: relevant ('\0')
    Data: not present ('<')
    URB sec: 1702353718
    URB usec: 985902
    URB status: Operation now in progress (-EINPROGRESS) (-115)
    URB length [bytes]: 18
    Data length [bytes]: 0
    [Response in: 34]
    Interval: 0
    Start frame: 0
    Copy of Transfer Flags: 0x00000200, Dir IN
    Number of ISO descriptors: 0
Setup Data
    bmRequestType: 0x80
    bRequest: GET DESCRIPTOR (6)
    Descriptor Index: 0x00
    bDescriptorType: DEVICE (0x01)
    Language Id: no language specified (0x0000)
    wLength: 18

No.     Time           Source                Destination           Protocol Length Info
     34 28.544823      1.5.0                 host                  USB      82     GET DESCRIPTOR Response DEVICE

Frame 34: 82 bytes on wire (656 bits), 82 bytes captured (656 bits) on interface usbmon1, id 0
USB URB
    [Source: 1.5.0]
    [Destination: host]
    URB id: 0xffff993e4b828f00
    URB type: URB_COMPLETE ('C')
    URB transfer type: URB_CONTROL (0x02)
    Endpoint: 0x80, Direction: IN
    Device: 5
    URB bus id: 1
    Device setup request: not relevant ('-')
    Data: present ('\0')
    URB sec: 1702353718
    URB usec: 987758
    URB status: Success (0)
    URB length [bytes]: 18
    Data length [bytes]: 18
    [Request in: 33]
    [Time from request: 0.001856000 seconds]
    Unused Setup Header
    Interval: 0
    Start frame: 0
    Copy of Transfer Flags: 0x00000200, Dir IN
    Number of ISO descriptors: 0
DEVICE DESCRIPTOR

No.     Time           Source                Destination           Protocol Length Info
     35 28.544858      host                  1.5.0                 USB      64     GET DESCRIPTOR Request CONFIGURATION

Frame 35: 64 bytes on wire (512 bits), 64 bytes captured (512 bits) on interface usbmon1, id 0
USB URB
    [Source: host]
    [Destination: 1.5.0]
    URB id: 0xffff993edd687d40
    URB type: URB_SUBMIT ('S')
    URB transfer type: URB_CONTROL (0x02)
    Endpoint: 0x80, Direction: IN
    Device: 5
    URB bus id: 1
    Device setup request: relevant ('\0')
    Data: not present ('<')
    URB sec: 1702353718
    URB usec: 987793
    URB status: Operation now in progress (-EINPROGRESS) (-115)
    URB length [bytes]: 218
    Data length [bytes]: 0
    [Response in: 36]
    Interval: 0
    Start frame: 0
    Copy of Transfer Flags: 0x00000200, Dir IN
    Number of ISO descriptors: 0
Setup Data
    bmRequestType: 0x80
    bRequest: GET DESCRIPTOR (6)
    Descriptor Index: 0x00
    bDescriptorType: CONFIGURATION (0x02)
    Language Id: no language specified (0x0000)
    wLength: 218

No.     Time           Source                Destination           Protocol Length Info
     36 28.547811      1.5.0                 host                  USB      282    GET DESCRIPTOR Response CONFIGURATION

Frame 36: 282 bytes on wire (2256 bits), 282 bytes captured (2256 bits) on interface usbmon1, id 0
USB URB
    [Source: 1.5.0]
    [Destination: host]
    URB id: 0xffff993edd687d40
    URB type: URB_COMPLETE ('C')
    URB transfer type: URB_CONTROL (0x02)
    Endpoint: 0x80, Direction: IN
    Device: 5
    URB bus id: 1
    Device setup request: not relevant ('-')
    Data: present ('\0')
    URB sec: 1702353718
    URB usec: 990746
    URB status: Success (0)
    URB length [bytes]: 218
    Data length [bytes]: 218
    [Request in: 35]
    [Time from request: 0.002953000 seconds]
    Unused Setup Header
    Interval: 0
    Start frame: 0
    Copy of Transfer Flags: 0x00000200, Dir IN
    Number of ISO descriptors: 0
CONFIGURATION DESCRIPTOR
INTERFACE DESCRIPTOR (0.0): class Vendor Specific
INTERFACE DESCRIPTOR (0.1): class Vendor Specific
ENDPOINT DESCRIPTOR
ENDPOINT DESCRIPTOR
ENDPOINT DESCRIPTOR
ENDPOINT DESCRIPTOR
ENDPOINT DESCRIPTOR
ENDPOINT DESCRIPTOR
ENDPOINT DESCRIPTOR
ENDPOINT DESCRIPTOR
ENDPOINT DESCRIPTOR
ENDPOINT DESCRIPTOR
ENDPOINT DESCRIPTOR
ENDPOINT DESCRIPTOR
ENDPOINT DESCRIPTOR
INTERFACE DESCRIPTOR (0.2): class Vendor Specific
ENDPOINT DESCRIPTOR
ENDPOINT DESCRIPTOR
ENDPOINT DESCRIPTOR
ENDPOINT DESCRIPTOR
ENDPOINT DESCRIPTOR
ENDPOINT DESCRIPTOR
ENDPOINT DESCRIPTOR
ENDPOINT DESCRIPTOR
ENDPOINT DESCRIPTOR
ENDPOINT DESCRIPTOR
ENDPOINT DESCRIPTOR
ENDPOINT DESCRIPTOR
ENDPOINT DESCRIPTOR

No.     Time           Source                Destination           Protocol Length Info
     37 28.547830      host                  1.5.0                 USB      64     SET CONFIGURATION Request

Frame 37: 64 bytes on wire (512 bits), 64 bytes captured (512 bits) on interface usbmon1, id 0
USB URB
    [Source: host]
    [Destination: 1.5.0]
    URB id: 0xffff993edd687d40
    URB type: URB_SUBMIT ('S')
    URB transfer type: URB_CONTROL (0x02)
    Endpoint: 0x00, Direction: OUT
    Device: 5
    URB bus id: 1
    Device setup request: relevant ('\0')
    Data: present ('\0')
    URB sec: 1702353718
    URB usec: 990765
    URB status: Operation now in progress (-EINPROGRESS) (-115)
    URB length [bytes]: 0
    Data length [bytes]: 0
    [Response in: 38]
    Interval: 0
    Start frame: 0
    Copy of Transfer Flags: 0x00000000
    Number of ISO descriptors: 0
Setup Data
    bmRequestType: 0x00
    bRequest: SET CONFIGURATION (9)
    bConfigurationValue: 1
    wIndex: 0 (0x0000)
    wLength: 0

No.     Time           Source                Destination           Protocol Length Info
     38 28.549812      1.5.0                 host                  USB      64     SET CONFIGURATION Response

Frame 38: 64 bytes on wire (512 bits), 64 bytes captured (512 bits) on interface usbmon1, id 0
USB URB
    [Source: 1.5.0]
    [Destination: host]
    URB id: 0xffff993edd687d40
    URB type: URB_COMPLETE ('C')
    URB transfer type: URB_CONTROL (0x02)
    Endpoint: 0x00, Direction: OUT
    Device: 5
    URB bus id: 1
    Device setup request: not relevant ('-')
    Data: not present ('>')
    URB sec: 1702353718
    URB usec: 992747
    URB status: Success (0)
    URB length [bytes]: 0
    Data length [bytes]: 0
    [Request in: 37]
    [Time from request: 0.001982000 seconds]
    Unused Setup Header
    Interval: 0
    Start frame: 0
    Copy of Transfer Flags: 0x00000000
    Number of ISO descriptors: 0

No.     Time           Source                Destination           Protocol Length Info
     39 28.610669      host                  1.5.0                 USB      64     GET DESCRIPTOR Request DEVICE

Frame 39: 64 bytes on wire (512 bits), 64 bytes captured (512 bits) on interface usbmon1, id 0
USB URB
    [Source: host]
    [Destination: 1.5.0]
    URB id: 0xffff993ece242f00
    URB type: URB_SUBMIT ('S')
    URB transfer type: URB_CONTROL (0x02)
    Endpoint: 0x80, Direction: IN
    Device: 5
    URB bus id: 1
    Device setup request: relevant ('\0')
    Data: not present ('<')
    URB sec: 1702353719
    URB usec: 53604
    URB status: Operation now in progress (-EINPROGRESS) (-115)
    URB length [bytes]: 64
    Data length [bytes]: 0
    [Response in: 40]
    Interval: 0
    Start frame: 0
    Copy of Transfer Flags: 0x00000200, Dir IN
    Number of ISO descriptors: 0
Setup Data
    bmRequestType: 0x80
    bRequest: GET DESCRIPTOR (6)
    Descriptor Index: 0x00
    bDescriptorType: DEVICE (0x01)
    Language Id: no language specified (0x0000)
    wLength: 64

No.     Time           Source                Destination           Protocol Length Info
     40 28.611820      1.5.0                 host                  USB      82     GET DESCRIPTOR Response DEVICE

Frame 40: 82 bytes on wire (656 bits), 82 bytes captured (656 bits) on interface usbmon1, id 0
USB URB
    [Source: 1.5.0]
    [Destination: host]
    URB id: 0xffff993ece242f00
    URB type: URB_COMPLETE ('C')
    URB transfer type: URB_CONTROL (0x02)
    Endpoint: 0x80, Direction: IN
    Device: 5
    URB bus id: 1
    Device setup request: not relevant ('-')
    Data: present ('\0')
    URB sec: 1702353719
    URB usec: 54755
    URB status: Success (0)
    URB length [bytes]: 18
    Data length [bytes]: 18
    [Request in: 39]
    [Time from request: 0.001151000 seconds]
    Unused Setup Header
    Interval: 0
    Start frame: 0
    Copy of Transfer Flags: 0x00000200, Dir IN
    Number of ISO descriptors: 0
DEVICE DESCRIPTOR

No.     Time           Source                Destination           Protocol Length Info
     41 28.616635      host                  1.1.0                 USBHUB   64     SET_FEATURE Request    [Port 1: PORT_RESET]

Frame 41: 64 bytes on wire (512 bits), 64 bytes captured (512 bits) on interface usbmon1, id 0
USB URB
    [Source: host]
    [Destination: 1.1.0]
    URB id: 0xffff993edd687d40
    URB type: URB_SUBMIT ('S')
    URB transfer type: URB_CONTROL (0x02)
    Endpoint: 0x00, Direction: OUT
    Device: 1
    URB bus id: 1
    Device setup request: relevant ('\0')
    Data: present ('\0')
    URB sec: 1702353719
    URB usec: 59570
    URB status: Operation now in progress (-EINPROGRESS) (-115)
    URB length [bytes]: 0
    Data length [bytes]: 0
    [Response in: 42]
    Interval: 0
    Start frame: 0
    Copy of Transfer Flags: 0x00000000
    Number of ISO descriptors: 0
    [bInterfaceClass: Unknown (0xffff)]
Setup Data
    bmRequestType: 0x23
    bRequest: SET_FEATURE (0x03)
    wValue: 0x0004
    wIndex: 1
    wLength: 0

No.     Time           Source                Destination           Protocol Length Info
     42 28.616647      1.1.0                 host                  USBHUB   64     SET_FEATURE Response   [Port 1: PORT_RESET]

Frame 42: 64 bytes on wire (512 bits), 64 bytes captured (512 bits) on interface usbmon1, id 0
USB URB
    [Source: 1.1.0]
    [Destination: host]
    URB id: 0xffff993edd687d40
    URB type: URB_COMPLETE ('C')
    URB transfer type: URB_CONTROL (0x02)
    Endpoint: 0x00, Direction: OUT
    Device: 1
    URB bus id: 1
    Device setup request: not relevant ('-')
    Data: not present ('>')
    URB sec: 1702353719
    URB usec: 59582
    URB status: Success (0)
    URB length [bytes]: 0
    Data length [bytes]: 0
    [Request in: 41]
    [Time from request: 0.000012000 seconds]
    Unused Setup Header
    Interval: 0
    Start frame: 0
    Copy of Transfer Flags: 0x00000000
    Number of ISO descriptors: 0
    [bInterfaceClass: Unknown (0xffff)]

No.     Time           Source                Destination           Protocol Length Info
     43 28.682970      host                  1.1.0                 USBHUB   64     GET_STATUS Request     [Port 1]

Frame 43: 64 bytes on wire (512 bits), 64 bytes captured (512 bits) on interface usbmon1, id 0
USB URB
    [Source: host]
    [Destination: 1.1.0]
    URB id: 0xffff993edd687d40
    URB type: URB_SUBMIT ('S')
    URB transfer type: URB_CONTROL (0x02)
    Endpoint: 0x80, Direction: IN
    Device: 1
    URB bus id: 1
    Device setup request: relevant ('\0')
    Data: not present ('<')
    URB sec: 1702353719
    URB usec: 125905
    URB status: Operation now in progress (-EINPROGRESS) (-115)
    URB length [bytes]: 4
    Data length [bytes]: 0
    [Response in: 44]
    Interval: 0
    Start frame: 0
    Copy of Transfer Flags: 0x00000200, Dir IN
    Number of ISO descriptors: 0
    [bInterfaceClass: Unknown (0xffff)]
Setup Data
    bmRequestType: 0xa3
    bRequest: GET_STATUS (0x00)
    wValue: 0x0000
    wIndex: 1
    wLength: 4

No.     Time           Source                Destination           Protocol Length Info
     44 28.682983      1.1.0                 host                  USBHUB   68     GET_STATUS Response    [Port 1]

Frame 44: 68 bytes on wire (544 bits), 68 bytes captured (544 bits) on interface usbmon1, id 0
USB URB
    [Source: 1.1.0]
    [Destination: host]
    URB id: 0xffff993edd687d40
    URB type: URB_COMPLETE ('C')
    URB transfer type: URB_CONTROL (0x02)
    Endpoint: 0x80, Direction: IN
    Device: 1
    URB bus id: 1
    Device setup request: not relevant ('-')
    Data: present ('\0')
    URB sec: 1702353719
    URB usec: 125918
    URB status: Success (0)
    URB length [bytes]: 4
    Data length [bytes]: 4
    [Request in: 43]
    [Time from request: 0.000013000 seconds]
    Unused Setup Header
    Interval: 0
    Start frame: 0
    Copy of Transfer Flags: 0x00000200, Dir IN
    Number of ISO descriptors: 0
    [bInterfaceClass: Unknown (0xffff)]
Port Status: 0x0103, PORT_CONNECTION, PORT_ENABLE, PORT_POWER
Port Change: 0x0010, C_PORT_RESET

No.     Time           Source                Destination           Protocol Length Info
     45 28.682990      host                  1.1.0                 USBHUB   64     CLEAR_FEATURE Request  [Port 1: C_PORT_RESET]

Frame 45: 64 bytes on wire (512 bits), 64 bytes captured (512 bits) on interface usbmon1, id 0
USB URB
    [Source: host]
    [Destination: 1.1.0]
    URB id: 0xffff993edd687d40
    URB type: URB_SUBMIT ('S')
    URB transfer type: URB_CONTROL (0x02)
    Endpoint: 0x00, Direction: OUT
    Device: 1
    URB bus id: 1
    Device setup request: relevant ('\0')
    Data: present ('\0')
    URB sec: 1702353719
    URB usec: 125925
    URB status: Operation now in progress (-EINPROGRESS) (-115)
    URB length [bytes]: 0
    Data length [bytes]: 0
    [Response in: 46]
    Interval: 0
    Start frame: 0
    Copy of Transfer Flags: 0x00000000
    Number of ISO descriptors: 0
    [bInterfaceClass: Unknown (0xffff)]
Setup Data
    bmRequestType: 0x23
    bRequest: CLEAR_FEATURE (0x01)
    wValue: 0x0014
    wIndex: 1
    wLength: 0

No.     Time           Source                Destination           Protocol Length Info
     46 28.682997      1.1.0                 host                  USBHUB   64     CLEAR_FEATURE Response [Port 1: C_PORT_RESET]

Frame 46: 64 bytes on wire (512 bits), 64 bytes captured (512 bits) on interface usbmon1, id 0
USB URB
    [Source: 1.1.0]
    [Destination: host]
    URB id: 0xffff993edd687d40
    URB type: URB_COMPLETE ('C')
    URB transfer type: URB_CONTROL (0x02)
    Endpoint: 0x00, Direction: OUT
    Device: 1
    URB bus id: 1
    Device setup request: not relevant ('-')
    Data: not present ('>')
    URB sec: 1702353719
    URB usec: 125932
    URB status: Success (0)
    URB length [bytes]: 0
    Data length [bytes]: 0
    [Request in: 45]
    [Time from request: 0.000007000 seconds]
    Unused Setup Header
    Interval: 0
    Start frame: 0
    Copy of Transfer Flags: 0x00000000
    Number of ISO descriptors: 0
    [bInterfaceClass: Unknown (0xffff)]

No.     Time           Source                Destination           Protocol Length Info
     47 28.743055      host                  1.0.0                 USB      64     GET DESCRIPTOR Request DEVICE

Frame 47: 64 bytes on wire (512 bits), 64 bytes captured (512 bits) on interface usbmon1, id 0
USB URB
    [Source: host]
    [Destination: 1.0.0]
    URB id: 0xffff993edd687d40
    URB type: URB_SUBMIT ('S')
    URB transfer type: URB_CONTROL (0x02)
    Endpoint: 0x80, Direction: IN
    Device: 0
    URB bus id: 1
    Device setup request: relevant ('\0')
    Data: not present ('<')
    URB sec: 1702353719
    URB usec: 185990
    URB status: Operation now in progress (-EINPROGRESS) (-115)
    URB length [bytes]: 64
    Data length [bytes]: 0
    [Response in: 48]
    Interval: 0
    Start frame: 0
    Copy of Transfer Flags: 0x00000200, Dir IN
    Number of ISO descriptors: 0
Setup Data
    bmRequestType: 0x80
    bRequest: GET DESCRIPTOR (6)
    Descriptor Index: 0x00
    bDescriptorType: DEVICE (0x01)
    Language Id: no language specified (0x0000)
    wLength: 64

No.     Time           Source                Destination           Protocol Length Info
     48 28.744830      1.0.0                 host                  USB      82     GET DESCRIPTOR Response DEVICE

Frame 48: 82 bytes on wire (656 bits), 82 bytes captured (656 bits) on interface usbmon1, id 0
USB URB
    [Source: 1.0.0]
    [Destination: host]
    URB id: 0xffff993edd687d40
    URB type: URB_COMPLETE ('C')
    URB transfer type: URB_CONTROL (0x02)
    Endpoint: 0x80, Direction: IN
    Device: 0
    URB bus id: 1
    Device setup request: not relevant ('-')
    Data: present ('\0')
    URB sec: 1702353719
    URB usec: 187765
    URB status: Success (0)
    URB length [bytes]: 18
    Data length [bytes]: 18
    [Request in: 47]
    [Time from request: 0.001775000 seconds]
    Unused Setup Header
    Interval: 0
    Start frame: 0
    Copy of Transfer Flags: 0x00000200, Dir IN
    Number of ISO descriptors: 0
DEVICE DESCRIPTOR

No.     Time           Source                Destination           Protocol Length Info
     49 28.744844      host                  1.1.0                 USBHUB   64     SET_FEATURE Request    [Port 1: PORT_RESET]

Frame 49: 64 bytes on wire (512 bits), 64 bytes captured (512 bits) on interface usbmon1, id 0
USB URB
    [Source: host]
    [Destination: 1.1.0]
    URB id: 0xffff993edd687d40
    URB type: URB_SUBMIT ('S')
    URB transfer type: URB_CONTROL (0x02)
    Endpoint: 0x00, Direction: OUT
    Device: 1
    URB bus id: 1
    Device setup request: relevant ('\0')
    Data: present ('\0')
    URB sec: 1702353719
    URB usec: 187779
    URB status: Operation now in progress (-EINPROGRESS) (-115)
    URB length [bytes]: 0
    Data length [bytes]: 0
    [Response in: 50]
    Interval: 0
    Start frame: 0
    Copy of Transfer Flags: 0x00000000
    Number of ISO descriptors: 0
    [bInterfaceClass: Unknown (0xffff)]
Setup Data
    bmRequestType: 0x23
    bRequest: SET_FEATURE (0x03)
    wValue: 0x0004
    wIndex: 1
    wLength: 0

No.     Time           Source                Destination           Protocol Length Info
     50 28.744855      1.1.0                 host                  USBHUB   64     SET_FEATURE Response   [Port 1: PORT_RESET]

Frame 50: 64 bytes on wire (512 bits), 64 bytes captured (512 bits) on interface usbmon1, id 0
USB URB
    [Source: 1.1.0]
    [Destination: host]
    URB id: 0xffff993edd687d40
    URB type: URB_COMPLETE ('C')
    URB transfer type: URB_CONTROL (0x02)
    Endpoint: 0x00, Direction: OUT
    Device: 1
    URB bus id: 1
    Device setup request: not relevant ('-')
    Data: not present ('>')
    URB sec: 1702353719
    URB usec: 187790
    URB status: Success (0)
    URB length [bytes]: 0
    Data length [bytes]: 0
    [Request in: 49]
    [Time from request: 0.000011000 seconds]
    Unused Setup Header
    Interval: 0
    Start frame: 0
    Copy of Transfer Flags: 0x00000000
    Number of ISO descriptors: 0
    [bInterfaceClass: Unknown (0xffff)]

No.     Time           Source                Destination           Protocol Length Info
     51 28.810969      host                  1.1.0                 USBHUB   64     GET_STATUS Request     [Port 1]

Frame 51: 64 bytes on wire (512 bits), 64 bytes captured (512 bits) on interface usbmon1, id 0
USB URB
    [Source: host]
    [Destination: 1.1.0]
    URB id: 0xffff993edd687d40
    URB type: URB_SUBMIT ('S')
    URB transfer type: URB_CONTROL (0x02)
    Endpoint: 0x80, Direction: IN
    Device: 1
    URB bus id: 1
    Device setup request: relevant ('\0')
    Data: not present ('<')
    URB sec: 1702353719
    URB usec: 253904
    URB status: Operation now in progress (-EINPROGRESS) (-115)
    URB length [bytes]: 4
    Data length [bytes]: 0
    [Response in: 52]
    Interval: 0
    Start frame: 0
    Copy of Transfer Flags: 0x00000200, Dir IN
    Number of ISO descriptors: 0
    [bInterfaceClass: Unknown (0xffff)]
Setup Data
    bmRequestType: 0xa3
    bRequest: GET_STATUS (0x00)
    wValue: 0x0000
    wIndex: 1
    wLength: 4

No.     Time           Source                Destination           Protocol Length Info
     52 28.810981      1.1.0                 host                  USBHUB   68     GET_STATUS Response    [Port 1]

Frame 52: 68 bytes on wire (544 bits), 68 bytes captured (544 bits) on interface usbmon1, id 0
USB URB
    [Source: 1.1.0]
    [Destination: host]
    URB id: 0xffff993edd687d40
    URB type: URB_COMPLETE ('C')
    URB transfer type: URB_CONTROL (0x02)
    Endpoint: 0x80, Direction: IN
    Device: 1
    URB bus id: 1
    Device setup request: not relevant ('-')
    Data: present ('\0')
    URB sec: 1702353719
    URB usec: 253916
    URB status: Success (0)
    URB length [bytes]: 4
    Data length [bytes]: 4
    [Request in: 51]
    [Time from request: 0.000012000 seconds]
    Unused Setup Header
    Interval: 0
    Start frame: 0
    Copy of Transfer Flags: 0x00000200, Dir IN
    Number of ISO descriptors: 0
    [bInterfaceClass: Unknown (0xffff)]
Port Status: 0x0103, PORT_CONNECTION, PORT_ENABLE, PORT_POWER
Port Change: 0x0010, C_PORT_RESET

No.     Time           Source                Destination           Protocol Length Info
     53 28.810989      host                  1.1.0                 USBHUB   64     CLEAR_FEATURE Request  [Port 1: C_PORT_RESET]

Frame 53: 64 bytes on wire (512 bits), 64 bytes captured (512 bits) on interface usbmon1, id 0
USB URB
    [Source: host]
    [Destination: 1.1.0]
    URB id: 0xffff993edd687d40
    URB type: URB_SUBMIT ('S')
    URB transfer type: URB_CONTROL (0x02)
    Endpoint: 0x00, Direction: OUT
    Device: 1
    URB bus id: 1
    Device setup request: relevant ('\0')
    Data: present ('\0')
    URB sec: 1702353719
    URB usec: 253924
    URB status: Operation now in progress (-EINPROGRESS) (-115)
    URB length [bytes]: 0
    Data length [bytes]: 0
    [Response in: 54]
    Interval: 0
    Start frame: 0
    Copy of Transfer Flags: 0x00000000
    Number of ISO descriptors: 0
    [bInterfaceClass: Unknown (0xffff)]
Setup Data
    bmRequestType: 0x23
    bRequest: CLEAR_FEATURE (0x01)
    wValue: 0x0014
    wIndex: 1
    wLength: 0

No.     Time           Source                Destination           Protocol Length Info
     54 28.810997      1.1.0                 host                  USBHUB   64     CLEAR_FEATURE Response [Port 1: C_PORT_RESET]

Frame 54: 64 bytes on wire (512 bits), 64 bytes captured (512 bits) on interface usbmon1, id 0
USB URB
    [Source: 1.1.0]
    [Destination: host]
    URB id: 0xffff993edd687d40
    URB type: URB_COMPLETE ('C')
    URB transfer type: URB_CONTROL (0x02)
    Endpoint: 0x00, Direction: OUT
    Device: 1
    URB bus id: 1
    Device setup request: not relevant ('-')
    Data: not present ('>')
    URB sec: 1702353719
    URB usec: 253932
    URB status: Success (0)
    URB length [bytes]: 0
    Data length [bytes]: 0
    [Request in: 53]
    [Time from request: 0.000008000 seconds]
    Unused Setup Header
    Interval: 0
    Start frame: 0
    Copy of Transfer Flags: 0x00000000
    Number of ISO descriptors: 0
    [bInterfaceClass: Unknown (0xffff)]

No.     Time           Source                Destination           Protocol Length Info
     55 28.890972      host                  1.5.0                 USB      64     GET DESCRIPTOR Request DEVICE

Frame 55: 64 bytes on wire (512 bits), 64 bytes captured (512 bits) on interface usbmon1, id 0
USB URB
    [Source: host]
    [Destination: 1.5.0]
    URB id: 0xffff993e4b828c00
    URB type: URB_SUBMIT ('S')
    URB transfer type: URB_CONTROL (0x02)
    Endpoint: 0x80, Direction: IN
    Device: 5
    URB bus id: 1
    Device setup request: relevant ('\0')
    Data: not present ('<')
    URB sec: 1702353719
    URB usec: 333907
    URB status: Operation now in progress (-EINPROGRESS) (-115)
    URB length [bytes]: 18
    Data length [bytes]: 0
    [Response in: 56]
    Interval: 0
    Start frame: 0
    Copy of Transfer Flags: 0x00000200, Dir IN
    Number of ISO descriptors: 0
Setup Data
    bmRequestType: 0x80
    bRequest: GET DESCRIPTOR (6)
    Descriptor Index: 0x00
    bDescriptorType: DEVICE (0x01)
    Language Id: no language specified (0x0000)
    wLength: 18

No.     Time           Source                Destination           Protocol Length Info
     56 28.892839      1.5.0                 host                  USB      82     GET DESCRIPTOR Response DEVICE

Frame 56: 82 bytes on wire (656 bits), 82 bytes captured (656 bits) on interface usbmon1, id 0
USB URB
    [Source: 1.5.0]
    [Destination: host]
    URB id: 0xffff993e4b828c00
    URB type: URB_COMPLETE ('C')
    URB transfer type: URB_CONTROL (0x02)
    Endpoint: 0x80, Direction: IN
    Device: 5
    URB bus id: 1
    Device setup request: not relevant ('-')
    Data: present ('\0')
    URB sec: 1702353719
    URB usec: 335774
    URB status: Success (0)
    URB length [bytes]: 18
    Data length [bytes]: 18
    [Request in: 55]
    [Time from request: 0.001867000 seconds]
    Unused Setup Header
    Interval: 0
    Start frame: 0
    Copy of Transfer Flags: 0x00000200, Dir IN
    Number of ISO descriptors: 0
DEVICE DESCRIPTOR

No.     Time           Source                Destination           Protocol Length Info
     57 28.892857      host                  1.5.0                 USB      64     GET DESCRIPTOR Request CONFIGURATION

Frame 57: 64 bytes on wire (512 bits), 64 bytes captured (512 bits) on interface usbmon1, id 0
USB URB
    [Source: host]
    [Destination: 1.5.0]
    URB id: 0xffff993e4b828c00
    URB type: URB_SUBMIT ('S')
    URB transfer type: URB_CONTROL (0x02)
    Endpoint: 0x80, Direction: IN
    Device: 5
    URB bus id: 1
    Device setup request: relevant ('\0')
    Data: not present ('<')
    URB sec: 1702353719
    URB usec: 335792
    URB status: Operation now in progress (-EINPROGRESS) (-115)
    URB length [bytes]: 218
    Data length [bytes]: 0
    [Response in: 58]
    Interval: 0
    Start frame: 0
    Copy of Transfer Flags: 0x00000200, Dir IN
    Number of ISO descriptors: 0
Setup Data
    bmRequestType: 0x80
    bRequest: GET DESCRIPTOR (6)
    Descriptor Index: 0x00
    bDescriptorType: CONFIGURATION (0x02)
    Language Id: no language specified (0x0000)
    wLength: 218

No.     Time           Source                Destination           Protocol Length Info
     58 28.895844      1.5.0                 host                  USB      282    GET DESCRIPTOR Response CONFIGURATION

Frame 58: 282 bytes on wire (2256 bits), 282 bytes captured (2256 bits) on interface usbmon1, id 0
USB URB
    [Source: 1.5.0]
    [Destination: host]
    URB id: 0xffff993e4b828c00
    URB type: URB_COMPLETE ('C')
    URB transfer type: URB_CONTROL (0x02)
    Endpoint: 0x80, Direction: IN
    Device: 5
    URB bus id: 1
    Device setup request: not relevant ('-')
    Data: present ('\0')
    URB sec: 1702353719
    URB usec: 338779
    URB status: Success (0)
    URB length [bytes]: 218
    Data length [bytes]: 218
    [Request in: 57]
    [Time from request: 0.002987000 seconds]
    Unused Setup Header
    Interval: 0
    Start frame: 0
    Copy of Transfer Flags: 0x00000200, Dir IN
    Number of ISO descriptors: 0
CONFIGURATION DESCRIPTOR
INTERFACE DESCRIPTOR (0.0): class Vendor Specific
INTERFACE DESCRIPTOR (0.1): class Vendor Specific
ENDPOINT DESCRIPTOR
ENDPOINT DESCRIPTOR
ENDPOINT DESCRIPTOR
ENDPOINT DESCRIPTOR
ENDPOINT DESCRIPTOR
ENDPOINT DESCRIPTOR
ENDPOINT DESCRIPTOR
ENDPOINT DESCRIPTOR
ENDPOINT DESCRIPTOR
ENDPOINT DESCRIPTOR
ENDPOINT DESCRIPTOR
ENDPOINT DESCRIPTOR
ENDPOINT DESCRIPTOR
INTERFACE DESCRIPTOR (0.2): class Vendor Specific
ENDPOINT DESCRIPTOR
ENDPOINT DESCRIPTOR
ENDPOINT DESCRIPTOR
ENDPOINT DESCRIPTOR
ENDPOINT DESCRIPTOR
ENDPOINT DESCRIPTOR
ENDPOINT DESCRIPTOR
ENDPOINT DESCRIPTOR
ENDPOINT DESCRIPTOR
ENDPOINT DESCRIPTOR
ENDPOINT DESCRIPTOR
ENDPOINT DESCRIPTOR
ENDPOINT DESCRIPTOR

No.     Time           Source                Destination           Protocol Length Info
     59 28.895863      host                  1.5.0                 USB      64     SET CONFIGURATION Request

Frame 59: 64 bytes on wire (512 bits), 64 bytes captured (512 bits) on interface usbmon1, id 0
USB URB
    [Source: host]
    [Destination: 1.5.0]
    URB id: 0xffff993e4b828c00
    URB type: URB_SUBMIT ('S')
    URB transfer type: URB_CONTROL (0x02)
    Endpoint: 0x00, Direction: OUT
    Device: 5
    URB bus id: 1
    Device setup request: relevant ('\0')
    Data: present ('\0')
    URB sec: 1702353719
    URB usec: 338798
    URB status: Operation now in progress (-EINPROGRESS) (-115)
    URB length [bytes]: 0
    Data length [bytes]: 0
    [Response in: 60]
    Interval: 0
    Start frame: 0
    Copy of Transfer Flags: 0x00000000
    Number of ISO descriptors: 0
Setup Data
    bmRequestType: 0x00
    bRequest: SET CONFIGURATION (9)
    bConfigurationValue: 1
    wIndex: 0 (0x0000)
    wLength: 0

No.     Time           Source                Destination           Protocol Length Info
     60 28.897838      1.5.0                 host                  USB      64     SET CONFIGURATION Response

Frame 60: 64 bytes on wire (512 bits), 64 bytes captured (512 bits) on interface usbmon1, id 0
USB URB
    [Source: 1.5.0]
    [Destination: host]
    URB id: 0xffff993e4b828c00
    URB type: URB_COMPLETE ('C')
    URB transfer type: URB_CONTROL (0x02)
    Endpoint: 0x00, Direction: OUT
    Device: 5
    URB bus id: 1
    Device setup request: not relevant ('-')
    Data: not present ('>')
    URB sec: 1702353719
    URB usec: 340773
    URB status: Success (0)
    URB length [bytes]: 0
    Data length [bytes]: 0
    [Request in: 59]
    [Time from request: 0.001975000 seconds]
    Unused Setup Header
    Interval: 0
    Start frame: 0
    Copy of Transfer Flags: 0x00000000
    Number of ISO descriptors: 0

No.     Time           Source                Destination           Protocol Length Info
     61 28.942355      host                  1.5.0                 USB      64     GET DESCRIPTOR Request DEVICE

Frame 61: 64 bytes on wire (512 bits), 64 bytes captured (512 bits) on interface usbmon1, id 0
USB URB
    [Source: host]
    [Destination: 1.5.0]
    URB id: 0xffff993ece243980
    URB type: URB_SUBMIT ('S')
    URB transfer type: URB_CONTROL (0x02)
    Endpoint: 0x80, Direction: IN
    Device: 5
    URB bus id: 1
    Device setup request: relevant ('\0')
    Data: not present ('<')
    URB sec: 1702353719
    URB usec: 385290
    URB status: Operation now in progress (-EINPROGRESS) (-115)
    URB length [bytes]: 18
    Data length [bytes]: 0
    [Response in: 62]
    Interval: 0
    Start frame: 0
    Copy of Transfer Flags: 0x00000200, Dir IN
    Number of ISO descriptors: 0
Setup Data
    bmRequestType: 0x80
    bRequest: GET DESCRIPTOR (6)
    Descriptor Index: 0x00
    bDescriptorType: DEVICE (0x01)
    Language Id: no language specified (0x0000)
    wLength: 18

No.     Time           Source                Destination           Protocol Length Info
     62 28.943847      1.5.0                 host                  USB      82     GET DESCRIPTOR Response DEVICE

Frame 62: 82 bytes on wire (656 bits), 82 bytes captured (656 bits) on interface usbmon1, id 0
USB URB
    [Source: 1.5.0]
    [Destination: host]
    URB id: 0xffff993ece243980
    URB type: URB_COMPLETE ('C')
    URB transfer type: URB_CONTROL (0x02)
    Endpoint: 0x80, Direction: IN
    Device: 5
    URB bus id: 1
    Device setup request: not relevant ('-')
    Data: present ('\0')
    URB sec: 1702353719
    URB usec: 386782
    URB status: Success (0)
    URB length [bytes]: 18
    Data length [bytes]: 18
    [Request in: 61]
    [Time from request: 0.001492000 seconds]
    Unused Setup Header
    Interval: 0
    Start frame: 0
    Copy of Transfer Flags: 0x00000200, Dir IN
    Number of ISO descriptors: 0
DEVICE DESCRIPTOR

No.     Time           Source                Destination           Protocol Length Info
     63 28.946600      host                  1.5.0                 USB      64     GET DESCRIPTOR Request CONFIGURATION

Frame 63: 64 bytes on wire (512 bits), 64 bytes captured (512 bits) on interface usbmon1, id 0
USB URB
    [Source: host]
    [Destination: 1.5.0]
    URB id: 0xffff993ece242300
    URB type: URB_SUBMIT ('S')
    URB transfer type: URB_CONTROL (0x02)
    Endpoint: 0x80, Direction: IN
    Device: 5
    URB bus id: 1
    Device setup request: relevant ('\0')
    Data: not present ('<')
    URB sec: 1702353719
    URB usec: 389535
    URB status: Operation now in progress (-EINPROGRESS) (-115)
    URB length [bytes]: 255
    Data length [bytes]: 0
    [Response in: 64]
    Interval: 0
    Start frame: 0
    Copy of Transfer Flags: 0x00000200, Dir IN
    Number of ISO descriptors: 0
Setup Data
    bmRequestType: 0x80
    bRequest: GET DESCRIPTOR (6)
    Descriptor Index: 0x00
    bDescriptorType: CONFIGURATION (0x02)
    Language Id: no language specified (0x0000)
    wLength: 255

No.     Time           Source                Destination           Protocol Length Info
     64 28.947839      1.5.0                 host                  USB      282    GET DESCRIPTOR Response CONFIGURATION

Frame 64: 282 bytes on wire (2256 bits), 282 bytes captured (2256 bits) on interface usbmon1, id 0
USB URB
    [Source: 1.5.0]
    [Destination: host]
    URB id: 0xffff993ece242300
    URB type: URB_COMPLETE ('C')
    URB transfer type: URB_CONTROL (0x02)
    Endpoint: 0x80, Direction: IN
    Device: 5
    URB bus id: 1
    Device setup request: not relevant ('-')
    Data: present ('\0')
    URB sec: 1702353719
    URB usec: 390774
    URB status: Success (0)
    URB length [bytes]: 218
    Data length [bytes]: 218
    [Request in: 63]
    [Time from request: 0.001239000 seconds]
    Unused Setup Header
    Interval: 0
    Start frame: 0
    Copy of Transfer Flags: 0x00000200, Dir IN
    Number of ISO descriptors: 0
CONFIGURATION DESCRIPTOR
INTERFACE DESCRIPTOR (0.0): class Vendor Specific
INTERFACE DESCRIPTOR (0.1): class Vendor Specific
ENDPOINT DESCRIPTOR
ENDPOINT DESCRIPTOR
ENDPOINT DESCRIPTOR
ENDPOINT DESCRIPTOR
ENDPOINT DESCRIPTOR
ENDPOINT DESCRIPTOR
ENDPOINT DESCRIPTOR
ENDPOINT DESCRIPTOR
ENDPOINT DESCRIPTOR
ENDPOINT DESCRIPTOR
ENDPOINT DESCRIPTOR
ENDPOINT DESCRIPTOR
ENDPOINT DESCRIPTOR
INTERFACE DESCRIPTOR (0.2): class Vendor Specific
ENDPOINT DESCRIPTOR
ENDPOINT DESCRIPTOR
ENDPOINT DESCRIPTOR
ENDPOINT DESCRIPTOR
ENDPOINT DESCRIPTOR
ENDPOINT DESCRIPTOR
ENDPOINT DESCRIPTOR
ENDPOINT DESCRIPTOR
ENDPOINT DESCRIPTOR
ENDPOINT DESCRIPTOR
ENDPOINT DESCRIPTOR
ENDPOINT DESCRIPTOR
ENDPOINT DESCRIPTOR

No.     Time           Source                Destination           Protocol Length Info
     65 28.988527      host                  1.5.0                 USB      64     GET DESCRIPTOR Request DEVICE

Frame 65: 64 bytes on wire (512 bits), 64 bytes captured (512 bits) on interface usbmon1, id 0
USB URB
    [Source: host]
    [Destination: 1.5.0]
    URB id: 0xffff993ece242c00
    URB type: URB_SUBMIT ('S')
    URB transfer type: URB_CONTROL (0x02)
    Endpoint: 0x80, Direction: IN
    Device: 5
    URB bus id: 1
    Device setup request: relevant ('\0')
    Data: not present ('<')
    URB sec: 1702353719
    URB usec: 431462
    URB status: Operation now in progress (-EINPROGRESS) (-115)
    URB length [bytes]: 18
    Data length [bytes]: 0
    [Response in: 66]
    Interval: 0
    Start frame: 0
    Copy of Transfer Flags: 0x00000200, Dir IN
    Number of ISO descriptors: 0
Setup Data
    bmRequestType: 0x80
    bRequest: GET DESCRIPTOR (6)
    Descriptor Index: 0x00
    bDescriptorType: DEVICE (0x01)
    Language Id: no language specified (0x0000)
    wLength: 18

No.     Time           Source                Destination           Protocol Length Info
     66 28.989852      1.5.0                 host                  USB      82     GET DESCRIPTOR Response DEVICE

Frame 66: 82 bytes on wire (656 bits), 82 bytes captured (656 bits) on interface usbmon1, id 0
USB URB
    [Source: 1.5.0]
    [Destination: host]
    URB id: 0xffff993ece242c00
    URB type: URB_COMPLETE ('C')
    URB transfer type: URB_CONTROL (0x02)
    Endpoint: 0x80, Direction: IN
    Device: 5
    URB bus id: 1
    Device setup request: not relevant ('-')
    Data: present ('\0')
    URB sec: 1702353719
    URB usec: 432787
    URB status: Success (0)
    URB length [bytes]: 18
    Data length [bytes]: 18
    [Request in: 65]
    [Time from request: 0.001325000 seconds]
    Unused Setup Header
    Interval: 0
    Start frame: 0
    Copy of Transfer Flags: 0x00000200, Dir IN
    Number of ISO descriptors: 0
DEVICE DESCRIPTOR

No.     Time           Source                Destination           Protocol Length Info
     67 28.992826      host                  1.5.0                 USB      64     GET DESCRIPTOR Request CONFIGURATION

Frame 67: 64 bytes on wire (512 bits), 64 bytes captured (512 bits) on interface usbmon1, id 0
USB URB
    [Source: host]
    [Destination: 1.5.0]
    URB id: 0xffff993ece243440
    URB type: URB_SUBMIT ('S')
    URB transfer type: URB_CONTROL (0x02)
    Endpoint: 0x80, Direction: IN
    Device: 5
    URB bus id: 1
    Device setup request: relevant ('\0')
    Data: not present ('<')
    URB sec: 1702353719
    URB usec: 435761
    URB status: Operation now in progress (-EINPROGRESS) (-115)
    URB length [bytes]: 9
    Data length [bytes]: 0
    [Response in: 68]
    Interval: 0
    Start frame: 0
    Copy of Transfer Flags: 0x00000200, Dir IN
    Number of ISO descriptors: 0
Setup Data
    bmRequestType: 0x80
    bRequest: GET DESCRIPTOR (6)
    Descriptor Index: 0x00
    bDescriptorType: CONFIGURATION (0x02)
    Language Id: no language specified (0x0000)
    wLength: 9

No.     Time           Source                Destination           Protocol Length Info
     68 28.994858      1.5.0                 host                  USB      73     GET DESCRIPTOR Response CONFIGURATION

Frame 68: 73 bytes on wire (584 bits), 73 bytes captured (584 bits) on interface usbmon1, id 0
USB URB
    [Source: 1.5.0]
    [Destination: host]
    URB id: 0xffff993ece243440
    URB type: URB_COMPLETE ('C')
    URB transfer type: URB_CONTROL (0x02)
    Endpoint: 0x80, Direction: IN
    Device: 5
    URB bus id: 1
    Device setup request: not relevant ('-')
    Data: present ('\0')
    URB sec: 1702353719
    URB usec: 437793
    URB status: Success (0)
    URB length [bytes]: 9
    Data length [bytes]: 9
    [Request in: 67]
    [Time from request: 0.002032000 seconds]
    Unused Setup Header
    Interval: 0
    Start frame: 0
    Copy of Transfer Flags: 0x00000200, Dir IN
    Number of ISO descriptors: 0
CONFIGURATION DESCRIPTOR

No.     Time           Source                Destination           Protocol Length Info
     69 28.997156      host                  1.5.0                 USB      64     GET DESCRIPTOR Request CONFIGURATION

Frame 69: 64 bytes on wire (512 bits), 64 bytes captured (512 bits) on interface usbmon1, id 0
USB URB
    [Source: host]
    [Destination: 1.5.0]
    URB id: 0xffff993ece242480
    URB type: URB_SUBMIT ('S')
    URB transfer type: URB_CONTROL (0x02)
    Endpoint: 0x80, Direction: IN
    Device: 5
    URB bus id: 1
    Device setup request: relevant ('\0')
    Data: not present ('<')
    URB sec: 1702353719
    URB usec: 440091
    URB status: Operation now in progress (-EINPROGRESS) (-115)
    URB length [bytes]: 218
    Data length [bytes]: 0
    [Response in: 70]
    Interval: 0
    Start frame: 0
    Copy of Transfer Flags: 0x00000200, Dir IN
    Number of ISO descriptors: 0
Setup Data
    bmRequestType: 0x80
    bRequest: GET DESCRIPTOR (6)
    Descriptor Index: 0x00
    bDescriptorType: CONFIGURATION (0x02)
    Language Id: no language specified (0x0000)
    wLength: 218

No.     Time           Source                Destination           Protocol Length Info
     70 28.998864      1.5.0                 host                  USB      282    GET DESCRIPTOR Response CONFIGURATION

Frame 70: 282 bytes on wire (2256 bits), 282 bytes captured (2256 bits) on interface usbmon1, id 0
USB URB
    [Source: 1.5.0]
    [Destination: host]
    URB id: 0xffff993ece242480
    URB type: URB_COMPLETE ('C')
    URB transfer type: URB_CONTROL (0x02)
    Endpoint: 0x80, Direction: IN
    Device: 5
    URB bus id: 1
    Device setup request: not relevant ('-')
    Data: present ('\0')
    URB sec: 1702353719
    URB usec: 441799
    URB status: Success (0)
    URB length [bytes]: 218
    Data length [bytes]: 218
    [Request in: 69]
    [Time from request: 0.001708000 seconds]
    Unused Setup Header
    Interval: 0
    Start frame: 0
    Copy of Transfer Flags: 0x00000200, Dir IN
    Number of ISO descriptors: 0
CONFIGURATION DESCRIPTOR
INTERFACE DESCRIPTOR (0.0): class Vendor Specific
INTERFACE DESCRIPTOR (0.1): class Vendor Specific
ENDPOINT DESCRIPTOR
ENDPOINT DESCRIPTOR
ENDPOINT DESCRIPTOR
ENDPOINT DESCRIPTOR
ENDPOINT DESCRIPTOR
ENDPOINT DESCRIPTOR
ENDPOINT DESCRIPTOR
ENDPOINT DESCRIPTOR
ENDPOINT DESCRIPTOR
ENDPOINT DESCRIPTOR
ENDPOINT DESCRIPTOR
ENDPOINT DESCRIPTOR
ENDPOINT DESCRIPTOR
INTERFACE DESCRIPTOR (0.2): class Vendor Specific
ENDPOINT DESCRIPTOR
ENDPOINT DESCRIPTOR
ENDPOINT DESCRIPTOR
ENDPOINT DESCRIPTOR
ENDPOINT DESCRIPTOR
ENDPOINT DESCRIPTOR
ENDPOINT DESCRIPTOR
ENDPOINT DESCRIPTOR
ENDPOINT DESCRIPTOR
ENDPOINT DESCRIPTOR
ENDPOINT DESCRIPTOR
ENDPOINT DESCRIPTOR
ENDPOINT DESCRIPTOR

No.     Time           Source                Destination           Protocol Length Info
     71 29.003455      host                  1.5.0                 USB      64     SET INTERFACE Request

Frame 71: 64 bytes on wire (512 bits), 64 bytes captured (512 bits) on interface usbmon1, id 0
USB URB
    [Source: host]
    [Destination: 1.5.0]
    URB id: 0xffff993e4b55b2c0
    URB type: URB_SUBMIT ('S')
    URB transfer type: URB_CONTROL (0x02)
    Endpoint: 0x00, Direction: OUT
    Device: 5
    URB bus id: 1
    Device setup request: relevant ('\0')
    Data: present ('\0')
    URB sec: 1702353719
    URB usec: 446390
    URB status: Operation now in progress (-EINPROGRESS) (-115)
    URB length [bytes]: 0
    Data length [bytes]: 0
    [Response in: 72]
    Interval: 0
    Start frame: 0
    Copy of Transfer Flags: 0x00000000
    Number of ISO descriptors: 0
Setup Data
    bmRequestType: 0x01
    bRequest: SET INTERFACE (11)
    bAlternateSetting: 0
    wInterface: 0
    wLength: 0

No.     Time           Source                Destination           Protocol Length Info
     72 29.003849      1.5.0                 host                  USB      64     SET INTERFACE Response

Frame 72: 64 bytes on wire (512 bits), 64 bytes captured (512 bits) on interface usbmon1, id 0
USB URB
    [Source: 1.5.0]
    [Destination: host]
    URB id: 0xffff993e4b55b2c0
    URB type: URB_COMPLETE ('C')
    URB transfer type: URB_CONTROL (0x02)
    Endpoint: 0x00, Direction: OUT
    Device: 5
    URB bus id: 1
    Device setup request: not relevant ('-')
    Data: not present ('>')
    URB sec: 1702353719
    URB usec: 446784
    URB status: Success (0)
    URB length [bytes]: 0
    Data length [bytes]: 0
    [Request in: 71]
    [Time from request: 0.000394000 seconds]
    Unused Setup Header
    Interval: 0
    Start frame: 0
    Copy of Transfer Flags: 0x00000000
    Number of ISO descriptors: 0

No.     Time           Source                Destination           Protocol Length Info
     73 29.005615      host                  1.5.0                 USB      65     URB_CONTROL out

Frame 73: 65 bytes on wire (520 bits), 65 bytes captured (520 bits) on interface usbmon1, id 0
USB URB
    [Source: host]
    [Destination: 1.5.0]
    URB id: 0xffff993e40248c00
    URB type: URB_SUBMIT ('S')
    URB transfer type: URB_CONTROL (0x02)
    Endpoint: 0x00, Direction: OUT
    Device: 5
    URB bus id: 1
    Device setup request: relevant ('\0')
    Data: present ('\0')
    URB sec: 1702353719
    URB usec: 448550
    URB status: Operation now in progress (-EINPROGRESS) (-115)
    URB length [bytes]: 1
    Data length [bytes]: 1
    [Response in: 74]
    Interval: 0
    Start frame: 0
    Copy of Transfer Flags: 0x00000000
    Number of ISO descriptors: 0
    [bInterfaceClass: Unknown (0xffff)]
Setup Data
    bmRequestType: 0x40
    bRequest: 160
    wValue: 0x7f92
    wIndex: 0 (0x0000)
    wLength: 1
    Data Fragment: 01

No.     Time           Source                Destination           Protocol Length Info
     74 29.006848      1.5.0                 host                  USB      64     URB_CONTROL out

Frame 74: 64 bytes on wire (512 bits), 64 bytes captured (512 bits) on interface usbmon1, id 0
USB URB
    [Source: 1.5.0]
    [Destination: host]
    URB id: 0xffff993e40248c00
    URB type: URB_COMPLETE ('C')
    URB transfer type: URB_CONTROL (0x02)
    Endpoint: 0x00, Direction: OUT
    Device: 5
    URB bus id: 1
    Device setup request: not relevant ('-')
    Data: not present ('>')
    URB sec: 1702353719
    URB usec: 449783
    URB status: Success (0)
    URB length [bytes]: 1
    Data length [bytes]: 0
    [Request in: 73]
    [Time from request: 0.001233000 seconds]
    Unused Setup Header
    Interval: 0
    Start frame: 0
    Copy of Transfer Flags: 0x00000000
    Number of ISO descriptors: 0
    [bInterfaceClass: Unknown (0xffff)]

No.     Time           Source                Destination           Protocol Length Info
     75 29.010834      host                  1.5.0                 USB      65     URB_CONTROL out

Frame 75: 65 bytes on wire (520 bits), 65 bytes captured (520 bits) on interface usbmon1, id 0
USB URB
    [Source: host]
    [Destination: 1.5.0]
    URB id: 0xffff993e40248000
    URB type: URB_SUBMIT ('S')
    URB transfer type: URB_CONTROL (0x02)
    Endpoint: 0x00, Direction: OUT
    Device: 5
    URB bus id: 1
    Device setup request: relevant ('\0')
    Data: present ('\0')
    URB sec: 1702353719
    URB usec: 453769
    URB status: Operation now in progress (-EINPROGRESS) (-115)
    URB length [bytes]: 1
    Data length [bytes]: 1
    [Response in: 76]
    Interval: 0
    Start frame: 0
    Copy of Transfer Flags: 0x00000000
    Number of ISO descriptors: 0
    [bInterfaceClass: Unknown (0xffff)]
Setup Data
    bmRequestType: 0x40
    bRequest: 160
    wValue: 0xe600
    wIndex: 0 (0x0000)
    wLength: 1
    Data Fragment: 01

No.     Time           Source                Destination           Protocol Length Info
     76 29.012845      1.5.0                 host                  USB      64     URB_CONTROL out

Frame 76: 64 bytes on wire (512 bits), 64 bytes captured (512 bits) on interface usbmon1, id 0
USB URB
    [Source: 1.5.0]
    [Destination: host]
    URB id: 0xffff993e40248000
    URB type: URB_COMPLETE ('C')
    URB transfer type: URB_CONTROL (0x02)
    Endpoint: 0x00, Direction: OUT
    Device: 5
    URB bus id: 1
    Device setup request: not relevant ('-')
    Data: not present ('>')
    URB sec: 1702353719
    URB usec: 455780
    URB status: Success (0)
    URB length [bytes]: 1
    Data length [bytes]: 0
    [Request in: 75]
    [Time from request: 0.002011000 seconds]
    Unused Setup Header
    Interval: 0
    Start frame: 0
    Copy of Transfer Flags: 0x00000000
    Number of ISO descriptors: 0
    [bInterfaceClass: Unknown (0xffff)]

No.     Time           Source                Destination           Protocol Length Info
     77 29.015152      host                  1.5.0                 USB      65     URB_CONTROL out

Frame 77: 65 bytes on wire (520 bits), 65 bytes captured (520 bits) on interface usbmon1, id 0
USB URB
    [Source: host]
    [Destination: 1.5.0]
    URB id: 0xffff993e40249980
    URB type: URB_SUBMIT ('S')
    URB transfer type: URB_CONTROL (0x02)
    Endpoint: 0x00, Direction: OUT
    Device: 5
    URB bus id: 1
    Device setup request: relevant ('\0')
    Data: present ('\0')
    URB sec: 1702353719
    URB usec: 458087
    URB status: Operation now in progress (-EINPROGRESS) (-115)
    URB length [bytes]: 1
    Data length [bytes]: 1
    [Response in: 78]
    Interval: 0
    Start frame: 0
    Copy of Transfer Flags: 0x00000000
    Number of ISO descriptors: 0
    [bInterfaceClass: Unknown (0xffff)]
Setup Data
    bmRequestType: 0x40
    bRequest: 160
    wValue: 0x7f92
    wIndex: 0 (0x0000)
    wLength: 1
    Data Fragment: 01

No.     Time           Source                Destination           Protocol Length Info
     78 29.016845      1.5.0                 host                  USB      64     URB_CONTROL out

Frame 78: 64 bytes on wire (512 bits), 64 bytes captured (512 bits) on interface usbmon1, id 0
USB URB
    [Source: 1.5.0]
    [Destination: host]
    URB id: 0xffff993e40249980
    URB type: URB_COMPLETE ('C')
    URB transfer type: URB_CONTROL (0x02)
    Endpoint: 0x00, Direction: OUT
    Device: 5
    URB bus id: 1
    Device setup request: not relevant ('-')
    Data: not present ('>')
    URB sec: 1702353719
    URB usec: 459780
    URB status: Success (0)
    URB length [bytes]: 1
    Data length [bytes]: 0
    [Request in: 77]
    [Time from request: 0.001693000 seconds]
    Unused Setup Header
    Interval: 0
    Start frame: 0
    Copy of Transfer Flags: 0x00000000
    Number of ISO descriptors: 0
    [bInterfaceClass: Unknown (0xffff)]

No.     Time           Source                Destination           Protocol Length Info
     79 29.019447      host                  1.5.0                 USB      65     URB_CONTROL out

Frame 79: 65 bytes on wire (520 bits), 65 bytes captured (520 bits) on interface usbmon1, id 0
USB URB
    [Source: host]
    [Destination: 1.5.0]
    URB id: 0xffff993e40249380
    URB type: URB_SUBMIT ('S')
    URB transfer type: URB_CONTROL (0x02)
    Endpoint: 0x00, Direction: OUT
    Device: 5
    URB bus id: 1
    Device setup request: relevant ('\0')
    Data: present ('\0')
    URB sec: 1702353719
    URB usec: 462382
    URB status: Operation now in progress (-EINPROGRESS) (-115)
    URB length [bytes]: 1
    Data length [bytes]: 1
    [Response in: 80]
    Interval: 0
    Start frame: 0
    Copy of Transfer Flags: 0x00000000
    Number of ISO descriptors: 0
    [bInterfaceClass: Unknown (0xffff)]
Setup Data
    bmRequestType: 0x40
    bRequest: 160
    wValue: 0xe600
    wIndex: 0 (0x0000)
    wLength: 1
    Data Fragment: 01

No.     Time           Source                Destination           Protocol Length Info
     80 29.020846      1.5.0                 host                  USB      64     URB_CONTROL out

Frame 80: 64 bytes on wire (512 bits), 64 bytes captured (512 bits) on interface usbmon1, id 0
USB URB
    [Source: 1.5.0]
    [Destination: host]
    URB id: 0xffff993e40249380
    URB type: URB_COMPLETE ('C')
    URB transfer type: URB_CONTROL (0x02)
    Endpoint: 0x00, Direction: OUT
    Device: 5
    URB bus id: 1
    Device setup request: not relevant ('-')
    Data: not present ('>')
    URB sec: 1702353719
    URB usec: 463781
    URB status: Success (0)
    URB length [bytes]: 1
    Data length [bytes]: 0
    [Request in: 79]
    [Time from request: 0.001399000 seconds]
    Unused Setup Header
    Interval: 0
    Start frame: 0
    Copy of Transfer Flags: 0x00000000
    Number of ISO descriptors: 0
    [bInterfaceClass: Unknown (0xffff)]

No.     Time           Source                Destination           Protocol Length Info
     81 29.023778      host                  1.5.0                 USB      70     URB_CONTROL out

Frame 81: 70 bytes on wire (560 bits), 70 bytes captured (560 bits) on interface usbmon1, id 0
USB URB
    [Source: host]
    [Destination: 1.5.0]
    URB id: 0xffff993e40249500
    URB type: URB_SUBMIT ('S')
    URB transfer type: URB_CONTROL (0x02)
    Endpoint: 0x00, Direction: OUT
    Device: 5
    URB bus id: 1
    Device setup request: relevant ('\0')
    Data: present ('\0')
    URB sec: 1702353719
    URB usec: 466713
    URB status: Operation now in progress (-EINPROGRESS) (-115)
    URB length [bytes]: 6
    Data length [bytes]: 6
    [Response in: 82]
    Interval: 0
    Start frame: 0
    Copy of Transfer Flags: 0x00000000
    Number of ISO descriptors: 0
    [bInterfaceClass: Unknown (0xffff)]
Setup Data
    bmRequestType: 0x40
    bRequest: 160
    wValue: 0x0000
    wIndex: 0 (0x0000)
    wLength: 6
    Data Fragment: 02023a0201bc

No.     Time           Source                Destination           Protocol Length Info
     82 29.024846      1.5.0                 host                  USB      64     URB_CONTROL out

Frame 82: 64 bytes on wire (512 bits), 64 bytes captured (512 bits) on interface usbmon1, id 0
USB URB
    [Source: 1.5.0]
    [Destination: host]
    URB id: 0xffff993e40249500
    URB type: URB_COMPLETE ('C')
    URB transfer type: URB_CONTROL (0x02)
    Endpoint: 0x00, Direction: OUT
    Device: 5
    URB bus id: 1
    Device setup request: not relevant ('-')
    Data: not present ('>')
    URB sec: 1702353719
    URB usec: 467781
    URB status: Success (0)
    URB length [bytes]: 6
    Data length [bytes]: 0
    [Request in: 81]
    [Time from request: 0.001068000 seconds]
    Unused Setup Header
    Interval: 0
    Start frame: 0
    Copy of Transfer Flags: 0x00000000
    Number of ISO descriptors: 0
    [bInterfaceClass: Unknown (0xffff)]

No.     Time           Source                Destination           Protocol Length Info
     83 29.031085      host                  1.5.0                 USB      67     URB_CONTROL out

Frame 83: 67 bytes on wire (536 bits), 67 bytes captured (536 bits) on interface usbmon1, id 0
USB URB
    [Source: host]
    [Destination: 1.5.0]
    URB id: 0xffff993e40249ec0
    URB type: URB_SUBMIT ('S')
    URB transfer type: URB_CONTROL (0x02)
    Endpoint: 0x00, Direction: OUT
    Device: 5
    URB bus id: 1
    Device setup request: relevant ('\0')
    Data: present ('\0')
    URB sec: 1702353719
    URB usec: 474020
    URB status: Operation now in progress (-EINPROGRESS) (-115)
    URB length [bytes]: 3
    Data length [bytes]: 3
    [Response in: 84]
    Interval: 0
    Start frame: 0
    Copy of Transfer Flags: 0x00000000
    Number of ISO descriptors: 0
    [bInterfaceClass: Unknown (0xffff)]
Setup Data
    bmRequestType: 0x40
    bRequest: 160
    wValue: 0x000b
    wIndex: 0 (0x0000)
    wLength: 3
    Data Fragment: 020584

No.     Time           Source                Destination           Protocol Length Info
     84 29.032845      1.5.0                 host                  USB      64     URB_CONTROL out

Frame 84: 64 bytes on wire (512 bits), 64 bytes captured (512 bits) on interface usbmon1, id 0
USB URB
    [Source: 1.5.0]
    [Destination: host]
    URB id: 0xffff993e40249ec0
    URB type: URB_COMPLETE ('C')
    URB transfer type: URB_CONTROL (0x02)
    Endpoint: 0x00, Direction: OUT
    Device: 5
    URB bus id: 1
    Device setup request: not relevant ('-')
    Data: not present ('>')
    URB sec: 1702353719
    URB usec: 475780
    URB status: Success (0)
    URB length [bytes]: 3
    Data length [bytes]: 0
    [Request in: 83]
    [Time from request: 0.001760000 seconds]
    Unused Setup Header
    Interval: 0
    Start frame: 0
    Copy of Transfer Flags: 0x00000000
    Number of ISO descriptors: 0
    [bInterfaceClass: Unknown (0xffff)]

No.     Time           Source                Destination           Protocol Length Info
     85 29.035125      host                  1.5.0                 USB      67     URB_CONTROL out

Frame 85: 67 bytes on wire (536 bits), 67 bytes captured (536 bits) on interface usbmon1, id 0
USB URB
    [Source: host]
    [Destination: 1.5.0]
    URB id: 0xffff993e40249ec0
    URB type: URB_SUBMIT ('S')
    URB transfer type: URB_CONTROL (0x02)
    Endpoint: 0x00, Direction: OUT
    Device: 5
    URB bus id: 1
    Device setup request: relevant ('\0')
    Data: present ('\0')
    URB sec: 1702353719
    URB usec: 478060
    URB status: Operation now in progress (-EINPROGRESS) (-115)
    URB length [bytes]: 3
    Data length [bytes]: 3
    [Response in: 86]
    Interval: 0
    Start frame: 0
    Copy of Transfer Flags: 0x00000000
    Number of ISO descriptors: 0
    [bInterfaceClass: Unknown (0xffff)]
Setup Data
    bmRequestType: 0x40
    bRequest: 160
    wValue: 0x0013
    wIndex: 0 (0x0000)
    wLength: 3
    Data Fragment: 0201bc

No.     Time           Source                Destination           Protocol Length Info
     86 29.036852      1.5.0                 host                  USB      64     URB_CONTROL out

Frame 86: 64 bytes on wire (512 bits), 64 bytes captured (512 bits) on interface usbmon1, id 0
USB URB
    [Source: 1.5.0]
    [Destination: host]
    URB id: 0xffff993e40249ec0
    URB type: URB_COMPLETE ('C')
    URB transfer type: URB_CONTROL (0x02)
    Endpoint: 0x00, Direction: OUT
    Device: 5
    URB bus id: 1
    Device setup request: not relevant ('-')
    Data: not present ('>')
    URB sec: 1702353719
    URB usec: 479787
    URB status: Success (0)
    URB length [bytes]: 3
    Data length [bytes]: 0
    [Request in: 85]
    [Time from request: 0.001727000 seconds]
    Unused Setup Header
    Interval: 0
    Start frame: 0
    Copy of Transfer Flags: 0x00000000
    Number of ISO descriptors: 0
    [bInterfaceClass: Unknown (0xffff)]

No.     Time           Source                Destination           Protocol Length Info
     87 29.039466      host                  1.5.0                 USB      67     URB_CONTROL out

Frame 87: 67 bytes on wire (536 bits), 67 bytes captured (536 bits) on interface usbmon1, id 0
USB URB
    [Source: host]
    [Destination: 1.5.0]
    URB id: 0xffff993e40249500
    URB type: URB_SUBMIT ('S')
    URB transfer type: URB_CONTROL (0x02)
    Endpoint: 0x00, Direction: OUT
    Device: 5
    URB bus id: 1
    Device setup request: relevant ('\0')
    Data: present ('\0')
    URB sec: 1702353719
    URB usec: 482401
    URB status: Operation now in progress (-EINPROGRESS) (-115)
    URB length [bytes]: 3
    Data length [bytes]: 3
    [Response in: 88]
    Interval: 0
    Start frame: 0
    Copy of Transfer Flags: 0x00000000
    Number of ISO descriptors: 0
    [bInterfaceClass: Unknown (0xffff)]
Setup Data
    bmRequestType: 0x40
    bRequest: 160
    wValue: 0x001b
    wIndex: 0 (0x0000)
    wLength: 3
    Data Fragment: 0201bc

No.     Time           Source                Destination           Protocol Length Info
     88 29.040855      1.5.0                 host                  USB      64     URB_CONTROL out

Frame 88: 64 bytes on wire (512 bits), 64 bytes captured (512 bits) on interface usbmon1, id 0
USB URB
    [Source: 1.5.0]
    [Destination: host]
    URB id: 0xffff993e40249500
    URB type: URB_COMPLETE ('C')
    URB transfer type: URB_CONTROL (0x02)
    Endpoint: 0x00, Direction: OUT
    Device: 5
    URB bus id: 1
    Device setup request: not relevant ('-')
    Data: not present ('>')
    URB sec: 1702353719
    URB usec: 483790
    URB status: Success (0)
    URB length [bytes]: 3
    Data length [bytes]: 0
    [Request in: 87]
    [Time from request: 0.001389000 seconds]
    Unused Setup Header
    Interval: 0
    Start frame: 0
    Copy of Transfer Flags: 0x00000000
    Number of ISO descriptors: 0
    [bInterfaceClass: Unknown (0xffff)]

No.     Time           Source                Destination           Protocol Length Info
     89 29.043810      host                  1.5.0                 USB      67     URB_CONTROL out

Frame 89: 67 bytes on wire (536 bits), 67 bytes captured (536 bits) on interface usbmon1, id 0
USB URB
    [Source: host]
    [Destination: 1.5.0]
    URB id: 0xffff993e40249380
    URB type: URB_SUBMIT ('S')
    URB transfer type: URB_CONTROL (0x02)
    Endpoint: 0x00, Direction: OUT
    Device: 5
    URB bus id: 1
    Device setup request: relevant ('\0')
    Data: present ('\0')
    URB sec: 1702353719
    URB usec: 486745
    URB status: Operation now in progress (-EINPROGRESS) (-115)
    URB length [bytes]: 3
    Data length [bytes]: 3
    [Response in: 90]
    Interval: 0
    Start frame: 0
    Copy of Transfer Flags: 0x00000000
    Number of ISO descriptors: 0
    [bInterfaceClass: Unknown (0xffff)]
Setup Data
    bmRequestType: 0x40
    bRequest: 160
    wValue: 0x0023
    wIndex: 0 (0x0000)
    wLength: 3
    Data Fragment: 0201bc

No.     Time           Source                Destination           Protocol Length Info
     90 29.045852      1.5.0                 host                  USB      64     URB_CONTROL out

Frame 90: 64 bytes on wire (512 bits), 64 bytes captured (512 bits) on interface usbmon1, id 0
USB URB
    [Source: 1.5.0]
    [Destination: host]
    URB id: 0xffff993e40249380
    URB type: URB_COMPLETE ('C')
    URB transfer type: URB_CONTROL (0x02)
    Endpoint: 0x00, Direction: OUT
    Device: 5
    URB bus id: 1
    Device setup request: not relevant ('-')
    Data: not present ('>')
    URB sec: 1702353719
    URB usec: 488787
    URB status: Success (0)
    URB length [bytes]: 3
    Data length [bytes]: 0
    [Request in: 89]
    [Time from request: 0.002042000 seconds]
    Unused Setup Header
    Interval: 0
    Start frame: 0
    Copy of Transfer Flags: 0x00000000
    Number of ISO descriptors: 0
    [bInterfaceClass: Unknown (0xffff)]

No.     Time           Source                Destination           Protocol Length Info
     91 29.048067      host                  1.5.0                 USB      67     URB_CONTROL out

Frame 91: 67 bytes on wire (536 bits), 67 bytes captured (536 bits) on interface usbmon1, id 0
USB URB
    [Source: host]
    [Destination: 1.5.0]
    URB id: 0xffff993e40249980
    URB type: URB_SUBMIT ('S')
    URB transfer type: URB_CONTROL (0x02)
    Endpoint: 0x00, Direction: OUT
    Device: 5
    URB bus id: 1
    Device setup request: relevant ('\0')
    Data: present ('\0')
    URB sec: 1702353719
    URB usec: 491002
    URB status: Operation now in progress (-EINPROGRESS) (-115)
    URB length [bytes]: 3
    Data length [bytes]: 3
    [Response in: 92]
    Interval: 0
    Start frame: 0
    Copy of Transfer Flags: 0x00000000
    Number of ISO descriptors: 0
    [bInterfaceClass: Unknown (0xffff)]
Setup Data
    bmRequestType: 0x40
    bRequest: 160
    wValue: 0x002b
    wIndex: 0 (0x0000)
    wLength: 3
    Data Fragment: 0201bc

No.     Time           Source                Destination           Protocol Length Info
     92 29.049847      1.5.0                 host                  USB      64     URB_CONTROL out

Frame 92: 64 bytes on wire (512 bits), 64 bytes captured (512 bits) on interface usbmon1, id 0
USB URB
    [Source: 1.5.0]
    [Destination: host]
    URB id: 0xffff993e40249980
    URB type: URB_COMPLETE ('C')
    URB transfer type: URB_CONTROL (0x02)
    Endpoint: 0x00, Direction: OUT
    Device: 5
    URB bus id: 1
    Device setup request: not relevant ('-')
    Data: not present ('>')
    URB sec: 1702353719
    URB usec: 492782
    URB status: Success (0)
    URB length [bytes]: 3
    Data length [bytes]: 0
    [Request in: 91]
    [Time from request: 0.001780000 seconds]
    Unused Setup Header
    Interval: 0
    Start frame: 0
    Copy of Transfer Flags: 0x00000000
    Number of ISO descriptors: 0
    [bInterfaceClass: Unknown (0xffff)]

No.     Time           Source                Destination           Protocol Length Info
     93 29.052080      host                  1.5.0                 USB      67     URB_CONTROL out

Frame 93: 67 bytes on wire (536 bits), 67 bytes captured (536 bits) on interface usbmon1, id 0
USB URB
    [Source: host]
    [Destination: 1.5.0]
    URB id: 0xffff993e40248000
    URB type: URB_SUBMIT ('S')
    URB transfer type: URB_CONTROL (0x02)
    Endpoint: 0x00, Direction: OUT
    Device: 5
    URB bus id: 1
    Device setup request: relevant ('\0')
    Data: present ('\0')
    URB sec: 1702353719
    URB usec: 495015
    URB status: Operation now in progress (-EINPROGRESS) (-115)
    URB length [bytes]: 3
    Data length [bytes]: 3
    [Response in: 94]
    Interval: 0
    Start frame: 0
    Copy of Transfer Flags: 0x00000000
    Number of ISO descriptors: 0
    [bInterfaceClass: Unknown (0xffff)]
Setup Data
    bmRequestType: 0x40
    bRequest: 160
    wValue: 0x0033
    wIndex: 0 (0x0000)
    wLength: 3
    Data Fragment: 0201bc

No.     Time           Source                Destination           Protocol Length Info
     94 29.053854      1.5.0                 host                  USB      64     URB_CONTROL out

Frame 94: 64 bytes on wire (512 bits), 64 bytes captured (512 bits) on interface usbmon1, id 0
USB URB
    [Source: 1.5.0]
    [Destination: host]
    URB id: 0xffff993e40248000
    URB type: URB_COMPLETE ('C')
    URB transfer type: URB_CONTROL (0x02)
    Endpoint: 0x00, Direction: OUT
    Device: 5
    URB bus id: 1
    Device setup request: not relevant ('-')
    Data: not present ('>')
    URB sec: 1702353719
    URB usec: 496789
    URB status: Success (0)
    URB length [bytes]: 3
    Data length [bytes]: 0
    [Request in: 93]
    [Time from request: 0.001774000 seconds]
    Unused Setup Header
    Interval: 0
    Start frame: 0
    Copy of Transfer Flags: 0x00000000
    Number of ISO descriptors: 0
    [bInterfaceClass: Unknown (0xffff)]

No.     Time           Source                Destination           Protocol Length Info
     95 29.056127      host                  1.5.0                 USB      67     URB_CONTROL out

Frame 95: 67 bytes on wire (536 bits), 67 bytes captured (536 bits) on interface usbmon1, id 0
USB URB
    [Source: host]
    [Destination: 1.5.0]
    URB id: 0xffff993ece243800
    URB type: URB_SUBMIT ('S')
    URB transfer type: URB_CONTROL (0x02)
    Endpoint: 0x00, Direction: OUT
    Device: 5
    URB bus id: 1
    Device setup request: relevant ('\0')
    Data: present ('\0')
    URB sec: 1702353719
    URB usec: 499062
    URB status: Operation now in progress (-EINPROGRESS) (-115)
    URB length [bytes]: 3
    Data length [bytes]: 3
    [Response in: 96]
    Interval: 0
    Start frame: 0
    Copy of Transfer Flags: 0x00000000
    Number of ISO descriptors: 0
    [bInterfaceClass: Unknown (0xffff)]
Setup Data
    bmRequestType: 0x40
    bRequest: 160
    wValue: 0x003b
    wIndex: 0 (0x0000)
    wLength: 3
    Data Fragment: 0201bc

No.     Time           Source                Destination           Protocol Length Info
     96 29.057847      1.5.0                 host                  USB      64     URB_CONTROL out

Frame 96: 64 bytes on wire (512 bits), 64 bytes captured (512 bits) on interface usbmon1, id 0
USB URB
    [Source: 1.5.0]
    [Destination: host]
    URB id: 0xffff993ece243800
    URB type: URB_COMPLETE ('C')
    URB transfer type: URB_CONTROL (0x02)
    Endpoint: 0x00, Direction: OUT
    Device: 5
    URB bus id: 1
    Device setup request: not relevant ('-')
    Data: not present ('>')
    URB sec: 1702353719
    URB usec: 500782
    URB status: Success (0)
    URB length [bytes]: 3
    Data length [bytes]: 0
    [Request in: 95]
    [Time from request: 0.001720000 seconds]
    Unused Setup Header
    Interval: 0
    Start frame: 0
    Copy of Transfer Flags: 0x00000000
    Number of ISO descriptors: 0
    [bInterfaceClass: Unknown (0xffff)]

No.     Time           Source                Destination           Protocol Length Info
     97 29.060383      host                  1.5.0                 USB      67     URB_CONTROL out

Frame 97: 67 bytes on wire (536 bits), 67 bytes captured (536 bits) on interface usbmon1, id 0
USB URB
    [Source: host]
    [Destination: 1.5.0]
    URB id: 0xffff993ece242780
    URB type: URB_SUBMIT ('S')
    URB transfer type: URB_CONTROL (0x02)
    Endpoint: 0x00, Direction: OUT
    Device: 5
    URB bus id: 1
    Device setup request: relevant ('\0')
    Data: present ('\0')
    URB sec: 1702353719
    URB usec: 503318
    URB status: Operation now in progress (-EINPROGRESS) (-115)
    URB length [bytes]: 3
    Data length [bytes]: 3
    [Response in: 98]
    Interval: 0
    Start frame: 0
    Copy of Transfer Flags: 0x00000000
    Number of ISO descriptors: 0
    [bInterfaceClass: Unknown (0xffff)]
Setup Data
    bmRequestType: 0x40
    bRequest: 160
    wValue: 0x0043
    wIndex: 0 (0x0000)
    wLength: 3
    Data Fragment: 020100

No.     Time           Source                Destination           Protocol Length Info
     98 29.061858      1.5.0                 host                  USB      64     URB_CONTROL out

Frame 98: 64 bytes on wire (512 bits), 64 bytes captured (512 bits) on interface usbmon1, id 0
USB URB
    [Source: 1.5.0]
    [Destination: host]
    URB id: 0xffff993ece242780
    URB type: URB_COMPLETE ('C')
    URB transfer type: URB_CONTROL (0x02)
    Endpoint: 0x00, Direction: OUT
    Device: 5
    URB bus id: 1
    Device setup request: not relevant ('-')
    Data: not present ('>')
    URB sec: 1702353719
    URB usec: 504793
    URB status: Success (0)
    URB length [bytes]: 3
    Data length [bytes]: 0
    [Request in: 97]
    [Time from request: 0.001475000 seconds]
    Unused Setup Header
    Interval: 0
    Start frame: 0
    Copy of Transfer Flags: 0x00000000
    Number of ISO descriptors: 0
    [bInterfaceClass: Unknown (0xffff)]

No.     Time           Source                Destination           Protocol Length Info
     99 29.064741      host                  1.5.0                 USB      67     URB_CONTROL out

Frame 99: 67 bytes on wire (536 bits), 67 bytes captured (536 bits) on interface usbmon1, id 0
USB URB
    [Source: host]
    [Destination: 1.5.0]
    URB id: 0xffff993e40248c00
    URB type: URB_SUBMIT ('S')
    URB transfer type: URB_CONTROL (0x02)
    Endpoint: 0x00, Direction: OUT
    Device: 5
    URB bus id: 1
    Device setup request: relevant ('\0')
    Data: present ('\0')
    URB sec: 1702353719
    URB usec: 507676
    URB status: Operation now in progress (-EINPROGRESS) (-115)
    URB length [bytes]: 3
    Data length [bytes]: 3
    [Response in: 100]
    Interval: 0
    Start frame: 0
    Copy of Transfer Flags: 0x00000000
    Number of ISO descriptors: 0
    [bInterfaceClass: Unknown (0xffff)]
Setup Data
    bmRequestType: 0x40
    bRequest: 160
    wValue: 0x004b
    wIndex: 0 (0x0000)
    wLength: 3
    Data Fragment: 0201bc

No.     Time           Source                Destination           Protocol Length Info
    100 29.065851      1.5.0                 host                  USB      64     URB_CONTROL out

Frame 100: 64 bytes on wire (512 bits), 64 bytes captured (512 bits) on interface usbmon1, id 0
USB URB
    [Source: 1.5.0]
    [Destination: host]
    URB id: 0xffff993e40248c00
    URB type: URB_COMPLETE ('C')
    URB transfer type: URB_CONTROL (0x02)
    Endpoint: 0x00, Direction: OUT
    Device: 5
    URB bus id: 1
    Device setup request: not relevant ('-')
    Data: not present ('>')
    URB sec: 1702353719
    URB usec: 508786
    URB status: Success (0)
    URB length [bytes]: 3
    Data length [bytes]: 0
    [Request in: 99]
    [Time from request: 0.001110000 seconds]
    Unused Setup Header
    Interval: 0
    Start frame: 0
    Copy of Transfer Flags: 0x00000000
    Number of ISO descriptors: 0
    [bInterfaceClass: Unknown (0xffff)]

No.     Time           Source                Destination           Protocol Length Info
    101 29.069141      host                  1.5.0                 USB      67     URB_CONTROL out

Frame 101: 67 bytes on wire (536 bits), 67 bytes captured (536 bits) on interface usbmon1, id 0
USB URB
    [Source: host]
    [Destination: 1.5.0]
    URB id: 0xffff993e40249740
    URB type: URB_SUBMIT ('S')
    URB transfer type: URB_CONTROL (0x02)
    Endpoint: 0x00, Direction: OUT
    Device: 5
    URB bus id: 1
    Device setup request: relevant ('\0')
    Data: present ('\0')
    URB sec: 1702353719
    URB usec: 512076
    URB status: Operation now in progress (-EINPROGRESS) (-115)
    URB length [bytes]: 3
    Data length [bytes]: 3
    [Response in: 102]
    Interval: 0
    Start frame: 0
    Copy of Transfer Flags: 0x00000000
    Number of ISO descriptors: 0
    [bInterfaceClass: Unknown (0xffff)]
Setup Data
    bmRequestType: 0x40
    bRequest: 160
    wValue: 0x0053
    wIndex: 0 (0x0000)
    wLength: 3
    Data Fragment: 020180

No.     Time           Source                Destination           Protocol Length Info
    102 29.070850      1.5.0                 host                  USB      64     URB_CONTROL out

Frame 102: 64 bytes on wire (512 bits), 64 bytes captured (512 bits) on interface usbmon1, id 0
USB URB
    [Source: 1.5.0]
    [Destination: host]
    URB id: 0xffff993e40249740
    URB type: URB_COMPLETE ('C')
    URB transfer type: URB_CONTROL (0x02)
    Endpoint: 0x00, Direction: OUT
    Device: 5
    URB bus id: 1
    Device setup request: not relevant ('-')
    Data: not present ('>')
    URB sec: 1702353719
    URB usec: 513785
    URB status: Success (0)
    URB length [bytes]: 3
    Data length [bytes]: 0
    [Request in: 101]
    [Time from request: 0.001709000 seconds]
    Unused Setup Header
    Interval: 0
    Start frame: 0
    Copy of Transfer Flags: 0x00000000
    Number of ISO descriptors: 0
    [bInterfaceClass: Unknown (0xffff)]

No.     Time           Source                Destination           Protocol Length Info
    103 29.073504      host                  1.5.0                 USB      67     URB_CONTROL out

Frame 103: 67 bytes on wire (536 bits), 67 bytes captured (536 bits) on interface usbmon1, id 0
USB URB
    [Source: host]
    [Destination: 1.5.0]
    URB id: 0xffff993e40249080
    URB type: URB_SUBMIT ('S')
    URB transfer type: URB_CONTROL (0x02)
    Endpoint: 0x00, Direction: OUT
    Device: 5
    URB bus id: 1
    Device setup request: relevant ('\0')
    Data: present ('\0')
    URB sec: 1702353719
    URB usec: 516439
    URB status: Operation now in progress (-EINPROGRESS) (-115)
    URB length [bytes]: 3
    Data length [bytes]: 3
    [Response in: 104]
    Interval: 0
    Start frame: 0
    Copy of Transfer Flags: 0x00000000
    Number of ISO descriptors: 0
    [bInterfaceClass: Unknown (0xffff)]
Setup Data
    bmRequestType: 0x40
    bRequest: 160
    wValue: 0x005b
    wIndex: 0 (0x0000)
    wLength: 3
    Data Fragment: 0201bc

No.     Time           Source                Destination           Protocol Length Info
    104 29.074856      1.5.0                 host                  USB      64     URB_CONTROL out

Frame 104: 64 bytes on wire (512 bits), 64 bytes captured (512 bits) on interface usbmon1, id 0
USB URB
    [Source: 1.5.0]
    [Destination: host]
    URB id: 0xffff993e40249080
    URB type: URB_COMPLETE ('C')
    URB transfer type: URB_CONTROL (0x02)
    Endpoint: 0x00, Direction: OUT
    Device: 5
    URB bus id: 1
    Device setup request: not relevant ('-')
    Data: not present ('>')
    URB sec: 1702353719
    URB usec: 517791
    URB status: Success (0)
    URB length [bytes]: 3
    Data length [bytes]: 0
    [Request in: 103]
    [Time from request: 0.001352000 seconds]
    Unused Setup Header
    Interval: 0
    Start frame: 0
    Copy of Transfer Flags: 0x00000000
    Number of ISO descriptors: 0
    [bInterfaceClass: Unknown (0xffff)]

No.     Time           Source                Destination           Protocol Length Info
    105 29.077858      host                  1.5.0                 USB      67     URB_CONTROL out

Frame 105: 67 bytes on wire (536 bits), 67 bytes captured (536 bits) on interface usbmon1, id 0
USB URB
    [Source: host]
    [Destination: 1.5.0]
    URB id: 0xffff993e40248540
    URB type: URB_SUBMIT ('S')
    URB transfer type: URB_CONTROL (0x02)
    Endpoint: 0x00, Direction: OUT
    Device: 5
    URB bus id: 1
    Device setup request: relevant ('\0')
    Data: present ('\0')
    URB sec: 1702353719
    URB usec: 520793
    URB status: Operation now in progress (-EINPROGRESS) (-115)
    URB length [bytes]: 3
    Data length [bytes]: 3
    [Response in: 106]
    Interval: 0
    Start frame: 0
    Copy of Transfer Flags: 0x00000000
    Number of ISO descriptors: 0
    [bInterfaceClass: Unknown (0xffff)]
Setup Data
    bmRequestType: 0x40
    bRequest: 160
    wValue: 0x0063
    wIndex: 0 (0x0000)
    wLength: 3
    Data Fragment: 0201bc

No.     Time           Source                Destination           Protocol Length Info
    106 29.079852      1.5.0                 host                  USB      64     URB_CONTROL out

Frame 106: 64 bytes on wire (512 bits), 64 bytes captured (512 bits) on interface usbmon1, id 0
USB URB
    [Source: 1.5.0]
    [Destination: host]
    URB id: 0xffff993e40248540
    URB type: URB_COMPLETE ('C')
    URB transfer type: URB_CONTROL (0x02)
    Endpoint: 0x00, Direction: OUT
    Device: 5
    URB bus id: 1
    Device setup request: not relevant ('-')
    Data: not present ('>')
    URB sec: 1702353719
    URB usec: 522787
    URB status: Success (0)
    URB length [bytes]: 3
    Data length [bytes]: 0
    [Request in: 105]
    [Time from request: 0.001994000 seconds]
    Unused Setup Header
    Interval: 0
    Start frame: 0
    Copy of Transfer Flags: 0x00000000
    Number of ISO descriptors: 0
    [bInterfaceClass: Unknown (0xffff)]

No.     Time           Source                Destination           Protocol Length Info
    107 29.082125      host                  1.5.0                 USB      80     URB_CONTROL out

Frame 107: 80 bytes on wire (640 bits), 80 bytes captured (640 bits) on interface usbmon1, id 0
USB URB
    [Source: host]
    [Destination: 1.5.0]
    URB id: 0xffff993e402492c0
    URB type: URB_SUBMIT ('S')
    URB transfer type: URB_CONTROL (0x02)
    Endpoint: 0x00, Direction: OUT
    Device: 5
    URB bus id: 1
    Device setup request: relevant ('\0')
    Data: present ('\0')
    URB sec: 1702353719
    URB usec: 525060
    URB status: Operation now in progress (-EINPROGRESS) (-115)
    URB length [bytes]: 16
    Data length [bytes]: 16
    [Response in: 108]
    Interval: 0
    Start frame: 0
    Copy of Transfer Flags: 0x00000000
    Number of ISO descriptors: 0
    [bInterfaceClass: Unknown (0xffff)]
Setup Data
    bmRequestType: 0x40
    bRequest: 160
    wValue: 0x0100
    wIndex: 0 (0x0000)
    wLength: 16
    Data Fragment: 02061f000201bc000201bc000201bc00

No.     Time           Source                Destination           Protocol Length Info
    108 29.083857      1.5.0                 host                  USB      64     URB_CONTROL out

Frame 108: 64 bytes on wire (512 bits), 64 bytes captured (512 bits) on interface usbmon1, id 0
USB URB
    [Source: 1.5.0]
    [Destination: host]
    URB id: 0xffff993e402492c0
    URB type: URB_COMPLETE ('C')
    URB transfer type: URB_CONTROL (0x02)
    Endpoint: 0x00, Direction: OUT
    Device: 5
    URB bus id: 1
    Device setup request: not relevant ('-')
    Data: not present ('>')
    URB sec: 1702353719
    URB usec: 526792
    URB status: Success (0)
    URB length [bytes]: 16
    Data length [bytes]: 0
    [Request in: 107]
    [Time from request: 0.001732000 seconds]
    Unused Setup Header
    Interval: 0
    Start frame: 0
    Copy of Transfer Flags: 0x00000000
    Number of ISO descriptors: 0
    [bInterfaceClass: Unknown (0xffff)]

No.     Time           Source                Destination           Protocol Length Info
    109 29.086465      host                  1.5.0                 USB      80     URB_CONTROL out

Frame 109: 80 bytes on wire (640 bits), 80 bytes captured (640 bits) on interface usbmon1, id 0
USB URB
    [Source: host]
    [Destination: 1.5.0]
    URB id: 0xffff993e40248d80
    URB type: URB_SUBMIT ('S')
    URB transfer type: URB_CONTROL (0x02)
    Endpoint: 0x00, Direction: OUT
    Device: 5
    URB bus id: 1
    Device setup request: relevant ('\0')
    Data: present ('\0')
    URB sec: 1702353719
    URB usec: 529400
    URB status: Operation now in progress (-EINPROGRESS) (-115)
    URB length [bytes]: 16
    Data length [bytes]: 16
    [Response in: 110]
    Interval: 0
    Start frame: 0
    Copy of Transfer Flags: 0x00000000
    Number of ISO descriptors: 0
    [bInterfaceClass: Unknown (0xffff)]
Setup Data
    bmRequestType: 0x40
    bRequest: 160
    wValue: 0x0110
    wIndex: 0 (0x0000)
    wLength: 16
    Data Fragment: 0201bc000201bc000201bc000201bc00

No.     Time           Source                Destination           Protocol Length Info
    110 29.087863      1.5.0                 host                  USB      64     URB_CONTROL out

Frame 110: 64 bytes on wire (512 bits), 64 bytes captured (512 bits) on interface usbmon1, id 0
USB URB
    [Source: 1.5.0]
    [Destination: host]
    URB id: 0xffff993e40248d80
    URB type: URB_COMPLETE ('C')
    URB transfer type: URB_CONTROL (0x02)
    Endpoint: 0x00, Direction: OUT
    Device: 5
    URB bus id: 1
    Device setup request: not relevant ('-')
    Data: not present ('>')
    URB sec: 1702353719
    URB usec: 530798
    URB status: Success (0)
    URB length [bytes]: 16
    Data length [bytes]: 0
    [Request in: 109]
    [Time from request: 0.001398000 seconds]
    Unused Setup Header
    Interval: 0
    Start frame: 0
    Copy of Transfer Flags: 0x00000000
    Number of ISO descriptors: 0
    [bInterfaceClass: Unknown (0xffff)]

No.     Time           Source                Destination           Protocol Length Info
    111 29.090864      host                  1.5.0                 USB      80     URB_CONTROL out

Frame 111: 80 bytes on wire (640 bits), 80 bytes captured (640 bits) on interface usbmon1, id 0
USB URB
    [Source: host]
    [Destination: 1.5.0]
    URB id: 0xffff993e40248180
    URB type: URB_SUBMIT ('S')
    URB transfer type: URB_CONTROL (0x02)
    Endpoint: 0x00, Direction: OUT
    Device: 5
    URB bus id: 1
    Device setup request: relevant ('\0')
    Data: present ('\0')
    URB sec: 1702353719
    URB usec: 533799
    URB status: Operation now in progress (-EINPROGRESS) (-115)
    URB length [bytes]: 16
    Data length [bytes]: 16
    [Response in: 112]
    Interval: 0
    Start frame: 0
    Copy of Transfer Flags: 0x00000000
    Number of ISO descriptors: 0
    [bInterfaceClass: Unknown (0xffff)]
Setup Data
    bmRequestType: 0x40
    bRequest: 160
    wValue: 0x0120
    wIndex: 0 (0x0000)
    wLength: 16
    Data Fragment: 0201bc000201bc000201bc000201bc00

No.     Time           Source                Destination           Protocol Length Info
    112 29.092849      1.5.0                 host                  USB      64     URB_CONTROL out

Frame 112: 64 bytes on wire (512 bits), 64 bytes captured (512 bits) on interface usbmon1, id 0
USB URB
    [Source: 1.5.0]
    [Destination: host]
    URB id: 0xffff993e40248180
    URB type: URB_COMPLETE ('C')
    URB transfer type: URB_CONTROL (0x02)
    Endpoint: 0x00, Direction: OUT
    Device: 5
    URB bus id: 1
    Device setup request: not relevant ('-')
    Data: not present ('>')
    URB sec: 1702353719
    URB usec: 535784
    URB status: Success (0)
    URB length [bytes]: 16
    Data length [bytes]: 0
    [Request in: 111]
    [Time from request: 0.001985000 seconds]
    Unused Setup Header
    Interval: 0
    Start frame: 0
    Copy of Transfer Flags: 0x00000000
    Number of ISO descriptors: 0
    [bInterfaceClass: Unknown (0xffff)]

No.     Time           Source                Destination           Protocol Length Info
    113 29.095162      host                  1.5.0                 USB      80     URB_CONTROL out

Frame 113: 80 bytes on wire (640 bits), 80 bytes captured (640 bits) on interface usbmon1, id 0
USB URB
    [Source: host]
    [Destination: 1.5.0]
    URB id: 0xffff993e40248180
    URB type: URB_SUBMIT ('S')
    URB transfer type: URB_CONTROL (0x02)
    Endpoint: 0x00, Direction: OUT
    Device: 5
    URB bus id: 1
    Device setup request: relevant ('\0')
    Data: present ('\0')
    URB sec: 1702353719
    URB usec: 538097
    URB status: Operation now in progress (-EINPROGRESS) (-115)
    URB length [bytes]: 16
    Data length [bytes]: 16
    [Response in: 114]
    Interval: 0
    Start frame: 0
    Copy of Transfer Flags: 0x00000000
    Number of ISO descriptors: 0
    [bInterfaceClass: Unknown (0xffff)]
Setup Data
    bmRequestType: 0x40
    bRequest: 160
    wValue: 0x0130
    wIndex: 0 (0x0000)
    wLength: 16
    Data Fragment: 0201bc000201bc000201bc000201bc00

No.     Time           Source                Destination           Protocol Length Info
    114 29.096863      1.5.0                 host                  USB      64     URB_CONTROL out

Frame 114: 64 bytes on wire (512 bits), 64 bytes captured (512 bits) on interface usbmon1, id 0
USB URB
    [Source: 1.5.0]
    [Destination: host]
    URB id: 0xffff993e40248180
    URB type: URB_COMPLETE ('C')
    URB transfer type: URB_CONTROL (0x02)
    Endpoint: 0x00, Direction: OUT
    Device: 5
    URB bus id: 1
    Device setup request: not relevant ('-')
    Data: not present ('>')
    URB sec: 1702353719
    URB usec: 539798
    URB status: Success (0)
    URB length [bytes]: 16
    Data length [bytes]: 0
    [Request in: 113]
    [Time from request: 0.001701000 seconds]
    Unused Setup Header
    Interval: 0
    Start frame: 0
    Copy of Transfer Flags: 0x00000000
    Number of ISO descriptors: 0
    [bInterfaceClass: Unknown (0xffff)]

No.     Time           Source                Destination           Protocol Length Info
    115 29.099505      host                  1.5.0                 USB      80     URB_CONTROL out

Frame 115: 80 bytes on wire (640 bits), 80 bytes captured (640 bits) on interface usbmon1, id 0
USB URB
    [Source: host]
    [Destination: 1.5.0]
    URB id: 0xffff993e40248d80
    URB type: URB_SUBMIT ('S')
    URB transfer type: URB_CONTROL (0x02)
    Endpoint: 0x00, Direction: OUT
    Device: 5
    URB bus id: 1
    Device setup request: relevant ('\0')
    Data: present ('\0')
    URB sec: 1702353719
    URB usec: 542440
    URB status: Operation now in progress (-EINPROGRESS) (-115)
    URB length [bytes]: 16
    Data length [bytes]: 16
    [Response in: 116]
    Interval: 0
    Start frame: 0
    Copy of Transfer Flags: 0x00000000
    Number of ISO descriptors: 0
    [bInterfaceClass: Unknown (0xffff)]
Setup Data
    bmRequestType: 0x40
    bRequest: 160
    wValue: 0x0140
    wIndex: 0 (0x0000)
    wLength: 16
    Data Fragment: 0201bc000201bc000201bc000201bc00

No.     Time           Source                Destination           Protocol Length Info
    116 29.100866      1.5.0                 host                  USB      64     URB_CONTROL out

Frame 116: 64 bytes on wire (512 bits), 64 bytes captured (512 bits) on interface usbmon1, id 0
USB URB
    [Source: 1.5.0]
    [Destination: host]
    URB id: 0xffff993e40248d80
    URB type: URB_COMPLETE ('C')
    URB transfer type: URB_CONTROL (0x02)
    Endpoint: 0x00, Direction: OUT
    Device: 5
    URB bus id: 1
    Device setup request: not relevant ('-')
    Data: not present ('>')
    URB sec: 1702353719
    URB usec: 543801
    URB status: Success (0)
    URB length [bytes]: 16
    Data length [bytes]: 0
    [Request in: 115]
    [Time from request: 0.001361000 seconds]
    Unused Setup Header
    Interval: 0
    Start frame: 0
    Copy of Transfer Flags: 0x00000000
    Number of ISO descriptors: 0
    [bInterfaceClass: Unknown (0xffff)]

No.     Time           Source                Destination           Protocol Length Info
    117 29.103862      host                  1.5.0                 USB      71     URB_CONTROL out

Frame 117: 71 bytes on wire (568 bits), 71 bytes captured (568 bits) on interface usbmon1, id 0
USB URB
    [Source: host]
    [Destination: 1.5.0]
    URB id: 0xffff993e402492c0
    URB type: URB_SUBMIT ('S')
    URB transfer type: URB_CONTROL (0x02)
    Endpoint: 0x00, Direction: OUT
    Device: 5
    URB bus id: 1
    Device setup request: relevant ('\0')
    Data: present ('\0')
    URB sec: 1702353719
    URB usec: 546797
    URB status: Operation now in progress (-EINPROGRESS) (-115)
    URB length [bytes]: 7
    Data length [bytes]: 7
    [Response in: 118]
    Interval: 0
    Start frame: 0
    Copy of Transfer Flags: 0x00000000
    Number of ISO descriptors: 0
    [bInterfaceClass: Unknown (0xffff)]
Setup Data
    bmRequestType: 0x40
    bRequest: 160
    wValue: 0x0150
    wIndex: 0 (0x0000)
    wLength: 7
    Data Fragment: 0201bc000201bc

No.     Time           Source                Destination           Protocol Length Info
    118 29.105856      1.5.0                 host                  USB      64     URB_CONTROL out

Frame 118: 64 bytes on wire (512 bits), 64 bytes captured (512 bits) on interface usbmon1, id 0
USB URB
    [Source: 1.5.0]
    [Destination: host]
    URB id: 0xffff993e402492c0
    URB type: URB_COMPLETE ('C')
    URB transfer type: URB_CONTROL (0x02)
    Endpoint: 0x00, Direction: OUT
    Device: 5
    URB bus id: 1
    Device setup request: not relevant ('-')
    Data: not present ('>')
    URB sec: 1702353719
    URB usec: 548791
    URB status: Success (0)
    URB length [bytes]: 7
    Data length [bytes]: 0
    [Request in: 117]
    [Time from request: 0.001994000 seconds]
    Unused Setup Header
    Interval: 0
    Start frame: 0
    Copy of Transfer Flags: 0x00000000
    Number of ISO descriptors: 0
    [bInterfaceClass: Unknown (0xffff)]

No.     Time           Source                Destination           Protocol Length Info
    119 29.108038      host                  1.5.0                 USB      80     URB_CONTROL out

Frame 119: 80 bytes on wire (640 bits), 80 bytes captured (640 bits) on interface usbmon1, id 0
USB URB
    [Source: host]
    [Destination: 1.5.0]
    URB id: 0xffff993ece242cc0
    URB type: URB_SUBMIT ('S')
    URB transfer type: URB_CONTROL (0x02)
    Endpoint: 0x00, Direction: OUT
    Device: 5
    URB bus id: 1
    Device setup request: relevant ('\0')
    Data: present ('\0')
    URB sec: 1702353719
    URB usec: 550973
    URB status: Operation now in progress (-EINPROGRESS) (-115)
    URB length [bytes]: 16
    Data length [bytes]: 16
    [Response in: 120]
    Interval: 0
    Start frame: 0
    Copy of Transfer Flags: 0x00000000
    Number of ISO descriptors: 0
    [bInterfaceClass: Unknown (0xffff)]
Setup Data
    bmRequestType: 0x40
    bRequest: 160
    wValue: 0x0180
    wIndex: 0 (0x0000)
    wLength: 16
    Data Fragment: 0201bc000201bc000201bc000201bc00

No.     Time           Source                Destination           Protocol Length Info
    120 29.109854      1.5.0                 host                  USB      64     URB_CONTROL out

Frame 120: 64 bytes on wire (512 bits), 64 bytes captured (512 bits) on interface usbmon1, id 0
USB URB
    [Source: 1.5.0]
    [Destination: host]
    URB id: 0xffff993ece242cc0
    URB type: URB_COMPLETE ('C')
    URB transfer type: URB_CONTROL (0x02)
    Endpoint: 0x00, Direction: OUT
    Device: 5
    URB bus id: 1
    Device setup request: not relevant ('-')
    Data: not present ('>')
    URB sec: 1702353719
    URB usec: 552789
    URB status: Success (0)
    URB length [bytes]: 16
    Data length [bytes]: 0
    [Request in: 119]
    [Time from request: 0.001816000 seconds]
    Unused Setup Header
    Interval: 0
    Start frame: 0
    Copy of Transfer Flags: 0x00000000
    Number of ISO descriptors: 0
    [bInterfaceClass: Unknown (0xffff)]

No.     Time           Source                Destination           Protocol Length Info
    121 29.112026      host                  1.5.0                 USB      80     URB_CONTROL out

Frame 121: 80 bytes on wire (640 bits), 80 bytes captured (640 bits) on interface usbmon1, id 0
USB URB
    [Source: host]
    [Destination: 1.5.0]
    URB id: 0xffff993ece242000
    URB type: URB_SUBMIT ('S')
    URB transfer type: URB_CONTROL (0x02)
    Endpoint: 0x00, Direction: OUT
    Device: 5
    URB bus id: 1
    Device setup request: relevant ('\0')
    Data: present ('\0')
    URB sec: 1702353719
    URB usec: 554961
    URB status: Operation now in progress (-EINPROGRESS) (-115)
    URB length [bytes]: 16
    Data length [bytes]: 16
    [Response in: 122]
    Interval: 0
    Start frame: 0
    Copy of Transfer Flags: 0x00000000
    Number of ISO descriptors: 0
    [bInterfaceClass: Unknown (0xffff)]
Setup Data
    bmRequestType: 0x40
    bRequest: 160
    wValue: 0x0190
    wIndex: 0 (0x0000)
    wLength: 16
    Data Fragment: 0201bc000201bc000201bc000201bc00

No.     Time           Source                Destination           Protocol Length Info
    122 29.113855      1.5.0                 host                  USB      64     URB_CONTROL out

Frame 122: 64 bytes on wire (512 bits), 64 bytes captured (512 bits) on interface usbmon1, id 0
USB URB
    [Source: 1.5.0]
    [Destination: host]
    URB id: 0xffff993ece242000
    URB type: URB_COMPLETE ('C')
    URB transfer type: URB_CONTROL (0x02)
    Endpoint: 0x00, Direction: OUT
    Device: 5
    URB bus id: 1
    Device setup request: not relevant ('-')
    Data: not present ('>')
    URB sec: 1702353719
    URB usec: 556790
    URB status: Success (0)
    URB length [bytes]: 16
    Data length [bytes]: 0
    [Request in: 121]
    [Time from request: 0.001829000 seconds]
    Unused Setup Header
    Interval: 0
    Start frame: 0
    Copy of Transfer Flags: 0x00000000
    Number of ISO descriptors: 0
    [bInterfaceClass: Unknown (0xffff)]

No.     Time           Source                Destination           Protocol Length Info
    123 29.116040      host                  1.5.0                 USB      80     URB_CONTROL out

Frame 123: 80 bytes on wire (640 bits), 80 bytes captured (640 bits) on interface usbmon1, id 0
USB URB
    [Source: host]
    [Destination: 1.5.0]
    URB id: 0xffff993ece243380
    URB type: URB_SUBMIT ('S')
    URB transfer type: URB_CONTROL (0x02)
    Endpoint: 0x00, Direction: OUT
    Device: 5
    URB bus id: 1
    Device setup request: relevant ('\0')
    Data: present ('\0')
    URB sec: 1702353719
    URB usec: 558975
    URB status: Operation now in progress (-EINPROGRESS) (-115)
    URB length [bytes]: 16
    Data length [bytes]: 16
    [Response in: 124]
    Interval: 0
    Start frame: 0
    Copy of Transfer Flags: 0x00000000
    Number of ISO descriptors: 0
    [bInterfaceClass: Unknown (0xffff)]
Setup Data
    bmRequestType: 0x40
    bRequest: 160
    wValue: 0x01a0
    wIndex: 0 (0x0000)
    wLength: 16
    Data Fragment: 0201bc000201bc000201bc000201bc00

No.     Time           Source                Destination           Protocol Length Info
    124 29.117853      1.5.0                 host                  USB      64     URB_CONTROL out

Frame 124: 64 bytes on wire (512 bits), 64 bytes captured (512 bits) on interface usbmon1, id 0
USB URB
    [Source: 1.5.0]
    [Destination: host]
    URB id: 0xffff993ece243380
    URB type: URB_COMPLETE ('C')
    URB transfer type: URB_CONTROL (0x02)
    Endpoint: 0x00, Direction: OUT
    Device: 5
    URB bus id: 1
    Device setup request: not relevant ('-')
    Data: not present ('>')
    URB sec: 1702353719
    URB usec: 560788
    URB status: Success (0)
    URB length [bytes]: 16
    Data length [bytes]: 0
    [Request in: 123]
    [Time from request: 0.001813000 seconds]
    Unused Setup Header
    Interval: 0
    Start frame: 0
    Copy of Transfer Flags: 0x00000000
    Number of ISO descriptors: 0
    [bInterfaceClass: Unknown (0xffff)]

No.     Time           Source                Destination           Protocol Length Info
    125 29.120059      host                  1.5.0                 USB      77     URB_CONTROL out

Frame 125: 77 bytes on wire (616 bits), 77 bytes captured (616 bits) on interface usbmon1, id 0
USB URB
    [Source: host]
    [Destination: 1.5.0]
    URB id: 0xffff993ece242600
    URB type: URB_SUBMIT ('S')
    URB transfer type: URB_CONTROL (0x02)
    Endpoint: 0x00, Direction: OUT
    Device: 5
    URB bus id: 1
    Device setup request: relevant ('\0')
    Data: present ('\0')
    URB sec: 1702353719
    URB usec: 562994
    URB status: Operation now in progress (-EINPROGRESS) (-115)
    URB length [bytes]: 13
    Data length [bytes]: 13
    [Response in: 126]
    Interval: 0
    Start frame: 0
    Copy of Transfer Flags: 0x00000000
    Number of ISO descriptors: 0
    [bInterfaceClass: Unknown (0xffff)]
Setup Data
    bmRequestType: 0x40
    bRequest: 160
    wValue: 0x01b0
    wIndex: 0 (0x0000)
    wLength: 13
    Data Fragment: 0201bc000201bc000201bc0032

No.     Time           Source                Destination           Protocol Length Info
    126 29.121857      1.5.0                 host                  USB      64     URB_CONTROL out

Frame 126: 64 bytes on wire (512 bits), 64 bytes captured (512 bits) on interface usbmon1, id 0
USB URB
    [Source: 1.5.0]
    [Destination: host]
    URB id: 0xffff993ece242600
    URB type: URB_COMPLETE ('C')
    URB transfer type: URB_CONTROL (0x02)
    Endpoint: 0x00, Direction: OUT
    Device: 5
    URB bus id: 1
    Device setup request: not relevant ('-')
    Data: not present ('>')
    URB sec: 1702353719
    URB usec: 564792
    URB status: Success (0)
    URB length [bytes]: 13
    Data length [bytes]: 0
    [Request in: 125]
    [Time from request: 0.001798000 seconds]
    Unused Setup Header
    Interval: 0
    Start frame: 0
    Copy of Transfer Flags: 0x00000000
    Number of ISO descriptors: 0
    [bInterfaceClass: Unknown (0xffff)]

No.     Time           Source                Destination           Protocol Length Info
    127 29.124077      host                  1.5.0                 USB      80     URB_CONTROL out

Frame 127: 80 bytes on wire (640 bits), 80 bytes captured (640 bits) on interface usbmon1, id 0
USB URB
    [Source: host]
    [Destination: 1.5.0]
    URB id: 0xffff993ece2432c0
    URB type: URB_SUBMIT ('S')
    URB transfer type: URB_CONTROL (0x02)
    Endpoint: 0x00, Direction: OUT
    Device: 5
    URB bus id: 1
    Device setup request: relevant ('\0')
    Data: present ('\0')
    URB sec: 1702353719
    URB usec: 567012
    URB status: Operation now in progress (-EINPROGRESS) (-115)
    URB length [bytes]: 16
    Data length [bytes]: 16
    [Response in: 128]
    Interval: 0
    Start frame: 0
    Copy of Transfer Flags: 0x00000000
    Number of ISO descriptors: 0
    [bInterfaceClass: Unknown (0xffff)]
Setup Data
    bmRequestType: 0x40
    bRequest: 160
    wValue: 0x0200
    wIndex: 0 (0x0000)
    wLength: 16
    Data Fragment: 5553422046696c74657220576865656c

No.     Time           Source                Destination           Protocol Length Info
    128 29.125869      1.5.0                 host                  USB      64     URB_CONTROL out

Frame 128: 64 bytes on wire (512 bits), 64 bytes captured (512 bits) on interface usbmon1, id 0
USB URB
    [Source: 1.5.0]
    [Destination: host]
    URB id: 0xffff993ece2432c0
    URB type: URB_COMPLETE ('C')
    URB transfer type: URB_CONTROL (0x02)
    Endpoint: 0x00, Direction: OUT
    Device: 5
    URB bus id: 1
    Device setup request: not relevant ('-')
    Data: not present ('>')
    URB sec: 1702353719
    URB usec: 568804
    URB status: Success (0)
    URB length [bytes]: 16
    Data length [bytes]: 0
    [Request in: 127]
    [Time from request: 0.001792000 seconds]
    Unused Setup Header
    Interval: 0
    Start frame: 0
    Copy of Transfer Flags: 0x00000000
    Number of ISO descriptors: 0
    [bInterfaceClass: Unknown (0xffff)]

No.     Time           Source                Destination           Protocol Length Info
    129 29.128159      host                  1.5.0                 USB      80     URB_CONTROL out

Frame 129: 80 bytes on wire (640 bits), 80 bytes captured (640 bits) on interface usbmon1, id 0
USB URB
    [Source: host]
    [Destination: 1.5.0]
    URB id: 0xffff993e40248540
    URB type: URB_SUBMIT ('S')
    URB transfer type: URB_CONTROL (0x02)
    Endpoint: 0x00, Direction: OUT
    Device: 5
    URB bus id: 1
    Device setup request: relevant ('\0')
    Data: present ('\0')
    URB sec: 1702353719
    URB usec: 571094
    URB status: Operation now in progress (-EINPROGRESS) (-115)
    URB length [bytes]: 16
    Data length [bytes]: 16
    [Response in: 130]
    Interval: 0
    Start frame: 0
    Copy of Transfer Flags: 0x00000000
    Number of ISO descriptors: 0
    [bInterfaceClass: Unknown (0xffff)]
Setup Data
    bmRequestType: 0x40
    bRequest: 160
    wValue: 0x0210
    wIndex: 0 (0x0000)
    wLength: 16
    Data Fragment: 0046696e676572204c616b657320496e

No.     Time           Source                Destination           Protocol Length Info
    130 29.129866      1.5.0                 host                  USB      64     URB_CONTROL out

Frame 130: 64 bytes on wire (512 bits), 64 bytes captured (512 bits) on interface usbmon1, id 0
USB URB
    [Source: 1.5.0]
    [Destination: host]
    URB id: 0xffff993e40248540
    URB type: URB_COMPLETE ('C')
    URB transfer type: URB_CONTROL (0x02)
    Endpoint: 0x00, Direction: OUT
    Device: 5
    URB bus id: 1
    Device setup request: not relevant ('-')
    Data: not present ('>')
    URB sec: 1702353719
    URB usec: 572801
    URB status: Success (0)
    URB length [bytes]: 16
    Data length [bytes]: 0
    [Request in: 129]
    [Time from request: 0.001707000 seconds]
    Unused Setup Header
    Interval: 0
    Start frame: 0
    Copy of Transfer Flags: 0x00000000
    Number of ISO descriptors: 0
    [bInterfaceClass: Unknown (0xffff)]

No.     Time           Source                Destination           Protocol Length Info
    131 29.132394      host                  1.5.0                 USB      80     URB_CONTROL out

Frame 131: 80 bytes on wire (640 bits), 80 bytes captured (640 bits) on interface usbmon1, id 0
USB URB
    [Source: host]
    [Destination: 1.5.0]
    URB id: 0xffff993e40249080
    URB type: URB_SUBMIT ('S')
    URB transfer type: URB_CONTROL (0x02)
    Endpoint: 0x00, Direction: OUT
    Device: 5
    URB bus id: 1
    Device setup request: relevant ('\0')
    Data: present ('\0')
    URB sec: 1702353719
    URB usec: 575329
    URB status: Operation now in progress (-EINPROGRESS) (-115)
    URB length [bytes]: 16
    Data length [bytes]: 16
    [Response in: 132]
    Interval: 0
    Start frame: 0
    Copy of Transfer Flags: 0x00000000
    Number of ISO descriptors: 0
    [bInterfaceClass: Unknown (0xffff)]
Setup Data
    bmRequestType: 0x40
    bRequest: 160
    wValue: 0x0220
    wIndex: 0 (0x0000)
    wLength: 16
    Data Fragment: 737472756d656e746174696f6e2c204c

No.     Time           Source                Destination           Protocol Length Info
    132 29.133862      1.5.0                 host                  USB      64     URB_CONTROL out

Frame 132: 64 bytes on wire (512 bits), 64 bytes captured (512 bits) on interface usbmon1, id 0
USB URB
    [Source: 1.5.0]
    [Destination: host]
    URB id: 0xffff993e40249080
    URB type: URB_COMPLETE ('C')
    URB transfer type: URB_CONTROL (0x02)
    Endpoint: 0x00, Direction: OUT
    Device: 5
    URB bus id: 1
    Device setup request: not relevant ('-')
    Data: not present ('>')
    URB sec: 1702353719
    URB usec: 576797
    URB status: Success (0)
    URB length [bytes]: 16
    Data length [bytes]: 0
    [Request in: 131]
    [Time from request: 0.001468000 seconds]
    Unused Setup Header
    Interval: 0
    Start frame: 0
    Copy of Transfer Flags: 0x00000000
    Number of ISO descriptors: 0
    [bInterfaceClass: Unknown (0xffff)]

No.     Time           Source                Destination           Protocol Length Info
    133 29.136654      host                  1.5.0                 USB      80     URB_CONTROL out

Frame 133: 80 bytes on wire (640 bits), 80 bytes captured (640 bits) on interface usbmon1, id 0
USB URB
    [Source: host]
    [Destination: 1.5.0]
    URB id: 0xffff993e40249740
    URB type: URB_SUBMIT ('S')
    URB transfer type: URB_CONTROL (0x02)
    Endpoint: 0x00, Direction: OUT
    Device: 5
    URB bus id: 1
    Device setup request: relevant ('\0')
    Data: present ('\0')
    URB sec: 1702353719
    URB usec: 579589
    URB status: Operation now in progress (-EINPROGRESS) (-115)
    URB length [bytes]: 16
    Data length [bytes]: 16
    [Response in: 134]
    Interval: 0
    Start frame: 0
    Copy of Transfer Flags: 0x00000000
    Number of ISO descriptors: 0
    [bInterfaceClass: Unknown (0xffff)]
Setup Data
    bmRequestType: 0x40
    bRequest: 160
    wValue: 0x0230
    wIndex: 0 (0x0000)
    wLength: 16
    Data Fragment: 2e4c2e432e00312e300075817f907fd6

No.     Time           Source                Destination           Protocol Length Info
    134 29.137859      1.5.0                 host                  USB      64     URB_CONTROL out

Frame 134: 64 bytes on wire (512 bits), 64 bytes captured (512 bits) on interface usbmon1, id 0
USB URB
    [Source: 1.5.0]
    [Destination: host]
    URB id: 0xffff993e40249740
    URB type: URB_COMPLETE ('C')
    URB transfer type: URB_CONTROL (0x02)
    Endpoint: 0x00, Direction: OUT
    Device: 5
    URB bus id: 1
    Device setup request: not relevant ('-')
    Data: not present ('>')
    URB sec: 1702353719
    URB usec: 580794
    URB status: Success (0)
    URB length [bytes]: 16
    Data length [bytes]: 0
    [Request in: 133]
    [Time from request: 0.001205000 seconds]
    Unused Setup Header
    Interval: 0
    Start frame: 0
    Copy of Transfer Flags: 0x00000000
    Number of ISO descriptors: 0
    [bInterfaceClass: Unknown (0xffff)]

No.     Time           Source                Destination           Protocol Length Info
    135 29.140900      host                  1.5.0                 USB      80     URB_CONTROL out

Frame 135: 80 bytes on wire (640 bits), 80 bytes captured (640 bits) on interface usbmon1, id 0
USB URB
    [Source: host]
    [Destination: 1.5.0]
    URB id: 0xffff993e40248c00
    URB type: URB_SUBMIT ('S')
    URB transfer type: URB_CONTROL (0x02)
    Endpoint: 0x00, Direction: OUT
    Device: 5
    URB bus id: 1
    Device setup request: relevant ('\0')
    Data: present ('\0')
    URB sec: 1702353719
    URB usec: 583835
    URB status: Operation now in progress (-EINPROGRESS) (-115)
    URB length [bytes]: 16
    Data length [bytes]: 16
    [Response in: 136]
    Interval: 0
    Start frame: 0
    Copy of Transfer Flags: 0x00000000
    Number of ISO descriptors: 0
    [bInterfaceClass: Unknown (0xffff)]
Setup Data
    bmRequestType: 0x40
    bRequest: 160
    wValue: 0x0240
    wIndex: 0 (0x0000)
    wLength: 16
    Data Fragment: 740af090784ae054f04400f090784974

No.     Time           Source                Destination           Protocol Length Info
    136 29.142860      1.5.0                 host                  USB      64     URB_CONTROL out

Frame 136: 64 bytes on wire (512 bits), 64 bytes captured (512 bits) on interface usbmon1, id 0
USB URB
    [Source: 1.5.0]
    [Destination: host]
    URB id: 0xffff993e40248c00
    URB type: URB_COMPLETE ('C')
    URB transfer type: URB_CONTROL (0x02)
    Endpoint: 0x00, Direction: OUT
    Device: 5
    URB bus id: 1
    Device setup request: not relevant ('-')
    Data: not present ('>')
    URB sec: 1702353719
    URB usec: 585795
    URB status: Success (0)
    URB length [bytes]: 16
    Data length [bytes]: 0
    [Request in: 135]
    [Time from request: 0.001960000 seconds]
    Unused Setup Header
    Interval: 0
    Start frame: 0
    Copy of Transfer Flags: 0x00000000
    Number of ISO descriptors: 0
    [bInterfaceClass: Unknown (0xffff)]

No.     Time           Source                Destination           Protocol Length Info
    137 29.145055      host                  1.5.0                 USB      80     URB_CONTROL out

Frame 137: 80 bytes on wire (640 bits), 80 bytes captured (640 bits) on interface usbmon1, id 0
USB URB
    [Source: host]
    [Destination: 1.5.0]
    URB id: 0xffff993e40248000
    URB type: URB_SUBMIT ('S')
    URB transfer type: URB_CONTROL (0x02)
    Endpoint: 0x00, Direction: OUT
    Device: 5
    URB bus id: 1
    Device setup request: relevant ('\0')
    Data: present ('\0')
    URB sec: 1702353719
    URB usec: 587990
    URB status: Operation now in progress (-EINPROGRESS) (-115)
    URB length [bytes]: 16
    Data length [bytes]: 16
    [Response in: 138]
    Interval: 0
    Start frame: 0
    Copy of Transfer Flags: 0x00000000
    Number of ISO descriptors: 0
    [bInterfaceClass: Unknown (0xffff)]
Setup Data
    bmRequestType: 0x40
    bRequest: 160
    wValue: 0x0250
    wIndex: 0 (0x0000)
    wLength: 16
    Data Fragment: 01f0907f937400f0907f9c74f1f07400

No.     Time           Source                Destination           Protocol Length Info
    138 29.146869      1.5.0                 host                  USB      64     URB_CONTROL out

Frame 138: 64 bytes on wire (512 bits), 64 bytes captured (512 bits) on interface usbmon1, id 0
USB URB
    [Source: 1.5.0]
    [Destination: host]
    URB id: 0xffff993e40248000
    URB type: URB_COMPLETE ('C')
    URB transfer type: URB_CONTROL (0x02)
    Endpoint: 0x00, Direction: OUT
    Device: 5
    URB bus id: 1
    Device setup request: not relevant ('-')
    Data: not present ('>')
    URB sec: 1702353719
    URB usec: 589804
    URB status: Success (0)
    URB length [bytes]: 16
    Data length [bytes]: 0
    [Request in: 137]
    [Time from request: 0.001814000 seconds]
    Unused Setup Header
    Interval: 0
    Start frame: 0
    Copy of Transfer Flags: 0x00000000
    Number of ISO descriptors: 0
    [bInterfaceClass: Unknown (0xffff)]

No.     Time           Source                Destination           Protocol Length Info
    139 29.149196      host                  1.5.0                 USB      80     URB_CONTROL out

Frame 139: 80 bytes on wire (640 bits), 80 bytes captured (640 bits) on interface usbmon1, id 0
USB URB
    [Source: host]
    [Destination: 1.5.0]
    URB id: 0xffff993e40249980
    URB type: URB_SUBMIT ('S')
    URB transfer type: URB_CONTROL (0x02)
    Endpoint: 0x00, Direction: OUT
    Device: 5
    URB bus id: 1
    Device setup request: relevant ('\0')
    Data: present ('\0')
    URB sec: 1702353719
    URB usec: 592131
    URB status: Operation now in progress (-EINPROGRESS) (-115)
    URB length [bytes]: 16
    Data length [bytes]: 16
    [Response in: 140]
    Interval: 0
    Start frame: 0
    Copy of Transfer Flags: 0x00000000
    Number of ISO descriptors: 0
    [bInterfaceClass: Unknown (0xffff)]
Setup Data
    bmRequestType: 0x40
    bRequest: 160
    wValue: 0x0260
    wIndex: 0 (0x0000)
    wLength: 16
    Data Fragment: f580907f947400f0907f9d747ff07400

No.     Time           Source                Destination           Protocol Length Info
    140 29.150865      1.5.0                 host                  USB      64     URB_CONTROL out

Frame 140: 64 bytes on wire (512 bits), 64 bytes captured (512 bits) on interface usbmon1, id 0
USB URB
    [Source: 1.5.0]
    [Destination: host]
    URB id: 0xffff993e40249980
    URB type: URB_COMPLETE ('C')
    URB transfer type: URB_CONTROL (0x02)
    Endpoint: 0x00, Direction: OUT
    Device: 5
    URB bus id: 1
    Device setup request: not relevant ('-')
    Data: not present ('>')
    URB sec: 1702353719
    URB usec: 593800
    URB status: Success (0)
    URB length [bytes]: 16
    Data length [bytes]: 0
    [Request in: 139]
    [Time from request: 0.001669000 seconds]
    Unused Setup Header
    Interval: 0
    Start frame: 0
    Copy of Transfer Flags: 0x00000000
    Number of ISO descriptors: 0
    [bInterfaceClass: Unknown (0xffff)]

No.     Time           Source                Destination           Protocol Length Info
    141 29.153553      host                  1.5.0                 USB      80     URB_CONTROL out

Frame 141: 80 bytes on wire (640 bits), 80 bytes captured (640 bits) on interface usbmon1, id 0
USB URB
    [Source: host]
    [Destination: 1.5.0]
    URB id: 0xffff993e40249380
    URB type: URB_SUBMIT ('S')
    URB transfer type: URB_CONTROL (0x02)
    Endpoint: 0x00, Direction: OUT
    Device: 5
    URB bus id: 1
    Device setup request: relevant ('\0')
    Data: present ('\0')
    URB sec: 1702353719
    URB usec: 596488
    URB status: Operation now in progress (-EINPROGRESS) (-115)
    URB length [bytes]: 16
    Data length [bytes]: 16
    [Response in: 142]
    Interval: 0
    Start frame: 0
    Copy of Transfer Flags: 0x00000000
    Number of ISO descriptors: 0
    [bInterfaceClass: Unknown (0xffff)]
Setup Data
    bmRequestType: 0x40
    bRequest: 160
    wValue: 0x0270
    wIndex: 0 (0x0000)
    wLength: 16
    Data Fragment: f590907f957400f0907f9e74fff07400

No.     Time           Source                Destination           Protocol Length Info
    142 29.154859      1.5.0                 host                  USB      64     URB_CONTROL out

Frame 142: 64 bytes on wire (512 bits), 64 bytes captured (512 bits) on interface usbmon1, id 0
USB URB
    [Source: 1.5.0]
    [Destination: host]
    URB id: 0xffff993e40249380
    URB type: URB_COMPLETE ('C')
    URB transfer type: URB_CONTROL (0x02)
    Endpoint: 0x00, Direction: OUT
    Device: 5
    URB bus id: 1
    Device setup request: not relevant ('-')
    Data: not present ('>')
    URB sec: 1702353719
    URB usec: 597794
    URB status: Success (0)
    URB length [bytes]: 16
    Data length [bytes]: 0
    [Request in: 141]
    [Time from request: 0.001306000 seconds]
    Unused Setup Header
    Interval: 0
    Start frame: 0
    Copy of Transfer Flags: 0x00000000
    Number of ISO descriptors: 0
    [bInterfaceClass: Unknown (0xffff)]

No.     Time           Source                Destination           Protocol Length Info
    143 29.157953      host                  1.5.0                 USB      80     URB_CONTROL out

Frame 143: 80 bytes on wire (640 bits), 80 bytes captured (640 bits) on interface usbmon1, id 0
USB URB
    [Source: host]
    [Destination: 1.5.0]
    URB id: 0xffff993e40249500
    URB type: URB_SUBMIT ('S')
    URB transfer type: URB_CONTROL (0x02)
    Endpoint: 0x00, Direction: OUT
    Device: 5
    URB bus id: 1
    Device setup request: relevant ('\0')
    Data: present ('\0')
    URB sec: 1702353719
    URB usec: 600888
    URB status: Operation now in progress (-EINPROGRESS) (-115)
    URB length [bytes]: 16
    Data length [bytes]: 16
    [Response in: 144]
    Interval: 0
    Start frame: 0
    Copy of Transfer Flags: 0x00000000
    Number of ISO descriptors: 0
    [bInterfaceClass: Unknown (0xffff)]
Setup Data
    bmRequestType: 0x40
    bRequest: 160
    wValue: 0x0280
    wIndex: 0 (0x0000)
    wLength: 16
    Data Fragment: f5a090784374fef090784774fff0d2b1

No.     Time           Source                Destination           Protocol Length Info
    144 29.159860      1.5.0                 host                  USB      64     URB_CONTROL out

Frame 144: 64 bytes on wire (512 bits), 64 bytes captured (512 bits) on interface usbmon1, id 0
USB URB
    [Source: 1.5.0]
    [Destination: host]
    URB id: 0xffff993e40249500
    URB type: URB_COMPLETE ('C')
    URB transfer type: URB_CONTROL (0x02)
    Endpoint: 0x00, Direction: OUT
    Device: 5
    URB bus id: 1
    Device setup request: not relevant ('-')
    Data: not present ('>')
    URB sec: 1702353719
    URB usec: 602795
    URB status: Success (0)
    URB length [bytes]: 16
    Data length [bytes]: 0
    [Request in: 143]
    [Time from request: 0.001907000 seconds]
    Unused Setup Header
    Interval: 0
    Start frame: 0
    Copy of Transfer Flags: 0x00000000
    Number of ISO descriptors: 0
    [bInterfaceClass: Unknown (0xffff)]

No.     Time           Source                Destination           Protocol Length Info
    145 29.162063      host                  1.5.0                 USB      80     URB_CONTROL out

Frame 145: 80 bytes on wire (640 bits), 80 bytes captured (640 bits) on interface usbmon1, id 0
USB URB
    [Source: host]
    [Destination: 1.5.0]
    URB id: 0xffff993ecd78cd80
    URB type: URB_SUBMIT ('S')
    URB transfer type: URB_CONTROL (0x02)
    Endpoint: 0x00, Direction: OUT
    Device: 5
    URB bus id: 1
    Device setup request: relevant ('\0')
    Data: present ('\0')
    URB sec: 1702353719
    URB usec: 604998
    URB status: Operation now in progress (-EINPROGRESS) (-115)
    URB length [bytes]: 16
    Data length [bytes]: 16
    [Response in: 146]
    Interval: 0
    Start frame: 0
    Copy of Transfer Flags: 0x00000000
    Number of ISO descriptors: 0
    [bInterfaceClass: Unknown (0xffff)]
Setup Data
    bmRequestType: 0x40
    bRequest: 160
    wValue: 0x0290
    wIndex: 0 (0x0000)
    wLength: 16
    Data Fragment: 7801907e007400f074a091c47810907e

No.     Time           Source                Destination           Protocol Length Info
    146 29.163862      1.5.0                 host                  USB      64     URB_CONTROL out

Frame 146: 64 bytes on wire (512 bits), 64 bytes captured (512 bits) on interface usbmon1, id 0
USB URB
    [Source: 1.5.0]
    [Destination: host]
    URB id: 0xffff993ecd78cd80
    URB type: URB_COMPLETE ('C')
    URB transfer type: URB_CONTROL (0x02)
    Endpoint: 0x00, Direction: OUT
    Device: 5
    URB bus id: 1
    Device setup request: not relevant ('-')
    Data: not present ('>')
    URB sec: 1702353719
    URB usec: 606797
    URB status: Success (0)
    URB length [bytes]: 16
    Data length [bytes]: 0
    [Request in: 145]
    [Time from request: 0.001799000 seconds]
    Unused Setup Header
    Interval: 0
    Start frame: 0
    Copy of Transfer Flags: 0x00000000
    Number of ISO descriptors: 0
    [bInterfaceClass: Unknown (0xffff)]

No.     Time           Source                Destination           Protocol Length Info
    147 29.166157      host                  1.5.0                 USB      80     URB_CONTROL out

Frame 147: 80 bytes on wire (640 bits), 80 bytes captured (640 bits) on interface usbmon1, id 0
USB URB
    [Source: host]
    [Destination: 1.5.0]
    URB id: 0xffff993ecd78c3c0
    URB type: URB_SUBMIT ('S')
    URB transfer type: URB_CONTROL (0x02)
    Endpoint: 0x00, Direction: OUT
    Device: 5
    URB bus id: 1
    Device setup request: relevant ('\0')
    Data: present ('\0')
    URB sec: 1702353719
    URB usec: 609092
    URB status: Operation now in progress (-EINPROGRESS) (-115)
    URB length [bytes]: 16
    Data length [bytes]: 16
    [Response in: 148]
    Interval: 0
    Start frame: 0
    Copy of Transfer Flags: 0x00000000
    Number of ISO descriptors: 0
    [bInterfaceClass: Unknown (0xffff)]
Setup Data
    bmRequestType: 0x40
    bRequest: 160
    wValue: 0x02a0
    wIndex: 0 (0x0000)
    wLength: 16
    Data Fragment: 0074a191ffc2b1907e09e0f538a3e0f5

No.     Time           Source                Destination           Protocol Length Info
    148 29.167865      1.5.0                 host                  USB      64     URB_CONTROL out

Frame 148: 64 bytes on wire (512 bits), 64 bytes captured (512 bits) on interface usbmon1, id 0
USB URB
    [Source: 1.5.0]
    [Destination: host]
    URB id: 0xffff993ecd78c3c0
    URB type: URB_COMPLETE ('C')
    URB transfer type: URB_CONTROL (0x02)
    Endpoint: 0x00, Direction: OUT
    Device: 5
    URB bus id: 1
    Device setup request: not relevant ('-')
    Data: not present ('>')
    URB sec: 1702353719
    URB usec: 610800
    URB status: Success (0)
    URB length [bytes]: 16
    Data length [bytes]: 0
    [Request in: 147]
    [Time from request: 0.001708000 seconds]
    Unused Setup Header
    Interval: 0
    Start frame: 0
    Copy of Transfer Flags: 0x00000000
    Number of ISO descriptors: 0
    [bInterfaceClass: Unknown (0xffff)]

No.     Time           Source                Destination           Protocol Length Info
    149 29.170528      host                  1.5.0                 USB      80     URB_CONTROL out

Frame 149: 80 bytes on wire (640 bits), 80 bytes captured (640 bits) on interface usbmon1, id 0
USB URB
    [Source: host]
    [Destination: 1.5.0]
    URB id: 0xffff993ecd78c840
    URB type: URB_SUBMIT ('S')
    URB transfer type: URB_CONTROL (0x02)
    Endpoint: 0x00, Direction: OUT
    Device: 5
    URB bus id: 1
    Device setup request: relevant ('\0')
    Data: present ('\0')
    URB sec: 1702353719
    URB usec: 613463
    URB status: Operation now in progress (-EINPROGRESS) (-115)
    URB length [bytes]: 16
    Data length [bytes]: 16
    [Response in: 150]
    Interval: 0
    Start frame: 0
    Copy of Transfer Flags: 0x00000000
    Number of ISO descriptors: 0
    [bInterfaceClass: Unknown (0xffff)]
Setup Data
    bmRequestType: 0x40
    bRequest: 160
    wValue: 0x02b0
    wIndex: 0 (0x0000)
    wLength: 16
    Data Fragment: 39a3e0f53aa3e0f53ba3e0f53ca3e0f5

No.     Time           Source                Destination           Protocol Length Info
    150 29.171866      1.5.0                 host                  USB      64     URB_CONTROL out

Frame 150: 64 bytes on wire (512 bits), 64 bytes captured (512 bits) on interface usbmon1, id 0
USB URB
    [Source: 1.5.0]
    [Destination: host]
    URB id: 0xffff993ecd78c840
    URB type: URB_COMPLETE ('C')
    URB transfer type: URB_CONTROL (0x02)
    Endpoint: 0x00, Direction: OUT
    Device: 5
    URB bus id: 1
    Device setup request: not relevant ('-')
    Data: not present ('>')
    URB sec: 1702353719
    URB usec: 614801
    URB status: Success (0)
    URB length [bytes]: 16
    Data length [bytes]: 0
    [Request in: 149]
    [Time from request: 0.001338000 seconds]
    Unused Setup Header
    Interval: 0
    Start frame: 0
    Copy of Transfer Flags: 0x00000000
    Number of ISO descriptors: 0
    [bInterfaceClass: Unknown (0xffff)]

No.     Time           Source                Destination           Protocol Length Info
    151 29.174926      host                  1.5.0                 USB      80     URB_CONTROL out

Frame 151: 80 bytes on wire (640 bits), 80 bytes captured (640 bits) on interface usbmon1, id 0
USB URB
    [Source: host]
    [Destination: 1.5.0]
    URB id: 0xffff993ecd78dec0
    URB type: URB_SUBMIT ('S')
    URB transfer type: URB_CONTROL (0x02)
    Endpoint: 0x00, Direction: OUT
    Device: 5
    URB bus id: 1
    Device setup request: relevant ('\0')
    Data: present ('\0')
    URB sec: 1702353719
    URB usec: 617861
    URB status: Operation now in progress (-EINPROGRESS) (-115)
    URB length [bytes]: 16
    Data length [bytes]: 16
    [Response in: 152]
    Interval: 0
    Start frame: 0
    Copy of Transfer Flags: 0x00000000
    Number of ISO descriptors: 0
    [bInterfaceClass: Unknown (0xffff)]
Setup Data
    bmRequestType: 0x40
    bRequest: 160
    wValue: 0x02c0
    wIndex: 0 (0x0000)
    wLength: 16
    Data Fragment: 3dc201c202e58003540764076006d202

No.     Time           Source                Destination           Protocol Length Info
    152 29.176861      1.5.0                 host                  USB      64     URB_CONTROL out

Frame 152: 64 bytes on wire (512 bits), 64 bytes captured (512 bits) on interface usbmon1, id 0
USB URB
    [Source: 1.5.0]
    [Destination: host]
    URB id: 0xffff993ecd78dec0
    URB type: URB_COMPLETE ('C')
    URB transfer type: URB_CONTROL (0x02)
    Endpoint: 0x00, Direction: OUT
    Device: 5
    URB bus id: 1
    Device setup request: not relevant ('-')
    Data: not present ('>')
    URB sec: 1702353719
    URB usec: 619796
    URB status: Success (0)
    URB length [bytes]: 16
    Data length [bytes]: 0
    [Request in: 151]
    [Time from request: 0.001935000 seconds]
    Unused Setup Header
    Interval: 0
    Start frame: 0
    Copy of Transfer Flags: 0x00000000
    Number of ISO descriptors: 0
    [bInterfaceClass: Unknown (0xffff)]

No.     Time           Source                Destination           Protocol Length Info
    153 29.179169      host                  1.5.0                 USB      80     URB_CONTROL out

Frame 153: 80 bytes on wire (640 bits), 80 bytes captured (640 bits) on interface usbmon1, id 0
USB URB
    [Source: host]
    [Destination: 1.5.0]
    URB id: 0xffff993ecd78dec0
    URB type: URB_SUBMIT ('S')
    URB transfer type: URB_CONTROL (0x02)
    Endpoint: 0x00, Direction: OUT
    Device: 5
    URB bus id: 1
    Device setup request: relevant ('\0')
    Data: present ('\0')
    URB sec: 1702353719
    URB usec: 622104
    URB status: Operation now in progress (-EINPROGRESS) (-115)
    URB length [bytes]: 16
    Data length [bytes]: 16
    [Response in: 154]
    Interval: 0
    Start frame: 0
    Copy of Transfer Flags: 0x00000000
    Number of ISO descriptors: 0
    [bInterfaceClass: Unknown (0xffff)]
Setup Data
    bmRequestType: 0x40
    bRequest: 160
    wValue: 0x02d0
    wIndex: 0 (0x0000)
    wLength: 16
    Data Fragment: 74078004d2017406900742f0907fac74

No.     Time           Source                Destination           Protocol Length Info
    154 29.180864      1.5.0                 host                  USB      64     URB_CONTROL out

Frame 154: 64 bytes on wire (512 bits), 64 bytes captured (512 bits) on interface usbmon1, id 0
USB URB
    [Source: 1.5.0]
    [Destination: host]
    URB id: 0xffff993ecd78dec0
    URB type: URB_COMPLETE ('C')
    URB transfer type: URB_CONTROL (0x02)
    Endpoint: 0x00, Direction: OUT
    Device: 5
    URB bus id: 1
    Device setup request: not relevant ('-')
    Data: not present ('>')
    URB sec: 1702353719
    URB usec: 623799
    URB status: Success (0)
    URB length [bytes]: 16
    Data length [bytes]: 0
    [Request in: 153]
    [Time from request: 0.001695000 seconds]
    Unused Setup Header
    Interval: 0
    Start frame: 0
    Copy of Transfer Flags: 0x00000000
    Number of ISO descriptors: 0
    [bInterfaceClass: Unknown (0xffff)]

No.     Time           Source                Destination           Protocol Length Info
    155 29.183592      host                  1.5.0                 USB      80     URB_CONTROL out

Frame 155: 80 bytes on wire (640 bits), 80 bytes captured (640 bits) on interface usbmon1, id 0
USB URB
    [Source: host]
    [Destination: 1.5.0]
    URB id: 0xffff993edd687d40
    URB type: URB_SUBMIT ('S')
    URB transfer type: URB_CONTROL (0x02)
    Endpoint: 0x00, Direction: OUT
    Device: 5
    URB bus id: 1
    Device setup request: relevant ('\0')
    Data: present ('\0')
    URB sec: 1702353719
    URB usec: 626527
    URB status: Operation now in progress (-EINPROGRESS) (-115)
    URB length [bytes]: 16
    Data length [bytes]: 16
    [Response in: 156]
    Interval: 0
    Start frame: 0
    Copy of Transfer Flags: 0x00000000
    Number of ISO descriptors: 0
    [bInterfaceClass: Unknown (0xffff)]
Setup Data
    bmRequestType: 0x40
    bRequest: 160
    wValue: 0x02e0
    wIndex: 0 (0x0000)
    wLength: 16
    Data Fragment: 00f0907fad7400f0907fae7401f0907f

No.     Time           Source                Destination           Protocol Length Info
    156 29.184863      1.5.0                 host                  USB      64     URB_CONTROL out

Frame 156: 64 bytes on wire (512 bits), 64 bytes captured (512 bits) on interface usbmon1, id 0
USB URB
    [Source: 1.5.0]
    [Destination: host]
    URB id: 0xffff993edd687d40
    URB type: URB_COMPLETE ('C')
    URB transfer type: URB_CONTROL (0x02)
    Endpoint: 0x00, Direction: OUT
    Device: 5
    URB bus id: 1
    Device setup request: not relevant ('-')
    Data: not present ('>')
    URB sec: 1702353719
    URB usec: 627798
    URB status: Success (0)
    URB length [bytes]: 16
    Data length [bytes]: 0
    [Request in: 155]
    [Time from request: 0.001271000 seconds]
    Unused Setup Header
    Interval: 0
    Start frame: 0
    Copy of Transfer Flags: 0x00000000
    Number of ISO descriptors: 0
    [bInterfaceClass: Unknown (0xffff)]

No.     Time           Source                Destination           Protocol Length Info
    157 29.187844      host                  1.5.0                 USB      80     URB_CONTROL out

Frame 157: 80 bytes on wire (640 bits), 80 bytes captured (640 bits) on interface usbmon1, id 0
USB URB
    [Source: host]
    [Destination: 1.5.0]
    URB id: 0xffff993edd687bc0
    URB type: URB_SUBMIT ('S')
    URB transfer type: URB_CONTROL (0x02)
    Endpoint: 0x00, Direction: OUT
    Device: 5
    URB bus id: 1
    Device setup request: relevant ('\0')
    Data: present ('\0')
    URB sec: 1702353719
    URB usec: 630779
    URB status: Operation now in progress (-EINPROGRESS) (-115)
    URB length [bytes]: 16
    Data length [bytes]: 16
    [Response in: 158]
    Interval: 0
    Start frame: 0
    Copy of Transfer Flags: 0x00000000
    Number of ISO descriptors: 0
    [bInterfaceClass: Unknown (0xffff)]
Setup Data
    bmRequestType: 0x40
    bRequest: 160
    wValue: 0x02f0
    wIndex: 0 (0x0000)
    wLength: 16
    Data Fragment: af7401f0907fa974fff0a3f0758901e5

No.     Time           Source                Destination           Protocol Length Info
    158 29.189866      1.5.0                 host                  USB      64     URB_CONTROL out

Frame 158: 64 bytes on wire (512 bits), 64 bytes captured (512 bits) on interface usbmon1, id 0
USB URB
    [Source: 1.5.0]
    [Destination: host]
    URB id: 0xffff993edd687bc0
    URB type: URB_COMPLETE ('C')
    URB transfer type: URB_CONTROL (0x02)
    Endpoint: 0x00, Direction: OUT
    Device: 5
    URB bus id: 1
    Device setup request: not relevant ('-')
    Data: not present ('>')
    URB sec: 1702353719
    URB usec: 632801
    URB status: Success (0)
    URB length [bytes]: 16
    Data length [bytes]: 0
    [Request in: 157]
    [Time from request: 0.002022000 seconds]
    Unused Setup Header
    Interval: 0
    Start frame: 0
    Copy of Transfer Flags: 0x00000000
    Number of ISO descriptors: 0
    [bInterfaceClass: Unknown (0xffff)]

No.     Time           Source                Destination           Protocol Length Info
    159 29.192095      host                  1.5.0                 USB      80     URB_CONTROL out

Frame 159: 80 bytes on wire (640 bits), 80 bytes captured (640 bits) on interface usbmon1, id 0
USB URB
    [Source: host]
    [Destination: 1.5.0]
    URB id: 0xffff993edd6866c0
    URB type: URB_SUBMIT ('S')
    URB transfer type: URB_CONTROL (0x02)
    Endpoint: 0x00, Direction: OUT
    Device: 5
    URB bus id: 1
    Device setup request: relevant ('\0')
    Data: present ('\0')
    URB sec: 1702353719
    URB usec: 635030
    URB status: Operation now in progress (-EINPROGRESS) (-115)
    URB length [bytes]: 16
    Data length [bytes]: 16
    [Response in: 160]
    Interval: 0
    Start frame: 0
    Copy of Transfer Flags: 0x00000000
    Number of ISO descriptors: 0
    [bInterfaceClass: Unknown (0xffff)]
Setup Data
    bmRequestType: 0x40
    bRequest: 160
    wValue: 0x0300
    wIndex: 0 (0x0000)
    wLength: 16
    Data Fragment: 8e4418f58ed28c907fde7457f0907fdd

No.     Time           Source                Destination           Protocol Length Info
    160 29.193871      1.5.0                 host                  USB      64     URB_CONTROL out

Frame 160: 64 bytes on wire (512 bits), 64 bytes captured (512 bits) on interface usbmon1, id 0
USB URB
    [Source: 1.5.0]
    [Destination: host]
    URB id: 0xffff993edd6866c0
    URB type: URB_COMPLETE ('C')
    URB transfer type: URB_CONTROL (0x02)
    Endpoint: 0x00, Direction: OUT
    Device: 5
    URB bus id: 1
    Device setup request: not relevant ('-')
    Data: not present ('>')
    URB sec: 1702353719
    URB usec: 636806
    URB status: Success (0)
    URB length [bytes]: 16
    Data length [bytes]: 0
    [Request in: 159]
    [Time from request: 0.001776000 seconds]
    Unused Setup Header
    Interval: 0
    Start frame: 0
    Copy of Transfer Flags: 0x00000000
    Number of ISO descriptors: 0
    [bInterfaceClass: Unknown (0xffff)]

No.     Time           Source                Destination           Protocol Length Info
    161 29.196116      host                  1.5.0                 USB      80     URB_CONTROL out

Frame 161: 80 bytes on wire (640 bits), 80 bytes captured (640 bits) on interface usbmon1, id 0
USB URB
    [Source: host]
    [Destination: 1.5.0]
    URB id: 0xffff993ecd78c840
    URB type: URB_SUBMIT ('S')
    URB transfer type: URB_CONTROL (0x02)
    Endpoint: 0x00, Direction: OUT
    Device: 5
    URB bus id: 1
    Device setup request: relevant ('\0')
    Data: present ('\0')
    URB sec: 1702353719
    URB usec: 639051
    URB status: Operation now in progress (-EINPROGRESS) (-115)
    URB length [bytes]: 16
    Data length [bytes]: 16
    [Response in: 162]
    Interval: 0
    Start frame: 0
    Copy of Transfer Flags: 0x00000000
    Number of ISO descriptors: 0
    [bInterfaceClass: Unknown (0xffff)]
Setup Data
    bmRequestType: 0x40
    bRequest: 160
    wValue: 0x0310
    wIndex: 0 (0x0000)
    wLength: 16
    Data Fragment: 7401f0d2e8d2af74c8b16d907fd67406

No.     Time           Source                Destination           Protocol Length Info
    162 29.197862      1.5.0                 host                  USB      64     URB_CONTROL out

Frame 162: 64 bytes on wire (512 bits), 64 bytes captured (512 bits) on interface usbmon1, id 0
USB URB
    [Source: 1.5.0]
    [Destination: host]
    URB id: 0xffff993ecd78c840
    URB type: URB_COMPLETE ('C')
    URB transfer type: URB_CONTROL (0x02)
    Endpoint: 0x00, Direction: OUT
    Device: 5
    URB bus id: 1
    Device setup request: not relevant ('-')
    Data: not present ('>')
    URB sec: 1702353719
    URB usec: 640797
    URB status: Success (0)
    URB length [bytes]: 16
    Data length [bytes]: 0
    [Request in: 161]
    [Time from request: 0.001746000 seconds]
    Unused Setup Header
    Interval: 0
    Start frame: 0
    Copy of Transfer Flags: 0x00000000
    Number of ISO descriptors: 0
    [bInterfaceClass: Unknown (0xffff)]

No.     Time           Source                Destination           Protocol Length Info
    163 29.200080      host                  1.5.0                 USB      80     URB_CONTROL out

Frame 163: 80 bytes on wire (640 bits), 80 bytes captured (640 bits) on interface usbmon1, id 0
USB URB
    [Source: host]
    [Destination: 1.5.0]
    URB id: 0xffff993ecd78c3c0
    URB type: URB_SUBMIT ('S')
    URB transfer type: URB_CONTROL (0x02)
    Endpoint: 0x00, Direction: OUT
    Device: 5
    URB bus id: 1
    Device setup request: relevant ('\0')
    Data: present ('\0')
    URB sec: 1702353719
    URB usec: 643015
    URB status: Operation now in progress (-EINPROGRESS) (-115)
    URB length [bytes]: 16
    Data length [bytes]: 16
    [Response in: 164]
    Interval: 0
    Start frame: 0
    Copy of Transfer Flags: 0x00000000
    Number of ISO descriptors: 0
    [bInterfaceClass: Unknown (0xffff)]
Setup Data
    bmRequestType: 0x40
    bRequest: 160
    wValue: 0x0320
    wIndex: 0 (0x0000)
    wLength: 16
    Data Fragment: f074c8b16d75320a75310a7534007535

No.     Time           Source                Destination           Protocol Length Info
    164 29.201864      1.5.0                 host                  USB      64     URB_CONTROL out

Frame 164: 64 bytes on wire (512 bits), 64 bytes captured (512 bits) on interface usbmon1, id 0
USB URB
    [Source: 1.5.0]
    [Destination: host]
    URB id: 0xffff993ecd78c3c0
    URB type: URB_COMPLETE ('C')
    URB transfer type: URB_CONTROL (0x02)
    Endpoint: 0x00, Direction: OUT
    Device: 5
    URB bus id: 1
    Device setup request: not relevant ('-')
    Data: not present ('>')
    URB sec: 1702353719
    URB usec: 644799
    URB status: Success (0)
    URB length [bytes]: 16
    Data length [bytes]: 0
    [Request in: 163]
    [Time from request: 0.001784000 seconds]
    Unused Setup Header
    Interval: 0
    Start frame: 0
    Copy of Transfer Flags: 0x00000000
    Number of ISO descriptors: 0
    [bInterfaceClass: Unknown (0xffff)]

No.     Time           Source                Destination           Protocol Length Info
    165 29.204139      host                  1.5.0                 USB      80     URB_CONTROL out

Frame 165: 80 bytes on wire (640 bits), 80 bytes captured (640 bits) on interface usbmon1, id 0
USB URB
    [Source: host]
    [Destination: 1.5.0]
    URB id: 0xffff993ecd78cd80
    URB type: URB_SUBMIT ('S')
    URB transfer type: URB_CONTROL (0x02)
    Endpoint: 0x00, Direction: OUT
    Device: 5
    URB bus id: 1
    Device setup request: relevant ('\0')
    Data: present ('\0')
    URB sec: 1702353719
    URB usec: 647074
    URB status: Operation now in progress (-EINPROGRESS) (-115)
    URB length [bytes]: 16
    Data length [bytes]: 16
    [Response in: 166]
    Interval: 0
    Start frame: 0
    Copy of Transfer Flags: 0x00000000
    Number of ISO descriptors: 0
    [bInterfaceClass: Unknown (0xffff)]
Setup Data
    bmRequestType: 0x40
    bRequest: 160
    wValue: 0x0330
    wIndex: 0 (0x0000)
    wLength: 16
    Data Fragment: 00753600753700c203753e00753f0075

No.     Time           Source                Destination           Protocol Length Info
    166 29.205861      1.5.0                 host                  USB      64     URB_CONTROL out

Frame 166: 64 bytes on wire (512 bits), 64 bytes captured (512 bits) on interface usbmon1, id 0
USB URB
    [Source: 1.5.0]
    [Destination: host]
    URB id: 0xffff993ecd78cd80
    URB type: URB_COMPLETE ('C')
    URB transfer type: URB_CONTROL (0x02)
    Endpoint: 0x00, Direction: OUT
    Device: 5
    URB bus id: 1
    Device setup request: not relevant ('-')
    Data: not present ('>')
    URB sec: 1702353719
    URB usec: 648796
    URB status: Success (0)
    URB length [bytes]: 16
    Data length [bytes]: 0
    [Request in: 165]
    [Time from request: 0.001722000 seconds]
    Unused Setup Header
    Interval: 0
    Start frame: 0
    Copy of Transfer Flags: 0x00000000
    Number of ISO descriptors: 0
    [bInterfaceClass: Unknown (0xffff)]

No.     Time           Source                Destination           Protocol Length Info
    167 29.208555      host                  1.5.0                 USB      80     URB_CONTROL out

Frame 167: 80 bytes on wire (640 bits), 80 bytes captured (640 bits) on interface usbmon1, id 0
USB URB
    [Source: host]
    [Destination: 1.5.0]
    URB id: 0xffff993ecd78d980
    URB type: URB_SUBMIT ('S')
    URB transfer type: URB_CONTROL (0x02)
    Endpoint: 0x00, Direction: OUT
    Device: 5
    URB bus id: 1
    Device setup request: relevant ('\0')
    Data: present ('\0')
    URB sec: 1702353719
    URB usec: 651490
    URB status: Operation now in progress (-EINPROGRESS) (-115)
    URB length [bytes]: 16
    Data length [bytes]: 16
    [Response in: 168]
    Interval: 0
    Start frame: 0
    Copy of Transfer Flags: 0x00000000
    Number of ISO descriptors: 0
    [bInterfaceClass: Unknown (0xffff)]
Setup Data
    bmRequestType: 0x40
    bRequest: 160
    wValue: 0x0340
    wIndex: 0 (0x0000)
    wLength: 16
    Data Fragment: 4000754100d2a9c2b1907fc9f0907fc8

No.     Time           Source                Destination           Protocol Length Info
    168 29.209865      1.5.0                 host                  USB      64     URB_CONTROL out

Frame 168: 64 bytes on wire (512 bits), 64 bytes captured (512 bits) on interface usbmon1, id 0
USB URB
    [Source: 1.5.0]
    [Destination: host]
    URB id: 0xffff993ecd78d980
    URB type: URB_COMPLETE ('C')
    URB transfer type: URB_CONTROL (0x02)
    Endpoint: 0x00, Direction: OUT
    Device: 5
    URB bus id: 1
    Device setup request: not relevant ('-')
    Data: not present ('>')
    URB sec: 1702353719
    URB usec: 652800
    URB status: Success (0)
    URB length [bytes]: 16
    Data length [bytes]: 0
    [Request in: 167]
    [Time from request: 0.001310000 seconds]
    Unused Setup Header
    Interval: 0
    Start frame: 0
    Copy of Transfer Flags: 0x00000000
    Number of ISO descriptors: 0
    [bInterfaceClass: Unknown (0xffff)]

No.     Time           Source                Destination           Protocol Length Info
    169 29.212916      host                  1.5.0                 USB      80     URB_CONTROL out

Frame 169: 80 bytes on wire (640 bits), 80 bytes captured (640 bits) on interface usbmon1, id 0
USB URB
    [Source: host]
    [Destination: 1.5.0]
    URB id: 0xffff993ecd78de00
    URB type: URB_SUBMIT ('S')
    URB transfer type: URB_CONTROL (0x02)
    Endpoint: 0x00, Direction: OUT
    Device: 5
    URB bus id: 1
    Device setup request: relevant ('\0')
    Data: present ('\0')
    URB sec: 1702353719
    URB usec: 655851
    URB status: Operation now in progress (-EINPROGRESS) (-115)
    URB length [bytes]: 16
    Data length [bytes]: 16
    [Response in: 170]
    Interval: 0
    Start frame: 0
    Copy of Transfer Flags: 0x00000000
    Number of ISO descriptors: 0
    [bInterfaceClass: Unknown (0xffff)]
Setup Data
    bmRequestType: 0x40
    bRequest: 160
    wValue: 0x0350
    wIndex: 0 (0x0000)
    wLength: 16
    Data Fragment: e020e1f9c2a9d2b191ab907dc0e0c454

No.     Time           Source                Destination           Protocol Length Info
    170 29.214870      1.5.0                 host                  USB      64     URB_CONTROL out

Frame 170: 64 bytes on wire (512 bits), 64 bytes captured (512 bits) on interface usbmon1, id 0
USB URB
    [Source: 1.5.0]
    [Destination: host]
    URB id: 0xffff993ecd78de00
    URB type: URB_COMPLETE ('C')
    URB transfer type: URB_CONTROL (0x02)
    Endpoint: 0x00, Direction: OUT
    Device: 5
    URB bus id: 1
    Device setup request: not relevant ('-')
    Data: not present ('>')
    URB sec: 1702353719
    URB usec: 657805
    URB status: Success (0)
    URB length [bytes]: 16
    Data length [bytes]: 0
    [Request in: 169]
    [Time from request: 0.001954000 seconds]
    Unused Setup Header
    Interval: 0
    Start frame: 0
    Copy of Transfer Flags: 0x00000000
    Number of ISO descriptors: 0
    [bInterfaceClass: Unknown (0xffff)]

No.     Time           Source                Destination           Protocol Length Info
    171 29.217190      host                  1.5.0                 USB      68     URB_CONTROL out

Frame 171: 68 bytes on wire (544 bits), 68 bytes captured (544 bits) on interface usbmon1, id 0
USB URB
    [Source: host]
    [Destination: 1.5.0]
    URB id: 0xffff993ecd78c600
    URB type: URB_SUBMIT ('S')
    URB transfer type: URB_CONTROL (0x02)
    Endpoint: 0x00, Direction: OUT
    Device: 5
    URB bus id: 1
    Device setup request: relevant ('\0')
    Data: present ('\0')
    URB sec: 1702353719
    URB usec: 660125
    URB status: Operation now in progress (-EINPROGRESS) (-115)
    URB length [bytes]: 4
    Data length [bytes]: 4
    [Response in: 172]
    Interval: 0
    Start frame: 0
    Copy of Transfer Flags: 0x00000000
    Number of ISO descriptors: 0
    [bInterfaceClass: Unknown (0xffff)]
Setup Data
    bmRequestType: 0x40
    bRequest: 160
    wValue: 0x0360
    wIndex: 0 (0x0000)
    wLength: 4
    Data Fragment: 0f900367

No.     Time           Source                Destination           Protocol Length Info
    172 29.218860      1.5.0                 host                  USB      64     URB_CONTROL out

Frame 172: 64 bytes on wire (512 bits), 64 bytes captured (512 bits) on interface usbmon1, id 0
USB URB
    [Source: 1.5.0]
    [Destination: host]
    URB id: 0xffff993ecd78c600
    URB type: URB_COMPLETE ('C')
    URB transfer type: URB_CONTROL (0x02)
    Endpoint: 0x00, Direction: OUT
    Device: 5
    URB bus id: 1
    Device setup request: not relevant ('-')
    Data: not present ('>')
    URB sec: 1702353719
    URB usec: 661795
    URB status: Success (0)
    URB length [bytes]: 4
    Data length [bytes]: 0
    [Request in: 171]
    [Time from request: 0.001670000 seconds]
    Unused Setup Header
    Interval: 0
    Start frame: 0
    Copy of Transfer Flags: 0x00000000
    Number of ISO descriptors: 0
    [bInterfaceClass: Unknown (0xffff)]

No.     Time           Source                Destination           Protocol Length Info
    173 29.221567      host                  1.5.0                 USB      80     URB_CONTROL out

Frame 173: 80 bytes on wire (640 bits), 80 bytes captured (640 bits) on interface usbmon1, id 0
USB URB
    [Source: host]
    [Destination: 1.5.0]
    URB id: 0xffff993ecd78c900
    URB type: URB_SUBMIT ('S')
    URB transfer type: URB_CONTROL (0x02)
    Endpoint: 0x00, Direction: OUT
    Device: 5
    URB bus id: 1
    Device setup request: relevant ('\0')
    Data: present ('\0')
    URB sec: 1702353719
    URB usec: 664502
    URB status: Operation now in progress (-EINPROGRESS) (-115)
    URB length [bytes]: 16
    Data length [bytes]: 16
    [Response in: 174]
    Interval: 0
    Start frame: 0
    Copy of Transfer Flags: 0x00000000
    Number of ISO descriptors: 0
    [bInterfaceClass: Unknown (0xffff)]
Setup Data
    bmRequestType: 0x40
    bRequest: 160
    wValue: 0x0364
    wIndex: 0 (0x0000)
    wLength: 16
    Data Fragment: 2323730203a7000203a7000203a70002

No.     Time           Source                Destination           Protocol Length Info
    174 29.222882      1.5.0                 host                  USB      64     URB_CONTROL out

Frame 174: 64 bytes on wire (512 bits), 64 bytes captured (512 bits) on interface usbmon1, id 0
USB URB
    [Source: 1.5.0]
    [Destination: host]
    URB id: 0xffff993ecd78c900
    URB type: URB_COMPLETE ('C')
    URB transfer type: URB_CONTROL (0x02)
    Endpoint: 0x00, Direction: OUT
    Device: 5
    URB bus id: 1
    Device setup request: not relevant ('-')
    Data: not present ('>')
    URB sec: 1702353719
    URB usec: 665817
    URB status: Success (0)
    URB length [bytes]: 16
    Data length [bytes]: 0
    [Request in: 173]
    [Time from request: 0.001315000 seconds]
    Unused Setup Header
    Interval: 0
    Start frame: 0
    Copy of Transfer Flags: 0x00000000
    Number of ISO descriptors: 0
    [bInterfaceClass: Unknown (0xffff)]

No.     Time           Source                Destination           Protocol Length Info
    175 29.225978      host                  1.5.0                 USB      80     URB_CONTROL out

Frame 175: 80 bytes on wire (640 bits), 80 bytes captured (640 bits) on interface usbmon1, id 0
USB URB
    [Source: host]
    [Destination: 1.5.0]
    URB id: 0xffff993ecd78c300
    URB type: URB_SUBMIT ('S')
    URB transfer type: URB_CONTROL (0x02)
    Endpoint: 0x00, Direction: OUT
    Device: 5
    URB bus id: 1
    Device setup request: relevant ('\0')
    Data: present ('\0')
    URB sec: 1702353719
    URB usec: 668913
    URB status: Operation now in progress (-EINPROGRESS) (-115)
    URB length [bytes]: 16
    Data length [bytes]: 16
    [Response in: 176]
    Interval: 0
    Start frame: 0
    Copy of Transfer Flags: 0x00000000
    Number of ISO descriptors: 0
    [bInterfaceClass: Unknown (0xffff)]
Setup Data
    bmRequestType: 0x40
    bRequest: 160
    wValue: 0x0374
    wIndex: 0 (0x0000)
    wLength: 16
    Data Fragment: 03a7000203a7000203a70002041c0002

No.     Time           Source                Destination           Protocol Length Info
    176 29.227867      1.5.0                 host                  USB      64     URB_CONTROL out

Frame 176: 64 bytes on wire (512 bits), 64 bytes captured (512 bits) on interface usbmon1, id 0
USB URB
    [Source: 1.5.0]
    [Destination: host]
    URB id: 0xffff993ecd78c300
    URB type: URB_COMPLETE ('C')
    URB transfer type: URB_CONTROL (0x02)
    Endpoint: 0x00, Direction: OUT
    Device: 5
    URB bus id: 1
    Device setup request: not relevant ('-')
    Data: not present ('>')
    URB sec: 1702353719
    URB usec: 670802
    URB status: Success (0)
    URB length [bytes]: 16
    Data length [bytes]: 0
    [Request in: 175]
    [Time from request: 0.001889000 seconds]
    Unused Setup Header
    Interval: 0
    Start frame: 0
    Copy of Transfer Flags: 0x00000000
    Number of ISO descriptors: 0
    [bInterfaceClass: Unknown (0xffff)]

No.     Time           Source                Destination           Protocol Length Info
    177 29.230126      host                  1.5.0                 USB      80     URB_CONTROL out

Frame 177: 80 bytes on wire (640 bits), 80 bytes captured (640 bits) on interface usbmon1, id 0
USB URB
    [Source: host]
    [Destination: 1.5.0]
    URB id: 0xffff993edd6863c0
    URB type: URB_SUBMIT ('S')
    URB transfer type: URB_CONTROL (0x02)
    Endpoint: 0x00, Direction: OUT
    Device: 5
    URB bus id: 1
    Device setup request: relevant ('\0')
    Data: present ('\0')
    URB sec: 1702353719
    URB usec: 673061
    URB status: Operation now in progress (-EINPROGRESS) (-115)
    URB length [bytes]: 16
    Data length [bytes]: 16
    [Response in: 178]
    Interval: 0
    Start frame: 0
    Copy of Transfer Flags: 0x00000000
    Number of ISO descriptors: 0
    [bInterfaceClass: Unknown (0xffff)]
Setup Data
    bmRequestType: 0x40
    bRequest: 160
    wValue: 0x0384
    wIndex: 0 (0x0000)
    wLength: 16
    Data Fragment: 0429000203ab000203f80002040a0002

No.     Time           Source                Destination           Protocol Length Info
    178 29.231863      1.5.0                 host                  USB      64     URB_CONTROL out

Frame 178: 64 bytes on wire (512 bits), 64 bytes captured (512 bits) on interface usbmon1, id 0
USB URB
    [Source: 1.5.0]
    [Destination: host]
    URB id: 0xffff993edd6863c0
    URB type: URB_COMPLETE ('C')
    URB transfer type: URB_CONTROL (0x02)
    Endpoint: 0x00, Direction: OUT
    Device: 5
    URB bus id: 1
    Device setup request: not relevant ('-')
    Data: not present ('>')
    URB sec: 1702353719
    URB usec: 674798
    URB status: Success (0)
    URB length [bytes]: 16
    Data length [bytes]: 0
    [Request in: 177]
    [Time from request: 0.001737000 seconds]
    Unused Setup Header
    Interval: 0
    Start frame: 0
    Copy of Transfer Flags: 0x00000000
    Number of ISO descriptors: 0
    [bInterfaceClass: Unknown (0xffff)]

No.     Time           Source                Destination           Protocol Length Info
    179 29.234081      host                  1.5.0                 USB      80     URB_CONTROL out

Frame 179: 80 bytes on wire (640 bits), 80 bytes captured (640 bits) on interface usbmon1, id 0
USB URB
    [Source: host]
    [Destination: 1.5.0]
    URB id: 0xffff993edd687080
    URB type: URB_SUBMIT ('S')
    URB transfer type: URB_CONTROL (0x02)
    Endpoint: 0x00, Direction: OUT
    Device: 5
    URB bus id: 1
    Device setup request: relevant ('\0')
    Data: present ('\0')
    URB sec: 1702353719
    URB usec: 677016
    URB status: Operation now in progress (-EINPROGRESS) (-115)
    URB length [bytes]: 16
    Data length [bytes]: 16
    [Response in: 180]
    Interval: 0
    Start frame: 0
    Copy of Transfer Flags: 0x00000000
    Number of ISO descriptors: 0
    [bInterfaceClass: Unknown (0xffff)]
Setup Data
    bmRequestType: 0x40
    bRequest: 160
    wValue: 0x0394
    wIndex: 0 (0x0000)
    wLength: 16
    Data Fragment: 03a7000203a7000203a7000203a70002

No.     Time           Source                Destination           Protocol Length Info
    180 29.235868      1.5.0                 host                  USB      64     URB_CONTROL out

Frame 180: 64 bytes on wire (512 bits), 64 bytes captured (512 bits) on interface usbmon1, id 0
USB URB
    [Source: 1.5.0]
    [Destination: host]
    URB id: 0xffff993edd687080
    URB type: URB_COMPLETE ('C')
    URB transfer type: URB_CONTROL (0x02)
    Endpoint: 0x00, Direction: OUT
    Device: 5
    URB bus id: 1
    Device setup request: not relevant ('-')
    Data: not present ('>')
    URB sec: 1702353719
    URB usec: 678803
    URB status: Success (0)
    URB length [bytes]: 16
    Data length [bytes]: 0
    [Request in: 179]
    [Time from request: 0.001787000 seconds]
    Unused Setup Header
    Interval: 0
    Start frame: 0
    Copy of Transfer Flags: 0x00000000
    Number of ISO descriptors: 0
    [bInterfaceClass: Unknown (0xffff)]

No.     Time           Source                Destination           Protocol Length Info
    181 29.241562      host                  1.5.0                 USB      80     URB_CONTROL out

Frame 181: 80 bytes on wire (640 bits), 80 bytes captured (640 bits) on interface usbmon1, id 0
USB URB
    [Source: host]
    [Destination: 1.5.0]
    URB id: 0xffff993edd686d80
    URB type: URB_SUBMIT ('S')
    URB transfer type: URB_CONTROL (0x02)
    Endpoint: 0x00, Direction: OUT
    Device: 5
    URB bus id: 1
    Device setup request: relevant ('\0')
    Data: present ('\0')
    URB sec: 1702353719
    URB usec: 684497
    URB status: Operation now in progress (-EINPROGRESS) (-115)
    URB length [bytes]: 16
    Data length [bytes]: 16
    [Response in: 182]
    Interval: 0
    Start frame: 0
    Copy of Transfer Flags: 0x00000000
    Number of ISO descriptors: 0
    [bInterfaceClass: Unknown (0xffff)]
Setup Data
    bmRequestType: 0x40
    bRequest: 160
    wValue: 0x03a4
    wIndex: 0 (0x0000)
    wLength: 16
    Data Fragment: 044800740281a3907dc1e054079003b7

No.     Time           Source                Destination           Protocol Length Info
    182 29.242870      1.5.0                 host                  USB      64     URB_CONTROL out

Frame 182: 64 bytes on wire (512 bits), 64 bytes captured (512 bits) on interface usbmon1, id 0
USB URB
    [Source: 1.5.0]
    [Destination: host]
    URB id: 0xffff993edd686d80
    URB type: URB_COMPLETE ('C')
    URB transfer type: URB_CONTROL (0x02)
    Endpoint: 0x00, Direction: OUT
    Device: 5
    URB bus id: 1
    Device setup request: not relevant ('-')
    Data: not present ('>')
    URB sec: 1702353719
    URB usec: 685805
    URB status: Success (0)
    URB length [bytes]: 16
    Data length [bytes]: 0
    [Request in: 181]
    [Time from request: 0.001308000 seconds]
    Unused Setup Header
    Interval: 0
    Start frame: 0
    Copy of Transfer Flags: 0x00000000
    Number of ISO descriptors: 0
    [bInterfaceClass: Unknown (0xffff)]

No.     Time           Source                Destination           Protocol Length Info
    183 29.245822      host                  1.5.0                 USB      80     URB_CONTROL out

Frame 183: 80 bytes on wire (640 bits), 80 bytes captured (640 bits) on interface usbmon1, id 0
USB URB
    [Source: host]
    [Destination: 1.5.0]
    URB id: 0xffff993edd687740
    URB type: URB_SUBMIT ('S')
    URB transfer type: URB_CONTROL (0x02)
    Endpoint: 0x00, Direction: OUT
    Device: 5
    URB bus id: 1
    Device setup request: relevant ('\0')
    Data: present ('\0')
    URB sec: 1702353719
    URB usec: 688757
    URB status: Operation now in progress (-EINPROGRESS) (-115)
    URB length [bytes]: 16
    Data length [bytes]: 16
    [Response in: 184]
    Interval: 0
    Start frame: 0
    Copy of Transfer Flags: 0x00000000
    Number of ISO descriptors: 0
    [bInterfaceClass: Unknown (0xffff)]
Setup Data
    bmRequestType: 0x40
    bRequest: 160
    wValue: 0x03b4
    wIndex: 0 (0x0000)
    wLength: 16
    Data Fragment: 2323730203a7000203d7000203eb0002

No.     Time           Source                Destination           Protocol Length Info
    184 29.247865      1.5.0                 host                  USB      64     URB_CONTROL out

Frame 184: 64 bytes on wire (512 bits), 64 bytes captured (512 bits) on interface usbmon1, id 0
USB URB
    [Source: 1.5.0]
    [Destination: host]
    URB id: 0xffff993edd687740
    URB type: URB_COMPLETE ('C')
    URB transfer type: URB_CONTROL (0x02)
    Endpoint: 0x00, Direction: OUT
    Device: 5
    URB bus id: 1
    Device setup request: not relevant ('-')
    Data: not present ('>')
    URB sec: 1702353719
    URB usec: 690800
    URB status: Success (0)
    URB length [bytes]: 16
    Data length [bytes]: 0
    [Request in: 183]
    [Time from request: 0.002043000 seconds]
    Unused Setup Header
    Interval: 0
    Start frame: 0
    Copy of Transfer Flags: 0x00000000
    Number of ISO descriptors: 0
    [bInterfaceClass: Unknown (0xffff)]

No.     Time           Source                Destination           Protocol Length Info
    185 29.250071      host                  1.5.0                 USB      80     URB_CONTROL out

Frame 185: 80 bytes on wire (640 bits), 80 bytes captured (640 bits) on interface usbmon1, id 0
USB URB
    [Source: host]
    [Destination: 1.5.0]
    URB id: 0xffff993edd686e40
    URB type: URB_SUBMIT ('S')
    URB transfer type: URB_CONTROL (0x02)
    Endpoint: 0x00, Direction: OUT
    Device: 5
    URB bus id: 1
    Device setup request: relevant ('\0')
    Data: present ('\0')
    URB sec: 1702353719
    URB usec: 693006
    URB status: Operation now in progress (-EINPROGRESS) (-115)
    URB length [bytes]: 16
    Data length [bytes]: 16
    [Response in: 186]
    Interval: 0
    Start frame: 0
    Copy of Transfer Flags: 0x00000000
    Number of ISO descriptors: 0
    [bInterfaceClass: Unknown (0xffff)]
Setup Data
    bmRequestType: 0x40
    bRequest: 160
    wValue: 0x03c4
    wIndex: 0 (0x0000)
    wLength: 16
    Data Fragment: 03a7000203a7000203a7000203e10002

No.     Time           Source                Destination           Protocol Length Info
    186 29.251870      1.5.0                 host                  USB      64     URB_CONTROL out

Frame 186: 64 bytes on wire (512 bits), 64 bytes captured (512 bits) on interface usbmon1, id 0
USB URB
    [Source: 1.5.0]
    [Destination: host]
    URB id: 0xffff993edd686e40
    URB type: URB_COMPLETE ('C')
    URB transfer type: URB_CONTROL (0x02)
    Endpoint: 0x00, Direction: OUT
    Device: 5
    URB bus id: 1
    Device setup request: not relevant ('-')
    Data: not present ('>')
    URB sec: 1702353719
    URB usec: 694805
    URB status: Success (0)
    URB length [bytes]: 16
    Data length [bytes]: 0
    [Request in: 185]
    [Time from request: 0.001799000 seconds]
    Unused Setup Header
    Interval: 0
    Start frame: 0
    Copy of Transfer Flags: 0x00000000
    Number of ISO descriptors: 0
    [bInterfaceClass: Unknown (0xffff)]

No.     Time           Source                Destination           Protocol Length Info
    187 29.254114      host                  1.5.0                 USB      80     URB_CONTROL out

Frame 187: 80 bytes on wire (640 bits), 80 bytes captured (640 bits) on interface usbmon1, id 0
USB URB
    [Source: host]
    [Destination: 1.5.0]
    URB id: 0xffff993edd686240
    URB type: URB_SUBMIT ('S')
    URB transfer type: URB_CONTROL (0x02)
    Endpoint: 0x00, Direction: OUT
    Device: 5
    URB bus id: 1
    Device setup request: relevant ('\0')
    Data: present ('\0')
    URB sec: 1702353719
    URB usec: 697049
    URB status: Operation now in progress (-EINPROGRESS) (-115)
    URB length [bytes]: 16
    Data length [bytes]: 16
    [Response in: 188]
    Interval: 0
    Start frame: 0
    Copy of Transfer Flags: 0x00000000
    Number of ISO descriptors: 0
    [bInterfaceClass: Unknown (0xffff)]
Setup Data
    bmRequestType: 0x40
    bRequest: 160
    wValue: 0x03d4
    wIndex: 0 (0x0000)
    wLength: 16
    Data Fragment: 042900907e017411f0740281a3907e01

No.     Time           Source                Destination           Protocol Length Info
    188 29.255882      1.5.0                 host                  USB      64     URB_CONTROL out

Frame 188: 64 bytes on wire (512 bits), 64 bytes captured (512 bits) on interface usbmon1, id 0
USB URB
    [Source: 1.5.0]
    [Destination: host]
    URB id: 0xffff993edd686240
    URB type: URB_COMPLETE ('C')
    URB transfer type: URB_CONTROL (0x02)
    Endpoint: 0x00, Direction: OUT
    Device: 5
    URB bus id: 1
    Device setup request: not relevant ('-')
    Data: not present ('>')
    URB sec: 1702353719
    URB usec: 698817
    URB status: Success (0)
    URB length [bytes]: 16
    Data length [bytes]: 0
    [Request in: 187]
    [Time from request: 0.001768000 seconds]
    Unused Setup Header
    Interval: 0
    Start frame: 0
    Copy of Transfer Flags: 0x00000000
    Number of ISO descriptors: 0
    [bInterfaceClass: Unknown (0xffff)]

No.     Time           Source                Destination           Protocol Length Info
    189 29.258133      host                  1.5.0                 USB      80     URB_CONTROL out

Frame 189: 80 bytes on wire (640 bits), 80 bytes captured (640 bits) on interface usbmon1, id 0
USB URB
    [Source: host]
    [Destination: 1.5.0]
    URB id: 0xffff993ecd78c780
    URB type: URB_SUBMIT ('S')
    URB transfer type: URB_CONTROL (0x02)
    Endpoint: 0x00, Direction: OUT
    Device: 5
    URB bus id: 1
    Device setup request: relevant ('\0')
    Data: present ('\0')
    URB sec: 1702353719
    URB usec: 701068
    URB status: Operation now in progress (-EINPROGRESS) (-115)
    URB length [bytes]: 16
    Data length [bytes]: 16
    [Response in: 190]
    Interval: 0
    Start frame: 0
    Copy of Transfer Flags: 0x00000000
    Number of ISO descriptors: 0
    [bInterfaceClass: Unknown (0xffff)]
Setup Data
    bmRequestType: 0x40
    bRequest: 160
    wValue: 0x03e4
    wIndex: 0 (0x0000)
    wLength: 16
    Data Fragment: 7403f0740281a3907e01e580035407f0

No.     Time           Source                Destination           Protocol Length Info
    190 29.259887      1.5.0                 host                  USB      64     URB_CONTROL out

Frame 190: 64 bytes on wire (512 bits), 64 bytes captured (512 bits) on interface usbmon1, id 0
USB URB
    [Source: 1.5.0]
    [Destination: host]
    URB id: 0xffff993ecd78c780
    URB type: URB_COMPLETE ('C')
    URB transfer type: URB_CONTROL (0x02)
    Endpoint: 0x00, Direction: OUT
    Device: 5
    URB bus id: 1
    Device setup request: not relevant ('-')
    Data: not present ('>')
    URB sec: 1702353719
    URB usec: 702822
    URB status: Success (0)
    URB length [bytes]: 16
    Data length [bytes]: 0
    [Request in: 189]
    [Time from request: 0.001754000 seconds]
    Unused Setup Header
    Interval: 0
    Start frame: 0
    Copy of Transfer Flags: 0x00000000
    Number of ISO descriptors: 0
    [bInterfaceClass: Unknown (0xffff)]

No.     Time           Source                Destination           Protocol Length Info
    191 29.262207      host                  1.5.0                 USB      80     URB_CONTROL out

Frame 191: 80 bytes on wire (640 bits), 80 bytes captured (640 bits) on interface usbmon1, id 0
USB URB
    [Source: host]
    [Destination: 1.5.0]
    URB id: 0xffff993eaefda300
    URB type: URB_SUBMIT ('S')
    URB transfer type: URB_CONTROL (0x02)
    Endpoint: 0x00, Direction: OUT
    Device: 5
    URB bus id: 1
    Device setup request: relevant ('\0')
    Data: present ('\0')
    URB sec: 1702353719
    URB usec: 705142
    URB status: Operation now in progress (-EINPROGRESS) (-115)
    URB length [bytes]: 16
    Data length [bytes]: 16
    [Response in: 192]
    Interval: 0
    Start frame: 0
    Copy of Transfer Flags: 0x00000000
    Number of ISO descriptors: 0
    [bInterfaceClass: Unknown (0xffff)]
Setup Data
    bmRequestType: 0x40
    bRequest: 160
    wValue: 0x03f4
    wIndex: 0 (0x0000)
    wLength: 16
    Data Fragment: 740281a3907dc0e0540ff536a3e0f537

No.     Time           Source                Destination           Protocol Length Info
    192 29.263871      1.5.0                 host                  USB      64     URB_CONTROL out

Frame 192: 64 bytes on wire (512 bits), 64 bytes captured (512 bits) on interface usbmon1, id 0
USB URB
    [Source: 1.5.0]
    [Destination: host]
    URB id: 0xffff993eaefda300
    URB type: URB_COMPLETE ('C')
    URB transfer type: URB_CONTROL (0x02)
    Endpoint: 0x00, Direction: OUT
    Device: 5
    URB bus id: 1
    Device setup request: not relevant ('-')
    Data: not present ('>')
    URB sec: 1702353719
    URB usec: 706806
    URB status: Success (0)
    URB length [bytes]: 16
    Data length [bytes]: 0
    [Request in: 191]
    [Time from request: 0.001664000 seconds]
    Unused Setup Header
    Interval: 0
    Start frame: 0
    Copy of Transfer Flags: 0x00000000
    Number of ISO descriptors: 0
    [bInterfaceClass: Unknown (0xffff)]

No.     Time           Source                Destination           Protocol Length Info
    193 29.266444      host                  1.5.0                 USB      80     URB_CONTROL out

Frame 193: 80 bytes on wire (640 bits), 80 bytes captured (640 bits) on interface usbmon1, id 0
USB URB
    [Source: host]
    [Destination: 1.5.0]
    URB id: 0xffff993eaefda840
    URB type: URB_SUBMIT ('S')
    URB transfer type: URB_CONTROL (0x02)
    Endpoint: 0x00, Direction: OUT
    Device: 5
    URB bus id: 1
    Device setup request: relevant ('\0')
    Data: present ('\0')
    URB sec: 1702353719
    URB usec: 709379
    URB status: Operation now in progress (-EINPROGRESS) (-115)
    URB length [bytes]: 16
    Data length [bytes]: 16
    [Response in: 194]
    Interval: 0
    Start frame: 0
    Copy of Transfer Flags: 0x00000000
    Number of ISO descriptors: 0
    [bInterfaceClass: Unknown (0xffff)]
Setup Data
    bmRequestType: 0x40
    bRequest: 160
    wValue: 0x0404
    wIndex: 0 (0x0000)
    wLength: 16
    Data Fragment: c200740281a3907dc0e0540ff536a3e0

No.     Time           Source                Destination           Protocol Length Info
    194 29.267865      1.5.0                 host                  USB      64     URB_CONTROL out

Frame 194: 64 bytes on wire (512 bits), 64 bytes captured (512 bits) on interface usbmon1, id 0
USB URB
    [Source: 1.5.0]
    [Destination: host]
    URB id: 0xffff993eaefda840
    URB type: URB_COMPLETE ('C')
    URB transfer type: URB_CONTROL (0x02)
    Endpoint: 0x00, Direction: OUT
    Device: 5
    URB bus id: 1
    Device setup request: not relevant ('-')
    Data: not present ('>')
    URB sec: 1702353719
    URB usec: 710800
    URB status: Success (0)
    URB length [bytes]: 16
    Data length [bytes]: 0
    [Request in: 193]
    [Time from request: 0.001421000 seconds]
    Unused Setup Header
    Interval: 0
    Start frame: 0
    Copy of Transfer Flags: 0x00000000
    Number of ISO descriptors: 0
    [bInterfaceClass: Unknown (0xffff)]

No.     Time           Source                Destination           Protocol Length Info
    195 29.270713      host                  1.5.0                 USB      80     URB_CONTROL out

Frame 195: 80 bytes on wire (640 bits), 80 bytes captured (640 bits) on interface usbmon1, id 0
USB URB
    [Source: host]
    [Destination: 1.5.0]
    URB id: 0xffff993eaefdba40
    URB type: URB_SUBMIT ('S')
    URB transfer type: URB_CONTROL (0x02)
    Endpoint: 0x00, Direction: OUT
    Device: 5
    URB bus id: 1
    Device setup request: relevant ('\0')
    Data: present ('\0')
    URB sec: 1702353719
    URB usec: 713648
    URB status: Operation now in progress (-EINPROGRESS) (-115)
    URB length [bytes]: 16
    Data length [bytes]: 16
    [Response in: 196]
    Interval: 0
    Start frame: 0
    Copy of Transfer Flags: 0x00000000
    Number of ISO descriptors: 0
    [bInterfaceClass: Unknown (0xffff)]
Setup Data
    bmRequestType: 0x40
    bRequest: 160
    wValue: 0x0414
    wIndex: 0 (0x0000)
    wLength: 16
    Data Fragment: f537d200740281a3907e01e0243ef8e6

No.     Time           Source                Destination           Protocol Length Info
    196 29.271876      1.5.0                 host                  USB      64     URB_CONTROL out

Frame 196: 64 bytes on wire (512 bits), 64 bytes captured (512 bits) on interface usbmon1, id 0
USB URB
    [Source: 1.5.0]
    [Destination: host]
    URB id: 0xffff993eaefdba40
    URB type: URB_COMPLETE ('C')
    URB transfer type: URB_CONTROL (0x02)
    Endpoint: 0x00, Direction: OUT
    Device: 5
    URB bus id: 1
    Device setup request: not relevant ('-')
    Data: not present ('>')
    URB sec: 1702353719
    URB usec: 714811
    URB status: Success (0)
    URB length [bytes]: 16
    Data length [bytes]: 0
    [Request in: 195]
    [Time from request: 0.001163000 seconds]
    Unused Setup Header
    Interval: 0
    Start frame: 0
    Copy of Transfer Flags: 0x00000000
    Number of ISO descriptors: 0
    [bInterfaceClass: Unknown (0xffff)]

No.     Time           Source                Destination           Protocol Length Info
    197 29.274996      host                  1.5.0                 USB      80     URB_CONTROL out

Frame 197: 80 bytes on wire (640 bits), 80 bytes captured (640 bits) on interface usbmon1, id 0
USB URB
    [Source: host]
    [Destination: 1.5.0]
    URB id: 0xffff993eaefdb680
    URB type: URB_SUBMIT ('S')
    URB transfer type: URB_CONTROL (0x02)
    Endpoint: 0x00, Direction: OUT
    Device: 5
    URB bus id: 1
    Device setup request: relevant ('\0')
    Data: present ('\0')
    URB sec: 1702353719
    URB usec: 717931
    URB status: Operation now in progress (-EINPROGRESS) (-115)
    URB length [bytes]: 16
    Data length [bytes]: 16
    [Response in: 198]
    Interval: 0
    Start frame: 0
    Copy of Transfer Flags: 0x00000000
    Number of ISO descriptors: 0
    [bInterfaceClass: Unknown (0xffff)]
Setup Data
    bmRequestType: 0x40
    bRequest: 160
    wValue: 0x0424
    wIndex: 0 (0x0000)
    wLength: 16
    Data Fragment: f07402807a907e00e054f04536f0a3e5

No.     Time           Source                Destination           Protocol Length Info
    198 29.276873      1.5.0                 host                  USB      64     URB_CONTROL out

Frame 198: 64 bytes on wire (512 bits), 64 bytes captured (512 bits) on interface usbmon1, id 0
USB URB
    [Source: 1.5.0]
    [Destination: host]
    URB id: 0xffff993eaefdb680
    URB type: URB_COMPLETE ('C')
    URB transfer type: URB_CONTROL (0x02)
    Endpoint: 0x00, Direction: OUT
    Device: 5
    URB bus id: 1
    Device setup request: not relevant ('-')
    Data: not present ('>')
    URB sec: 1702353719
    URB usec: 719808
    URB status: Success (0)
    URB length [bytes]: 16
    Data length [bytes]: 0
    [Request in: 197]
    [Time from request: 0.001877000 seconds]
    Unused Setup Header
    Interval: 0
    Start frame: 0
    Copy of Transfer Flags: 0x00000000
    Number of ISO descriptors: 0
    [bInterfaceClass: Unknown (0xffff)]

No.     Time           Source                Destination           Protocol Length Info
    199 29.279092      host                  1.5.0                 USB      80     URB_CONTROL out

Frame 199: 80 bytes on wire (640 bits), 80 bytes captured (640 bits) on interface usbmon1, id 0
USB URB
    [Source: host]
    [Destination: 1.5.0]
    URB id: 0xffff993eaefdbd40
    URB type: URB_SUBMIT ('S')
    URB transfer type: URB_CONTROL (0x02)
    Endpoint: 0x00, Direction: OUT
    Device: 5
    URB bus id: 1
    Device setup request: relevant ('\0')
    Data: present ('\0')
    URB sec: 1702353719
    URB usec: 722027
    URB status: Operation now in progress (-EINPROGRESS) (-115)
    URB length [bytes]: 16
    Data length [bytes]: 16
    [Response in: 200]
    Interval: 0
    Start frame: 0
    Copy of Transfer Flags: 0x00000000
    Number of ISO descriptors: 0
    [bInterfaceClass: Unknown (0xffff)]
Setup Data
    bmRequestType: 0x40
    bRequest: 160
    wValue: 0x0434
    wIndex: 0 (0x0000)
    wLength: 16
    Data Fragment: 3645376004e5378006e53560027401f0

No.     Time           Source                Destination           Protocol Length Info
    200 29.280869      1.5.0                 host                  USB      64     URB_CONTROL out

Frame 200: 64 bytes on wire (512 bits), 64 bytes captured (512 bits) on interface usbmon1, id 0
USB URB
    [Source: 1.5.0]
    [Destination: host]
    URB id: 0xffff993eaefdbd40
    URB type: URB_COMPLETE ('C')
    URB transfer type: URB_CONTROL (0x02)
    Endpoint: 0x00, Direction: OUT
    Device: 5
    URB bus id: 1
    Device setup request: not relevant ('-')
    Data: not present ('>')
    URB sec: 1702353719
    URB usec: 723804
    URB status: Success (0)
    URB length [bytes]: 16
    Data length [bytes]: 0
    [Request in: 199]
    [Time from request: 0.001777000 seconds]
    Unused Setup Header
    Interval: 0
    Start frame: 0
    Copy of Transfer Flags: 0x00000000
    Number of ISO descriptors: 0
    [bInterfaceClass: Unknown (0xffff)]

No.     Time           Source                Destination           Protocol Length Info
    201 29.283107      host                  1.5.0                 USB      80     URB_CONTROL out

Frame 201: 80 bytes on wire (640 bits), 80 bytes captured (640 bits) on interface usbmon1, id 0
USB URB
    [Source: host]
    [Destination: 1.5.0]
    URB id: 0xffff993eaefdbbc0
    URB type: URB_SUBMIT ('S')
    URB transfer type: URB_CONTROL (0x02)
    Endpoint: 0x00, Direction: OUT
    Device: 5
    URB bus id: 1
    Device setup request: relevant ('\0')
    Data: present ('\0')
    URB sec: 1702353719
    URB usec: 726042
    URB status: Operation now in progress (-EINPROGRESS) (-115)
    URB length [bytes]: 16
    Data length [bytes]: 16
    [Response in: 202]
    Interval: 0
    Start frame: 0
    Copy of Transfer Flags: 0x00000000
    Number of ISO descriptors: 0
    [bInterfaceClass: Unknown (0xffff)]
Setup Data
    bmRequestType: 0x40
    bRequest: 160
    wValue: 0x0444
    wIndex: 0 (0x0000)
    wLength: 16
    Data Fragment: 7402805bd2a920b00bc200753764e537

No.     Time           Source                Destination           Protocol Length Info
    202 29.284866      1.5.0                 host                  USB      64     URB_CONTROL out

Frame 202: 64 bytes on wire (512 bits), 64 bytes captured (512 bits) on interface usbmon1, id 0
USB URB
    [Source: 1.5.0]
    [Destination: host]
    URB id: 0xffff993eaefdbbc0
    URB type: URB_COMPLETE ('C')
    URB transfer type: URB_CONTROL (0x02)
    Endpoint: 0x00, Direction: OUT
    Device: 5
    URB bus id: 1
    Device setup request: not relevant ('-')
    Data: not present ('>')
    URB sec: 1702353719
    URB usec: 727801
    URB status: Success (0)
    URB length [bytes]: 16
    Data length [bytes]: 0
    [Request in: 201]
    [Time from request: 0.001759000 seconds]
    Unused Setup Header
    Interval: 0
    Start frame: 0
    Copy of Transfer Flags: 0x00000000
    Number of ISO descriptors: 0
    [bInterfaceClass: Unknown (0xffff)]

No.     Time           Source                Destination           Protocol Length Info
    203 29.289628      host                  1.5.0                 USB      80     URB_CONTROL out

Frame 203: 80 bytes on wire (640 bits), 80 bytes captured (640 bits) on interface usbmon1, id 0
USB URB
    [Source: host]
    [Destination: 1.5.0]
    URB id: 0xffff993eaefda6c0
    URB type: URB_SUBMIT ('S')
    URB transfer type: URB_CONTROL (0x02)
    Endpoint: 0x00, Direction: OUT
    Device: 5
    URB bus id: 1
    Device setup request: relevant ('\0')
    Data: present ('\0')
    URB sec: 1702353719
    URB usec: 732563
    URB status: Operation now in progress (-EINPROGRESS) (-115)
    URB length [bytes]: 16
    Data length [bytes]: 16
    [Response in: 204]
    Interval: 0
    Start frame: 0
    Copy of Transfer Flags: 0x00000000
    Number of ISO descriptors: 0
    [bInterfaceClass: Unknown (0xffff)]
Setup Data
    bmRequestType: 0x40
    bRequest: 160
    wValue: 0x0454
    wIndex: 0 (0x0000)
    wLength: 16
    Data Fragment: 60fc80f0d203d20075360fe536453760

No.     Time           Source                Destination           Protocol Length Info
    204 29.290877      1.5.0                 host                  USB      64     URB_CONTROL out

Frame 204: 64 bytes on wire (512 bits), 64 bytes captured (512 bits) on interface usbmon1, id 0
USB URB
    [Source: 1.5.0]
    [Destination: host]
    URB id: 0xffff993eaefda6c0
    URB type: URB_COMPLETE ('C')
    URB transfer type: URB_CONTROL (0x02)
    Endpoint: 0x00, Direction: OUT
    Device: 5
    URB bus id: 1
    Device setup request: not relevant ('-')
    Data: not present ('>')
    URB sec: 1702353719
    URB usec: 733812
    URB status: Success (0)
    URB length [bytes]: 16
    Data length [bytes]: 0
    [Request in: 203]
    [Time from request: 0.001249000 seconds]
    Unused Setup Header
    Interval: 0
    Start frame: 0
    Copy of Transfer Flags: 0x00000000
    Number of ISO descriptors: 0
    [bInterfaceClass: Unknown (0xffff)]

No.     Time           Source                Destination           Protocol Length Info
    205 29.293948      host                  1.5.0                 USB      80     URB_CONTROL out

Frame 205: 80 bytes on wire (640 bits), 80 bytes captured (640 bits) on interface usbmon1, id 0
USB URB
    [Source: host]
    [Destination: 1.5.0]
    URB id: 0xffff993eaefda3c0
    URB type: URB_SUBMIT ('S')
    URB transfer type: URB_CONTROL (0x02)
    Endpoint: 0x00, Direction: OUT
    Device: 5
    URB bus id: 1
    Device setup request: relevant ('\0')
    Data: present ('\0')
    URB sec: 1702353719
    URB usec: 736883
    URB status: Operation now in progress (-EINPROGRESS) (-115)
    URB length [bytes]: 16
    Data length [bytes]: 16
    [Response in: 206]
    Interval: 0
    Start frame: 0
    Copy of Transfer Flags: 0x00000000
    Number of ISO descriptors: 0
    [bInterfaceClass: Unknown (0xffff)]
Setup Data
    bmRequestType: 0x40
    bRequest: 160
    wValue: 0x0464
    wIndex: 0 (0x0000)
    wLength: 16
    Data Fragment: 1b20b0f7c2a9753600753700753e0075

No.     Time           Source                Destination           Protocol Length Info
    206 29.295879      1.5.0                 host                  USB      64     URB_CONTROL out

Frame 206: 64 bytes on wire (512 bits), 64 bytes captured (512 bits) on interface usbmon1, id 0
USB URB
    [Source: 1.5.0]
    [Destination: host]
    URB id: 0xffff993eaefda3c0
    URB type: URB_COMPLETE ('C')
    URB transfer type: URB_CONTROL (0x02)
    Endpoint: 0x00, Direction: OUT
    Device: 5
    URB bus id: 1
    Device setup request: not relevant ('-')
    Data: not present ('>')
    URB sec: 1702353719
    URB usec: 738814
    URB status: Success (0)
    URB length [bytes]: 16
    Data length [bytes]: 0
    [Request in: 205]
    [Time from request: 0.001931000 seconds]
    Unused Setup Header
    Interval: 0
    Start frame: 0
    Copy of Transfer Flags: 0x00000000
    Number of ISO descriptors: 0
    [bInterfaceClass: Unknown (0xffff)]

No.     Time           Source                Destination           Protocol Length Info
    207 29.298134      host                  1.5.0                 USB      80     URB_CONTROL out

Frame 207: 80 bytes on wire (640 bits), 80 bytes captured (640 bits) on interface usbmon1, id 0
USB URB
    [Source: host]
    [Destination: 1.5.0]
    URB id: 0xffff993eaefdb080
    URB type: URB_SUBMIT ('S')
    URB transfer type: URB_CONTROL (0x02)
    Endpoint: 0x00, Direction: OUT
    Device: 5
    URB bus id: 1
    Device setup request: relevant ('\0')
    Data: present ('\0')
    URB sec: 1702353719
    URB usec: 741069
    URB status: Operation now in progress (-EINPROGRESS) (-115)
    URB length [bytes]: 16
    Data length [bytes]: 16
    [Response in: 208]
    Interval: 0
    Start frame: 0
    Copy of Transfer Flags: 0x00000000
    Number of ISO descriptors: 0
    [bInterfaceClass: Unknown (0xffff)]
Setup Data
    bmRequestType: 0x40
    bRequest: 160
    wValue: 0x0474
    wIndex: 0 (0x0000)
    wLength: 16
    Data Fragment: 3f00754000754100c2038006907e0074

No.     Time           Source                Destination           Protocol Length Info
    208 29.299867      1.5.0                 host                  USB      64     URB_CONTROL out

Frame 208: 64 bytes on wire (512 bits), 64 bytes captured (512 bits) on interface usbmon1, id 0
USB URB
    [Source: 1.5.0]
    [Destination: host]
    URB id: 0xffff993eaefdb080
    URB type: URB_COMPLETE ('C')
    URB transfer type: URB_CONTROL (0x02)
    Endpoint: 0x00, Direction: OUT
    Device: 5
    URB bus id: 1
    Device setup request: not relevant ('-')
    Data: not present ('>')
    URB sec: 1702353719
    URB usec: 742802
    URB status: Success (0)
    URB length [bytes]: 16
    Data length [bytes]: 0
    [Request in: 207]
    [Time from request: 0.001733000 seconds]
    Unused Setup Header
    Interval: 0
    Start frame: 0
    Copy of Transfer Flags: 0x00000000
    Number of ISO descriptors: 0
    [bInterfaceClass: Unknown (0xffff)]

No.     Time           Source                Destination           Protocol Length Info
    209 29.302107      host                  1.5.0                 USB      80     URB_CONTROL out

Frame 209: 80 bytes on wire (640 bits), 80 bytes captured (640 bits) on interface usbmon1, id 0
USB URB
    [Source: host]
    [Destination: 1.5.0]
    URB id: 0xffff993eaefdad80
    URB type: URB_SUBMIT ('S')
    URB transfer type: URB_CONTROL (0x02)
    Endpoint: 0x00, Direction: OUT
    Device: 5
    URB bus id: 1
    Device setup request: relevant ('\0')
    Data: present ('\0')
    URB sec: 1702353719
    URB usec: 745042
    URB status: Operation now in progress (-EINPROGRESS) (-115)
    URB length [bytes]: 16
    Data length [bytes]: 16
    [Response in: 210]
    Interval: 0
    Start frame: 0
    Copy of Transfer Flags: 0x00000000
    Number of ISO descriptors: 0
    [bInterfaceClass: Unknown (0xffff)]
Setup Data
    bmRequestType: 0x40
    bRequest: 160
    wValue: 0x0484
    wIndex: 0 (0x0000)
    wLength: 16
    Data Fragment: 01f0740280197801907e007400f074a0

No.     Time           Source                Destination           Protocol Length Info
    210 29.303873      1.5.0                 host                  USB      64     URB_CONTROL out

Frame 210: 64 bytes on wire (512 bits), 64 bytes captured (512 bits) on interface usbmon1, id 0
USB URB
    [Source: 1.5.0]
    [Destination: host]
    URB id: 0xffff993eaefdad80
    URB type: URB_COMPLETE ('C')
    URB transfer type: URB_CONTROL (0x02)
    Endpoint: 0x00, Direction: OUT
    Device: 5
    URB bus id: 1
    Device setup request: not relevant ('-')
    Data: not present ('>')
    URB sec: 1702353719
    URB usec: 746808
    URB status: Success (0)
    URB length [bytes]: 16
    Data length [bytes]: 0
    [Request in: 209]
    [Time from request: 0.001766000 seconds]
    Unused Setup Header
    Interval: 0
    Start frame: 0
    Copy of Transfer Flags: 0x00000000
    Number of ISO descriptors: 0
    [bInterfaceClass: Unknown (0xffff)]

No.     Time           Source                Destination           Protocol Length Info
    211 29.306093      host                  1.5.0                 USB      80     URB_CONTROL out

Frame 211: 80 bytes on wire (640 bits), 80 bytes captured (640 bits) on interface usbmon1, id 0
USB URB
    [Source: host]
    [Destination: 1.5.0]
    URB id: 0xffff993eaefdb740
    URB type: URB_SUBMIT ('S')
    URB transfer type: URB_CONTROL (0x02)
    Endpoint: 0x00, Direction: OUT
    Device: 5
    URB bus id: 1
    Device setup request: relevant ('\0')
    Data: present ('\0')
    URB sec: 1702353719
    URB usec: 749028
    URB status: Operation now in progress (-EINPROGRESS) (-115)
    URB length [bytes]: 16
    Data length [bytes]: 16
    [Response in: 212]
    Interval: 0
    Start frame: 0
    Copy of Transfer Flags: 0x00000000
    Number of ISO descriptors: 0
    [bInterfaceClass: Unknown (0xffff)]
Setup Data
    bmRequestType: 0x40
    bRequest: 160
    wValue: 0x0494
    wIndex: 0 (0x0000)
    wLength: 16
    Data Fragment: 91c47810907e0074a191ff7410800060

No.     Time           Source                Destination           Protocol Length Info
    212 29.307873      1.5.0                 host                  USB      64     URB_CONTROL out

Frame 212: 64 bytes on wire (512 bits), 64 bytes captured (512 bits) on interface usbmon1, id 0
USB URB
    [Source: 1.5.0]
    [Destination: host]
    URB id: 0xffff993eaefdb740
    URB type: URB_COMPLETE ('C')
    URB transfer type: URB_CONTROL (0x02)
    Endpoint: 0x00, Direction: OUT
    Device: 5
    URB bus id: 1
    Device setup request: not relevant ('-')
    Data: not present ('>')
    URB sec: 1702353719
    URB usec: 750808
    URB status: Success (0)
    URB length [bytes]: 16
    Data length [bytes]: 0
    [Request in: 211]
    [Time from request: 0.001780000 seconds]
    Unused Setup Header
    Interval: 0
    Start frame: 0
    Copy of Transfer Flags: 0x00000000
    Number of ISO descriptors: 0
    [bInterfaceClass: Unknown (0xffff)]

No.     Time           Source                Destination           Protocol Length Info
    213 29.310079      host                  1.5.0                 USB      80     URB_CONTROL out

Frame 213: 80 bytes on wire (640 bits), 80 bytes captured (640 bits) on interface usbmon1, id 0
USB URB
    [Source: host]
    [Destination: 1.5.0]
    URB id: 0xffff993eaefdae40
    URB type: URB_SUBMIT ('S')
    URB transfer type: URB_CONTROL (0x02)
    Endpoint: 0x00, Direction: OUT
    Device: 5
    URB bus id: 1
    Device setup request: relevant ('\0')
    Data: present ('\0')
    URB sec: 1702353719
    URB usec: 753014
    URB status: Operation now in progress (-EINPROGRESS) (-115)
    URB length [bytes]: 16
    Data length [bytes]: 16
    [Response in: 214]
    Interval: 0
    Start frame: 0
    Copy of Transfer Flags: 0x00000000
    Number of ISO descriptors: 0
    [bInterfaceClass: Unknown (0xffff)]
Setup Data
    bmRequestType: 0x40
    bRequest: 160
    wValue: 0x04a4
    wIndex: 0 (0x0000)
    wLength: 16
    Data Fragment: 04907fb9f06145907dc00586907e0005

No.     Time           Source                Destination           Protocol Length Info
    214 29.311871      1.5.0                 host                  USB      64     URB_CONTROL out

Frame 214: 64 bytes on wire (512 bits), 64 bytes captured (512 bits) on interface usbmon1, id 0
USB URB
    [Source: 1.5.0]
    [Destination: host]
    URB id: 0xffff993eaefdae40
    URB type: URB_COMPLETE ('C')
    URB transfer type: URB_CONTROL (0x02)
    Endpoint: 0x00, Direction: OUT
    Device: 5
    URB bus id: 1
    Device setup request: not relevant ('-')
    Data: not present ('>')
    URB sec: 1702353719
    URB usec: 754806
    URB status: Success (0)
    URB length [bytes]: 16
    Data length [bytes]: 0
    [Request in: 213]
    [Time from request: 0.001792000 seconds]
    Unused Setup Header
    Interval: 0
    Start frame: 0
    Copy of Transfer Flags: 0x00000000
    Number of ISO descriptors: 0
    [bInterfaceClass: Unknown (0xffff)]

No.     Time           Source                Destination           Protocol Length Info
    215 29.314081      host                  1.5.0                 USB      72     URB_CONTROL out

Frame 215: 72 bytes on wire (576 bits), 72 bytes captured (576 bits) on interface usbmon1, id 0
USB URB
    [Source: host]
    [Destination: 1.5.0]
    URB id: 0xffff993eaefda240
    URB type: URB_SUBMIT ('S')
    URB transfer type: URB_CONTROL (0x02)
    Endpoint: 0x00, Direction: OUT
    Device: 5
    URB bus id: 1
    Device setup request: relevant ('\0')
    Data: present ('\0')
    URB sec: 1702353719
    URB usec: 757016
    URB status: Operation now in progress (-EINPROGRESS) (-115)
    URB length [bytes]: 8
    Data length [bytes]: 8
    [Response in: 216]
    Interval: 0
    Start frame: 0
    Copy of Transfer Flags: 0x00000000
    Number of ISO descriptors: 0
    [bInterfaceClass: Unknown (0xffff)]
Setup Data
    bmRequestType: 0x40
    bRequest: 160
    wValue: 0x04b4
    wIndex: 0 (0x0000)
    wLength: 8
    Data Fragment: 86753040e0a30586

No.     Time           Source                Destination           Protocol Length Info
    216 29.315868      1.5.0                 host                  USB      64     URB_CONTROL out

Frame 216: 64 bytes on wire (512 bits), 64 bytes captured (512 bits) on interface usbmon1, id 0
USB URB
    [Source: 1.5.0]
    [Destination: host]
    URB id: 0xffff993eaefda240
    URB type: URB_COMPLETE ('C')
    URB transfer type: URB_CONTROL (0x02)
    Endpoint: 0x00, Direction: OUT
    Device: 5
    URB bus id: 1
    Device setup request: not relevant ('-')
    Data: not present ('>')
    URB sec: 1702353719
    URB usec: 758803
    URB status: Success (0)
    URB length [bytes]: 8
    Data length [bytes]: 0
    [Request in: 215]
    [Time from request: 0.001787000 seconds]
    Unused Setup Header
    Interval: 0
    Start frame: 0
    Copy of Transfer Flags: 0x00000000
    Number of ISO descriptors: 0
    [bInterfaceClass: Unknown (0xffff)]

No.     Time           Source                Destination           Protocol Length Info
    217 29.318070      host                  1.5.0                 USB      80     URB_CONTROL out

Frame 217: 80 bytes on wire (640 bits), 80 bytes captured (640 bits) on interface usbmon1, id 0
USB URB
    [Source: host]
    [Destination: 1.5.0]
    URB id: 0xffff993eaefda240
    URB type: URB_SUBMIT ('S')
    URB transfer type: URB_CONTROL (0x02)
    Endpoint: 0x00, Direction: OUT
    Device: 5
    URB bus id: 1
    Device setup request: relevant ('\0')
    Data: present ('\0')
    URB sec: 1702353719
    URB usec: 761005
    URB status: Operation now in progress (-EINPROGRESS) (-115)
    URB length [bytes]: 16
    Data length [bytes]: 16
    [Response in: 218]
    Interval: 0
    Start frame: 0
    Copy of Transfer Flags: 0x00000000
    Number of ISO descriptors: 0
    [bInterfaceClass: Unknown (0xffff)]
Setup Data
    bmRequestType: 0x40
    bRequest: 160
    wValue: 0x04bc
    wIndex: 0 (0x0000)
    wLength: 16
    Data Fragment: f0a30586d530f522758601f9907fa5e0

No.     Time           Source                Destination           Protocol Length Info
    218 29.319876      1.5.0                 host                  USB      64     URB_CONTROL out

Frame 218: 64 bytes on wire (512 bits), 64 bytes captured (512 bits) on interface usbmon1, id 0
USB URB
    [Source: 1.5.0]
    [Destination: host]
    URB id: 0xffff993eaefda240
    URB type: URB_COMPLETE ('C')
    URB transfer type: URB_CONTROL (0x02)
    Endpoint: 0x00, Direction: OUT
    Device: 5
    URB bus id: 1
    Device setup request: not relevant ('-')
    Data: not present ('>')
    URB sec: 1702353719
    URB usec: 762811
    URB status: Success (0)
    URB length [bytes]: 16
    Data length [bytes]: 0
    [Request in: 217]
    [Time from request: 0.001806000 seconds]
    Unused Setup Header
    Interval: 0
    Start frame: 0
    Copy of Transfer Flags: 0x00000000
    Number of ISO descriptors: 0
    [bInterfaceClass: Unknown (0xffff)]

No.     Time           Source                Destination           Protocol Length Info
    219 29.322190      host                  1.5.0                 USB      80     URB_CONTROL out

Frame 219: 80 bytes on wire (640 bits), 80 bytes captured (640 bits) on interface usbmon1, id 0
USB URB
    [Source: host]
    [Destination: 1.5.0]
    URB id: 0xffff993eaefdae40
    URB type: URB_SUBMIT ('S')
    URB transfer type: URB_CONTROL (0x02)
    Endpoint: 0x00, Direction: OUT
    Device: 5
    URB bus id: 1
    Device setup request: relevant ('\0')
    Data: present ('\0')
    URB sec: 1702353719
    URB usec: 765125
    URB status: Operation now in progress (-EINPROGRESS) (-115)
    URB length [bytes]: 16
    Data length [bytes]: 16
    [Response in: 220]
    Interval: 0
    Start frame: 0
    Copy of Transfer Flags: 0x00000000
    Number of ISO descriptors: 0
    [bInterfaceClass: Unknown (0xffff)]
Setup Data
    bmRequestType: 0x40
    bRequest: 160
    wValue: 0x04cc
    wIndex: 0 (0x0000)
    wLength: 16
    Data Fragment: 4480f0a3e9c2e0f0907fa5e030e0fc30

No.     Time           Source                Destination           Protocol Length Info
    220 29.323887      1.5.0                 host                  USB      64     URB_CONTROL out

Frame 220: 64 bytes on wire (512 bits), 64 bytes captured (512 bits) on interface usbmon1, id 0
USB URB
    [Source: 1.5.0]
    [Destination: host]
    URB id: 0xffff993eaefdae40
    URB type: URB_COMPLETE ('C')
    URB transfer type: URB_CONTROL (0x02)
    Endpoint: 0x00, Direction: OUT
    Device: 5
    URB bus id: 1
    Device setup request: not relevant ('-')
    Data: not present ('>')
    URB sec: 1702353719
    URB usec: 766822
    URB status: Success (0)
    URB length [bytes]: 16
    Data length [bytes]: 0
    [Request in: 219]
    [Time from request: 0.001697000 seconds]
    Unused Setup Header
    Interval: 0
    Start frame: 0
    Copy of Transfer Flags: 0x00000000
    Number of ISO descriptors: 0
    [bInterfaceClass: Unknown (0xffff)]

No.     Time           Source                Destination           Protocol Length Info
    221 29.326097      host                  1.5.0                 USB      80     URB_CONTROL out

Frame 221: 80 bytes on wire (640 bits), 80 bytes captured (640 bits) on interface usbmon1, id 0
USB URB
    [Source: host]
    [Destination: 1.5.0]
    URB id: 0xffff993eaefdb740
    URB type: URB_SUBMIT ('S')
    URB transfer type: URB_CONTROL (0x02)
    Endpoint: 0x00, Direction: OUT
    Device: 5
    URB bus id: 1
    Device setup request: relevant ('\0')
    Data: present ('\0')
    URB sec: 1702353719
    URB usec: 769032
    URB status: Operation now in progress (-EINPROGRESS) (-115)
    URB length [bytes]: 16
    Data length [bytes]: 16
    [Response in: 222]
    Interval: 0
    Start frame: 0
    Copy of Transfer Flags: 0x00000000
    Number of ISO descriptors: 0
    [bInterfaceClass: Unknown (0xffff)]
Setup Data
    bmRequestType: 0x40
    bRequest: 160
    wValue: 0x04dc
    wIndex: 0 (0x0000)
    wLength: 16
    Data Fragment: e11220e20fe8600c758600e0a30586a3

No.     Time           Source                Destination           Protocol Length Info
    222 29.327872      1.5.0                 host                  USB      64     URB_CONTROL out

Frame 222: 64 bytes on wire (512 bits), 64 bytes captured (512 bits) on interface usbmon1, id 0
USB URB
    [Source: 1.5.0]
    [Destination: host]
    URB id: 0xffff993eaefdb740
    URB type: URB_COMPLETE ('C')
    URB transfer type: URB_CONTROL (0x02)
    Endpoint: 0x00, Direction: OUT
    Device: 5
    URB bus id: 1
    Device setup request: not relevant ('-')
    Data: not present ('>')
    URB sec: 1702353719
    URB usec: 770807
    URB status: Success (0)
    URB length [bytes]: 16
    Data length [bytes]: 0
    [Request in: 221]
    [Time from request: 0.001775000 seconds]
    Unused Setup Header
    Interval: 0
    Start frame: 0
    Copy of Transfer Flags: 0x00000000
    Number of ISO descriptors: 0
    [bInterfaceClass: Unknown (0xffff)]

No.     Time           Source                Destination           Protocol Length Info
    223 29.330072      host                  1.5.0                 USB      80     URB_CONTROL out

Frame 223: 80 bytes on wire (640 bits), 80 bytes captured (640 bits) on interface usbmon1, id 0
USB URB
    [Source: host]
    [Destination: 1.5.0]
    URB id: 0xffff993eaefdad80
    URB type: URB_SUBMIT ('S')
    URB transfer type: URB_CONTROL (0x02)
    Endpoint: 0x00, Direction: OUT
    Device: 5
    URB bus id: 1
    Device setup request: relevant ('\0')
    Data: present ('\0')
    URB sec: 1702353719
    URB usec: 773007
    URB status: Operation now in progress (-EINPROGRESS) (-115)
    URB length [bytes]: 16
    Data length [bytes]: 16
    [Response in: 224]
    Interval: 0
    Start frame: 0
    Copy of Transfer Flags: 0x00000000
    Number of ISO descriptors: 0
    [bInterfaceClass: Unknown (0xffff)]
Setup Data
    bmRequestType: 0x40
    bRequest: 160
    wValue: 0x04ec
    wIndex: 0 (0x0000)
    wLength: 16
    Data Fragment: f01880e4907fa5e04440f0e020e6fc75

No.     Time           Source                Destination           Protocol Length Info
    224 29.331874      1.5.0                 host                  USB      64     URB_CONTROL out

Frame 224: 64 bytes on wire (512 bits), 64 bytes captured (512 bits) on interface usbmon1, id 0
USB URB
    [Source: 1.5.0]
    [Destination: host]
    URB id: 0xffff993eaefdad80
    URB type: URB_COMPLETE ('C')
    URB transfer type: URB_CONTROL (0x02)
    Endpoint: 0x00, Direction: OUT
    Device: 5
    URB bus id: 1
    Device setup request: not relevant ('-')
    Data: not present ('>')
    URB sec: 1702353719
    URB usec: 774809
    URB status: Success (0)
    URB length [bytes]: 16
    Data length [bytes]: 0
    [Request in: 223]
    [Time from request: 0.001802000 seconds]
    Unused Setup Header
    Interval: 0
    Start frame: 0
    Copy of Transfer Flags: 0x00000000
    Number of ISO descriptors: 0
    [bInterfaceClass: Unknown (0xffff)]

No.     Time           Source                Destination           Protocol Length Info
    225 29.337531      host                  1.5.0                 USB      80     URB_CONTROL out

Frame 225: 80 bytes on wire (640 bits), 80 bytes captured (640 bits) on interface usbmon1, id 0
USB URB
    [Source: host]
    [Destination: 1.5.0]
    URB id: 0xffff993eaefdb080
    URB type: URB_SUBMIT ('S')
    URB transfer type: URB_CONTROL (0x02)
    Endpoint: 0x00, Direction: OUT
    Device: 5
    URB bus id: 1
    Device setup request: relevant ('\0')
    Data: present ('\0')
    URB sec: 1702353719
    URB usec: 780466
    URB status: Operation now in progress (-EINPROGRESS) (-115)
    URB length [bytes]: 16
    Data length [bytes]: 16
    [Response in: 226]
    Interval: 0
    Start frame: 0
    Copy of Transfer Flags: 0x00000000
    Number of ISO descriptors: 0
    [bInterfaceClass: Unknown (0xffff)]
Setup Data
    bmRequestType: 0x40
    bRequest: 160
    wValue: 0x04fc
    wIndex: 0 (0x0000)
    wLength: 16
    Data Fragment: 860022758601f9907fa5e0d2e7f0a3e9

No.     Time           Source                Destination           Protocol Length Info
    226 29.338874      1.5.0                 host                  USB      64     URB_CONTROL out

Frame 226: 64 bytes on wire (512 bits), 64 bytes captured (512 bits) on interface usbmon1, id 0
USB URB
    [Source: 1.5.0]
    [Destination: host]
    URB id: 0xffff993eaefdb080
    URB type: URB_COMPLETE ('C')
    URB transfer type: URB_CONTROL (0x02)
    Endpoint: 0x00, Direction: OUT
    Device: 5
    URB bus id: 1
    Device setup request: not relevant ('-')
    Data: not present ('>')
    URB sec: 1702353719
    URB usec: 781809
    URB status: Success (0)
    URB length [bytes]: 16
    Data length [bytes]: 0
    [Request in: 225]
    [Time from request: 0.001343000 seconds]
    Unused Setup Header
    Interval: 0
    Start frame: 0
    Copy of Transfer Flags: 0x00000000
    Number of ISO descriptors: 0
    [bInterfaceClass: Unknown (0xffff)]

No.     Time           Source                Destination           Protocol Length Info
    227 29.341779      host                  1.5.0                 USB      80     URB_CONTROL out

Frame 227: 80 bytes on wire (640 bits), 80 bytes captured (640 bits) on interface usbmon1, id 0
USB URB
    [Source: host]
    [Destination: 1.5.0]
    URB id: 0xffff993eaefda3c0
    URB type: URB_SUBMIT ('S')
    URB transfer type: URB_CONTROL (0x02)
    Endpoint: 0x00, Direction: OUT
    Device: 5
    URB bus id: 1
    Device setup request: relevant ('\0')
    Data: present ('\0')
    URB sec: 1702353719
    URB usec: 784714
    URB status: Operation now in progress (-EINPROGRESS) (-115)
    URB length [bytes]: 16
    Data length [bytes]: 16
    [Response in: 228]
    Interval: 0
    Start frame: 0
    Copy of Transfer Flags: 0x00000000
    Number of ISO descriptors: 0
    [bInterfaceClass: Unknown (0xffff)]
Setup Data
    bmRequestType: 0x40
    bRequest: 160
    wValue: 0x050c
    wIndex: 0 (0x0000)
    wLength: 16
    Data Fragment: d2e0f0907fa5e030e0fc30e12820e225

No.     Time           Source                Destination           Protocol Length Info
    228 29.342873      1.5.0                 host                  USB      64     URB_CONTROL out

Frame 228: 64 bytes on wire (512 bits), 64 bytes captured (512 bits) on interface usbmon1, id 0
USB URB
    [Source: 1.5.0]
    [Destination: host]
    URB id: 0xffff993eaefda3c0
    URB type: URB_COMPLETE ('C')
    URB transfer type: URB_CONTROL (0x02)
    Endpoint: 0x00, Direction: OUT
    Device: 5
    URB bus id: 1
    Device setup request: not relevant ('-')
    Data: not present ('>')
    URB sec: 1702353719
    URB usec: 785808
    URB status: Success (0)
    URB length [bytes]: 16
    Data length [bytes]: 0
    [Request in: 227]
    [Time from request: 0.001094000 seconds]
    Unused Setup Header
    Interval: 0
    Start frame: 0
    Copy of Transfer Flags: 0x00000000
    Number of ISO descriptors: 0
    [bInterfaceClass: Unknown (0xffff)]

No.     Time           Source                Destination           Protocol Length Info
    229 29.346101      host                  1.5.0                 USB      80     URB_CONTROL out

Frame 229: 80 bytes on wire (640 bits), 80 bytes captured (640 bits) on interface usbmon1, id 0
USB URB
    [Source: host]
    [Destination: 1.5.0]
    URB id: 0xffff993ecd78d380
    URB type: URB_SUBMIT ('S')
    URB transfer type: URB_CONTROL (0x02)
    Endpoint: 0x00, Direction: OUT
    Device: 5
    URB bus id: 1
    Device setup request: relevant ('\0')
    Data: present ('\0')
    URB sec: 1702353719
    URB usec: 789036
    URB status: Operation now in progress (-EINPROGRESS) (-115)
    URB length [bytes]: 16
    Data length [bytes]: 16
    [Response in: 230]
    Interval: 0
    Start frame: 0
    Copy of Transfer Flags: 0x00000000
    Number of ISO descriptors: 0
    [bInterfaceClass: Unknown (0xffff)]
Setup Data
    bmRequestType: 0x40
    bRequest: 160
    wValue: 0x051c
    wIndex: 0 (0x0000)
    wLength: 16
    Data Fragment: b80104e0d2e5f0a3e0907fa5e030e0fc

No.     Time           Source                Destination           Protocol Length Info
    230 29.347879      1.5.0                 host                  USB      64     URB_CONTROL out

Frame 230: 64 bytes on wire (512 bits), 64 bytes captured (512 bits) on interface usbmon1, id 0
USB URB
    [Source: 1.5.0]
    [Destination: host]
    URB id: 0xffff993ecd78d380
    URB type: URB_COMPLETE ('C')
    URB transfer type: URB_CONTROL (0x02)
    Endpoint: 0x00, Direction: OUT
    Device: 5
    URB bus id: 1
    Device setup request: not relevant ('-')
    Data: not present ('>')
    URB sec: 1702353719
    URB usec: 790814
    URB status: Success (0)
    URB length [bytes]: 16
    Data length [bytes]: 0
    [Request in: 229]
    [Time from request: 0.001778000 seconds]
    Unused Setup Header
    Interval: 0
    Start frame: 0
    Copy of Transfer Flags: 0x00000000
    Number of ISO descriptors: 0
    [bInterfaceClass: Unknown (0xffff)]

No.     Time           Source                Destination           Protocol Length Info
    231 29.350150      host                  1.5.0                 USB      80     URB_CONTROL out

Frame 231: 80 bytes on wire (640 bits), 80 bytes captured (640 bits) on interface usbmon1, id 0
USB URB
    [Source: host]
    [Destination: 1.5.0]
    URB id: 0xffff993ecd78ca80
    URB type: URB_SUBMIT ('S')
    URB transfer type: URB_CONTROL (0x02)
    Endpoint: 0x00, Direction: OUT
    Device: 5
    URB bus id: 1
    Device setup request: relevant ('\0')
    Data: present ('\0')
    URB sec: 1702353719
    URB usec: 793085
    URB status: Operation now in progress (-EINPROGRESS) (-115)
    URB length [bytes]: 16
    Data length [bytes]: 16
    [Response in: 232]
    Interval: 0
    Start frame: 0
    Copy of Transfer Flags: 0x00000000
    Number of ISO descriptors: 0
    [bInterfaceClass: Unknown (0xffff)]
Setup Data
    bmRequestType: 0x40
    bRequest: 160
    wValue: 0x052c
    wIndex: 0 (0x0000)
    wLength: 16
    Data Fragment: 20e212b80203d2e5f0a3e00586f0a305

No.     Time           Source                Destination           Protocol Length Info
    232 29.351889      1.5.0                 host                  USB      64     URB_CONTROL out

Frame 232: 64 bytes on wire (512 bits), 64 bytes captured (512 bits) on interface usbmon1, id 0
USB URB
    [Source: 1.5.0]
    [Destination: host]
    URB id: 0xffff993ecd78ca80
    URB type: URB_COMPLETE ('C')
    URB transfer type: URB_CONTROL (0x02)
    Endpoint: 0x00, Direction: OUT
    Device: 5
    URB bus id: 1
    Device setup request: not relevant ('-')
    Data: not present ('>')
    URB sec: 1702353719
    URB usec: 794824
    URB status: Success (0)
    URB length [bytes]: 16
    Data length [bytes]: 0
    [Request in: 231]
    [Time from request: 0.001739000 seconds]
    Unused Setup Header
    Interval: 0
    Start frame: 0
    Copy of Transfer Flags: 0x00000000
    Number of ISO descriptors: 0
    [bInterfaceClass: Unknown (0xffff)]

No.     Time           Source                Destination           Protocol Length Info
    233 29.354227      host                  1.5.0                 USB      80     URB_CONTROL out

Frame 233: 80 bytes on wire (640 bits), 80 bytes captured (640 bits) on interface usbmon1, id 0
USB URB
    [Source: host]
    [Destination: 1.5.0]
    URB id: 0xffff993ecd78c480
    URB type: URB_SUBMIT ('S')
    URB transfer type: URB_CONTROL (0x02)
    Endpoint: 0x00, Direction: OUT
    Device: 5
    URB bus id: 1
    Device setup request: relevant ('\0')
    Data: present ('\0')
    URB sec: 1702353719
    URB usec: 797162
    URB status: Operation now in progress (-EINPROGRESS) (-115)
    URB length [bytes]: 16
    Data length [bytes]: 16
    [Response in: 234]
    Interval: 0
    Start frame: 0
    Copy of Transfer Flags: 0x00000000
    Number of ISO descriptors: 0
    [bInterfaceClass: Unknown (0xffff)]
Setup Data
    bmRequestType: 0x40
    bRequest: 160
    wValue: 0x053c
    wIndex: 0 (0x0000)
    wLength: 16
    Data Fragment: 8618e870e4907fa5e0d2e6f0e020e6fc

No.     Time           Source                Destination           Protocol Length Info
    234 29.355891      1.5.0                 host                  USB      64     URB_CONTROL out

Frame 234: 64 bytes on wire (512 bits), 64 bytes captured (512 bits) on interface usbmon1, id 0
USB URB
    [Source: 1.5.0]
    [Destination: host]
    URB id: 0xffff993ecd78c480
    URB type: URB_COMPLETE ('C')
    URB transfer type: URB_CONTROL (0x02)
    Endpoint: 0x00, Direction: OUT
    Device: 5
    URB bus id: 1
    Device setup request: not relevant ('-')
    Data: not present ('>')
    URB sec: 1702353719
    URB usec: 798826
    URB status: Success (0)
    URB length [bytes]: 16
    Data length [bytes]: 0
    [Request in: 233]
    [Time from request: 0.001664000 seconds]
    Unused Setup Header
    Interval: 0
    Start frame: 0
    Copy of Transfer Flags: 0x00000000
    Number of ISO descriptors: 0
    [bInterfaceClass: Unknown (0xffff)]

No.     Time           Source                Destination           Protocol Length Info
    235 29.358493      host                  1.5.0                 USB      80     URB_CONTROL out

Frame 235: 80 bytes on wire (640 bits), 80 bytes captured (640 bits) on interface usbmon1, id 0
USB URB
    [Source: host]
    [Destination: 1.5.0]
    URB id: 0xffff993ecd78c240
    URB type: URB_SUBMIT ('S')
    URB transfer type: URB_CONTROL (0x02)
    Endpoint: 0x00, Direction: OUT
    Device: 5
    URB bus id: 1
    Device setup request: relevant ('\0')
    Data: present ('\0')
    URB sec: 1702353719
    URB usec: 801428
    URB status: Operation now in progress (-EINPROGRESS) (-115)
    URB length [bytes]: 16
    Data length [bytes]: 16
    [Response in: 236]
    Interval: 0
    Start frame: 0
    Copy of Transfer Flags: 0x00000000
    Number of ISO descriptors: 0
    [bInterfaceClass: Unknown (0xffff)]
Setup Data
    bmRequestType: 0x40
    bRequest: 160
    wValue: 0x054c
    wIndex: 0 (0x0000)
    wLength: 16
    Data Fragment: 758600220000220000000022b153b153

No.     Time           Source                Destination           Protocol Length Info
    236 29.359876      1.5.0                 host                  USB      64     URB_CONTROL out

Frame 236: 64 bytes on wire (512 bits), 64 bytes captured (512 bits) on interface usbmon1, id 0
USB URB
    [Source: 1.5.0]
    [Destination: host]
    URB id: 0xffff993ecd78c240
    URB type: URB_COMPLETE ('C')
    URB transfer type: URB_CONTROL (0x02)
    Endpoint: 0x00, Direction: OUT
    Device: 5
    URB bus id: 1
    Device setup request: not relevant ('-')
    Data: not present ('>')
    URB sec: 1702353719
    URB usec: 802811
    URB status: Success (0)
    URB length [bytes]: 16
    Data length [bytes]: 0
    [Request in: 235]
    [Time from request: 0.001383000 seconds]
    Unused Setup Header
    Interval: 0
    Start frame: 0
    Copy of Transfer Flags: 0x00000000
    Number of ISO descriptors: 0
    [bInterfaceClass: Unknown (0xffff)]

No.     Time           Source                Destination           Protocol Length Info
    237 29.362772      host                  1.5.0                 USB      80     URB_CONTROL out

Frame 237: 80 bytes on wire (640 bits), 80 bytes captured (640 bits) on interface usbmon1, id 0
USB URB
    [Source: host]
    [Destination: 1.5.0]
    URB id: 0xffff993ecd78c0c0
    URB type: URB_SUBMIT ('S')
    URB transfer type: URB_CONTROL (0x02)
    Endpoint: 0x00, Direction: OUT
    Device: 5
    URB bus id: 1
    Device setup request: relevant ('\0')
    Data: present ('\0')
    URB sec: 1702353719
    URB usec: 805707
    URB status: Operation now in progress (-EINPROGRESS) (-115)
    URB length [bytes]: 16
    Data length [bytes]: 16
    [Response in: 238]
    Interval: 0
    Start frame: 0
    Copy of Transfer Flags: 0x00000000
    Number of ISO descriptors: 0
    [bInterfaceClass: Unknown (0xffff)]
Setup Data
    bmRequestType: 0x40
    bRequest: 160
    wValue: 0x055c
    wIndex: 0 (0x0000)
    wLength: 16
    Data Fragment: b153b153b153b153b153b153b153b153

No.     Time           Source                Destination           Protocol Length Info
    238 29.363882      1.5.0                 host                  USB      64     URB_CONTROL out

Frame 238: 64 bytes on wire (512 bits), 64 bytes captured (512 bits) on interface usbmon1, id 0
USB URB
    [Source: 1.5.0]
    [Destination: host]
    URB id: 0xffff993ecd78c0c0
    URB type: URB_COMPLETE ('C')
    URB transfer type: URB_CONTROL (0x02)
    Endpoint: 0x00, Direction: OUT
    Device: 5
    URB bus id: 1
    Device setup request: not relevant ('-')
    Data: not present ('>')
    URB sec: 1702353719
    URB usec: 806817
    URB status: Success (0)
    URB length [bytes]: 16
    Data length [bytes]: 0
    [Request in: 237]
    [Time from request: 0.001110000 seconds]
    Unused Setup Header
    Interval: 0
    Start frame: 0
    Copy of Transfer Flags: 0x00000000
    Number of ISO descriptors: 0
    [bInterfaceClass: Unknown (0xffff)]

No.     Time           Source                Destination           Protocol Length Info
    239 29.367076      host                  1.5.0                 USB      80     URB_CONTROL out

Frame 239: 80 bytes on wire (640 bits), 80 bytes captured (640 bits) on interface usbmon1, id 0
USB URB
    [Source: host]
    [Destination: 1.5.0]
    URB id: 0xffff993ecd78ce40
    URB type: URB_SUBMIT ('S')
    URB transfer type: URB_CONTROL (0x02)
    Endpoint: 0x00, Direction: OUT
    Device: 5
    URB bus id: 1
    Device setup request: relevant ('\0')
    Data: present ('\0')
    URB sec: 1702353719
    URB usec: 810011
    URB status: Operation now in progress (-EINPROGRESS) (-115)
    URB length [bytes]: 16
    Data length [bytes]: 16
    [Response in: 240]
    Interval: 0
    Start frame: 0
    Copy of Transfer Flags: 0x00000000
    Number of ISO descriptors: 0
    [bInterfaceClass: Unknown (0xffff)]
Setup Data
    bmRequestType: 0x40
    bRequest: 160
    wValue: 0x056c
    wIndex: 0 (0x0000)
    wLength: 16
    Data Fragment: 22f530b175d530fb2290fb50a3e58245

No.     Time           Source                Destination           Protocol Length Info
    240 29.368875      1.5.0                 host                  USB      64     URB_CONTROL out

Frame 240: 64 bytes on wire (512 bits), 64 bytes captured (512 bits) on interface usbmon1, id 0
USB URB
    [Source: 1.5.0]
    [Destination: host]
    URB id: 0xffff993ecd78ce40
    URB type: URB_COMPLETE ('C')
    URB transfer type: URB_CONTROL (0x02)
    Endpoint: 0x00, Direction: OUT
    Device: 5
    URB bus id: 1
    Device setup request: not relevant ('-')
    Data: not present ('>')
    URB sec: 1702353719
    URB usec: 811810
    URB status: Success (0)
    URB length [bytes]: 16
    Data length [bytes]: 0
    [Request in: 239]
    [Time from request: 0.001799000 seconds]
    Unused Setup Header
    Interval: 0
    Start frame: 0
    Copy of Transfer Flags: 0x00000000
    Number of ISO descriptors: 0
    [bInterfaceClass: Unknown (0xffff)]

No.     Time           Source                Destination           Protocol Length Info
    241 29.371093      host                  1.5.0                 USB      80     URB_CONTROL out

Frame 241: 80 bytes on wire (640 bits), 80 bytes captured (640 bits) on interface usbmon1, id 0
USB URB
    [Source: host]
    [Destination: 1.5.0]
    URB id: 0xffff993ecd78d740
    URB type: URB_SUBMIT ('S')
    URB transfer type: URB_CONTROL (0x02)
    Endpoint: 0x00, Direction: OUT
    Device: 5
    URB bus id: 1
    Device setup request: relevant ('\0')
    Data: present ('\0')
    URB sec: 1702353719
    URB usec: 814028
    URB status: Operation now in progress (-EINPROGRESS) (-115)
    URB length [bytes]: 16
    Data length [bytes]: 16
    [Response in: 242]
    Interval: 0
    Start frame: 0
    Copy of Transfer Flags: 0x00000000
    Number of ISO descriptors: 0
    [bInterfaceClass: Unknown (0xffff)]
Setup Data
    bmRequestType: 0x40
    bRequest: 160
    wValue: 0x057c
    wIndex: 0 (0x0000)
    wLength: 16
    Data Fragment: 8370f92205060a09c0d0c0e0c082c083

No.     Time           Source                Destination           Protocol Length Info
    242 29.372872      1.5.0                 host                  USB      64     URB_CONTROL out

Frame 242: 64 bytes on wire (512 bits), 64 bytes captured (512 bits) on interface usbmon1, id 0
USB URB
    [Source: 1.5.0]
    [Destination: host]
    URB id: 0xffff993ecd78d740
    URB type: URB_COMPLETE ('C')
    URB transfer type: URB_CONTROL (0x02)
    Endpoint: 0x00, Direction: OUT
    Device: 5
    URB bus id: 1
    Device setup request: not relevant ('-')
    Data: not present ('>')
    URB sec: 1702353719
    URB usec: 815807
    URB status: Success (0)
    URB length [bytes]: 16
    Data length [bytes]: 0
    [Request in: 241]
    [Time from request: 0.001779000 seconds]
    Unused Setup Header
    Interval: 0
    Start frame: 0
    Copy of Transfer Flags: 0x00000000
    Number of ISO descriptors: 0
    [bInterfaceClass: Unknown (0xffff)]

No.     Time           Source                Destination           Protocol Length Info
    243 29.375418      host                  1.5.0                 USB      80     URB_CONTROL out

Frame 243: 80 bytes on wire (640 bits), 80 bytes captured (640 bits) on interface usbmon1, id 0
USB URB
    [Source: host]
    [Destination: 1.5.0]
    URB id: 0xffff993ecd78dbc0
    URB type: URB_SUBMIT ('S')
    URB transfer type: URB_CONTROL (0x02)
    Endpoint: 0x00, Direction: OUT
    Device: 5
    URB bus id: 1
    Device setup request: relevant ('\0')
    Data: present ('\0')
    URB sec: 1702353719
    URB usec: 818353
    URB status: Operation now in progress (-EINPROGRESS) (-115)
    URB length [bytes]: 16
    Data length [bytes]: 16
    [Response in: 244]
    Interval: 0
    Start frame: 0
    Copy of Transfer Flags: 0x00000000
    Number of ISO descriptors: 0
    [bInterfaceClass: Unknown (0xffff)]
Setup Data
    bmRequestType: 0x40
    bRequest: 160
    wValue: 0x058c
    wIndex: 0 (0x0000)
    wLength: 16
    Data Fragment: 758cd1758a37d5311ee532f531e53645

No.     Time           Source                Destination           Protocol Length Info
    244 29.376883      1.5.0                 host                  USB      64     URB_CONTROL out

Frame 244: 64 bytes on wire (512 bits), 64 bytes captured (512 bits) on interface usbmon1, id 0
USB URB
    [Source: 1.5.0]
    [Destination: host]
    URB id: 0xffff993ecd78dbc0
    URB type: URB_COMPLETE ('C')
    URB transfer type: URB_CONTROL (0x02)
    Endpoint: 0x00, Direction: OUT
    Device: 5
    URB bus id: 1
    Device setup request: not relevant ('-')
    Data: not present ('>')
    URB sec: 1702353719
    URB usec: 819818
    URB status: Success (0)
    URB length [bytes]: 16
    Data length [bytes]: 0
    [Request in: 243]
    [Time from request: 0.001465000 seconds]
    Unused Setup Header
    Interval: 0
    Start frame: 0
    Copy of Transfer Flags: 0x00000000
    Number of ISO descriptors: 0
    [bInterfaceClass: Unknown (0xffff)]

No.     Time           Source                Destination           Protocol Length Info
    245 29.383343      host                  1.5.0                 USB      80     URB_CONTROL out

Frame 245: 80 bytes on wire (640 bits), 80 bytes captured (640 bits) on interface usbmon1, id 0
USB URB
    [Source: host]
    [Destination: 1.5.0]
    URB id: 0xffff993ecd78dc80
    URB type: URB_SUBMIT ('S')
    URB transfer type: URB_CONTROL (0x02)
    Endpoint: 0x00, Direction: OUT
    Device: 5
    URB bus id: 1
    Device setup request: relevant ('\0')
    Data: present ('\0')
    URB sec: 1702353719
    URB usec: 826278
    URB status: Operation now in progress (-EINPROGRESS) (-115)
    URB length [bytes]: 16
    Data length [bytes]: 16
    [Response in: 246]
    Interval: 0
    Start frame: 0
    Copy of Transfer Flags: 0x00000000
    Number of ISO descriptors: 0
    [bInterfaceClass: Unknown (0xffff)]
Setup Data
    bmRequestType: 0x40
    bRequest: 160
    wValue: 0x059c
    wIndex: 0 (0x0000)
    wLength: 16
    Data Fragment: 3745356075e535700675340575350ae5

No.     Time           Source                Destination           Protocol Length Info
    246 29.384890      1.5.0                 host                  USB      64     URB_CONTROL out

Frame 246: 64 bytes on wire (512 bits), 64 bytes captured (512 bits) on interface usbmon1, id 0
USB URB
    [Source: 1.5.0]
    [Destination: host]
    URB id: 0xffff993ecd78dc80
    URB type: URB_COMPLETE ('C')
    URB transfer type: URB_CONTROL (0x02)
    Endpoint: 0x00, Direction: OUT
    Device: 5
    URB bus id: 1
    Device setup request: not relevant ('-')
    Data: not present ('>')
    URB sec: 1702353719
    URB usec: 827825
    URB status: Success (0)
    URB length [bytes]: 16
    Data length [bytes]: 0
    [Request in: 245]
    [Time from request: 0.001547000 seconds]
    Unused Setup Header
    Interval: 0
    Start frame: 0
    Copy of Transfer Flags: 0x00000000
    Number of ISO descriptors: 0
    [bInterfaceClass: Unknown (0xffff)]

No.     Time           Source                Destination           Protocol Length Info
    247 29.387759      host                  1.5.0                 USB      80     URB_CONTROL out

Frame 247: 80 bytes on wire (640 bits), 80 bytes captured (640 bits) on interface usbmon1, id 0
USB URB
    [Source: host]
    [Destination: 1.5.0]
    URB id: 0xffff993ecd78d5c0
    URB type: URB_SUBMIT ('S')
    URB transfer type: URB_CONTROL (0x02)
    Endpoint: 0x00, Direction: OUT
    Device: 5
    URB bus id: 1
    Device setup request: relevant ('\0')
    Data: present ('\0')
    URB sec: 1702353719
    URB usec: 830694
    URB status: Operation now in progress (-EINPROGRESS) (-115)
    URB length [bytes]: 16
    Data length [bytes]: 16
    [Response in: 248]
    Interval: 0
    Start frame: 0
    Copy of Transfer Flags: 0x00000000
    Number of ISO descriptors: 0
    [bInterfaceClass: Unknown (0xffff)]
Setup Data
    bmRequestType: 0x40
    bRequest: 160
    wValue: 0x05ac
    wIndex: 0 (0x0000)
    wLength: 16
    Data Fragment: 346006c2801534806130030520b01180

No.     Time           Source                Destination           Protocol Length Info
    248 29.388875      1.5.0                 host                  USB      64     URB_CONTROL out

Frame 248: 64 bytes on wire (512 bits), 64 bytes captured (512 bits) on interface usbmon1, id 0
USB URB
    [Source: 1.5.0]
    [Destination: host]
    URB id: 0xffff993ecd78d5c0
    URB type: URB_COMPLETE ('C')
    URB transfer type: URB_CONTROL (0x02)
    Endpoint: 0x00, Direction: OUT
    Device: 5
    URB bus id: 1
    Device setup request: not relevant ('-')
    Data: not present ('>')
    URB sec: 1702353719
    URB usec: 831810
    URB status: Success (0)
    URB length [bytes]: 16
    Data length [bytes]: 0
    [Request in: 247]
    [Time from request: 0.001116000 seconds]
    Unused Setup Header
    Interval: 0
    Start frame: 0
    Copy of Transfer Flags: 0x00000000
    Number of ISO descriptors: 0
    [bInterfaceClass: Unknown (0xffff)]

No.     Time           Source                Destination           Protocol Length Info
    249 29.391991      host                  1.5.0                 USB      80     URB_CONTROL out

Frame 249: 80 bytes on wire (640 bits), 80 bytes captured (640 bits) on interface usbmon1, id 0
USB URB
    [Source: host]
    [Destination: 1.5.0]
    URB id: 0xffff993ecd78d5c0
    URB type: URB_SUBMIT ('S')
    URB transfer type: URB_CONTROL (0x02)
    Endpoint: 0x00, Direction: OUT
    Device: 5
    URB bus id: 1
    Device setup request: relevant ('\0')
    Data: present ('\0')
    URB sec: 1702353719
    URB usec: 834926
    URB status: Operation now in progress (-EINPROGRESS) (-115)
    URB length [bytes]: 16
    Data length [bytes]: 16
    [Response in: 250]
    Interval: 0
    Start frame: 0
    Copy of Transfer Flags: 0x00000000
    Number of ISO descriptors: 0
    [bInterfaceClass: Unknown (0xffff)]
Setup Data
    bmRequestType: 0x40
    bRequest: 160
    wValue: 0x05bc
    wIndex: 0 (0x0000)
    wLength: 16
    Data Fragment: 5930010c30000920b006753600753700

No.     Time           Source                Destination           Protocol Length Info
    250 29.393873      1.5.0                 host                  USB      64     URB_CONTROL out

Frame 250: 64 bytes on wire (512 bits), 64 bytes captured (512 bits) on interface usbmon1, id 0
USB URB
    [Source: 1.5.0]
    [Destination: host]
    URB id: 0xffff993ecd78d5c0
    URB type: URB_COMPLETE ('C')
    URB transfer type: URB_CONTROL (0x02)
    Endpoint: 0x00, Direction: OUT
    Device: 5
    URB bus id: 1
    Device setup request: not relevant ('-')
    Data: not present ('>')
    URB sec: 1702353719
    URB usec: 836808
    URB status: Success (0)
    URB length [bytes]: 16
    Data length [bytes]: 0
    [Request in: 249]
    [Time from request: 0.001882000 seconds]
    Unused Setup Header
    Interval: 0
    Start frame: 0
    Copy of Transfer Flags: 0x00000000
    Number of ISO descriptors: 0
    [bInterfaceClass: Unknown (0xffff)]

No.     Time           Source                Destination           Protocol Length Info
    251 29.396122      host                  1.5.0                 USB      79     URB_CONTROL out

Frame 251: 79 bytes on wire (632 bits), 79 bytes captured (632 bits) on interface usbmon1, id 0
USB URB
    [Source: host]
    [Destination: 1.5.0]
    URB id: 0xffff993ecd78dc80
    URB type: URB_SUBMIT ('S')
    URB transfer type: URB_CONTROL (0x02)
    Endpoint: 0x00, Direction: OUT
    Device: 5
    URB bus id: 1
    Device setup request: relevant ('\0')
    Data: present ('\0')
    URB sec: 1702353719
    URB usec: 839057
    URB status: Operation now in progress (-EINPROGRESS) (-115)
    URB length [bytes]: 15
    Data length [bytes]: 15
    [Response in: 252]
    Interval: 0
    Start frame: 0
    Copy of Transfer Flags: 0x00000000
    Number of ISO descriptors: 0
    [bInterfaceClass: Unknown (0xffff)]
Setup Data
    bmRequestType: 0x40
    bRequest: 160
    wValue: 0x05cc
    wIndex: 0 (0x0000)
    wLength: 15
    Data Fragment: e5364537603a1537e537f470021536

No.     Time           Source                Destination           Protocol Length Info
    252 29.397874      1.5.0                 host                  USB      64     URB_CONTROL out

Frame 252: 64 bytes on wire (512 bits), 64 bytes captured (512 bits) on interface usbmon1, id 0
USB URB
    [Source: 1.5.0]
    [Destination: host]
    URB id: 0xffff993ecd78dc80
    URB type: URB_COMPLETE ('C')
    URB transfer type: URB_CONTROL (0x02)
    Endpoint: 0x00, Direction: OUT
    Device: 5
    URB bus id: 1
    Device setup request: not relevant ('-')
    Data: not present ('>')
    URB sec: 1702353719
    URB usec: 840809
    URB status: Success (0)
    URB length [bytes]: 15
    Data length [bytes]: 0
    [Request in: 251]
    [Time from request: 0.001752000 seconds]
    Unused Setup Header
    Interval: 0
    Start frame: 0
    Copy of Transfer Flags: 0x00000000
    Number of ISO descriptors: 0
    [bInterfaceClass: Unknown (0xffff)]

No.     Time           Source                Destination           Protocol Length Info
    253 29.400104      host                  1.5.0                 USB      80     URB_CONTROL out

Frame 253: 80 bytes on wire (640 bits), 80 bytes captured (640 bits) on interface usbmon1, id 0
USB URB
    [Source: host]
    [Destination: 1.5.0]
    URB id: 0xffff993ecd78dbc0
    URB type: URB_SUBMIT ('S')
    URB transfer type: URB_CONTROL (0x02)
    Endpoint: 0x00, Direction: OUT
    Device: 5
    URB bus id: 1
    Device setup request: relevant ('\0')
    Data: present ('\0')
    URB sec: 1702353719
    URB usec: 843039
    URB status: Operation now in progress (-EINPROGRESS) (-115)
    URB length [bytes]: 16
    Data length [bytes]: 16
    [Response in: 254]
    Interval: 0
    Start frame: 0
    Copy of Transfer Flags: 0x00000000
    Number of ISO descriptors: 0
    [bInterfaceClass: Unknown (0xffff)]
Setup Data
    bmRequestType: 0x40
    bRequest: 160
    wValue: 0x05db
    wIndex: 0 (0x0000)
    wLength: 16
    Data Fragment: 20000c0533053ee53e700f053f800b15

No.     Time           Source                Destination           Protocol Length Info
    254 29.401875      1.5.0                 host                  USB      64     URB_CONTROL out

Frame 254: 64 bytes on wire (512 bits), 64 bytes captured (512 bits) on interface usbmon1, id 0
USB URB
    [Source: 1.5.0]
    [Destination: host]
    URB id: 0xffff993ecd78dbc0
    URB type: URB_COMPLETE ('C')
    URB transfer type: URB_CONTROL (0x02)
    Endpoint: 0x00, Direction: OUT
    Device: 5
    URB bus id: 1
    Device setup request: not relevant ('-')
    Data: not present ('>')
    URB sec: 1702353719
    URB usec: 844810
    URB status: Success (0)
    URB length [bytes]: 16
    Data length [bytes]: 0
    [Request in: 253]
    [Time from request: 0.001771000 seconds]
    Unused Setup Header
    Interval: 0
    Start frame: 0
    Copy of Transfer Flags: 0x00000000
    Number of ISO descriptors: 0
    [bInterfaceClass: Unknown (0xffff)]

No.     Time           Source                Destination           Protocol Length Info
    255 29.404059      host                  1.5.0                 USB      80     URB_CONTROL out

Frame 255: 80 bytes on wire (640 bits), 80 bytes captured (640 bits) on interface usbmon1, id 0
USB URB
    [Source: host]
    [Destination: 1.5.0]
    URB id: 0xffff993ecd78d740
    URB type: URB_SUBMIT ('S')
    URB transfer type: URB_CONTROL (0x02)
    Endpoint: 0x00, Direction: OUT
    Device: 5
    URB bus id: 1
    Device setup request: relevant ('\0')
    Data: present ('\0')
    URB sec: 1702353719
    URB usec: 846994
    URB status: Operation now in progress (-EINPROGRESS) (-115)
    URB length [bytes]: 16
    Data length [bytes]: 16
    [Response in: 256]
    Interval: 0
    Start frame: 0
    Copy of Transfer Flags: 0x00000000
    Number of ISO descriptors: 0
    [bInterfaceClass: Unknown (0xffff)]
Setup Data
    bmRequestType: 0x40
    bRequest: 160
    wValue: 0x05eb
    wIndex: 0 (0x0000)
    wLength: 16
    Data Fragment: 33153ee53ef47002153fe53354039005

No.     Time           Source                Destination           Protocol Length Info
    256 29.405878      1.5.0                 host                  USB      64     URB_CONTROL out

Frame 256: 64 bytes on wire (512 bits), 64 bytes captured (512 bits) on interface usbmon1, id 0
USB URB
    [Source: 1.5.0]
    [Destination: host]
    URB id: 0xffff993ecd78d740
    URB type: URB_COMPLETE ('C')
    URB transfer type: URB_CONTROL (0x02)
    Endpoint: 0x00, Direction: OUT
    Device: 5
    URB bus id: 1
    Device setup request: not relevant ('-')
    Data: not present ('>')
    URB sec: 1702353719
    URB usec: 848813
    URB status: Success (0)
    URB length [bytes]: 16
    Data length [bytes]: 0
    [Request in: 255]
    [Time from request: 0.001819000 seconds]
    Unused Setup Header
    Interval: 0
    Start frame: 0
    Copy of Transfer Flags: 0x00000000
    Number of ISO descriptors: 0
    [bInterfaceClass: Unknown (0xffff)]

No.     Time           Source                Destination           Protocol Length Info
    257 29.408113      host                  1.5.0                 USB      80     URB_CONTROL out

Frame 257: 80 bytes on wire (640 bits), 80 bytes captured (640 bits) on interface usbmon1, id 0
USB URB
    [Source: host]
    [Destination: 1.5.0]
    URB id: 0xffff993ecd78ce40
    URB type: URB_SUBMIT ('S')
    URB transfer type: URB_CONTROL (0x02)
    Endpoint: 0x00, Direction: OUT
    Device: 5
    URB bus id: 1
    Device setup request: relevant ('\0')
    Data: present ('\0')
    URB sec: 1702353719
    URB usec: 851048
    URB status: Operation now in progress (-EINPROGRESS) (-115)
    URB length [bytes]: 16
    Data length [bytes]: 16
    [Response in: 258]
    Interval: 0
    Start frame: 0
    Copy of Transfer Flags: 0x00000000
    Number of ISO descriptors: 0
    [bInterfaceClass: Unknown (0xffff)]
Setup Data
    bmRequestType: 0x40
    bRequest: 160
    wValue: 0x05fb
    wIndex: 0 (0x0000)
    wLength: 16
    Data Fragment: 8093540fc4f530e580540f4530f58080

No.     Time           Source                Destination           Protocol Length Info
    258 29.409878      1.5.0                 host                  USB      64     URB_CONTROL out

Frame 258: 64 bytes on wire (512 bits), 64 bytes captured (512 bits) on interface usbmon1, id 0
USB URB
    [Source: 1.5.0]
    [Destination: host]
    URB id: 0xffff993ecd78ce40
    URB type: URB_COMPLETE ('C')
    URB transfer type: URB_CONTROL (0x02)
    Endpoint: 0x00, Direction: OUT
    Device: 5
    URB bus id: 1
    Device setup request: not relevant ('-')
    Data: not present ('>')
    URB sec: 1702353719
    URB usec: 852813
    URB status: Success (0)
    URB length [bytes]: 16
    Data length [bytes]: 0
    [Request in: 257]
    [Time from request: 0.001765000 seconds]
    Unused Setup Header
    Interval: 0
    Start frame: 0
    Copy of Transfer Flags: 0x00000000
    Number of ISO descriptors: 0
    [bInterfaceClass: Unknown (0xffff)]

No.     Time           Source                Destination           Protocol Length Info
    259 29.412162      host                  1.5.0                 USB      80     URB_CONTROL out

Frame 259: 80 bytes on wire (640 bits), 80 bytes captured (640 bits) on interface usbmon1, id 0
USB URB
    [Source: host]
    [Destination: 1.5.0]
    URB id: 0xffff993ecd78c0c0
    URB type: URB_SUBMIT ('S')
    URB transfer type: URB_CONTROL (0x02)
    Endpoint: 0x00, Direction: OUT
    Device: 5
    URB bus id: 1
    Device setup request: relevant ('\0')
    Data: present ('\0')
    URB sec: 1702353719
    URB usec: 855097
    URB status: Operation now in progress (-EINPROGRESS) (-115)
    URB length [bytes]: 16
    Data length [bytes]: 16
    [Response in: 260]
    Interval: 0
    Start frame: 0
    Copy of Transfer Flags: 0x00000000
    Number of ISO descriptors: 0
    [bInterfaceClass: Unknown (0xffff)]
Setup Data
    bmRequestType: 0x40
    bRequest: 160
    wValue: 0x060b
    wIndex: 0 (0x0000)
    wLength: 16
    Data Fragment: 0a1535e5357004d2808000d083d082d0

No.     Time           Source                Destination           Protocol Length Info
    260 29.413876      1.5.0                 host                  USB      64     URB_CONTROL out

Frame 260: 64 bytes on wire (512 bits), 64 bytes captured (512 bits) on interface usbmon1, id 0
USB URB
    [Source: 1.5.0]
    [Destination: host]
    URB id: 0xffff993ecd78c0c0
    URB type: URB_COMPLETE ('C')
    URB transfer type: URB_CONTROL (0x02)
    Endpoint: 0x00, Direction: OUT
    Device: 5
    URB bus id: 1
    Device setup request: not relevant ('-')
    Data: not present ('>')
    URB sec: 1702353719
    URB usec: 856811
    URB status: Success (0)
    URB length [bytes]: 16
    Data length [bytes]: 0
    [Request in: 259]
    [Time from request: 0.001714000 seconds]
    Unused Setup Header
    Interval: 0
    Start frame: 0
    Copy of Transfer Flags: 0x00000000
    Number of ISO descriptors: 0
    [bInterfaceClass: Unknown (0xffff)]

No.     Time           Source                Destination           Protocol Length Info
    261 29.416528      host                  1.5.0                 USB      80     URB_CONTROL out

Frame 261: 80 bytes on wire (640 bits), 80 bytes captured (640 bits) on interface usbmon1, id 0
USB URB
    [Source: host]
    [Destination: 1.5.0]
    URB id: 0xffff993ecd78c240
    URB type: URB_SUBMIT ('S')
    URB transfer type: URB_CONTROL (0x02)
    Endpoint: 0x00, Direction: OUT
    Device: 5
    URB bus id: 1
    Device setup request: relevant ('\0')
    Data: present ('\0')
    URB sec: 1702353719
    URB usec: 859463
    URB status: Operation now in progress (-EINPROGRESS) (-115)
    URB length [bytes]: 16
    Data length [bytes]: 16
    [Response in: 262]
    Interval: 0
    Start frame: 0
    Copy of Transfer Flags: 0x00000000
    Number of ISO descriptors: 0
    [bInterfaceClass: Unknown (0xffff)]
Setup Data
    bmRequestType: 0x40
    bRequest: 160
    wValue: 0x061b
    wIndex: 0 (0x0000)
    wLength: 16
    Data Fragment: e0d0d032c0d0c0e0c082c083907fe9e0

No.     Time           Source                Destination           Protocol Length Info
    262 29.417884      1.5.0                 host                  USB      64     URB_CONTROL out

Frame 262: 64 bytes on wire (512 bits), 64 bytes captured (512 bits) on interface usbmon1, id 0
USB URB
    [Source: 1.5.0]
    [Destination: host]
    URB id: 0xffff993ecd78c240
    URB type: URB_COMPLETE ('C')
    URB transfer type: URB_CONTROL (0x02)
    Endpoint: 0x00, Direction: OUT
    Device: 5
    URB bus id: 1
    Device setup request: not relevant ('-')
    Data: not present ('>')
    URB sec: 1702353719
    URB usec: 860819
    URB status: Success (0)
    URB length [bytes]: 16
    Data length [bytes]: 0
    [Request in: 261]
    [Time from request: 0.001356000 seconds]
    Unused Setup Header
    Interval: 0
    Start frame: 0
    Copy of Transfer Flags: 0x00000000
    Number of ISO descriptors: 0
    [bInterfaceClass: Unknown (0xffff)]

No.     Time           Source                Destination           Protocol Length Info
    263 29.420900      host                  1.5.0                 USB      80     URB_CONTROL out

Frame 263: 80 bytes on wire (640 bits), 80 bytes captured (640 bits) on interface usbmon1, id 0
USB URB
    [Source: host]
    [Destination: 1.5.0]
    URB id: 0xffff993ecd78c480
    URB type: URB_SUBMIT ('S')
    URB transfer type: URB_CONTROL (0x02)
    Endpoint: 0x00, Direction: OUT
    Device: 5
    URB bus id: 1
    Device setup request: relevant ('\0')
    Data: present ('\0')
    URB sec: 1702353719
    URB usec: 863835
    URB status: Operation now in progress (-EINPROGRESS) (-115)
    URB length [bytes]: 16
    Data length [bytes]: 16
    [Response in: 264]
    Interval: 0
    Start frame: 0
    Copy of Transfer Flags: 0x00000000
    Number of ISO descriptors: 0
    [bInterfaceClass: Unknown (0xffff)]
Setup Data
    bmRequestType: 0x40
    bRequest: 160
    wValue: 0x062b
    wIndex: 0 (0x0000)
    wLength: 16
    Data Fragment: 540f23239006337302067f0002071c00

No.     Time           Source                Destination           Protocol Length Info
    264 29.422886      1.5.0                 host                  USB      64     URB_CONTROL out

Frame 264: 64 bytes on wire (512 bits), 64 bytes captured (512 bits) on interface usbmon1, id 0
USB URB
    [Source: 1.5.0]
    [Destination: host]
    URB id: 0xffff993ecd78c480
    URB type: URB_COMPLETE ('C')
    URB transfer type: URB_CONTROL (0x02)
    Endpoint: 0x00, Direction: OUT
    Device: 5
    URB bus id: 1
    Device setup request: not relevant ('-')
    Data: not present ('>')
    URB sec: 1702353719
    URB usec: 865821
    URB status: Success (0)
    URB length [bytes]: 16
    Data length [bytes]: 0
    [Request in: 263]
    [Time from request: 0.001986000 seconds]
    Unused Setup Header
    Interval: 0
    Start frame: 0
    Copy of Transfer Flags: 0x00000000
    Number of ISO descriptors: 0
    [bInterfaceClass: Unknown (0xffff)]

No.     Time           Source                Destination           Protocol Length Info
    265 29.425190      host                  1.5.0                 USB      80     URB_CONTROL out

Frame 265: 80 bytes on wire (640 bits), 80 bytes captured (640 bits) on interface usbmon1, id 0
USB URB
    [Source: host]
    [Destination: 1.5.0]
    URB id: 0xffff993ecd78ca80
    URB type: URB_SUBMIT ('S')
    URB transfer type: URB_CONTROL (0x02)
    Endpoint: 0x00, Direction: OUT
    Device: 5
    URB bus id: 1
    Device setup request: relevant ('\0')
    Data: present ('\0')
    URB sec: 1702353719
    URB usec: 868125
    URB status: Operation now in progress (-EINPROGRESS) (-115)
    URB length [bytes]: 16
    Data length [bytes]: 16
    [Response in: 266]
    Interval: 0
    Start frame: 0
    Copy of Transfer Flags: 0x00000000
    Number of ISO descriptors: 0
    [bInterfaceClass: Unknown (0xffff)]
Setup Data
    bmRequestType: 0x40
    bRequest: 160
    wValue: 0x063b
    wIndex: 0 (0x0000)
    wLength: 16
    Data Fragment: 02071c0002071c0002071c0002071c00

No.     Time           Source                Destination           Protocol Length Info
    266 29.426877      1.5.0                 host                  USB      64     URB_CONTROL out

Frame 266: 64 bytes on wire (512 bits), 64 bytes captured (512 bits) on interface usbmon1, id 0
USB URB
    [Source: 1.5.0]
    [Destination: host]
    URB id: 0xffff993ecd78ca80
    URB type: URB_COMPLETE ('C')
    URB transfer type: URB_CONTROL (0x02)
    Endpoint: 0x00, Direction: OUT
    Device: 5
    URB bus id: 1
    Device setup request: not relevant ('-')
    Data: not present ('>')
    URB sec: 1702353719
    URB usec: 869812
    URB status: Success (0)
    URB length [bytes]: 16
    Data length [bytes]: 0
    [Request in: 265]
    [Time from request: 0.001687000 seconds]
    Unused Setup Header
    Interval: 0
    Start frame: 0
    Copy of Transfer Flags: 0x00000000
    Number of ISO descriptors: 0
    [bInterfaceClass: Unknown (0xffff)]

No.     Time           Source                Destination           Protocol Length Info
    267 29.429164      host                  1.5.0                 USB      80     URB_CONTROL out

Frame 267: 80 bytes on wire (640 bits), 80 bytes captured (640 bits) on interface usbmon1, id 0
USB URB
    [Source: host]
    [Destination: 1.5.0]
    URB id: 0xffff993ecd78d380
    URB type: URB_SUBMIT ('S')
    URB transfer type: URB_CONTROL (0x02)
    Endpoint: 0x00, Direction: OUT
    Device: 5
    URB bus id: 1
    Device setup request: relevant ('\0')
    Data: present ('\0')
    URB sec: 1702353719
    URB usec: 872099
    URB status: Operation now in progress (-EINPROGRESS) (-115)
    URB length [bytes]: 16
    Data length [bytes]: 16
    [Response in: 268]
    Interval: 0
    Start frame: 0
    Copy of Transfer Flags: 0x00000000
    Number of ISO descriptors: 0
    [bInterfaceClass: Unknown (0xffff)]
Setup Data
    bmRequestType: 0x40
    bRequest: 160
    wValue: 0x064b
    wIndex: 0 (0x0000)
    wLength: 16
    Data Fragment: 0206ac0002071c0002071c0002067300

No.     Time           Source                Destination           Protocol Length Info
    268 29.430881      1.5.0                 host                  USB      64     URB_CONTROL out

Frame 268: 64 bytes on wire (512 bits), 64 bytes captured (512 bits) on interface usbmon1, id 0
USB URB
    [Source: 1.5.0]
    [Destination: host]
    URB id: 0xffff993ecd78d380
    URB type: URB_COMPLETE ('C')
    URB transfer type: URB_CONTROL (0x02)
    Endpoint: 0x00, Direction: OUT
    Device: 5
    URB bus id: 1
    Device setup request: not relevant ('-')
    Data: not present ('>')
    URB sec: 1702353719
    URB usec: 873816
    URB status: Success (0)
    URB length [bytes]: 16
    Data length [bytes]: 0
    [Request in: 267]
    [Time from request: 0.001717000 seconds]
    Unused Setup Header
    Interval: 0
    Start frame: 0
    Copy of Transfer Flags: 0x00000000
    Number of ISO descriptors: 0
    [bInterfaceClass: Unknown (0xffff)]

No.     Time           Source                Destination           Protocol Length Info
    269 29.433546      host                  1.5.0                 USB      80     URB_CONTROL out

Frame 269: 80 bytes on wire (640 bits), 80 bytes captured (640 bits) on interface usbmon1, id 0
USB URB
    [Source: host]
    [Destination: 1.5.0]
    URB id: 0xffff993ecd78c780
    URB type: URB_SUBMIT ('S')
    URB transfer type: URB_CONTROL (0x02)
    Endpoint: 0x00, Direction: OUT
    Device: 5
    URB bus id: 1
    Device setup request: relevant ('\0')
    Data: present ('\0')
    URB sec: 1702353719
    URB usec: 876481
    URB status: Operation now in progress (-EINPROGRESS) (-115)
    URB length [bytes]: 16
    Data length [bytes]: 16
    [Response in: 270]
    Interval: 0
    Start frame: 0
    Copy of Transfer Flags: 0x00000000
    Number of ISO descriptors: 0
    [bInterfaceClass: Unknown (0xffff)]
Setup Data
    bmRequestType: 0x40
    bRequest: 160
    wValue: 0x065b
    wIndex: 0 (0x0000)
    wLength: 16
    Data Fragment: 02071c0002071c0002071c0002071c00

No.     Time           Source                Destination           Protocol Length Info
    270 29.434879      1.5.0                 host                  USB      64     URB_CONTROL out

Frame 270: 64 bytes on wire (512 bits), 64 bytes captured (512 bits) on interface usbmon1, id 0
USB URB
    [Source: 1.5.0]
    [Destination: host]
    URB id: 0xffff993ecd78c780
    URB type: URB_COMPLETE ('C')
    URB transfer type: URB_CONTROL (0x02)
    Endpoint: 0x00, Direction: OUT
    Device: 5
    URB bus id: 1
    Device setup request: not relevant ('-')
    Data: not present ('>')
    URB sec: 1702353719
    URB usec: 877814
    URB status: Success (0)
    URB length [bytes]: 16
    Data length [bytes]: 0
    [Request in: 269]
    [Time from request: 0.001333000 seconds]
    Unused Setup Header
    Interval: 0
    Start frame: 0
    Copy of Transfer Flags: 0x00000000
    Number of ISO descriptors: 0
    [bInterfaceClass: Unknown (0xffff)]

No.     Time           Source                Destination           Protocol Length Info
    271 29.437905      host                  1.5.0                 USB      80     URB_CONTROL out

Frame 271: 80 bytes on wire (640 bits), 80 bytes captured (640 bits) on interface usbmon1, id 0
USB URB
    [Source: host]
    [Destination: 1.5.0]
    URB id: 0xffff993ecd78c300
    URB type: URB_SUBMIT ('S')
    URB transfer type: URB_CONTROL (0x02)
    Endpoint: 0x00, Direction: OUT
    Device: 5
    URB bus id: 1
    Device setup request: relevant ('\0')
    Data: present ('\0')
    URB sec: 1702353719
    URB usec: 880840
    URB status: Operation now in progress (-EINPROGRESS) (-115)
    URB length [bytes]: 16
    Data length [bytes]: 16
    [Response in: 272]
    Interval: 0
    Start frame: 0
    Copy of Transfer Flags: 0x00000000
    Number of ISO descriptors: 0
    [bInterfaceClass: Unknown (0xffff)]
Setup Data
    bmRequestType: 0x40
    bRequest: 160
    wValue: 0x066b
    wIndex: 0 (0x0000)
    wLength: 16
    Data Fragment: 02071c0002071c00020713907f007401

No.     Time           Source                Destination           Protocol Length Info
    272 29.439882      1.5.0                 host                  USB      64     URB_CONTROL out

Frame 272: 64 bytes on wire (512 bits), 64 bytes captured (512 bits) on interface usbmon1, id 0
USB URB
    [Source: 1.5.0]
    [Destination: host]
    URB id: 0xffff993ecd78c300
    URB type: URB_COMPLETE ('C')
    URB transfer type: URB_CONTROL (0x02)
    Endpoint: 0x00, Direction: OUT
    Device: 5
    URB bus id: 1
    Device setup request: not relevant ('-')
    Data: not present ('>')
    URB sec: 1702353719
    URB usec: 882817
    URB status: Success (0)
    URB length [bytes]: 16
    Data length [bytes]: 0
    [Request in: 271]
    [Time from request: 0.001977000 seconds]
    Unused Setup Header
    Interval: 0
    Start frame: 0
    Copy of Transfer Flags: 0x00000000
    Number of ISO descriptors: 0
    [bInterfaceClass: Unknown (0xffff)]

No.     Time           Source                Destination           Protocol Length Info
    273 29.442154      host                  1.5.0                 USB      80     URB_CONTROL out

Frame 273: 80 bytes on wire (640 bits), 80 bytes captured (640 bits) on interface usbmon1, id 0
USB URB
    [Source: host]
    [Destination: 1.5.0]
    URB id: 0xffff993ecd78c900
    URB type: URB_SUBMIT ('S')
    URB transfer type: URB_CONTROL (0x02)
    Endpoint: 0x00, Direction: OUT
    Device: 5
    URB bus id: 1
    Device setup request: relevant ('\0')
    Data: present ('\0')
    URB sec: 1702353719
    URB usec: 885089
    URB status: Operation now in progress (-EINPROGRESS) (-115)
    URB length [bytes]: 16
    Data length [bytes]: 16
    [Response in: 274]
    Interval: 0
    Start frame: 0
    Copy of Transfer Flags: 0x00000000
    Number of ISO descriptors: 0
    [bInterfaceClass: Unknown (0xffff)]
Setup Data
    bmRequestType: 0x40
    bRequest: 160
    wValue: 0x067b
    wIndex: 0 (0x0000)
    wLength: 16
    Data Fragment: f0020713907fe8b4800b907f007400f0

No.     Time           Source                Destination           Protocol Length Info
    274 29.443883      1.5.0                 host                  USB      64     URB_CONTROL out

Frame 274: 64 bytes on wire (512 bits), 64 bytes captured (512 bits) on interface usbmon1, id 0
USB URB
    [Source: 1.5.0]
    [Destination: host]
    URB id: 0xffff993ecd78c900
    URB type: URB_COMPLETE ('C')
    URB transfer type: URB_CONTROL (0x02)
    Endpoint: 0x00, Direction: OUT
    Device: 5
    URB bus id: 1
    Device setup request: not relevant ('-')
    Data: not present ('>')
    URB sec: 1702353719
    URB usec: 886818
    URB status: Success (0)
    URB length [bytes]: 16
    Data length [bytes]: 0
    [Request in: 273]
    [Time from request: 0.001729000 seconds]
    Unused Setup Header
    Interval: 0
    Start frame: 0
    Copy of Transfer Flags: 0x00000000
    Number of ISO descriptors: 0
    [bInterfaceClass: Unknown (0xffff)]

No.     Time           Source                Destination           Protocol Length Info
    275 29.446489      host                  1.5.0                 USB      80     URB_CONTROL out

Frame 275: 80 bytes on wire (640 bits), 80 bytes captured (640 bits) on interface usbmon1, id 0
USB URB
    [Source: host]
    [Destination: 1.5.0]
    URB id: 0xffff993ecd78c600
    URB type: URB_SUBMIT ('S')
    URB transfer type: URB_CONTROL (0x02)
    Endpoint: 0x00, Direction: OUT
    Device: 5
    URB bus id: 1
    Device setup request: relevant ('\0')
    Data: present ('\0')
    URB sec: 1702353719
    URB usec: 889424
    URB status: Operation now in progress (-EINPROGRESS) (-115)
    URB length [bytes]: 16
    Data length [bytes]: 16
    [Response in: 276]
    Interval: 0
    Start frame: 0
    Copy of Transfer Flags: 0x00000000
    Number of ISO descriptors: 0
    [bInterfaceClass: Unknown (0xffff)]
Setup Data
    bmRequestType: 0x40
    bRequest: 160
    wValue: 0x068b
    wIndex: 0 (0x0000)
    wLength: 16
    Data Fragment: a3f0020713b4810b907f007400f0a3f0

No.     Time           Source                Destination           Protocol Length Info
    276 29.447886      1.5.0                 host                  USB      64     URB_CONTROL out

Frame 276: 64 bytes on wire (512 bits), 64 bytes captured (512 bits) on interface usbmon1, id 0
USB URB
    [Source: 1.5.0]
    [Destination: host]
    URB id: 0xffff993ecd78c600
    URB type: URB_COMPLETE ('C')
    URB transfer type: URB_CONTROL (0x02)
    Endpoint: 0x00, Direction: OUT
    Device: 5
    URB bus id: 1
    Device setup request: not relevant ('-')
    Data: not present ('>')
    URB sec: 1702353719
    URB usec: 890821
    URB status: Success (0)
    URB length [bytes]: 16
    Data length [bytes]: 0
    [Request in: 275]
    [Time from request: 0.001397000 seconds]
    Unused Setup Header
    Interval: 0
    Start frame: 0
    Copy of Transfer Flags: 0x00000000
    Number of ISO descriptors: 0
    [bInterfaceClass: Unknown (0xffff)]

No.     Time           Source                Destination           Protocol Length Info
    277 29.450863      host                  1.5.0                 USB      80     URB_CONTROL out

Frame 277: 80 bytes on wire (640 bits), 80 bytes captured (640 bits) on interface usbmon1, id 0
USB URB
    [Source: host]
    [Destination: 1.5.0]
    URB id: 0xffff993ecd78de00
    URB type: URB_SUBMIT ('S')
    URB transfer type: URB_CONTROL (0x02)
    Endpoint: 0x00, Direction: OUT
    Device: 5
    URB bus id: 1
    Device setup request: relevant ('\0')
    Data: present ('\0')
    URB sec: 1702353719
    URB usec: 893798
    URB status: Operation now in progress (-EINPROGRESS) (-115)
    URB length [bytes]: 16
    Data length [bytes]: 16
    [Response in: 278]
    Interval: 0
    Start frame: 0
    Copy of Transfer Flags: 0x00000000
    Number of ISO descriptors: 0
    [bInterfaceClass: Unknown (0xffff)]
Setup Data
    bmRequestType: 0x40
    bRequest: 160
    wValue: 0x069b
    wIndex: 0 (0x0000)
    wLength: 16
    Data Fragment: 020713b4827b907f007400f0a3f00207

No.     Time           Source                Destination           Protocol Length Info
    278 29.452881      1.5.0                 host                  USB      64     URB_CONTROL out

Frame 278: 64 bytes on wire (512 bits), 64 bytes captured (512 bits) on interface usbmon1, id 0
USB URB
    [Source: 1.5.0]
    [Destination: host]
    URB id: 0xffff993ecd78de00
    URB type: URB_COMPLETE ('C')
    URB transfer type: URB_CONTROL (0x02)
    Endpoint: 0x00, Direction: OUT
    Device: 5
    URB bus id: 1
    Device setup request: not relevant ('-')
    Data: not present ('>')
    URB sec: 1702353719
    URB usec: 895816
    URB status: Success (0)
    URB length [bytes]: 16
    Data length [bytes]: 0
    [Request in: 277]
    [Time from request: 0.002018000 seconds]
    Unused Setup Header
    Interval: 0
    Start frame: 0
    Copy of Transfer Flags: 0x00000000
    Number of ISO descriptors: 0
    [bInterfaceClass: Unknown (0xffff)]

No.     Time           Source                Destination           Protocol Length Info
    279 29.455160      host                  1.5.0                 USB      80     URB_CONTROL out

Frame 279: 80 bytes on wire (640 bits), 80 bytes captured (640 bits) on interface usbmon1, id 0
USB URB
    [Source: host]
    [Destination: 1.5.0]
    URB id: 0xffff993ecd78d980
    URB type: URB_SUBMIT ('S')
    URB transfer type: URB_CONTROL (0x02)
    Endpoint: 0x00, Direction: OUT
    Device: 5
    URB bus id: 1
    Device setup request: relevant ('\0')
    Data: present ('\0')
    URB sec: 1702353719
    URB usec: 898095
    URB status: Operation now in progress (-EINPROGRESS) (-115)
    URB length [bytes]: 16
    Data length [bytes]: 16
    [Response in: 280]
    Interval: 0
    Start frame: 0
    Copy of Transfer Flags: 0x00000000
    Number of ISO descriptors: 0
    [bInterfaceClass: Unknown (0xffff)]
Setup Data
    bmRequestType: 0x40
    bRequest: 160
    wValue: 0x06ab
    wIndex: 0 (0x0000)
    wLength: 16
    Data Fragment: 13907fe8e0b48069907febe054032323

No.     Time           Source                Destination           Protocol Length Info
    280 29.456891      1.5.0                 host                  USB      64     URB_CONTROL out

Frame 280: 64 bytes on wire (512 bits), 64 bytes captured (512 bits) on interface usbmon1, id 0
USB URB
    [Source: 1.5.0]
    [Destination: host]
    URB id: 0xffff993ecd78d980
    URB type: URB_COMPLETE ('C')
    URB transfer type: URB_CONTROL (0x02)
    Endpoint: 0x00, Direction: OUT
    Device: 5
    URB bus id: 1
    Device setup request: not relevant ('-')
    Data: not present ('>')
    URB sec: 1702353719
    URB usec: 899826
    URB status: Success (0)
    URB length [bytes]: 16
    Data length [bytes]: 0
    [Request in: 279]
    [Time from request: 0.001731000 seconds]
    Unused Setup Header
    Interval: 0
    Start frame: 0
    Copy of Transfer Flags: 0x00000000
    Number of ISO descriptors: 0
    [bInterfaceClass: Unknown (0xffff)]

No.     Time           Source                Destination           Protocol Length Info
    281 29.459451      host                  1.5.0                 USB      80     URB_CONTROL out

Frame 281: 80 bytes on wire (640 bits), 80 bytes captured (640 bits) on interface usbmon1, id 0
USB URB
    [Source: host]
    [Destination: 1.5.0]
    URB id: 0xffff993edd687200
    URB type: URB_SUBMIT ('S')
    URB transfer type: URB_CONTROL (0x02)
    Endpoint: 0x00, Direction: OUT
    Device: 5
    URB bus id: 1
    Device setup request: relevant ('\0')
    Data: present ('\0')
    URB sec: 1702353719
    URB usec: 902386
    URB status: Operation now in progress (-EINPROGRESS) (-115)
    URB length [bytes]: 16
    Data length [bytes]: 16
    [Response in: 282]
    Interval: 0
    Start frame: 0
    Copy of Transfer Flags: 0x00000000
    Number of ISO descriptors: 0
    [bInterfaceClass: Unknown (0xffff)]
Setup Data
    bmRequestType: 0x40
    bRequest: 160
    wValue: 0x06bb
    wIndex: 0 (0x0000)
    wLength: 16
    Data Fragment: 9006bf7302071c000206cf000206d400

No.     Time           Source                Destination           Protocol Length Info
    282 29.460894      1.5.0                 host                  USB      64     URB_CONTROL out

Frame 282: 64 bytes on wire (512 bits), 64 bytes captured (512 bits) on interface usbmon1, id 0
USB URB
    [Source: 1.5.0]
    [Destination: host]
    URB id: 0xffff993edd687200
    URB type: URB_COMPLETE ('C')
    URB transfer type: URB_CONTROL (0x02)
    Endpoint: 0x00, Direction: OUT
    Device: 5
    URB bus id: 1
    Device setup request: not relevant ('-')
    Data: not present ('>')
    URB sec: 1702353719
    URB usec: 903829
    URB status: Success (0)
    URB length [bytes]: 16
    Data length [bytes]: 0
    [Request in: 281]
    [Time from request: 0.001443000 seconds]
    Unused Setup Header
    Interval: 0
    Start frame: 0
    Copy of Transfer Flags: 0x00000000
    Number of ISO descriptors: 0
    [bInterfaceClass: Unknown (0xffff)]

No.     Time           Source                Destination           Protocol Length Info
    283 29.463599      host                  1.5.0                 USB      80     URB_CONTROL out

Frame 283: 80 bytes on wire (640 bits), 80 bytes captured (640 bits) on interface usbmon1, id 0
USB URB
    [Source: host]
    [Destination: 1.5.0]
    URB id: 0xffff993edd687500
    URB type: URB_SUBMIT ('S')
    URB transfer type: URB_CONTROL (0x02)
    Endpoint: 0x00, Direction: OUT
    Device: 5
    URB bus id: 1
    Device setup request: relevant ('\0')
    Data: present ('\0')
    URB sec: 1702353719
    URB usec: 906534
    URB status: Operation now in progress (-EINPROGRESS) (-115)
    URB length [bytes]: 16
    Data length [bytes]: 16
    [Response in: 284]
    Interval: 0
    Start frame: 0
    Copy of Transfer Flags: 0x00000000
    Number of ISO descriptors: 0
    [bInterfaceClass: Unknown (0xffff)]
Setup Data
    bmRequestType: 0x40
    bRequest: 160
    wValue: 0x06cb
    wIndex: 0 (0x0000)
    wLength: 16
    Data Fragment: 0206d900900738803090074a802b907f

No.     Time           Source                Destination           Protocol Length Info
    284 29.464883      1.5.0                 host                  USB      64     URB_CONTROL out

Frame 284: 64 bytes on wire (512 bits), 64 bytes captured (512 bits) on interface usbmon1, id 0
USB URB
    [Source: 1.5.0]
    [Destination: host]
    URB id: 0xffff993edd687500
    URB type: URB_COMPLETE ('C')
    URB transfer type: URB_CONTROL (0x02)
    Endpoint: 0x00, Direction: OUT
    Device: 5
    URB bus id: 1
    Device setup request: not relevant ('-')
    Data: not present ('>')
    URB sec: 1702353719
    URB usec: 907818
    URB status: Success (0)
    URB length [bytes]: 16
    Data length [bytes]: 0
    [Request in: 283]
    [Time from request: 0.001284000 seconds]
    Unused Setup Header
    Interval: 0
    Start frame: 0
    Copy of Transfer Flags: 0x00000000
    Number of ISO descriptors: 0
    [bInterfaceClass: Unknown (0xffff)]

No.     Time           Source                Destination           Protocol Length Info
    285 29.467802      host                  1.5.0                 USB      80     URB_CONTROL out

Frame 285: 80 bytes on wire (640 bits), 80 bytes captured (640 bits) on interface usbmon1, id 0
USB URB
    [Source: host]
    [Destination: 1.5.0]
    URB id: 0xffff993ecd78cd80
    URB type: URB_SUBMIT ('S')
    URB transfer type: URB_CONTROL (0x02)
    Endpoint: 0x00, Direction: OUT
    Device: 5
    URB bus id: 1
    Device setup request: relevant ('\0')
    Data: present ('\0')
    URB sec: 1702353719
    URB usec: 910737
    URB status: Operation now in progress (-EINPROGRESS) (-115)
    URB length [bytes]: 16
    Data length [bytes]: 16
    [Response in: 286]
    Interval: 0
    Start frame: 0
    Copy of Transfer Flags: 0x00000000
    Number of ISO descriptors: 0
    [bInterfaceClass: Unknown (0xffff)]
Setup Data
    bmRequestType: 0x40
    bRequest: 160
    wValue: 0x06db
    wIndex: 0 (0x0000)
    wLength: 16
    Data Fragment: eae0700590077f8020d5e00590078380

No.     Time           Source                Destination           Protocol Length Info
    286 29.468878      1.5.0                 host                  USB      64     URB_CONTROL out

Frame 286: 64 bytes on wire (512 bits), 64 bytes captured (512 bits) on interface usbmon1, id 0
USB URB
    [Source: 1.5.0]
    [Destination: host]
    URB id: 0xffff993ecd78cd80
    URB type: URB_COMPLETE ('C')
    URB transfer type: URB_CONTROL (0x02)
    Endpoint: 0x00, Direction: OUT
    Device: 5
    URB bus id: 1
    Device setup request: not relevant ('-')
    Data: not present ('>')
    URB sec: 1702353719
    URB usec: 911813
    URB status: Success (0)
    URB length [bytes]: 16
    Data length [bytes]: 0
    [Request in: 285]
    [Time from request: 0.001076000 seconds]
    Unused Setup Header
    Interval: 0
    Start frame: 0
    Copy of Transfer Flags: 0x00000000
    Number of ISO descriptors: 0
    [bInterfaceClass: Unknown (0xffff)]

No.     Time           Source                Destination           Protocol Length Info
    287 29.472032      host                  1.5.0                 USB      80     URB_CONTROL out

Frame 287: 80 bytes on wire (640 bits), 80 bytes captured (640 bits) on interface usbmon1, id 0
USB URB
    [Source: host]
    [Destination: 1.5.0]
    URB id: 0xffff993ecd78c3c0
    URB type: URB_SUBMIT ('S')
    URB transfer type: URB_CONTROL (0x02)
    Endpoint: 0x00, Direction: OUT
    Device: 5
    URB bus id: 1
    Device setup request: relevant ('\0')
    Data: present ('\0')
    URB sec: 1702353719
    URB usec: 914967
    URB status: Operation now in progress (-EINPROGRESS) (-115)
    URB length [bytes]: 16
    Data length [bytes]: 16
    [Response in: 288]
    Interval: 0
    Start frame: 0
    Copy of Transfer Flags: 0x00000000
    Number of ISO descriptors: 0
    [bInterfaceClass: Unknown (0xffff)]
Setup Data
    bmRequestType: 0x40
    bRequest: 160
    wValue: 0x06eb
    wIndex: 0 (0x0000)
    wLength: 16
    Data Fragment: 18d5e02d20010820020a9007cd800a90

No.     Time           Source                Destination           Protocol Length Info
    288 29.473883      1.5.0                 host                  USB      64     URB_CONTROL out

Frame 288: 64 bytes on wire (512 bits), 64 bytes captured (512 bits) on interface usbmon1, id 0
USB URB
    [Source: 1.5.0]
    [Destination: host]
    URB id: 0xffff993ecd78c3c0
    URB type: URB_COMPLETE ('C')
    URB transfer type: URB_CONTROL (0x02)
    Endpoint: 0x00, Direction: OUT
    Device: 5
    URB bus id: 1
    Device setup request: not relevant ('-')
    Data: not present ('>')
    URB sec: 1702353719
    URB usec: 916818
    URB status: Success (0)
    URB length [bytes]: 16
    Data length [bytes]: 0
    [Request in: 287]
    [Time from request: 0.001851000 seconds]
    Unused Setup Header
    Interval: 0
    Start frame: 0
    Copy of Transfer Flags: 0x00000000
    Number of ISO descriptors: 0
    [bInterfaceClass: Unknown (0xffff)]

No.     Time           Source                Destination           Protocol Length Info
    289 29.479747      host                  1.5.0                 USB      80     URB_CONTROL out

Frame 289: 80 bytes on wire (640 bits), 80 bytes captured (640 bits) on interface usbmon1, id 0
USB URB
    [Source: host]
    [Destination: 1.5.0]
    URB id: 0xffff993ecd78c840
    URB type: URB_SUBMIT ('S')
    URB transfer type: URB_CONTROL (0x02)
    Endpoint: 0x00, Direction: OUT
    Device: 5
    URB bus id: 1
    Device setup request: relevant ('\0')
    Data: present ('\0')
    URB sec: 1702353719
    URB usec: 922682
    URB status: Operation now in progress (-EINPROGRESS) (-115)
    URB length [bytes]: 16
    Data length [bytes]: 16
    [Response in: 290]
    Interval: 0
    Start frame: 0
    Copy of Transfer Flags: 0x00000000
    Number of ISO descriptors: 0
    [bInterfaceClass: Unknown (0xffff)]
Setup Data
    bmRequestType: 0x40
    bRequest: 160
    wValue: 0x06fb
    wIndex: 0 (0x0000)
    wLength: 16
    Data Fragment: 07fb800590081b8000e58385821e907f

No.     Time           Source                Destination           Protocol Length Info
    290 29.480889      1.5.0                 host                  USB      64     URB_CONTROL out

Frame 290: 64 bytes on wire (512 bits), 64 bytes captured (512 bits) on interface usbmon1, id 0
USB URB
    [Source: 1.5.0]
    [Destination: host]
    URB id: 0xffff993ecd78c840
    URB type: URB_COMPLETE ('C')
    URB transfer type: URB_CONTROL (0x02)
    Endpoint: 0x00, Direction: OUT
    Device: 5
    URB bus id: 1
    Device setup request: not relevant ('-')
    Data: not present ('>')
    URB sec: 1702353719
    URB usec: 923824
    URB status: Success (0)
    URB length [bytes]: 16
    Data length [bytes]: 0
    [Request in: 289]
    [Time from request: 0.001142000 seconds]
    Unused Setup Header
    Interval: 0
    Start frame: 0
    Copy of Transfer Flags: 0x00000000
    Number of ISO descriptors: 0
    [bInterfaceClass: Unknown (0xffff)]

No.     Time           Source                Destination           Protocol Length Info
    291 29.483939      host                  1.5.0                 USB      80     URB_CONTROL out

Frame 291: 80 bytes on wire (640 bits), 80 bytes captured (640 bits) on interface usbmon1, id 0
USB URB
    [Source: host]
    [Destination: 1.5.0]
    URB id: 0xffff993edd686fc0
    URB type: URB_SUBMIT ('S')
    URB transfer type: URB_CONTROL (0x02)
    Endpoint: 0x00, Direction: OUT
    Device: 5
    URB bus id: 1
    Device setup request: relevant ('\0')
    Data: present ('\0')
    URB sec: 1702353719
    URB usec: 926874
    URB status: Operation now in progress (-EINPROGRESS) (-115)
    URB length [bytes]: 16
    Data length [bytes]: 16
    [Response in: 292]
    Interval: 0
    Start frame: 0
    Copy of Transfer Flags: 0x00000000
    Number of ISO descriptors: 0
    [bInterfaceClass: Unknown (0xffff)]
Setup Data
    bmRequestType: 0x40
    bRequest: 160
    wValue: 0x070b
    wIndex: 0 (0x0000)
    wLength: 16
    Data Fragment: d4f0e51ea3f08000907fb4e04402f080

No.     Time           Source                Destination           Protocol Length Info
    292 29.485886      1.5.0                 host                  USB      64     URB_CONTROL out

Frame 292: 64 bytes on wire (512 bits), 64 bytes captured (512 bits) on interface usbmon1, id 0
USB URB
    [Source: 1.5.0]
    [Destination: host]
    URB id: 0xffff993edd686fc0
    URB type: URB_COMPLETE ('C')
    URB transfer type: URB_CONTROL (0x02)
    Endpoint: 0x00, Direction: OUT
    Device: 5
    URB bus id: 1
    Device setup request: not relevant ('-')
    Data: not present ('>')
    URB sec: 1702353719
    URB usec: 928821
    URB status: Success (0)
    URB length [bytes]: 16
    Data length [bytes]: 0
    [Request in: 291]
    [Time from request: 0.001947000 seconds]
    Unused Setup Header
    Interval: 0
    Start frame: 0
    Copy of Transfer Flags: 0x00000000
    Number of ISO descriptors: 0
    [bInterfaceClass: Unknown (0xffff)]

No.     Time           Source                Destination           Protocol Length Info
    293 29.488046      host                  1.5.0                 USB      80     URB_CONTROL out

Frame 293: 80 bytes on wire (640 bits), 80 bytes captured (640 bits) on interface usbmon1, id 0
USB URB
    [Source: host]
    [Destination: 1.5.0]
    URB id: 0xffff993ecd78dec0
    URB type: URB_SUBMIT ('S')
    URB transfer type: URB_CONTROL (0x02)
    Endpoint: 0x00, Direction: OUT
    Device: 5
    URB bus id: 1
    Device setup request: relevant ('\0')
    Data: present ('\0')
    URB sec: 1702353719
    URB usec: 930981
    URB status: Operation now in progress (-EINPROGRESS) (-115)
    URB length [bytes]: 16
    Data length [bytes]: 16
    [Response in: 294]
    Interval: 0
    Start frame: 0
    Copy of Transfer Flags: 0x00000000
    Number of ISO descriptors: 0
    [bInterfaceClass: Unknown (0xffff)]
Setup Data
    bmRequestType: 0x40
    bRequest: 160
    wValue: 0x071b
    wIndex: 0 (0x0000)
    wLength: 16
    Data Fragment: 07907fb4e04403f0e591c2e4f591907f

No.     Time           Source                Destination           Protocol Length Info
    294 29.489884      1.5.0                 host                  USB      64     URB_CONTROL out

Frame 294: 64 bytes on wire (512 bits), 64 bytes captured (512 bits) on interface usbmon1, id 0
USB URB
    [Source: 1.5.0]
    [Destination: host]
    URB id: 0xffff993ecd78dec0
    URB type: URB_COMPLETE ('C')
    URB transfer type: URB_CONTROL (0x02)
    Endpoint: 0x00, Direction: OUT
    Device: 5
    URB bus id: 1
    Device setup request: not relevant ('-')
    Data: not present ('>')
    URB sec: 1702353719
    URB usec: 932819
    URB status: Success (0)
    URB length [bytes]: 16
    Data length [bytes]: 0
    [Request in: 293]
    [Time from request: 0.001838000 seconds]
    Unused Setup Header
    Interval: 0
    Start frame: 0
    Copy of Transfer Flags: 0x00000000
    Number of ISO descriptors: 0
    [bInterfaceClass: Unknown (0xffff)]

No.     Time           Source                Destination           Protocol Length Info
    295 29.492025      host                  1.5.0                 USB      74     URB_CONTROL out

Frame 295: 74 bytes on wire (592 bits), 74 bytes captured (592 bits) on interface usbmon1, id 0
USB URB
    [Source: host]
    [Destination: 1.5.0]
    URB id: 0xffff993ecd78dec0
    URB type: URB_SUBMIT ('S')
    URB transfer type: URB_CONTROL (0x02)
    Endpoint: 0x00, Direction: OUT
    Device: 5
    URB bus id: 1
    Device setup request: relevant ('\0')
    Data: present ('\0')
    URB sec: 1702353719
    URB usec: 934960
    URB status: Operation now in progress (-EINPROGRESS) (-115)
    URB length [bytes]: 10
    Data length [bytes]: 10
    [Response in: 296]
    Interval: 0
    Start frame: 0
    Copy of Transfer Flags: 0x00000000
    Number of ISO descriptors: 0
    [bInterfaceClass: Unknown (0xffff)]
Setup Data
    bmRequestType: 0x40
    bRequest: 160
    wValue: 0x072b
    wIndex: 0 (0x0000)
    wLength: 10
    Data Fragment: ab7401f0d083d082d0e0

No.     Time           Source                Destination           Protocol Length Info
    296 29.493883      1.5.0                 host                  USB      64     URB_CONTROL out

Frame 296: 64 bytes on wire (512 bits), 64 bytes captured (512 bits) on interface usbmon1, id 0
USB URB
    [Source: 1.5.0]
    [Destination: host]
    URB id: 0xffff993ecd78dec0
    URB type: URB_COMPLETE ('C')
    URB transfer type: URB_CONTROL (0x02)
    Endpoint: 0x00, Direction: OUT
    Device: 5
    URB bus id: 1
    Device setup request: not relevant ('-')
    Data: not present ('>')
    URB sec: 1702353719
    URB usec: 936818
    URB status: Success (0)
    URB length [bytes]: 10
    Data length [bytes]: 0
    [Request in: 295]
    [Time from request: 0.001858000 seconds]
    Unused Setup Header
    Interval: 0
    Start frame: 0
    Copy of Transfer Flags: 0x00000000
    Number of ISO descriptors: 0
    [bInterfaceClass: Unknown (0xffff)]

No.     Time           Source                Destination           Protocol Length Info
    297 29.496033      host                  1.5.0                 USB      80     URB_CONTROL out

Frame 297: 80 bytes on wire (640 bits), 80 bytes captured (640 bits) on interface usbmon1, id 0
USB URB
    [Source: host]
    [Destination: 1.5.0]
    URB id: 0xffff993ecd78c840
    URB type: URB_SUBMIT ('S')
    URB transfer type: URB_CONTROL (0x02)
    Endpoint: 0x00, Direction: OUT
    Device: 5
    URB bus id: 1
    Device setup request: relevant ('\0')
    Data: present ('\0')
    URB sec: 1702353719
    URB usec: 938968
    URB status: Operation now in progress (-EINPROGRESS) (-115)
    URB length [bytes]: 16
    Data length [bytes]: 16
    [Response in: 298]
    Interval: 0
    Start frame: 0
    Copy of Transfer Flags: 0x00000000
    Number of ISO descriptors: 0
    [bInterfaceClass: Unknown (0xffff)]
Setup Data
    bmRequestType: 0x40
    bRequest: 160
    wValue: 0x0735
    wIndex: 0 (0x0000)
    wLength: 16
    Data Fragment: d0d03212011001ffffff40180f060000

No.     Time           Source                Destination           Protocol Length Info
    298 29.497883      1.5.0                 host                  USB      64     URB_CONTROL out

Frame 298: 64 bytes on wire (512 bits), 64 bytes captured (512 bits) on interface usbmon1, id 0
USB URB
    [Source: 1.5.0]
    [Destination: host]
    URB id: 0xffff993ecd78c840
    URB type: URB_COMPLETE ('C')
    URB transfer type: URB_CONTROL (0x02)
    Endpoint: 0x00, Direction: OUT
    Device: 5
    URB bus id: 1
    Device setup request: not relevant ('-')
    Data: not present ('>')
    URB sec: 1702353719
    URB usec: 940818
    URB status: Success (0)
    URB length [bytes]: 16
    Data length [bytes]: 0
    [Request in: 297]
    [Time from request: 0.001850000 seconds]
    Unused Setup Header
    Interval: 0
    Start frame: 0
    Copy of Transfer Flags: 0x00000000
    Number of ISO descriptors: 0
    [bInterfaceClass: Unknown (0xffff)]

No.     Time           Source                Destination           Protocol Length Info
    299 29.500024      host                  1.5.0                 USB      80     URB_CONTROL out

Frame 299: 80 bytes on wire (640 bits), 80 bytes captured (640 bits) on interface usbmon1, id 0
USB URB
    [Source: host]
    [Destination: 1.5.0]
    URB id: 0xffff993ecd78c3c0
    URB type: URB_SUBMIT ('S')
    URB transfer type: URB_CONTROL (0x02)
    Endpoint: 0x00, Direction: OUT
    Device: 5
    URB bus id: 1
    Device setup request: relevant ('\0')
    Data: present ('\0')
    URB sec: 1702353719
    URB usec: 942959
    URB status: Operation now in progress (-EINPROGRESS) (-115)
    URB length [bytes]: 16
    Data length [bytes]: 16
    [Response in: 300]
    Interval: 0
    Start frame: 0
    Copy of Transfer Flags: 0x00000000
    Number of ISO descriptors: 0
    [bInterfaceClass: Unknown (0xffff)]
Setup Data
    bmRequestType: 0x40
    bRequest: 160
    wValue: 0x0745
    wIndex: 0 (0x0000)
    wLength: 16
    Data Fragment: 01010200010902350001010080320904

No.     Time           Source                Destination           Protocol Length Info
    300 29.501882      1.5.0                 host                  USB      64     URB_CONTROL out

Frame 300: 64 bytes on wire (512 bits), 64 bytes captured (512 bits) on interface usbmon1, id 0
USB URB
    [Source: 1.5.0]
    [Destination: host]
    URB id: 0xffff993ecd78c3c0
    URB type: URB_COMPLETE ('C')
    URB transfer type: URB_CONTROL (0x02)
    Endpoint: 0x00, Direction: OUT
    Device: 5
    URB bus id: 1
    Device setup request: not relevant ('-')
    Data: not present ('>')
    URB sec: 1702353719
    URB usec: 944817
    URB status: Success (0)
    URB length [bytes]: 16
    Data length [bytes]: 0
    [Request in: 299]
    [Time from request: 0.001858000 seconds]
    Unused Setup Header
    Interval: 0
    Start frame: 0
    Copy of Transfer Flags: 0x00000000
    Number of ISO descriptors: 0
    [bInterfaceClass: Unknown (0xffff)]

No.     Time           Source                Destination           Protocol Length Info
    301 29.504024      host                  1.5.0                 USB      80     URB_CONTROL out

Frame 301: 80 bytes on wire (640 bits), 80 bytes captured (640 bits) on interface usbmon1, id 0
USB URB
    [Source: host]
    [Destination: 1.5.0]
    URB id: 0xffff993ecd78cd80
    URB type: URB_SUBMIT ('S')
    URB transfer type: URB_CONTROL (0x02)
    Endpoint: 0x00, Direction: OUT
    Device: 5
    URB bus id: 1
    Device setup request: relevant ('\0')
    Data: present ('\0')
    URB sec: 1702353719
    URB usec: 946959
    URB status: Operation now in progress (-EINPROGRESS) (-115)
    URB length [bytes]: 16
    Data length [bytes]: 16
    [Response in: 302]
    Interval: 0
    Start frame: 0
    Copy of Transfer Flags: 0x00000000
    Number of ISO descriptors: 0
    [bInterfaceClass: Unknown (0xffff)]
Setup Data
    bmRequestType: 0x40
    bRequest: 160
    wValue: 0x0755
    wIndex: 0 (0x0000)
    wLength: 16
    Data Fragment: 000005ff000000070581031000000705

No.     Time           Source                Destination           Protocol Length Info
    302 29.505887      1.5.0                 host                  USB      64     URB_CONTROL out

Frame 302: 64 bytes on wire (512 bits), 64 bytes captured (512 bits) on interface usbmon1, id 0
USB URB
    [Source: 1.5.0]
    [Destination: host]
    URB id: 0xffff993ecd78cd80
    URB type: URB_COMPLETE ('C')
    URB transfer type: URB_CONTROL (0x02)
    Endpoint: 0x00, Direction: OUT
    Device: 5
    URB bus id: 1
    Device setup request: not relevant ('-')
    Data: not present ('>')
    URB sec: 1702353719
    URB usec: 948822
    URB status: Success (0)
    URB length [bytes]: 16
    Data length [bytes]: 0
    [Request in: 301]
    [Time from request: 0.001863000 seconds]
    Unused Setup Header
    Interval: 0
    Start frame: 0
    Copy of Transfer Flags: 0x00000000
    Number of ISO descriptors: 0
    [bInterfaceClass: Unknown (0xffff)]

No.     Time           Source                Destination           Protocol Length Info
    303 29.508021      host                  1.5.0                 USB      80     URB_CONTROL out

Frame 303: 80 bytes on wire (640 bits), 80 bytes captured (640 bits) on interface usbmon1, id 0
USB URB
    [Source: host]
    [Destination: 1.5.0]
    URB id: 0xffff993ecd78d980
    URB type: URB_SUBMIT ('S')
    URB transfer type: URB_CONTROL (0x02)
    Endpoint: 0x00, Direction: OUT
    Device: 5
    URB bus id: 1
    Device setup request: relevant ('\0')
    Data: present ('\0')
    URB sec: 1702353719
    URB usec: 950956
    URB status: Operation now in progress (-EINPROGRESS) (-115)
    URB length [bytes]: 16
    Data length [bytes]: 16
    [Response in: 304]
    Interval: 0
    Start frame: 0
    Copy of Transfer Flags: 0x00000000
    Number of ISO descriptors: 0
    [bInterfaceClass: Unknown (0xffff)]
Setup Data
    bmRequestType: 0x40
    bRequest: 160
    wValue: 0x0765
    wIndex: 0 (0x0000)
    wLength: 16
    Data Fragment: 82024000000705020240000007058402

No.     Time           Source                Destination           Protocol Length Info
    304 29.509884      1.5.0                 host                  USB      64     URB_CONTROL out

Frame 304: 64 bytes on wire (512 bits), 64 bytes captured (512 bits) on interface usbmon1, id 0
USB URB
    [Source: 1.5.0]
    [Destination: host]
    URB id: 0xffff993ecd78d980
    URB type: URB_COMPLETE ('C')
    URB transfer type: URB_CONTROL (0x02)
    Endpoint: 0x00, Direction: OUT
    Device: 5
    URB bus id: 1
    Device setup request: not relevant ('-')
    Data: not present ('>')
    URB sec: 1702353719
    URB usec: 952819
    URB status: Success (0)
    URB length [bytes]: 16
    Data length [bytes]: 0
    [Request in: 303]
    [Time from request: 0.001863000 seconds]
    Unused Setup Header
    Interval: 0
    Start frame: 0
    Copy of Transfer Flags: 0x00000000
    Number of ISO descriptors: 0
    [bInterfaceClass: Unknown (0xffff)]

No.     Time           Source                Destination           Protocol Length Info
    305 29.512026      host                  1.5.0                 USB      80     URB_CONTROL out

Frame 305: 80 bytes on wire (640 bits), 80 bytes captured (640 bits) on interface usbmon1, id 0
USB URB
    [Source: host]
    [Destination: 1.5.0]
    URB id: 0xffff993ecd78de00
    URB type: URB_SUBMIT ('S')
    URB transfer type: URB_CONTROL (0x02)
    Endpoint: 0x00, Direction: OUT
    Device: 5
    URB bus id: 1
    Device setup request: relevant ('\0')
    Data: present ('\0')
    URB sec: 1702353719
    URB usec: 954961
    URB status: Operation now in progress (-EINPROGRESS) (-115)
    URB length [bytes]: 16
    Data length [bytes]: 16
    [Response in: 306]
    Interval: 0
    Start frame: 0
    Copy of Transfer Flags: 0x00000000
    Number of ISO descriptors: 0
    [bInterfaceClass: Unknown (0xffff)]
Setup Data
    bmRequestType: 0x40
    bRequest: 160
    wValue: 0x0775
    wIndex: 0 (0x0000)
    wLength: 16
    Data Fragment: 40000007050402400000040309044a03

No.     Time           Source                Destination           Protocol Length Info
    306 29.513890      1.5.0                 host                  USB      64     URB_CONTROL out

Frame 306: 64 bytes on wire (512 bits), 64 bytes captured (512 bits) on interface usbmon1, id 0
USB URB
    [Source: 1.5.0]
    [Destination: host]
    URB id: 0xffff993ecd78de00
    URB type: URB_COMPLETE ('C')
    URB transfer type: URB_CONTROL (0x02)
    Endpoint: 0x00, Direction: OUT
    Device: 5
    URB bus id: 1
    Device setup request: not relevant ('-')
    Data: not present ('>')
    URB sec: 1702353719
    URB usec: 956825
    URB status: Success (0)
    URB length [bytes]: 16
    Data length [bytes]: 0
    [Request in: 305]
    [Time from request: 0.001864000 seconds]
    Unused Setup Header
    Interval: 0
    Start frame: 0
    Copy of Transfer Flags: 0x00000000
    Number of ISO descriptors: 0
    [bInterfaceClass: Unknown (0xffff)]

No.     Time           Source                Destination           Protocol Length Info
    307 29.516122      host                  1.5.0                 USB      80     URB_CONTROL out

Frame 307: 80 bytes on wire (640 bits), 80 bytes captured (640 bits) on interface usbmon1, id 0
USB URB
    [Source: host]
    [Destination: 1.5.0]
    URB id: 0xffff993ecd78c600
    URB type: URB_SUBMIT ('S')
    URB transfer type: URB_CONTROL (0x02)
    Endpoint: 0x00, Direction: OUT
    Device: 5
    URB bus id: 1
    Device setup request: relevant ('\0')
    Data: present ('\0')
    URB sec: 1702353719
    URB usec: 959057
    URB status: Operation now in progress (-EINPROGRESS) (-115)
    URB length [bytes]: 16
    Data length [bytes]: 16
    [Response in: 308]
    Interval: 0
    Start frame: 0
    Copy of Transfer Flags: 0x00000000
    Number of ISO descriptors: 0
    [bInterfaceClass: Unknown (0xffff)]
Setup Data
    bmRequestType: 0x40
    bRequest: 160
    wValue: 0x0785
    wIndex: 0 (0x0000)
    wLength: 16
    Data Fragment: 460069006e0067006500720020004c00

No.     Time           Source                Destination           Protocol Length Info
    308 29.517882      1.5.0                 host                  USB      64     URB_CONTROL out

Frame 308: 64 bytes on wire (512 bits), 64 bytes captured (512 bits) on interface usbmon1, id 0
USB URB
    [Source: 1.5.0]
    [Destination: host]
    URB id: 0xffff993ecd78c600
    URB type: URB_COMPLETE ('C')
    URB transfer type: URB_CONTROL (0x02)
    Endpoint: 0x00, Direction: OUT
    Device: 5
    URB bus id: 1
    Device setup request: not relevant ('-')
    Data: not present ('>')
    URB sec: 1702353719
    URB usec: 960817
    URB status: Success (0)
    URB length [bytes]: 16
    Data length [bytes]: 0
    [Request in: 307]
    [Time from request: 0.001760000 seconds]
    Unused Setup Header
    Interval: 0
    Start frame: 0
    Copy of Transfer Flags: 0x00000000
    Number of ISO descriptors: 0
    [bInterfaceClass: Unknown (0xffff)]

No.     Time           Source                Destination           Protocol Length Info
    309 29.520030      host                  1.5.0                 USB      80     URB_CONTROL out

Frame 309: 80 bytes on wire (640 bits), 80 bytes captured (640 bits) on interface usbmon1, id 0
USB URB
    [Source: host]
    [Destination: 1.5.0]
    URB id: 0xffff993ecd78c900
    URB type: URB_SUBMIT ('S')
    URB transfer type: URB_CONTROL (0x02)
    Endpoint: 0x00, Direction: OUT
    Device: 5
    URB bus id: 1
    Device setup request: relevant ('\0')
    Data: present ('\0')
    URB sec: 1702353719
    URB usec: 962965
    URB status: Operation now in progress (-EINPROGRESS) (-115)
    URB length [bytes]: 16
    Data length [bytes]: 16
    [Response in: 310]
    Interval: 0
    Start frame: 0
    Copy of Transfer Flags: 0x00000000
    Number of ISO descriptors: 0
    [bInterfaceClass: Unknown (0xffff)]
Setup Data
    bmRequestType: 0x40
    bRequest: 160
    wValue: 0x0795
    wIndex: 0 (0x0000)
    wLength: 16
    Data Fragment: 61006b0065007300200049006e007300

No.     Time           Source                Destination           Protocol Length Info
    310 29.521890      1.5.0                 host                  USB      64     URB_CONTROL out

Frame 310: 64 bytes on wire (512 bits), 64 bytes captured (512 bits) on interface usbmon1, id 0
USB URB
    [Source: 1.5.0]
    [Destination: host]
    URB id: 0xffff993ecd78c900
    URB type: URB_COMPLETE ('C')
    URB transfer type: URB_CONTROL (0x02)
    Endpoint: 0x00, Direction: OUT
    Device: 5
    URB bus id: 1
    Device setup request: not relevant ('-')
    Data: not present ('>')
    URB sec: 1702353719
    URB usec: 964825
    URB status: Success (0)
    URB length [bytes]: 16
    Data length [bytes]: 0
    [Request in: 309]
    [Time from request: 0.001860000 seconds]
    Unused Setup Header
    Interval: 0
    Start frame: 0
    Copy of Transfer Flags: 0x00000000
    Number of ISO descriptors: 0
    [bInterfaceClass: Unknown (0xffff)]

No.     Time           Source                Destination           Protocol Length Info
    311 29.524088      host                  1.5.0                 USB      80     URB_CONTROL out

Frame 311: 80 bytes on wire (640 bits), 80 bytes captured (640 bits) on interface usbmon1, id 0
USB URB
    [Source: host]
    [Destination: 1.5.0]
    URB id: 0xffff993ecd78c300
    URB type: URB_SUBMIT ('S')
    URB transfer type: URB_CONTROL (0x02)
    Endpoint: 0x00, Direction: OUT
    Device: 5
    URB bus id: 1
    Device setup request: relevant ('\0')
    Data: present ('\0')
    URB sec: 1702353719
    URB usec: 967023
    URB status: Operation now in progress (-EINPROGRESS) (-115)
    URB length [bytes]: 16
    Data length [bytes]: 16
    [Response in: 312]
    Interval: 0
    Start frame: 0
    Copy of Transfer Flags: 0x00000000
    Number of ISO descriptors: 0
    [bInterfaceClass: Unknown (0xffff)]
Setup Data
    bmRequestType: 0x40
    bRequest: 160
    wValue: 0x07a5
    wIndex: 0 (0x0000)
    wLength: 16
    Data Fragment: 7400720075006d0065006e0074006100

No.     Time           Source                Destination           Protocol Length Info
    312 29.525883      1.5.0                 host                  USB      64     URB_CONTROL out

Frame 312: 64 bytes on wire (512 bits), 64 bytes captured (512 bits) on interface usbmon1, id 0
USB URB
    [Source: 1.5.0]
    [Destination: host]
    URB id: 0xffff993ecd78c300
    URB type: URB_COMPLETE ('C')
    URB transfer type: URB_CONTROL (0x02)
    Endpoint: 0x00, Direction: OUT
    Device: 5
    URB bus id: 1
    Device setup request: not relevant ('-')
    Data: not present ('>')
    URB sec: 1702353719
    URB usec: 968818
    URB status: Success (0)
    URB length [bytes]: 16
    Data length [bytes]: 0
    [Request in: 311]
    [Time from request: 0.001795000 seconds]
    Unused Setup Header
    Interval: 0
    Start frame: 0
    Copy of Transfer Flags: 0x00000000
    Number of ISO descriptors: 0
    [bInterfaceClass: Unknown (0xffff)]

No.     Time           Source                Destination           Protocol Length Info
    313 29.528087      host                  1.5.0                 USB      80     URB_CONTROL out

Frame 313: 80 bytes on wire (640 bits), 80 bytes captured (640 bits) on interface usbmon1, id 0
USB URB
    [Source: host]
    [Destination: 1.5.0]
    URB id: 0xffff993ecd78c780
    URB type: URB_SUBMIT ('S')
    URB transfer type: URB_CONTROL (0x02)
    Endpoint: 0x00, Direction: OUT
    Device: 5
    URB bus id: 1
    Device setup request: relevant ('\0')
    Data: present ('\0')
    URB sec: 1702353719
    URB usec: 971022
    URB status: Operation now in progress (-EINPROGRESS) (-115)
    URB length [bytes]: 16
    Data length [bytes]: 16
    [Response in: 314]
    Interval: 0
    Start frame: 0
    Copy of Transfer Flags: 0x00000000
    Number of ISO descriptors: 0
    [bInterfaceClass: Unknown (0xffff)]
Setup Data
    bmRequestType: 0x40
    bRequest: 160
    wValue: 0x07b5
    wIndex: 0 (0x0000)
    wLength: 16
    Data Fragment: 740069006f006e002c0020004c002e00

No.     Time           Source                Destination           Protocol Length Info
    314 29.529886      1.5.0                 host                  USB      64     URB_CONTROL out

Frame 314: 64 bytes on wire (512 bits), 64 bytes captured (512 bits) on interface usbmon1, id 0
USB URB
    [Source: 1.5.0]
    [Destination: host]
    URB id: 0xffff993ecd78c780
    URB type: URB_COMPLETE ('C')
    URB transfer type: URB_CONTROL (0x02)
    Endpoint: 0x00, Direction: OUT
    Device: 5
    URB bus id: 1
    Device setup request: not relevant ('-')
    Data: not present ('>')
    URB sec: 1702353719
    URB usec: 972821
    URB status: Success (0)
    URB length [bytes]: 16
    Data length [bytes]: 0
    [Request in: 313]
    [Time from request: 0.001799000 seconds]
    Unused Setup Header
    Interval: 0
    Start frame: 0
    Copy of Transfer Flags: 0x00000000
    Number of ISO descriptors: 0
    [bInterfaceClass: Unknown (0xffff)]

No.     Time           Source                Destination           Protocol Length Info
    315 29.532089      host                  1.5.0                 USB      80     URB_CONTROL out

Frame 315: 80 bytes on wire (640 bits), 80 bytes captured (640 bits) on interface usbmon1, id 0
USB URB
    [Source: host]
    [Destination: 1.5.0]
    URB id: 0xffff993ecd78d380
    URB type: URB_SUBMIT ('S')
    URB transfer type: URB_CONTROL (0x02)
    Endpoint: 0x00, Direction: OUT
    Device: 5
    URB bus id: 1
    Device setup request: relevant ('\0')
    Data: present ('\0')
    URB sec: 1702353719
    URB usec: 975024
    URB status: Operation now in progress (-EINPROGRESS) (-115)
    URB length [bytes]: 16
    Data length [bytes]: 16
    [Response in: 316]
    Interval: 0
    Start frame: 0
    Copy of Transfer Flags: 0x00000000
    Number of ISO descriptors: 0
    [bInterfaceClass: Unknown (0xffff)]
Setup Data
    bmRequestType: 0x40
    bRequest: 160
    wValue: 0x07c5
    wIndex: 0 (0x0000)
    wLength: 16
    Data Fragment: 4c002e0043002e002e0346004c004900

No.     Time           Source                Destination           Protocol Length Info
    316 29.533883      1.5.0                 host                  USB      64     URB_CONTROL out

Frame 316: 64 bytes on wire (512 bits), 64 bytes captured (512 bits) on interface usbmon1, id 0
USB URB
    [Source: 1.5.0]
    [Destination: host]
    URB id: 0xffff993ecd78d380
    URB type: URB_COMPLETE ('C')
    URB transfer type: URB_CONTROL (0x02)
    Endpoint: 0x00, Direction: OUT
    Device: 5
    URB bus id: 1
    Device setup request: not relevant ('-')
    Data: not present ('>')
    URB sec: 1702353719
    URB usec: 976818
    URB status: Success (0)
    URB length [bytes]: 16
    Data length [bytes]: 0
    [Request in: 315]
    [Time from request: 0.001794000 seconds]
    Unused Setup Header
    Interval: 0
    Start frame: 0
    Copy of Transfer Flags: 0x00000000
    Number of ISO descriptors: 0
    [bInterfaceClass: Unknown (0xffff)]

No.     Time           Source                Destination           Protocol Length Info
    317 29.536086      host                  1.5.0                 USB      80     URB_CONTROL out

Frame 317: 80 bytes on wire (640 bits), 80 bytes captured (640 bits) on interface usbmon1, id 0
USB URB
    [Source: host]
    [Destination: 1.5.0]
    URB id: 0xffff993ecd78ca80
    URB type: URB_SUBMIT ('S')
    URB transfer type: URB_CONTROL (0x02)
    Endpoint: 0x00, Direction: OUT
    Device: 5
    URB bus id: 1
    Device setup request: relevant ('\0')
    Data: present ('\0')
    URB sec: 1702353719
    URB usec: 979021
    URB status: Operation now in progress (-EINPROGRESS) (-115)
    URB length [bytes]: 16
    Data length [bytes]: 16
    [Response in: 318]
    Interval: 0
    Start frame: 0
    Copy of Transfer Flags: 0x00000000
    Number of ISO descriptors: 0
    [bInterfaceClass: Unknown (0xffff)]
Setup Data
    bmRequestType: 0x40
    bRequest: 160
    wValue: 0x07d5
    wIndex: 0 (0x0000)
    wLength: 16
    Data Fragment: 20005500530042002000530074006500

No.     Time           Source                Destination           Protocol Length Info
    318 29.537893      1.5.0                 host                  USB      64     URB_CONTROL out

Frame 318: 64 bytes on wire (512 bits), 64 bytes captured (512 bits) on interface usbmon1, id 0
USB URB
    [Source: 1.5.0]
    [Destination: host]
    URB id: 0xffff993ecd78ca80
    URB type: URB_COMPLETE ('C')
    URB transfer type: URB_CONTROL (0x02)
    Endpoint: 0x00, Direction: OUT
    Device: 5
    URB bus id: 1
    Device setup request: not relevant ('-')
    Data: not present ('>')
    URB sec: 1702353719
    URB usec: 980828
    URB status: Success (0)
    URB length [bytes]: 16
    Data length [bytes]: 0
    [Request in: 317]
    [Time from request: 0.001807000 seconds]
    Unused Setup Header
    Interval: 0
    Start frame: 0
    Copy of Transfer Flags: 0x00000000
    Number of ISO descriptors: 0
    [bInterfaceClass: Unknown (0xffff)]

No.     Time           Source                Destination           Protocol Length Info
    319 29.543106      host                  1.5.0                 USB      80     URB_CONTROL out

Frame 319: 80 bytes on wire (640 bits), 80 bytes captured (640 bits) on interface usbmon1, id 0
USB URB
    [Source: host]
    [Destination: 1.5.0]
    URB id: 0xffff993ecd78c480
    URB type: URB_SUBMIT ('S')
    URB transfer type: URB_CONTROL (0x02)
    Endpoint: 0x00, Direction: OUT
    Device: 5
    URB bus id: 1
    Device setup request: relevant ('\0')
    Data: present ('\0')
    URB sec: 1702353719
    URB usec: 986041
    URB status: Operation now in progress (-EINPROGRESS) (-115)
    URB length [bytes]: 16
    Data length [bytes]: 16
    [Response in: 320]
    Interval: 0
    Start frame: 0
    Copy of Transfer Flags: 0x00000000
    Number of ISO descriptors: 0
    [bInterfaceClass: Unknown (0xffff)]
Setup Data
    bmRequestType: 0x40
    bRequest: 160
    wValue: 0x07e5
    wIndex: 0 (0x0000)
    wLength: 16
    Data Fragment: 70007000650072002000440065007600

No.     Time           Source                Destination           Protocol Length Info
    320 29.544886      1.5.0                 host                  USB      64     URB_CONTROL out

Frame 320: 64 bytes on wire (512 bits), 64 bytes captured (512 bits) on interface usbmon1, id 0
USB URB
    [Source: 1.5.0]
    [Destination: host]
    URB id: 0xffff993ecd78c480
    URB type: URB_COMPLETE ('C')
    URB transfer type: URB_CONTROL (0x02)
    Endpoint: 0x00, Direction: OUT
    Device: 5
    URB bus id: 1
    Device setup request: not relevant ('-')
    Data: not present ('>')
    URB sec: 1702353719
    URB usec: 987821
    URB status: Success (0)
    URB length [bytes]: 16
    Data length [bytes]: 0
    [Request in: 319]
    [Time from request: 0.001780000 seconds]
    Unused Setup Header
    Interval: 0
    Start frame: 0
    Copy of Transfer Flags: 0x00000000
    Number of ISO descriptors: 0
    [bInterfaceClass: Unknown (0xffff)]

No.     Time           Source                Destination           Protocol Length Info
    321 29.547077      host                  1.5.0                 USB      80     URB_CONTROL out

Frame 321: 80 bytes on wire (640 bits), 80 bytes captured (640 bits) on interface usbmon1, id 0
USB URB
    [Source: host]
    [Destination: 1.5.0]
    URB id: 0xffff993ecd78c240
    URB type: URB_SUBMIT ('S')
    URB transfer type: URB_CONTROL (0x02)
    Endpoint: 0x00, Direction: OUT
    Device: 5
    URB bus id: 1
    Device setup request: relevant ('\0')
    Data: present ('\0')
    URB sec: 1702353719
    URB usec: 990012
    URB status: Operation now in progress (-EINPROGRESS) (-115)
    URB length [bytes]: 16
    Data length [bytes]: 16
    [Response in: 322]
    Interval: 0
    Start frame: 0
    Copy of Transfer Flags: 0x00000000
    Number of ISO descriptors: 0
    [bInterfaceClass: Unknown (0xffff)]
Setup Data
    bmRequestType: 0x40
    bRequest: 160
    wValue: 0x07f5
    wIndex: 0 (0x0000)
    wLength: 16
    Data Fragment: 690063006500200346004c0049002000

No.     Time           Source                Destination           Protocol Length Info
    322 29.548888      1.5.0                 host                  USB      64     URB_CONTROL out

Frame 322: 64 bytes on wire (512 bits), 64 bytes captured (512 bits) on interface usbmon1, id 0
USB URB
    [Source: 1.5.0]
    [Destination: host]
    URB id: 0xffff993ecd78c240
    URB type: URB_COMPLETE ('C')
    URB transfer type: URB_CONTROL (0x02)
    Endpoint: 0x00, Direction: OUT
    Device: 5
    URB bus id: 1
    Device setup request: not relevant ('-')
    Data: not present ('>')
    URB sec: 1702353719
    URB usec: 991823
    URB status: Success (0)
    URB length [bytes]: 16
    Data length [bytes]: 0
    [Request in: 321]
    [Time from request: 0.001811000 seconds]
    Unused Setup Header
    Interval: 0
    Start frame: 0
    Copy of Transfer Flags: 0x00000000
    Number of ISO descriptors: 0
    [bInterfaceClass: Unknown (0xffff)]

No.     Time           Source                Destination           Protocol Length Info
    323 29.551083      host                  1.5.0                 USB      80     URB_CONTROL out

Frame 323: 80 bytes on wire (640 bits), 80 bytes captured (640 bits) on interface usbmon1, id 0
USB URB
    [Source: host]
    [Destination: 1.5.0]
    URB id: 0xffff993ecd78c0c0
    URB type: URB_SUBMIT ('S')
    URB transfer type: URB_CONTROL (0x02)
    Endpoint: 0x00, Direction: OUT
    Device: 5
    URB bus id: 1
    Device setup request: relevant ('\0')
    Data: present ('\0')
    URB sec: 1702353719
    URB usec: 994018
    URB status: Operation now in progress (-EINPROGRESS) (-115)
    URB length [bytes]: 16
    Data length [bytes]: 16
    [Response in: 324]
    Interval: 0
    Start frame: 0
    Copy of Transfer Flags: 0x00000000
    Number of ISO descriptors: 0
    [bInterfaceClass: Unknown (0xffff)]
Setup Data
    bmRequestType: 0x40
    bRequest: 160
    wValue: 0x0805
    wIndex: 0 (0x0000)
    wLength: 16
    Data Fragment: 550053004200200046006f0063007500

No.     Time           Source                Destination           Protocol Length Info
    324 29.552891      1.5.0                 host                  USB      64     URB_CONTROL out

Frame 324: 64 bytes on wire (512 bits), 64 bytes captured (512 bits) on interface usbmon1, id 0
USB URB
    [Source: 1.5.0]
    [Destination: host]
    URB id: 0xffff993ecd78c0c0
    URB type: URB_COMPLETE ('C')
    URB transfer type: URB_CONTROL (0x02)
    Endpoint: 0x00, Direction: OUT
    Device: 5
    URB bus id: 1
    Device setup request: not relevant ('-')
    Data: not present ('>')
    URB sec: 1702353719
    URB usec: 995826
    URB status: Success (0)
    URB length [bytes]: 16
    Data length [bytes]: 0
    [Request in: 323]
    [Time from request: 0.001808000 seconds]
    Unused Setup Header
    Interval: 0
    Start frame: 0
    Copy of Transfer Flags: 0x00000000
    Number of ISO descriptors: 0
    [bInterfaceClass: Unknown (0xffff)]

No.     Time           Source                Destination           Protocol Length Info
    325 29.555091      host                  1.5.0                 USB      80     URB_CONTROL out

Frame 325: 80 bytes on wire (640 bits), 80 bytes captured (640 bits) on interface usbmon1, id 0
USB URB
    [Source: host]
    [Destination: 1.5.0]
    URB id: 0xffff993ecd78ce40
    URB type: URB_SUBMIT ('S')
    URB transfer type: URB_CONTROL (0x02)
    Endpoint: 0x00, Direction: OUT
    Device: 5
    URB bus id: 1
    Device setup request: relevant ('\0')
    Data: present ('\0')
    URB sec: 1702353719
    URB usec: 998026
    URB status: Operation now in progress (-EINPROGRESS) (-115)
    URB length [bytes]: 16
    Data length [bytes]: 16
    [Response in: 326]
    Interval: 0
    Start frame: 0
    Copy of Transfer Flags: 0x00000000
    Number of ISO descriptors: 0
    [bInterfaceClass: Unknown (0xffff)]
Setup Data
    bmRequestType: 0x40
    bRequest: 160
    wValue: 0x0815
    wIndex: 0 (0x0000)
    wLength: 16
    Data Fragment: 7300650072002a0346004c0049002000

No.     Time           Source                Destination           Protocol Length Info
    326 29.556891      1.5.0                 host                  USB      64     URB_CONTROL out

Frame 326: 64 bytes on wire (512 bits), 64 bytes captured (512 bits) on interface usbmon1, id 0
USB URB
    [Source: 1.5.0]
    [Destination: host]
    URB id: 0xffff993ecd78ce40
    URB type: URB_COMPLETE ('C')
    URB transfer type: URB_CONTROL (0x02)
    Endpoint: 0x00, Direction: OUT
    Device: 5
    URB bus id: 1
    Device setup request: not relevant ('-')
    Data: not present ('>')
    URB sec: 1702353719
    URB usec: 999826
    URB status: Success (0)
    URB length [bytes]: 16
    Data length [bytes]: 0
    [Request in: 325]
    [Time from request: 0.001800000 seconds]
    Unused Setup Header
    Interval: 0
    Start frame: 0
    Copy of Transfer Flags: 0x00000000
    Number of ISO descriptors: 0
    [bInterfaceClass: Unknown (0xffff)]

No.     Time           Source                Destination           Protocol Length Info
    327 29.559119      host                  1.5.0                 USB      80     URB_CONTROL out

Frame 327: 80 bytes on wire (640 bits), 80 bytes captured (640 bits) on interface usbmon1, id 0
USB URB
    [Source: host]
    [Destination: 1.5.0]
    URB id: 0xffff993ecd78d740
    URB type: URB_SUBMIT ('S')
    URB transfer type: URB_CONTROL (0x02)
    Endpoint: 0x00, Direction: OUT
    Device: 5
    URB bus id: 1
    Device setup request: relevant ('\0')
    Data: present ('\0')
    URB sec: 1702353720
    URB usec: 2054
    URB status: Operation now in progress (-EINPROGRESS) (-115)
    URB length [bytes]: 16
    Data length [bytes]: 16
    [Response in: 328]
    Interval: 0
    Start frame: 0
    Copy of Transfer Flags: 0x00000000
    Number of ISO descriptors: 0
    [bInterfaceClass: Unknown (0xffff)]
Setup Data
    bmRequestType: 0x40
    bRequest: 160
    wValue: 0x0825
    wIndex: 0 (0x0000)
    wLength: 16
    Data Fragment: 5500530042002000460069006c007400

No.     Time           Source                Destination           Protocol Length Info
    328 29.560907      1.5.0                 host                  USB      64     URB_CONTROL out

Frame 328: 64 bytes on wire (512 bits), 64 bytes captured (512 bits) on interface usbmon1, id 0
USB URB
    [Source: 1.5.0]
    [Destination: host]
    URB id: 0xffff993ecd78d740
    URB type: URB_COMPLETE ('C')
    URB transfer type: URB_CONTROL (0x02)
    Endpoint: 0x00, Direction: OUT
    Device: 5
    URB bus id: 1
    Device setup request: not relevant ('-')
    Data: not present ('>')
    URB sec: 1702353720
    URB usec: 3842
    URB status: Success (0)
    URB length [bytes]: 16
    Data length [bytes]: 0
    [Request in: 327]
    [Time from request: 0.001788000 seconds]
    Unused Setup Header
    Interval: 0
    Start frame: 0
    Copy of Transfer Flags: 0x00000000
    Number of ISO descriptors: 0
    [bInterfaceClass: Unknown (0xffff)]

No.     Time           Source                Destination           Protocol Length Info
    329 29.563129      host                  1.5.0                 USB      80     URB_CONTROL out

Frame 329: 80 bytes on wire (640 bits), 80 bytes captured (640 bits) on interface usbmon1, id 0
USB URB
    [Source: host]
    [Destination: 1.5.0]
    URB id: 0xffff993ecd78dbc0
    URB type: URB_SUBMIT ('S')
    URB transfer type: URB_CONTROL (0x02)
    Endpoint: 0x00, Direction: OUT
    Device: 5
    URB bus id: 1
    Device setup request: relevant ('\0')
    Data: present ('\0')
    URB sec: 1702353720
    URB usec: 6064
    URB status: Operation now in progress (-EINPROGRESS) (-115)
    URB length [bytes]: 16
    Data length [bytes]: 16
    [Response in: 330]
    Interval: 0
    Start frame: 0
    Copy of Transfer Flags: 0x00000000
    Number of ISO descriptors: 0
    [bInterfaceClass: Unknown (0xffff)]
Setup Data
    bmRequestType: 0x40
    bRequest: 160
    wValue: 0x0835
    wIndex: 0 (0x0000)
    wLength: 16
    Data Fragment: 65007200200057006800650065006c00

No.     Time           Source                Destination           Protocol Length Info
    330 29.564888      1.5.0                 host                  USB      64     URB_CONTROL out

Frame 330: 64 bytes on wire (512 bits), 64 bytes captured (512 bits) on interface usbmon1, id 0
USB URB
    [Source: 1.5.0]
    [Destination: host]
    URB id: 0xffff993ecd78dbc0
    URB type: URB_COMPLETE ('C')
    URB transfer type: URB_CONTROL (0x02)
    Endpoint: 0x00, Direction: OUT
    Device: 5
    URB bus id: 1
    Device setup request: not relevant ('-')
    Data: not present ('>')
    URB sec: 1702353720
    URB usec: 7823
    URB status: Success (0)
    URB length [bytes]: 16
    Data length [bytes]: 0
    [Request in: 329]
    [Time from request: 0.001759000 seconds]
    Unused Setup Header
    Interval: 0
    Start frame: 0
    Copy of Transfer Flags: 0x00000000
    Number of ISO descriptors: 0
    [bInterfaceClass: Unknown (0xffff)]

No.     Time           Source                Destination           Protocol Length Info
    331 29.567188      host                  1.5.0                 USB      65     URB_CONTROL out

Frame 331: 65 bytes on wire (520 bits), 65 bytes captured (520 bits) on interface usbmon1, id 0
USB URB
    [Source: host]
    [Destination: 1.5.0]
    URB id: 0xffff993ecd78dc80
    URB type: URB_SUBMIT ('S')
    URB transfer type: URB_CONTROL (0x02)
    Endpoint: 0x00, Direction: OUT
    Device: 5
    URB bus id: 1
    Device setup request: relevant ('\0')
    Data: present ('\0')
    URB sec: 1702353720
    URB usec: 10123
    URB status: Operation now in progress (-EINPROGRESS) (-115)
    URB length [bytes]: 1
    Data length [bytes]: 1
    [Response in: 338]
    Interval: 0
    Start frame: 0
    Copy of Transfer Flags: 0x00000000
    Number of ISO descriptors: 0
    [bInterfaceClass: Unknown (0xffff)]
Setup Data
    bmRequestType: 0x40
    bRequest: 160
    wValue: 0x7f92
    wIndex: 0 (0x0000)
    wLength: 1
    Data Fragment: 00

No.     Time           Source                Destination           Protocol Length Info
    332 29.567903      1.1.1                 host                  USB      65     URB_INTERRUPT in

Frame 332: 65 bytes on wire (520 bits), 65 bytes captured (520 bits) on interface usbmon1, id 0
USB URB
    [Source: 1.1.1]
    [Destination: host]
    URB id: 0xffff993e410b7140
    URB type: URB_COMPLETE ('C')
    URB transfer type: URB_INTERRUPT (0x01)
    Endpoint: 0x81, Direction: IN
    Device: 1
    URB bus id: 1
    Device setup request: not relevant ('-')
    Data: present ('\0')
    URB sec: 1702353720
    URB usec: 10838
    URB status: Success (0)
    URB length [bytes]: 1
    Data length [bytes]: 1
    [bInterfaceClass: Hub (0x09)]
    Unused Setup Header
    Interval: 2048
    Start frame: 0
    Copy of Transfer Flags: 0x00000200, Dir IN
    Number of ISO descriptors: 0
Leftover Capture Data: 02

No.     Time           Source                Destination           Protocol Length Info
    333 29.567912      host                  1.1.1                 USB      64     URB_INTERRUPT in

Frame 333: 64 bytes on wire (512 bits), 64 bytes captured (512 bits) on interface usbmon1, id 0
USB URB
    [Source: host]
    [Destination: 1.1.1]
    URB id: 0xffff993e410b7140
    URB type: URB_SUBMIT ('S')
    URB transfer type: URB_INTERRUPT (0x01)
    Endpoint: 0x81, Direction: IN
    Device: 1
    URB bus id: 1
    Device setup request: not relevant ('-')
    Data: not present ('<')
    URB sec: 1702353720
    URB usec: 10847
    URB status: Operation now in progress (-EINPROGRESS) (-115)
    URB length [bytes]: 4
    Data length [bytes]: 0
    [Response in: 349]
    [bInterfaceClass: Hub (0x09)]
    Unused Setup Header
    Interval: 2048
    Start frame: 0
    Copy of Transfer Flags: 0x00000200, Dir IN
    Number of ISO descriptors: 0

No.     Time           Source                Destination           Protocol Length Info
    334 29.567922      host                  1.1.0                 USBHUB   64     GET_STATUS Request     [Port 1]

Frame 334: 64 bytes on wire (512 bits), 64 bytes captured (512 bits) on interface usbmon1, id 0
USB URB
    [Source: host]
    [Destination: 1.1.0]
    URB id: 0xffff993fc43735c0
    URB type: URB_SUBMIT ('S')
    URB transfer type: URB_CONTROL (0x02)
    Endpoint: 0x80, Direction: IN
    Device: 1
    URB bus id: 1
    Device setup request: relevant ('\0')
    Data: not present ('<')
    URB sec: 1702353720
    URB usec: 10857
    URB status: Operation now in progress (-EINPROGRESS) (-115)
    URB length [bytes]: 4
    Data length [bytes]: 0
    [Response in: 335]
    Interval: 0
    Start frame: 0
    Copy of Transfer Flags: 0x00000200, Dir IN
    Number of ISO descriptors: 0
    [bInterfaceClass: Unknown (0xffff)]
Setup Data
    bmRequestType: 0xa3
    bRequest: GET_STATUS (0x00)
    wValue: 0x0000
    wIndex: 1
    wLength: 4

No.     Time           Source                Destination           Protocol Length Info
    335 29.567929      1.1.0                 host                  USBHUB   68     GET_STATUS Response    [Port 1]

Frame 335: 68 bytes on wire (544 bits), 68 bytes captured (544 bits) on interface usbmon1, id 0
USB URB
    [Source: 1.1.0]
    [Destination: host]
    URB id: 0xffff993fc43735c0
    URB type: URB_COMPLETE ('C')
    URB transfer type: URB_CONTROL (0x02)
    Endpoint: 0x80, Direction: IN
    Device: 1
    URB bus id: 1
    Device setup request: not relevant ('-')
    Data: present ('\0')
    URB sec: 1702353720
    URB usec: 10864
    URB status: Success (0)
    URB length [bytes]: 4
    Data length [bytes]: 4
    [Request in: 334]
    [Time from request: 0.000007000 seconds]
    Unused Setup Header
    Interval: 0
    Start frame: 0
    Copy of Transfer Flags: 0x00000200, Dir IN
    Number of ISO descriptors: 0
    [bInterfaceClass: Unknown (0xffff)]
Port Status: 0x0100, PORT_POWER
Port Change: 0x0001, C_PORT_CONNECTION

No.     Time           Source                Destination           Protocol Length Info
    336 29.567934      host                  1.1.0                 USBHUB   64     CLEAR_FEATURE Request  [Port 1: C_PORT_CONNECTION]

Frame 336: 64 bytes on wire (512 bits), 64 bytes captured (512 bits) on interface usbmon1, id 0
USB URB
    [Source: host]
    [Destination: 1.1.0]
    URB id: 0xffff993fc43735c0
    URB type: URB_SUBMIT ('S')
    URB transfer type: URB_CONTROL (0x02)
    Endpoint: 0x00, Direction: OUT
    Device: 1
    URB bus id: 1
    Device setup request: relevant ('\0')
    Data: present ('\0')
    URB sec: 1702353720
    URB usec: 10869
    URB status: Operation now in progress (-EINPROGRESS) (-115)
    URB length [bytes]: 0
    Data length [bytes]: 0
    [Response in: 337]
    Interval: 0
    Start frame: 0
    Copy of Transfer Flags: 0x00000000
    Number of ISO descriptors: 0
    [bInterfaceClass: Unknown (0xffff)]
Setup Data
    bmRequestType: 0x23
    bRequest: CLEAR_FEATURE (0x01)
    wValue: 0x0010
    wIndex: 1
    wLength: 0

No.     Time           Source                Destination           Protocol Length Info
    337 29.567940      1.1.0                 host                  USBHUB   64     CLEAR_FEATURE Response [Port 1: C_PORT_CONNECTION]

Frame 337: 64 bytes on wire (512 bits), 64 bytes captured (512 bits) on interface usbmon1, id 0
USB URB
    [Source: 1.1.0]
    [Destination: host]
    URB id: 0xffff993fc43735c0
    URB type: URB_COMPLETE ('C')
    URB transfer type: URB_CONTROL (0x02)
    Endpoint: 0x00, Direction: OUT
    Device: 1
    URB bus id: 1
    Device setup request: not relevant ('-')
    Data: not present ('>')
    URB sec: 1702353720
    URB usec: 10875
    URB status: Success (0)
    URB length [bytes]: 0
    Data length [bytes]: 0
    [Request in: 336]
    [Time from request: 0.000006000 seconds]
    Unused Setup Header
    Interval: 0
    Start frame: 0
    Copy of Transfer Flags: 0x00000000
    Number of ISO descriptors: 0
    [bInterfaceClass: Unknown (0xffff)]

No.     Time           Source                Destination           Protocol Length Info
    338 29.568068      1.5.0                 host                  USB      64     URB_CONTROL out

Frame 338: 64 bytes on wire (512 bits), 64 bytes captured (512 bits) on interface usbmon1, id 0
USB URB
    [Source: 1.5.0]
    [Destination: host]
    URB id: 0xffff993ecd78dc80
    URB type: URB_COMPLETE ('C')
    URB transfer type: URB_CONTROL (0x02)
    Endpoint: 0x00, Direction: OUT
    Device: 5
    URB bus id: 1
    Device setup request: not relevant ('-')
    Data: not present ('>')
    URB sec: 1702353720
    URB usec: 11003
    URB status: Cannot send after transport endpoint shutdown (-ESHUTDOWN) (-108)
    URB length [bytes]: 1
    Data length [bytes]: 0
    [Request in: 331]
    [Time from request: 0.000880000 seconds]
    Unused Setup Header
    Interval: 0
    Start frame: 0
    Copy of Transfer Flags: 0x00000000
    Number of ISO descriptors: 0
    [bInterfaceClass: Unknown (0xffff)]

No.     Time           Source                Destination           Protocol Length Info
    339 29.568221      host                  1.1.0                 USBHUB   64     GET_STATUS Request     [Port 1]

Frame 339: 64 bytes on wire (512 bits), 64 bytes captured (512 bits) on interface usbmon1, id 0
USB URB
    [Source: host]
    [Destination: 1.1.0]
    URB id: 0xffff993fc43720c0
    URB type: URB_SUBMIT ('S')
    URB transfer type: URB_CONTROL (0x02)
    Endpoint: 0x80, Direction: IN
    Device: 1
    URB bus id: 1
    Device setup request: relevant ('\0')
    Data: not present ('<')
    URB sec: 1702353720
    URB usec: 11156
    URB status: Operation now in progress (-EINPROGRESS) (-115)
    URB length [bytes]: 4
    Data length [bytes]: 0
    [Response in: 340]
    Interval: 0
    Start frame: 0
    Copy of Transfer Flags: 0x00000200, Dir IN
    Number of ISO descriptors: 0
    [bInterfaceClass: Unknown (0xffff)]
Setup Data
    bmRequestType: 0xa3
    bRequest: GET_STATUS (0x00)
    wValue: 0x0000
    wIndex: 1
    wLength: 4

No.     Time           Source                Destination           Protocol Length Info
    340 29.568227      1.1.0                 host                  USBHUB   68     GET_STATUS Response    [Port 1]

Frame 340: 68 bytes on wire (544 bits), 68 bytes captured (544 bits) on interface usbmon1, id 0
USB URB
    [Source: 1.1.0]
    [Destination: host]
    URB id: 0xffff993fc43720c0
    URB type: URB_COMPLETE ('C')
    URB transfer type: URB_CONTROL (0x02)
    Endpoint: 0x80, Direction: IN
    Device: 1
    URB bus id: 1
    Device setup request: not relevant ('-')
    Data: present ('\0')
    URB sec: 1702353720
    URB usec: 11162
    URB status: Success (0)
    URB length [bytes]: 4
    Data length [bytes]: 4
    [Request in: 339]
    [Time from request: 0.000006000 seconds]
    Unused Setup Header
    Interval: 0
    Start frame: 0
    Copy of Transfer Flags: 0x00000200, Dir IN
    Number of ISO descriptors: 0
    [bInterfaceClass: Unknown (0xffff)]
Port Status: 0x0100, PORT_POWER
Port Change: 0x0000

No.     Time           Source                Destination           Protocol Length Info
    341 29.602955      host                  1.1.0                 USBHUB   64     GET_STATUS Request     [Port 1]

Frame 341: 64 bytes on wire (512 bits), 64 bytes captured (512 bits) on interface usbmon1, id 0
USB URB
    [Source: host]
    [Destination: 1.1.0]
    URB id: 0xffff993fc43720c0
    URB type: URB_SUBMIT ('S')
    URB transfer type: URB_CONTROL (0x02)
    Endpoint: 0x80, Direction: IN
    Device: 1
    URB bus id: 1
    Device setup request: relevant ('\0')
    Data: not present ('<')
    URB sec: 1702353720
    URB usec: 45890
    URB status: Operation now in progress (-EINPROGRESS) (-115)
    URB length [bytes]: 4
    Data length [bytes]: 0
    [Response in: 342]
    Interval: 0
    Start frame: 0
    Copy of Transfer Flags: 0x00000200, Dir IN
    Number of ISO descriptors: 0
    [bInterfaceClass: Unknown (0xffff)]
Setup Data
    bmRequestType: 0xa3
    bRequest: GET_STATUS (0x00)
    wValue: 0x0000
    wIndex: 1
    wLength: 4

No.     Time           Source                Destination           Protocol Length Info
    342 29.602970      1.1.0                 host                  USBHUB   68     GET_STATUS Response    [Port 1]

Frame 342: 68 bytes on wire (544 bits), 68 bytes captured (544 bits) on interface usbmon1, id 0
USB URB
    [Source: 1.1.0]
    [Destination: host]
    URB id: 0xffff993fc43720c0
    URB type: URB_COMPLETE ('C')
    URB transfer type: URB_CONTROL (0x02)
    Endpoint: 0x80, Direction: IN
    Device: 1
    URB bus id: 1
    Device setup request: not relevant ('-')
    Data: present ('\0')
    URB sec: 1702353720
    URB usec: 45905
    URB status: Success (0)
    URB length [bytes]: 4
    Data length [bytes]: 4
    [Request in: 341]
    [Time from request: 0.000015000 seconds]
    Unused Setup Header
    Interval: 0
    Start frame: 0
    Copy of Transfer Flags: 0x00000200, Dir IN
    Number of ISO descriptors: 0
    [bInterfaceClass: Unknown (0xffff)]
Port Status: 0x0100, PORT_POWER
Port Change: 0x0000

No.     Time           Source                Destination           Protocol Length Info
    343 29.638964      host                  1.1.0                 USBHUB   64     GET_STATUS Request     [Port 1]

Frame 343: 64 bytes on wire (512 bits), 64 bytes captured (512 bits) on interface usbmon1, id 0
USB URB
    [Source: host]
    [Destination: 1.1.0]
    URB id: 0xffff993fc43720c0
    URB type: URB_SUBMIT ('S')
    URB transfer type: URB_CONTROL (0x02)
    Endpoint: 0x80, Direction: IN
    Device: 1
    URB bus id: 1
    Device setup request: relevant ('\0')
    Data: not present ('<')
    URB sec: 1702353720
    URB usec: 81899
    URB status: Operation now in progress (-EINPROGRESS) (-115)
    URB length [bytes]: 4
    Data length [bytes]: 0
    [Response in: 344]
    Interval: 0
    Start frame: 0
    Copy of Transfer Flags: 0x00000200, Dir IN
    Number of ISO descriptors: 0
    [bInterfaceClass: Unknown (0xffff)]
Setup Data
    bmRequestType: 0xa3
    bRequest: GET_STATUS (0x00)
    wValue: 0x0000
    wIndex: 1
    wLength: 4

No.     Time           Source                Destination           Protocol Length Info
    344 29.638978      1.1.0                 host                  USBHUB   68     GET_STATUS Response    [Port 1]

Frame 344: 68 bytes on wire (544 bits), 68 bytes captured (544 bits) on interface usbmon1, id 0
USB URB
    [Source: 1.1.0]
    [Destination: host]
    URB id: 0xffff993fc43720c0
    URB type: URB_COMPLETE ('C')
    URB transfer type: URB_CONTROL (0x02)
    Endpoint: 0x80, Direction: IN
    Device: 1
    URB bus id: 1
    Device setup request: not relevant ('-')
    Data: present ('\0')
    URB sec: 1702353720
    URB usec: 81913
    URB status: Success (0)
    URB length [bytes]: 4
    Data length [bytes]: 4
    [Request in: 343]
    [Time from request: 0.000014000 seconds]
    Unused Setup Header
    Interval: 0
    Start frame: 0
    Copy of Transfer Flags: 0x00000200, Dir IN
    Number of ISO descriptors: 0
    [bInterfaceClass: Unknown (0xffff)]
Port Status: 0x0100, PORT_POWER
Port Change: 0x0000

No.     Time           Source                Destination           Protocol Length Info
    345 29.674959      host                  1.1.0                 USBHUB   64     GET_STATUS Request     [Port 1]

Frame 345: 64 bytes on wire (512 bits), 64 bytes captured (512 bits) on interface usbmon1, id 0
USB URB
    [Source: host]
    [Destination: 1.1.0]
    URB id: 0xffff993fc43720c0
    URB type: URB_SUBMIT ('S')
    URB transfer type: URB_CONTROL (0x02)
    Endpoint: 0x80, Direction: IN
    Device: 1
    URB bus id: 1
    Device setup request: relevant ('\0')
    Data: not present ('<')
    URB sec: 1702353720
    URB usec: 117894
    URB status: Operation now in progress (-EINPROGRESS) (-115)
    URB length [bytes]: 4
    Data length [bytes]: 0
    [Response in: 346]
    Interval: 0
    Start frame: 0
    Copy of Transfer Flags: 0x00000200, Dir IN
    Number of ISO descriptors: 0
    [bInterfaceClass: Unknown (0xffff)]
Setup Data
    bmRequestType: 0xa3
    bRequest: GET_STATUS (0x00)
    wValue: 0x0000
    wIndex: 1
    wLength: 4

No.     Time           Source                Destination           Protocol Length Info
    346 29.674969      1.1.0                 host                  USBHUB   68     GET_STATUS Response    [Port 1]

Frame 346: 68 bytes on wire (544 bits), 68 bytes captured (544 bits) on interface usbmon1, id 0
USB URB
    [Source: 1.1.0]
    [Destination: host]
    URB id: 0xffff993fc43720c0
    URB type: URB_COMPLETE ('C')
    URB transfer type: URB_CONTROL (0x02)
    Endpoint: 0x80, Direction: IN
    Device: 1
    URB bus id: 1
    Device setup request: not relevant ('-')
    Data: present ('\0')
    URB sec: 1702353720
    URB usec: 117904
    URB status: Success (0)
    URB length [bytes]: 4
    Data length [bytes]: 4
    [Request in: 345]
    [Time from request: 0.000010000 seconds]
    Unused Setup Header
    Interval: 0
    Start frame: 0
    Copy of Transfer Flags: 0x00000200, Dir IN
    Number of ISO descriptors: 0
    [bInterfaceClass: Unknown (0xffff)]
Port Status: 0x0100, PORT_POWER
Port Change: 0x0000

No.     Time           Source                Destination           Protocol Length Info
    347 29.714950      host                  1.1.0                 USBHUB   64     GET_STATUS Request     [Port 1]

Frame 347: 64 bytes on wire (512 bits), 64 bytes captured (512 bits) on interface usbmon1, id 0
USB URB
    [Source: host]
    [Destination: 1.1.0]
    URB id: 0xffff993fc43720c0
    URB type: URB_SUBMIT ('S')
    URB transfer type: URB_CONTROL (0x02)
    Endpoint: 0x80, Direction: IN
    Device: 1
    URB bus id: 1
    Device setup request: relevant ('\0')
    Data: not present ('<')
    URB sec: 1702353720
    URB usec: 157885
    URB status: Operation now in progress (-EINPROGRESS) (-115)
    URB length [bytes]: 4
    Data length [bytes]: 0
    [Response in: 348]
    Interval: 0
    Start frame: 0
    Copy of Transfer Flags: 0x00000200, Dir IN
    Number of ISO descriptors: 0
    [bInterfaceClass: Unknown (0xffff)]
Setup Data
    bmRequestType: 0xa3
    bRequest: GET_STATUS (0x00)
    wValue: 0x0000
    wIndex: 1
    wLength: 4

No.     Time           Source                Destination           Protocol Length Info
    348 29.714960      1.1.0                 host                  USBHUB   68     GET_STATUS Response    [Port 1]

Frame 348: 68 bytes on wire (544 bits), 68 bytes captured (544 bits) on interface usbmon1, id 0
USB URB
    [Source: 1.1.0]
    [Destination: host]
    URB id: 0xffff993fc43720c0
    URB type: URB_COMPLETE ('C')
    URB transfer type: URB_CONTROL (0x02)
    Endpoint: 0x80, Direction: IN
    Device: 1
    URB bus id: 1
    Device setup request: not relevant ('-')
    Data: present ('\0')
    URB sec: 1702353720
    URB usec: 157895
    URB status: Success (0)
    URB length [bytes]: 4
    Data length [bytes]: 4
    [Request in: 347]
    [Time from request: 0.000010000 seconds]
    Unused Setup Header
    Interval: 0
    Start frame: 0
    Copy of Transfer Flags: 0x00000200, Dir IN
    Number of ISO descriptors: 0
    [bInterfaceClass: Unknown (0xffff)]
Port Status: 0x0100, PORT_POWER
Port Change: 0x0000

No.     Time           Source                Destination           Protocol Length Info
    349 29.714983      1.1.1                 host                  USB      64     URB_INTERRUPT in

Frame 349: 64 bytes on wire (512 bits), 64 bytes captured (512 bits) on interface usbmon1, id 0
USB URB
    [Source: 1.1.1]
    [Destination: host]
    URB id: 0xffff993e410b7140
    URB type: URB_COMPLETE ('C')
    URB transfer type: URB_INTERRUPT (0x01)
    Endpoint: 0x81, Direction: IN
    Device: 1
    URB bus id: 1
    Device setup request: not relevant ('-')
    Data: present ('\0')
    URB sec: 1702353720
    URB usec: 157918
    URB status: No such file or directory (-ENOENT) (-2)
    URB length [bytes]: 0
    Data length [bytes]: 0
    [Request in: 333]
    [Time from request: 0.147071000 seconds]
    [bInterfaceClass: Hub (0x09)]
    Unused Setup Header
    Interval: 2048
    Start frame: 0
    Copy of Transfer Flags: 0x00000200, Dir IN
    Number of ISO descriptors: 0

No.     Time           Source                Destination           Protocol Length Info
    350 29.770216      host                  1.1.0                 USBHUB   64     GET_STATUS Request     [Port 1]

Frame 350: 64 bytes on wire (512 bits), 64 bytes captured (512 bits) on interface usbmon1, id 0
USB URB
    [Source: host]
    [Destination: 1.1.0]
    URB id: 0xffff993fc43720c0
    URB type: URB_SUBMIT ('S')
    URB transfer type: URB_CONTROL (0x02)
    Endpoint: 0x80, Direction: IN
    Device: 1
    URB bus id: 1
    Device setup request: relevant ('\0')
    Data: not present ('<')
    URB sec: 1702353720
    URB usec: 213151
    URB status: Operation now in progress (-EINPROGRESS) (-115)
    URB length [bytes]: 4
    Data length [bytes]: 0
    [Response in: 351]
    Interval: 0
    Start frame: 0
    Copy of Transfer Flags: 0x00000200, Dir IN
    Number of ISO descriptors: 0
    [bInterfaceClass: Unknown (0xffff)]
Setup Data
    bmRequestType: 0xa3
    bRequest: GET_STATUS (0x00)
    wValue: 0x0000
    wIndex: 1
    wLength: 4

No.     Time           Source                Destination           Protocol Length Info
    351 29.770229      1.1.0                 host                  USBHUB   68     GET_STATUS Response    [Port 1]

Frame 351: 68 bytes on wire (544 bits), 68 bytes captured (544 bits) on interface usbmon1, id 0
USB URB
    [Source: 1.1.0]
    [Destination: host]
    URB id: 0xffff993fc43720c0
    URB type: URB_COMPLETE ('C')
    URB transfer type: URB_CONTROL (0x02)
    Endpoint: 0x80, Direction: IN
    Device: 1
    URB bus id: 1
    Device setup request: not relevant ('-')
    Data: present ('\0')
    URB sec: 1702353720
    URB usec: 213164
    URB status: Success (0)
    URB length [bytes]: 4
    Data length [bytes]: 4
    [Request in: 350]
    [Time from request: 0.000013000 seconds]
    Unused Setup Header
    Interval: 0
    Start frame: 0
    Copy of Transfer Flags: 0x00000200, Dir IN
    Number of ISO descriptors: 0
    [bInterfaceClass: Unknown (0xffff)]
Port Status: 0x0101, PORT_CONNECTION, PORT_POWER
Port Change: 0x0001, C_PORT_CONNECTION

No.     Time           Source                Destination           Protocol Length Info
    352 29.770240      host                  1.1.0                 USBHUB   64     CLEAR_FEATURE Request  [Port 1: C_PORT_CONNECTION]

Frame 352: 64 bytes on wire (512 bits), 64 bytes captured (512 bits) on interface usbmon1, id 0
USB URB
    [Source: host]
    [Destination: 1.1.0]
    URB id: 0xffff993fc43720c0
    URB type: URB_SUBMIT ('S')
    URB transfer type: URB_CONTROL (0x02)
    Endpoint: 0x00, Direction: OUT
    Device: 1
    URB bus id: 1
    Device setup request: relevant ('\0')
    Data: present ('\0')
    URB sec: 1702353720
    URB usec: 213175
    URB status: Operation now in progress (-EINPROGRESS) (-115)
    URB length [bytes]: 0
    Data length [bytes]: 0
    [Response in: 353]
    Interval: 0
    Start frame: 0
    Copy of Transfer Flags: 0x00000000
    Number of ISO descriptors: 0
    [bInterfaceClass: Unknown (0xffff)]
Setup Data
    bmRequestType: 0x23
    bRequest: CLEAR_FEATURE (0x01)
    wValue: 0x0010
    wIndex: 1
    wLength: 0

No.     Time           Source                Destination           Protocol Length Info
    353 29.770244      1.1.0                 host                  USBHUB   64     CLEAR_FEATURE Response [Port 1: C_PORT_CONNECTION]

Frame 353: 64 bytes on wire (512 bits), 64 bytes captured (512 bits) on interface usbmon1, id 0
USB URB
    [Source: 1.1.0]
    [Destination: host]
    URB id: 0xffff993fc43720c0
    URB type: URB_COMPLETE ('C')
    URB transfer type: URB_CONTROL (0x02)
    Endpoint: 0x00, Direction: OUT
    Device: 1
    URB bus id: 1
    Device setup request: not relevant ('-')
    Data: not present ('>')
    URB sec: 1702353720
    URB usec: 213179
    URB status: Success (0)
    URB length [bytes]: 0
    Data length [bytes]: 0
    [Request in: 352]
    [Time from request: 0.000004000 seconds]
    Unused Setup Header
    Interval: 0
    Start frame: 0
    Copy of Transfer Flags: 0x00000000
    Number of ISO descriptors: 0
    [bInterfaceClass: Unknown (0xffff)]

No.     Time           Source                Destination           Protocol Length Info
    354 29.770249      host                  1.1.0                 USBHUB   64     GET_STATUS Request     [Port 2]

Frame 354: 64 bytes on wire (512 bits), 64 bytes captured (512 bits) on interface usbmon1, id 0
USB URB
    [Source: host]
    [Destination: 1.1.0]
    URB id: 0xffff993fc43720c0
    URB type: URB_SUBMIT ('S')
    URB transfer type: URB_CONTROL (0x02)
    Endpoint: 0x80, Direction: IN
    Device: 1
    URB bus id: 1
    Device setup request: relevant ('\0')
    Data: not present ('<')
    URB sec: 1702353720
    URB usec: 213184
    URB status: Operation now in progress (-EINPROGRESS) (-115)
    URB length [bytes]: 4
    Data length [bytes]: 0
    [Response in: 355]
    Interval: 0
    Start frame: 0
    Copy of Transfer Flags: 0x00000200, Dir IN
    Number of ISO descriptors: 0
    [bInterfaceClass: Unknown (0xffff)]
Setup Data
    bmRequestType: 0xa3
    bRequest: GET_STATUS (0x00)
    wValue: 0x0000
    wIndex: 2
    wLength: 4

No.     Time           Source                Destination           Protocol Length Info
    355 29.770253      1.1.0                 host                  USBHUB   68     GET_STATUS Response    [Port 2]

Frame 355: 68 bytes on wire (544 bits), 68 bytes captured (544 bits) on interface usbmon1, id 0
USB URB
    [Source: 1.1.0]
    [Destination: host]
    URB id: 0xffff993fc43720c0
    URB type: URB_COMPLETE ('C')
    URB transfer type: URB_CONTROL (0x02)
    Endpoint: 0x80, Direction: IN
    Device: 1
    URB bus id: 1
    Device setup request: not relevant ('-')
    Data: present ('\0')
    URB sec: 1702353720
    URB usec: 213188
    URB status: Success (0)
    URB length [bytes]: 4
    Data length [bytes]: 4
    [Request in: 354]
    [Time from request: 0.000004000 seconds]
    Unused Setup Header
    Interval: 0
    Start frame: 0
    Copy of Transfer Flags: 0x00000200, Dir IN
    Number of ISO descriptors: 0
    [bInterfaceClass: Unknown (0xffff)]
Port Status: 0x0100, PORT_POWER
Port Change: 0x0000

No.     Time           Source                Destination           Protocol Length Info
    356 29.770257      host                  1.1.0                 USBHUB   64     GET_STATUS Request     [Port 3]

Frame 356: 64 bytes on wire (512 bits), 64 bytes captured (512 bits) on interface usbmon1, id 0
USB URB
    [Source: host]
    [Destination: 1.1.0]
    URB id: 0xffff993fc43720c0
    URB type: URB_SUBMIT ('S')
    URB transfer type: URB_CONTROL (0x02)
    Endpoint: 0x80, Direction: IN
    Device: 1
    URB bus id: 1
    Device setup request: relevant ('\0')
    Data: not present ('<')
    URB sec: 1702353720
    URB usec: 213192
    URB status: Operation now in progress (-EINPROGRESS) (-115)
    URB length [bytes]: 4
    Data length [bytes]: 0
    [Response in: 357]
    Interval: 0
    Start frame: 0
    Copy of Transfer Flags: 0x00000200, Dir IN
    Number of ISO descriptors: 0
    [bInterfaceClass: Unknown (0xffff)]
Setup Data
    bmRequestType: 0xa3
    bRequest: GET_STATUS (0x00)
    wValue: 0x0000
    wIndex: 3
    wLength: 4

No.     Time           Source                Destination           Protocol Length Info
    357 29.770261      1.1.0                 host                  USBHUB   68     GET_STATUS Response    [Port 3]

Frame 357: 68 bytes on wire (544 bits), 68 bytes captured (544 bits) on interface usbmon1, id 0
USB URB
    [Source: 1.1.0]
    [Destination: host]
    URB id: 0xffff993fc43720c0
    URB type: URB_COMPLETE ('C')
    URB transfer type: URB_CONTROL (0x02)
    Endpoint: 0x80, Direction: IN
    Device: 1
    URB bus id: 1
    Device setup request: not relevant ('-')
    Data: present ('\0')
    URB sec: 1702353720
    URB usec: 213196
    URB status: Success (0)
    URB length [bytes]: 4
    Data length [bytes]: 4
    [Request in: 356]
    [Time from request: 0.000004000 seconds]
    Unused Setup Header
    Interval: 0
    Start frame: 0
    Copy of Transfer Flags: 0x00000200, Dir IN
    Number of ISO descriptors: 0
    [bInterfaceClass: Unknown (0xffff)]
Port Status: 0x0100, PORT_POWER
Port Change: 0x0000

No.     Time           Source                Destination           Protocol Length Info
    358 29.770267      host                  1.1.0                 USBHUB   64     GET_STATUS Request     [Port 4]

Frame 358: 64 bytes on wire (512 bits), 64 bytes captured (512 bits) on interface usbmon1, id 0
USB URB
    [Source: host]
    [Destination: 1.1.0]
    URB id: 0xffff993fc43720c0
    URB type: URB_SUBMIT ('S')
    URB transfer type: URB_CONTROL (0x02)
    Endpoint: 0x80, Direction: IN
    Device: 1
    URB bus id: 1
    Device setup request: relevant ('\0')
    Data: not present ('<')
    URB sec: 1702353720
    URB usec: 213202
    URB status: Operation now in progress (-EINPROGRESS) (-115)
    URB length [bytes]: 4
    Data length [bytes]: 0
    [Response in: 359]
    Interval: 0
    Start frame: 0
    Copy of Transfer Flags: 0x00000200, Dir IN
    Number of ISO descriptors: 0
    [bInterfaceClass: Unknown (0xffff)]
Setup Data
    bmRequestType: 0xa3
    bRequest: GET_STATUS (0x00)
    wValue: 0x0000
    wIndex: 4
    wLength: 4

No.     Time           Source                Destination           Protocol Length Info
    359 29.770271      1.1.0                 host                  USBHUB   68     GET_STATUS Response    [Port 4]

Frame 359: 68 bytes on wire (544 bits), 68 bytes captured (544 bits) on interface usbmon1, id 0
USB URB
    [Source: 1.1.0]
    [Destination: host]
    URB id: 0xffff993fc43720c0
    URB type: URB_COMPLETE ('C')
    URB transfer type: URB_CONTROL (0x02)
    Endpoint: 0x80, Direction: IN
    Device: 1
    URB bus id: 1
    Device setup request: not relevant ('-')
    Data: present ('\0')
    URB sec: 1702353720
    URB usec: 213206
    URB status: Success (0)
    URB length [bytes]: 4
    Data length [bytes]: 4
    [Request in: 358]
    [Time from request: 0.000004000 seconds]
    Unused Setup Header
    Interval: 0
    Start frame: 0
    Copy of Transfer Flags: 0x00000200, Dir IN
    Number of ISO descriptors: 0
    [bInterfaceClass: Unknown (0xffff)]
Port Status: 0x0100, PORT_POWER
Port Change: 0x0000

No.     Time           Source                Destination           Protocol Length Info
    360 29.874955      host                  1.1.1                 USB      64     URB_INTERRUPT in

Frame 360: 64 bytes on wire (512 bits), 64 bytes captured (512 bits) on interface usbmon1, id 0
USB URB
    [Source: host]
    [Destination: 1.1.1]
    URB id: 0xffff993e410b7140
    URB type: URB_SUBMIT ('S')
    URB transfer type: URB_INTERRUPT (0x01)
    Endpoint: 0x81, Direction: IN
    Device: 1
    URB bus id: 1
    Device setup request: not relevant ('-')
    Data: not present ('<')
    URB sec: 1702353720
    URB usec: 317890
    URB status: Operation now in progress (-EINPROGRESS) (-115)
    URB length [bytes]: 4
    Data length [bytes]: 0
    [bInterfaceClass: Hub (0x09)]
    Unused Setup Header
    Interval: 2048
    Start frame: 0
    Copy of Transfer Flags: 0x00000200, Dir IN
    Number of ISO descriptors: 0

No.     Time           Source                Destination           Protocol Length Info
    361 29.874976      host                  1.1.0                 USBHUB   64     GET_STATUS Request     [Port 1]

Frame 361: 64 bytes on wire (512 bits), 64 bytes captured (512 bits) on interface usbmon1, id 0
USB URB
    [Source: host]
    [Destination: 1.1.0]
    URB id: 0xffff993fc43720c0
    URB type: URB_SUBMIT ('S')
    URB transfer type: URB_CONTROL (0x02)
    Endpoint: 0x80, Direction: IN
    Device: 1
    URB bus id: 1
    Device setup request: relevant ('\0')
    Data: not present ('<')
    URB sec: 1702353720
    URB usec: 317911
    URB status: Operation now in progress (-EINPROGRESS) (-115)
    URB length [bytes]: 4
    Data length [bytes]: 0
    [Response in: 362]
    Interval: 0
    Start frame: 0
    Copy of Transfer Flags: 0x00000200, Dir IN
    Number of ISO descriptors: 0
    [bInterfaceClass: Unknown (0xffff)]
Setup Data
    bmRequestType: 0xa3
    bRequest: GET_STATUS (0x00)
    wValue: 0x0000
    wIndex: 1
    wLength: 4

No.     Time           Source                Destination           Protocol Length Info
    362 29.874985      1.1.0                 host                  USBHUB   68     GET_STATUS Response    [Port 1]

Frame 362: 68 bytes on wire (544 bits), 68 bytes captured (544 bits) on interface usbmon1, id 0
USB URB
    [Source: 1.1.0]
    [Destination: host]
    URB id: 0xffff993fc43720c0
    URB type: URB_COMPLETE ('C')
    URB transfer type: URB_CONTROL (0x02)
    Endpoint: 0x80, Direction: IN
    Device: 1
    URB bus id: 1
    Device setup request: not relevant ('-')
    Data: present ('\0')
    URB sec: 1702353720
    URB usec: 317920
    URB status: Success (0)
    URB length [bytes]: 4
    Data length [bytes]: 4
    [Request in: 361]
    [Time from request: 0.000009000 seconds]
    Unused Setup Header
    Interval: 0
    Start frame: 0
    Copy of Transfer Flags: 0x00000200, Dir IN
    Number of ISO descriptors: 0
    [bInterfaceClass: Unknown (0xffff)]
Port Status: 0x0101, PORT_CONNECTION, PORT_POWER
Port Change: 0x0000

No.     Time           Source                Destination           Protocol Length Info
    363 29.875044      host                  1.1.0                 USBHUB   64     SET_FEATURE Request    [Port 1: PORT_RESET]

Frame 363: 64 bytes on wire (512 bits), 64 bytes captured (512 bits) on interface usbmon1, id 0
USB URB
    [Source: host]
    [Destination: 1.1.0]
    URB id: 0xffff993fc43720c0
    URB type: URB_SUBMIT ('S')
    URB transfer type: URB_CONTROL (0x02)
    Endpoint: 0x00, Direction: OUT
    Device: 1
    URB bus id: 1
    Device setup request: relevant ('\0')
    Data: present ('\0')
    URB sec: 1702353720
    URB usec: 317979
    URB status: Operation now in progress (-EINPROGRESS) (-115)
    URB length [bytes]: 0
    Data length [bytes]: 0
    [Response in: 364]
    Interval: 0
    Start frame: 0
    Copy of Transfer Flags: 0x00000000
    Number of ISO descriptors: 0
    [bInterfaceClass: Unknown (0xffff)]
Setup Data
    bmRequestType: 0x23
    bRequest: SET_FEATURE (0x03)
    wValue: 0x0004
    wIndex: 1
    wLength: 0

No.     Time           Source                Destination           Protocol Length Info
    364 29.875053      1.1.0                 host                  USBHUB   64     SET_FEATURE Response   [Port 1: PORT_RESET]

Frame 364: 64 bytes on wire (512 bits), 64 bytes captured (512 bits) on interface usbmon1, id 0
USB URB
    [Source: 1.1.0]
    [Destination: host]
    URB id: 0xffff993fc43720c0
    URB type: URB_COMPLETE ('C')
    URB transfer type: URB_CONTROL (0x02)
    Endpoint: 0x00, Direction: OUT
    Device: 1
    URB bus id: 1
    Device setup request: not relevant ('-')
    Data: not present ('>')
    URB sec: 1702353720
    URB usec: 317988
    URB status: Success (0)
    URB length [bytes]: 0
    Data length [bytes]: 0
    [Request in: 363]
    [Time from request: 0.000009000 seconds]
    Unused Setup Header
    Interval: 0
    Start frame: 0
    Copy of Transfer Flags: 0x00000000
    Number of ISO descriptors: 0
    [bInterfaceClass: Unknown (0xffff)]

No.     Time           Source                Destination           Protocol Length Info
    365 29.942967      host                  1.1.0                 USBHUB   64     GET_STATUS Request     [Port 1]

Frame 365: 64 bytes on wire (512 bits), 64 bytes captured (512 bits) on interface usbmon1, id 0
USB URB
    [Source: host]
    [Destination: 1.1.0]
    URB id: 0xffff993fc43720c0
    URB type: URB_SUBMIT ('S')
    URB transfer type: URB_CONTROL (0x02)
    Endpoint: 0x80, Direction: IN
    Device: 1
    URB bus id: 1
    Device setup request: relevant ('\0')
    Data: not present ('<')
    URB sec: 1702353720
    URB usec: 385902
    URB status: Operation now in progress (-EINPROGRESS) (-115)
    URB length [bytes]: 4
    Data length [bytes]: 0
    [Response in: 366]
    Interval: 0
    Start frame: 0
    Copy of Transfer Flags: 0x00000200, Dir IN
    Number of ISO descriptors: 0
    [bInterfaceClass: Unknown (0xffff)]
Setup Data
    bmRequestType: 0xa3
    bRequest: GET_STATUS (0x00)
    wValue: 0x0000
    wIndex: 1
    wLength: 4

No.     Time           Source                Destination           Protocol Length Info
    366 29.942983      1.1.0                 host                  USBHUB   68     GET_STATUS Response    [Port 1]

Frame 366: 68 bytes on wire (544 bits), 68 bytes captured (544 bits) on interface usbmon1, id 0
USB URB
    [Source: 1.1.0]
    [Destination: host]
    URB id: 0xffff993fc43720c0
    URB type: URB_COMPLETE ('C')
    URB transfer type: URB_CONTROL (0x02)
    Endpoint: 0x80, Direction: IN
    Device: 1
    URB bus id: 1
    Device setup request: not relevant ('-')
    Data: present ('\0')
    URB sec: 1702353720
    URB usec: 385918
    URB status: Success (0)
    URB length [bytes]: 4
    Data length [bytes]: 4
    [Request in: 365]
    [Time from request: 0.000016000 seconds]
    Unused Setup Header
    Interval: 0
    Start frame: 0
    Copy of Transfer Flags: 0x00000200, Dir IN
    Number of ISO descriptors: 0
    [bInterfaceClass: Unknown (0xffff)]
Port Status: 0x0103, PORT_CONNECTION, PORT_ENABLE, PORT_POWER
Port Change: 0x0010, C_PORT_RESET

No.     Time           Source                Destination           Protocol Length Info
    367 29.942991      host                  1.1.0                 USBHUB   64     CLEAR_FEATURE Request  [Port 1: C_PORT_RESET]

Frame 367: 64 bytes on wire (512 bits), 64 bytes captured (512 bits) on interface usbmon1, id 0
USB URB
    [Source: host]
    [Destination: 1.1.0]
    URB id: 0xffff993fc43720c0
    URB type: URB_SUBMIT ('S')
    URB transfer type: URB_CONTROL (0x02)
    Endpoint: 0x00, Direction: OUT
    Device: 1
    URB bus id: 1
    Device setup request: relevant ('\0')
    Data: present ('\0')
    URB sec: 1702353720
    URB usec: 385926
    URB status: Operation now in progress (-EINPROGRESS) (-115)
    URB length [bytes]: 0
    Data length [bytes]: 0
    [Response in: 368]
    Interval: 0
    Start frame: 0
    Copy of Transfer Flags: 0x00000000
    Number of ISO descriptors: 0
    [bInterfaceClass: Unknown (0xffff)]
Setup Data
    bmRequestType: 0x23
    bRequest: CLEAR_FEATURE (0x01)
    wValue: 0x0014
    wIndex: 1
    wLength: 0

No.     Time           Source                Destination           Protocol Length Info
    368 29.942997      1.1.0                 host                  USBHUB   64     CLEAR_FEATURE Response [Port 1: C_PORT_RESET]

Frame 368: 64 bytes on wire (512 bits), 64 bytes captured (512 bits) on interface usbmon1, id 0
USB URB
    [Source: 1.1.0]
    [Destination: host]
    URB id: 0xffff993fc43720c0
    URB type: URB_COMPLETE ('C')
    URB transfer type: URB_CONTROL (0x02)
    Endpoint: 0x00, Direction: OUT
    Device: 1
    URB bus id: 1
    Device setup request: not relevant ('-')
    Data: not present ('>')
    URB sec: 1702353720
    URB usec: 385932
    URB status: Success (0)
    URB length [bytes]: 0
    Data length [bytes]: 0
    [Request in: 367]
    [Time from request: 0.000006000 seconds]
    Unused Setup Header
    Interval: 0
    Start frame: 0
    Copy of Transfer Flags: 0x00000000
    Number of ISO descriptors: 0
    [bInterfaceClass: Unknown (0xffff)]

No.     Time           Source                Destination           Protocol Length Info
    369 30.003009      host                  1.0.0                 USB      64     GET DESCRIPTOR Request DEVICE

Frame 369: 64 bytes on wire (512 bits), 64 bytes captured (512 bits) on interface usbmon1, id 0
USB URB
    [Source: host]
    [Destination: 1.0.0]
    URB id: 0xffff993fc43720c0
    URB type: URB_SUBMIT ('S')
    URB transfer type: URB_CONTROL (0x02)
    Endpoint: 0x80, Direction: IN
    Device: 0
    URB bus id: 1
    Device setup request: relevant ('\0')
    Data: not present ('<')
    URB sec: 1702353720
    URB usec: 445944
    URB status: Operation now in progress (-EINPROGRESS) (-115)
    URB length [bytes]: 64
    Data length [bytes]: 0
    [Response in: 370]
    Interval: 0
    Start frame: 0
    Copy of Transfer Flags: 0x00000200, Dir IN
    Number of ISO descriptors: 0
Setup Data
    bmRequestType: 0x80
    bRequest: GET DESCRIPTOR (6)
    Descriptor Index: 0x00
    bDescriptorType: DEVICE (0x01)
    Language Id: no language specified (0x0000)
    wLength: 64

No.     Time           Source                Destination           Protocol Length Info
    370 30.004913      1.0.0                 host                  USB      82     GET DESCRIPTOR Response DEVICE

Frame 370: 82 bytes on wire (656 bits), 82 bytes captured (656 bits) on interface usbmon1, id 0
USB URB
    [Source: 1.0.0]
    [Destination: host]
    URB id: 0xffff993fc43720c0
    URB type: URB_COMPLETE ('C')
    URB transfer type: URB_CONTROL (0x02)
    Endpoint: 0x80, Direction: IN
    Device: 0
    URB bus id: 1
    Device setup request: not relevant ('-')
    Data: present ('\0')
    URB sec: 1702353720
    URB usec: 447848
    URB status: Success (0)
    URB length [bytes]: 18
    Data length [bytes]: 18
    [Request in: 369]
    [Time from request: 0.001904000 seconds]
    Unused Setup Header
    Interval: 0
    Start frame: 0
    Copy of Transfer Flags: 0x00000200, Dir IN
    Number of ISO descriptors: 0
DEVICE DESCRIPTOR

No.     Time           Source                Destination           Protocol Length Info
    371 30.004921      host                  1.1.0                 USBHUB   64     SET_FEATURE Request    [Port 1: PORT_RESET]

Frame 371: 64 bytes on wire (512 bits), 64 bytes captured (512 bits) on interface usbmon1, id 0
USB URB
    [Source: host]
    [Destination: 1.1.0]
    URB id: 0xffff993fc43720c0
    URB type: URB_SUBMIT ('S')
    URB transfer type: URB_CONTROL (0x02)
    Endpoint: 0x00, Direction: OUT
    Device: 1
    URB bus id: 1
    Device setup request: relevant ('\0')
    Data: present ('\0')
    URB sec: 1702353720
    URB usec: 447856
    URB status: Operation now in progress (-EINPROGRESS) (-115)
    URB length [bytes]: 0
    Data length [bytes]: 0
    [Response in: 372]
    Interval: 0
    Start frame: 0
    Copy of Transfer Flags: 0x00000000
    Number of ISO descriptors: 0
    [bInterfaceClass: Unknown (0xffff)]
Setup Data
    bmRequestType: 0x23
    bRequest: SET_FEATURE (0x03)
    wValue: 0x0004
    wIndex: 1
    wLength: 0

No.     Time           Source                Destination           Protocol Length Info
    372 30.004932      1.1.0                 host                  USBHUB   64     SET_FEATURE Response   [Port 1: PORT_RESET]

Frame 372: 64 bytes on wire (512 bits), 64 bytes captured (512 bits) on interface usbmon1, id 0
USB URB
    [Source: 1.1.0]
    [Destination: host]
    URB id: 0xffff993fc43720c0
    URB type: URB_COMPLETE ('C')
    URB transfer type: URB_CONTROL (0x02)
    Endpoint: 0x00, Direction: OUT
    Device: 1
    URB bus id: 1
    Device setup request: not relevant ('-')
    Data: not present ('>')
    URB sec: 1702353720
    URB usec: 447867
    URB status: Success (0)
    URB length [bytes]: 0
    Data length [bytes]: 0
    [Request in: 371]
    [Time from request: 0.000011000 seconds]
    Unused Setup Header
    Interval: 0
    Start frame: 0
    Copy of Transfer Flags: 0x00000000
    Number of ISO descriptors: 0
    [bInterfaceClass: Unknown (0xffff)]

No.     Time           Source                Destination           Protocol Length Info
    373 30.070957      host                  1.1.0                 USBHUB   64     GET_STATUS Request     [Port 1]

Frame 373: 64 bytes on wire (512 bits), 64 bytes captured (512 bits) on interface usbmon1, id 0
USB URB
    [Source: host]
    [Destination: 1.1.0]
    URB id: 0xffff993fc43720c0
    URB type: URB_SUBMIT ('S')
    URB transfer type: URB_CONTROL (0x02)
    Endpoint: 0x80, Direction: IN
    Device: 1
    URB bus id: 1
    Device setup request: relevant ('\0')
    Data: not present ('<')
    URB sec: 1702353720
    URB usec: 513892
    URB status: Operation now in progress (-EINPROGRESS) (-115)
    URB length [bytes]: 4
    Data length [bytes]: 0
    [Response in: 374]
    Interval: 0
    Start frame: 0
    Copy of Transfer Flags: 0x00000200, Dir IN
    Number of ISO descriptors: 0
    [bInterfaceClass: Unknown (0xffff)]
Setup Data
    bmRequestType: 0xa3
    bRequest: GET_STATUS (0x00)
    wValue: 0x0000
    wIndex: 1
    wLength: 4

No.     Time           Source                Destination           Protocol Length Info
    374 30.070973      1.1.0                 host                  USBHUB   68     GET_STATUS Response    [Port 1]

Frame 374: 68 bytes on wire (544 bits), 68 bytes captured (544 bits) on interface usbmon1, id 0
USB URB
    [Source: 1.1.0]
    [Destination: host]
    URB id: 0xffff993fc43720c0
    URB type: URB_COMPLETE ('C')
    URB transfer type: URB_CONTROL (0x02)
    Endpoint: 0x80, Direction: IN
    Device: 1
    URB bus id: 1
    Device setup request: not relevant ('-')
    Data: present ('\0')
    URB sec: 1702353720
    URB usec: 513908
    URB status: Success (0)
    URB length [bytes]: 4
    Data length [bytes]: 4
    [Request in: 373]
    [Time from request: 0.000016000 seconds]
    Unused Setup Header
    Interval: 0
    Start frame: 0
    Copy of Transfer Flags: 0x00000200, Dir IN
    Number of ISO descriptors: 0
    [bInterfaceClass: Unknown (0xffff)]
Port Status: 0x0103, PORT_CONNECTION, PORT_ENABLE, PORT_POWER
Port Change: 0x0010, C_PORT_RESET

No.     Time           Source                Destination           Protocol Length Info
    375 30.070979      host                  1.1.0                 USBHUB   64     CLEAR_FEATURE Request  [Port 1: C_PORT_RESET]

Frame 375: 64 bytes on wire (512 bits), 64 bytes captured (512 bits) on interface usbmon1, id 0
USB URB
    [Source: host]
    [Destination: 1.1.0]
    URB id: 0xffff993fc43720c0
    URB type: URB_SUBMIT ('S')
    URB transfer type: URB_CONTROL (0x02)
    Endpoint: 0x00, Direction: OUT
    Device: 1
    URB bus id: 1
    Device setup request: relevant ('\0')
    Data: present ('\0')
    URB sec: 1702353720
    URB usec: 513914
    URB status: Operation now in progress (-EINPROGRESS) (-115)
    URB length [bytes]: 0
    Data length [bytes]: 0
    [Response in: 376]
    Interval: 0
    Start frame: 0
    Copy of Transfer Flags: 0x00000000
    Number of ISO descriptors: 0
    [bInterfaceClass: Unknown (0xffff)]
Setup Data
    bmRequestType: 0x23
    bRequest: CLEAR_FEATURE (0x01)
    wValue: 0x0014
    wIndex: 1
    wLength: 0

No.     Time           Source                Destination           Protocol Length Info
    376 30.070983      1.1.0                 host                  USBHUB   64     CLEAR_FEATURE Response [Port 1: C_PORT_RESET]

Frame 376: 64 bytes on wire (512 bits), 64 bytes captured (512 bits) on interface usbmon1, id 0
USB URB
    [Source: 1.1.0]
    [Destination: host]
    URB id: 0xffff993fc43720c0
    URB type: URB_COMPLETE ('C')
    URB transfer type: URB_CONTROL (0x02)
    Endpoint: 0x00, Direction: OUT
    Device: 1
    URB bus id: 1
    Device setup request: not relevant ('-')
    Data: not present ('>')
    URB sec: 1702353720
    URB usec: 513918
    URB status: Success (0)
    URB length [bytes]: 0
    Data length [bytes]: 0
    [Request in: 375]
    [Time from request: 0.000004000 seconds]
    Unused Setup Header
    Interval: 0
    Start frame: 0
    Copy of Transfer Flags: 0x00000000
    Number of ISO descriptors: 0
    [bInterfaceClass: Unknown (0xffff)]

No.     Time           Source                Destination           Protocol Length Info
    377 30.150963      host                  1.6.0                 USB      64     GET DESCRIPTOR Request DEVICE

Frame 377: 64 bytes on wire (512 bits), 64 bytes captured (512 bits) on interface usbmon1, id 0
USB URB
    [Source: host]
    [Destination: 1.6.0]
    URB id: 0xffff993fc43720c0
    URB type: URB_SUBMIT ('S')
    URB transfer type: URB_CONTROL (0x02)
    Endpoint: 0x80, Direction: IN
    Device: 6
    URB bus id: 1
    Device setup request: relevant ('\0')
    Data: not present ('<')
    URB sec: 1702353720
    URB usec: 593898
    URB status: Operation now in progress (-EINPROGRESS) (-115)
    URB length [bytes]: 18
    Data length [bytes]: 0
    [Response in: 378]
    Interval: 0
    Start frame: 0
    Copy of Transfer Flags: 0x00000200, Dir IN
    Number of ISO descriptors: 0
Setup Data
    bmRequestType: 0x80
    bRequest: GET DESCRIPTOR (6)
    Descriptor Index: 0x00
    bDescriptorType: DEVICE (0x01)
    Language Id: no language specified (0x0000)
    wLength: 18

No.     Time           Source                Destination           Protocol Length Info
    378 30.152928      1.6.0                 host                  USB      82     GET DESCRIPTOR Response DEVICE

Frame 378: 82 bytes on wire (656 bits), 82 bytes captured (656 bits) on interface usbmon1, id 0
USB URB
    [Source: 1.6.0]
    [Destination: host]
    URB id: 0xffff993fc43720c0
    URB type: URB_COMPLETE ('C')
    URB transfer type: URB_CONTROL (0x02)
    Endpoint: 0x80, Direction: IN
    Device: 6
    URB bus id: 1
    Device setup request: not relevant ('-')
    Data: present ('\0')
    URB sec: 1702353720
    URB usec: 595863
    URB status: Success (0)
    URB length [bytes]: 18
    Data length [bytes]: 18
    [Request in: 377]
    [Time from request: 0.001965000 seconds]
    Unused Setup Header
    Interval: 0
    Start frame: 0
    Copy of Transfer Flags: 0x00000200, Dir IN
    Number of ISO descriptors: 0
DEVICE DESCRIPTOR

No.     Time           Source                Destination           Protocol Length Info
    379 30.152954      host                  1.6.0                 USB      64     GET DESCRIPTOR Request CONFIGURATION

Frame 379: 64 bytes on wire (512 bits), 64 bytes captured (512 bits) on interface usbmon1, id 0
USB URB
    [Source: host]
    [Destination: 1.6.0]
    URB id: 0xffff993fc43720c0
    URB type: URB_SUBMIT ('S')
    URB transfer type: URB_CONTROL (0x02)
    Endpoint: 0x80, Direction: IN
    Device: 6
    URB bus id: 1
    Device setup request: relevant ('\0')
    Data: not present ('<')
    URB sec: 1702353720
    URB usec: 595889
    URB status: Operation now in progress (-EINPROGRESS) (-115)
    URB length [bytes]: 9
    Data length [bytes]: 0
    [Response in: 380]
    Interval: 0
    Start frame: 0
    Copy of Transfer Flags: 0x00000200, Dir IN
    Number of ISO descriptors: 0
Setup Data
    bmRequestType: 0x80
    bRequest: GET DESCRIPTOR (6)
    Descriptor Index: 0x00
    bDescriptorType: CONFIGURATION (0x02)
    Language Id: no language specified (0x0000)
    wLength: 9

No.     Time           Source                Destination           Protocol Length Info
    380 30.155930      1.6.0                 host                  USB      73     GET DESCRIPTOR Response CONFIGURATION

Frame 380: 73 bytes on wire (584 bits), 73 bytes captured (584 bits) on interface usbmon1, id 0
USB URB
    [Source: 1.6.0]
    [Destination: host]
    URB id: 0xffff993fc43720c0
    URB type: URB_COMPLETE ('C')
    URB transfer type: URB_CONTROL (0x02)
    Endpoint: 0x80, Direction: IN
    Device: 6
    URB bus id: 1
    Device setup request: not relevant ('-')
    Data: present ('\0')
    URB sec: 1702353720
    URB usec: 598865
    URB status: Success (0)
    URB length [bytes]: 9
    Data length [bytes]: 9
    [Request in: 379]
    [Time from request: 0.002976000 seconds]
    Unused Setup Header
    Interval: 0
    Start frame: 0
    Copy of Transfer Flags: 0x00000200, Dir IN
    Number of ISO descriptors: 0
CONFIGURATION DESCRIPTOR

No.     Time           Source                Destination           Protocol Length Info
    381 30.155942      host                  1.6.0                 USB      64     GET DESCRIPTOR Request CONFIGURATION

Frame 381: 64 bytes on wire (512 bits), 64 bytes captured (512 bits) on interface usbmon1, id 0
USB URB
    [Source: host]
    [Destination: 1.6.0]
    URB id: 0xffff993fc43720c0
    URB type: URB_SUBMIT ('S')
    URB transfer type: URB_CONTROL (0x02)
    Endpoint: 0x80, Direction: IN
    Device: 6
    URB bus id: 1
    Device setup request: relevant ('\0')
    Data: not present ('<')
    URB sec: 1702353720
    URB usec: 598877
    URB status: Operation now in progress (-EINPROGRESS) (-115)
    URB length [bytes]: 53
    Data length [bytes]: 0
    [Response in: 382]
    Interval: 0
    Start frame: 0
    Copy of Transfer Flags: 0x00000200, Dir IN
    Number of ISO descriptors: 0
Setup Data
    bmRequestType: 0x80
    bRequest: GET DESCRIPTOR (6)
    Descriptor Index: 0x00
    bDescriptorType: CONFIGURATION (0x02)
    Language Id: no language specified (0x0000)
    wLength: 53

No.     Time           Source                Destination           Protocol Length Info
    382 30.158927      1.6.0                 host                  USB      117    GET DESCRIPTOR Response CONFIGURATION

Frame 382: 117 bytes on wire (936 bits), 117 bytes captured (936 bits) on interface usbmon1, id 0
USB URB
    [Source: 1.6.0]
    [Destination: host]
    URB id: 0xffff993fc43720c0
    URB type: URB_COMPLETE ('C')
    URB transfer type: URB_CONTROL (0x02)
    Endpoint: 0x80, Direction: IN
    Device: 6
    URB bus id: 1
    Device setup request: not relevant ('-')
    Data: present ('\0')
    URB sec: 1702353720
    URB usec: 601862
    URB status: Success (0)
    URB length [bytes]: 53
    Data length [bytes]: 53
    [Request in: 381]
    [Time from request: 0.002985000 seconds]
    Unused Setup Header
    Interval: 0
    Start frame: 0
    Copy of Transfer Flags: 0x00000200, Dir IN
    Number of ISO descriptors: 0
CONFIGURATION DESCRIPTOR
INTERFACE DESCRIPTOR (0.0): class Vendor Specific
ENDPOINT DESCRIPTOR
ENDPOINT DESCRIPTOR
ENDPOINT DESCRIPTOR
ENDPOINT DESCRIPTOR
ENDPOINT DESCRIPTOR

No.     Time           Source                Destination           Protocol Length Info
    383 30.158971      host                  1.6.0                 USB      64     GET DESCRIPTOR Request STRING

Frame 383: 64 bytes on wire (512 bits), 64 bytes captured (512 bits) on interface usbmon1, id 0
USB URB
    [Source: host]
    [Destination: 1.6.0]
    URB id: 0xffff993fc43720c0
    URB type: URB_SUBMIT ('S')
    URB transfer type: URB_CONTROL (0x02)
    Endpoint: 0x80, Direction: IN
    Device: 6
    URB bus id: 1
    Device setup request: relevant ('\0')
    Data: not present ('<')
    URB sec: 1702353720
    URB usec: 601906
    URB status: Operation now in progress (-EINPROGRESS) (-115)
    URB length [bytes]: 255
    Data length [bytes]: 0
    [Response in: 384]
    Interval: 0
    Start frame: 0
    Copy of Transfer Flags: 0x00000200, Dir IN
    Number of ISO descriptors: 0
Setup Data
    bmRequestType: 0x80
    bRequest: GET DESCRIPTOR (6)
    Descriptor Index: 0x00
    bDescriptorType: STRING (0x03)
    Language Id: no language specified (0x0000)
    wLength: 255

No.     Time           Source                Destination           Protocol Length Info
    384 30.161938      1.6.0                 host                  USB      68     GET DESCRIPTOR Response STRING

Frame 384: 68 bytes on wire (544 bits), 68 bytes captured (544 bits) on interface usbmon1, id 0
USB URB
    [Source: 1.6.0]
    [Destination: host]
    URB id: 0xffff993fc43720c0
    URB type: URB_COMPLETE ('C')
    URB transfer type: URB_CONTROL (0x02)
    Endpoint: 0x80, Direction: IN
    Device: 6
    URB bus id: 1
    Device setup request: not relevant ('-')
    Data: present ('\0')
    URB sec: 1702353720
    URB usec: 604873
    URB status: Success (0)
    URB length [bytes]: 4
    Data length [bytes]: 4
    [Request in: 383]
    [Time from request: 0.002967000 seconds]
    Unused Setup Header
    Interval: 0
    Start frame: 0
    Copy of Transfer Flags: 0x00000200, Dir IN
    Number of ISO descriptors: 0
STRING DESCRIPTOR

No.     Time           Source                Destination           Protocol Length Info
    385 30.161951      host                  1.6.0                 USB      64     GET DESCRIPTOR Request STRING

Frame 385: 64 bytes on wire (512 bits), 64 bytes captured (512 bits) on interface usbmon1, id 0
USB URB
    [Source: host]
    [Destination: 1.6.0]
    URB id: 0xffff993fc43720c0
    URB type: URB_SUBMIT ('S')
    URB transfer type: URB_CONTROL (0x02)
    Endpoint: 0x80, Direction: IN
    Device: 6
    URB bus id: 1
    Device setup request: relevant ('\0')
    Data: not present ('<')
    URB sec: 1702353720
    URB usec: 604886
    URB status: Operation now in progress (-EINPROGRESS) (-115)
    URB length [bytes]: 255
    Data length [bytes]: 0
    [Response in: 386]
    Interval: 0
    Start frame: 0
    Copy of Transfer Flags: 0x00000200, Dir IN
    Number of ISO descriptors: 0
Setup Data
    bmRequestType: 0x80
    bRequest: GET DESCRIPTOR (6)
    Descriptor Index: 0x02
    bDescriptorType: STRING (0x03)
    Language Id: English (United States) (0x0409)
    wLength: 255

No.     Time           Source                Destination           Protocol Length Info
    386 30.164928      1.6.0                 host                  USB      96     GET DESCRIPTOR Response STRING

Frame 386: 96 bytes on wire (768 bits), 96 bytes captured (768 bits) on interface usbmon1, id 0
USB URB
    [Source: 1.6.0]
    [Destination: host]
    URB id: 0xffff993fc43720c0
    URB type: URB_COMPLETE ('C')
    URB transfer type: URB_CONTROL (0x02)
    Endpoint: 0x80, Direction: IN
    Device: 6
    URB bus id: 1
    Device setup request: not relevant ('-')
    Data: present ('\0')
    URB sec: 1702353720
    URB usec: 607863
    URB status: Success (0)
    URB length [bytes]: 32
    Data length [bytes]: 32
    [Request in: 385]
    [Time from request: 0.002977000 seconds]
    Unused Setup Header
    Interval: 0
    Start frame: 0
    Copy of Transfer Flags: 0x00000200, Dir IN
    Number of ISO descriptors: 0
STRING DESCRIPTOR

No.     Time           Source                Destination           Protocol Length Info
    387 30.164945      host                  1.6.0                 USB      64     GET DESCRIPTOR Request STRING

Frame 387: 64 bytes on wire (512 bits), 64 bytes captured (512 bits) on interface usbmon1, id 0
USB URB
    [Source: host]
    [Destination: 1.6.0]
    URB id: 0xffff993fc43720c0
    URB type: URB_SUBMIT ('S')
    URB transfer type: URB_CONTROL (0x02)
    Endpoint: 0x80, Direction: IN
    Device: 6
    URB bus id: 1
    Device setup request: relevant ('\0')
    Data: not present ('<')
    URB sec: 1702353720
    URB usec: 607880
    URB status: Operation now in progress (-EINPROGRESS) (-115)
    URB length [bytes]: 255
    Data length [bytes]: 0
    [Response in: 388]
    Interval: 0
    Start frame: 0
    Copy of Transfer Flags: 0x00000200, Dir IN
    Number of ISO descriptors: 0
Setup Data
    bmRequestType: 0x80
    bRequest: GET DESCRIPTOR (6)
    Descriptor Index: 0x01
    bDescriptorType: STRING (0x03)
    Language Id: English (United States) (0x0409)
    wLength: 255

No.     Time           Source                Destination           Protocol Length Info
    388 30.167924      1.6.0                 host                  USB      138    GET DESCRIPTOR Response STRING

Frame 388: 138 bytes on wire (1104 bits), 138 bytes captured (1104 bits) on interface usbmon1, id 0
USB URB
    [Source: 1.6.0]
    [Destination: host]
    URB id: 0xffff993fc43720c0
    URB type: URB_COMPLETE ('C')
    URB transfer type: URB_CONTROL (0x02)
    Endpoint: 0x80, Direction: IN
    Device: 6
    URB bus id: 1
    Device setup request: not relevant ('-')
    Data: present ('\0')
    URB sec: 1702353720
    URB usec: 610859
    URB status: Success (0)
    URB length [bytes]: 74
    Data length [bytes]: 74
    [Request in: 387]
    [Time from request: 0.002979000 seconds]
    Unused Setup Header
    Interval: 0
    Start frame: 0
    Copy of Transfer Flags: 0x00000200, Dir IN
    Number of ISO descriptors: 0
STRING DESCRIPTOR

No.     Time           Source                Destination           Protocol Length Info
    389 30.179075      host                  1.6.0                 USB      64     SET CONFIGURATION Request

Frame 389: 64 bytes on wire (512 bits), 64 bytes captured (512 bits) on interface usbmon1, id 0
USB URB
    [Source: host]
    [Destination: 1.6.0]
    URB id: 0xffff993fc43720c0
    URB type: URB_SUBMIT ('S')
    URB transfer type: URB_CONTROL (0x02)
    Endpoint: 0x00, Direction: OUT
    Device: 6
    URB bus id: 1
    Device setup request: relevant ('\0')
    Data: present ('\0')
    URB sec: 1702353720
    URB usec: 622010
    URB status: Operation now in progress (-EINPROGRESS) (-115)
    URB length [bytes]: 0
    Data length [bytes]: 0
    [Response in: 390]
    Interval: 0
    Start frame: 0
    Copy of Transfer Flags: 0x00000000
    Number of ISO descriptors: 0
Setup Data
    bmRequestType: 0x00
    bRequest: SET CONFIGURATION (9)
    bConfigurationValue: 1
    wIndex: 0 (0x0000)
    wLength: 0

No.     Time           Source                Destination           Protocol Length Info
    390 30.179924      1.6.0                 host                  USB      64     SET CONFIGURATION Response

Frame 390: 64 bytes on wire (512 bits), 64 bytes captured (512 bits) on interface usbmon1, id 0
USB URB
    [Source: 1.6.0]
    [Destination: host]
    URB id: 0xffff993fc43720c0
    URB type: URB_COMPLETE ('C')
    URB transfer type: URB_CONTROL (0x02)
    Endpoint: 0x00, Direction: OUT
    Device: 6
    URB bus id: 1
    Device setup request: not relevant ('-')
    Data: not present ('>')
    URB sec: 1702353720
    URB usec: 622859
    URB status: Success (0)
    URB length [bytes]: 0
    Data length [bytes]: 0
    [Request in: 389]
    [Time from request: 0.000849000 seconds]
    Unused Setup Header
    Interval: 0
    Start frame: 0
    Copy of Transfer Flags: 0x00000000
    Number of ISO descriptors: 0
